1001	IDNUM	13	23	88Y206206L
1001	MEDICALRECORD	24	35	8892062.BPL
1001	PATIENT	37	63	Vatterott, Jerrie CLARENCE
1001	IDNUM	74	82	88Y20620
1001	IDNUM	83	91	88Y20620
1001	STREET	92	98	Exeter
1001	CITY	99	112	DECEPTION BAY
1001	STATE	114	132	Northern Territory
1001	ZIP	134	138	6845
1001	DATE	170	180	15/11/2004	2004-11-15
1001	DATE	200	209	20/5/2064	2064-05-20
1001	DEPARTMENT	226	234	PARKES 8
1001	HOSPITAL	237	263	GUNNEDAH DISTRICT HOSPITAL
1001	DOCTOR	267	288	Edison Clay GOLDHIRSH
1001	DATE	400	404	2059	2059
1001	DATE	1193	1197	2059	2059
1001	DOCTOR	1212	1215	Sek
1001	DOCTOR	1243	1253	X Standrew
1001	TIME	1257	1274	9:30am on 18/3/14	2014-03-18T09:30
1001	DOCTOR	1802	1804	KH
1001	DATE	1808	1815	21/5/64	2064-05-21
1001	DOCTOR	1846	1853	X Karma
1001	HOSPITAL	2215	2235	HALLS CREEK HOSPITAL
1001	IDNUM	2444	2452	88Y20620
1001	DATE	2476	2483	30.5.64	2064-05-30
1001	HOSPITAL	2505	2541	TRANGIE MULTI PURPOSE HEALTH SERVICE
1001	DOCTOR	2577	2587	X Spittler
1002	IDNUM	14	24	46U2273647
1002	MEDICALRECORD	25	36	4672273.RKT
1002	PATIENT	38	54	Parmar, Gregorio
1002	IDNUM	65	73	46U22736
1002	STREET	74	83	Underdale
1002	CITY	84	93	TRAFALGAR
1002	STATE	95	97	NT
1002	ZIP	99	103	3660
1002	DATE	129	138	7/12/1999	1999-12-07
1002	TIME	158	177	21/03/2014 at 13:26	2014-03-21T13:26
1002	DEPARTMENT	189	210	3HR STAY SURGICALUNIT
1002	HOSPITAL	211	264	ROBINVALE DISTRICT HEALTH SERVICES - ROBINVALE CAMPUS
1002	DOCTOR	269	289	GENARO ARMAND Forcht
1002	DOCTOR	2108	2119	L. Lazewski
1002	DATE	2930	2937	27/5/64	2064-05-27
1003	IDNUM	13	23	94Q248422C
1003	MEDICALRECORD	24	35	9462484.GGC
1003	PATIENT	37	56	Pullon, Loren DUANE
1003	IDNUM	67	75	94Q24842
1003	STREET	76	84	Bellanca
1003	CITY	85	93	COOKTOWN
1003	STATE	95	98	VIC
1003	ZIP	100	104	2739
1003	DATE	130	139	29/9/2000	2000-09-29
1003	TIME	159	178	18/03/2014 at 19:04	2014-03-18T19:04
1003	DEPARTMENT	190	200	2.PARKES 8
1003	HOSPITAL	201	239	TULLAMORE MULTI PURPOSE HEALTH SERVICE
1003	DOCTOR	244	267	FELIPE Eldridge ALLCORN
1003	IDNUM	516	532	94-QH-48-4220673
1003	HOSPITAL	533	550	BARALABA HOSPITAL
1003	DATE	552	561	2/10/2062	2062-02-10
1003	IDNUM	605	615	94624-84GG
1003	DATE	617	626	16/1/2062	2062-01-16
1003	DATE	3527	3534	23/5/64	2064-05-23
1003	DOCTOR	3536	3545	Z Varajas
1004	IDNUM	13	23	52N379480L
1004	MEDICALRECORD	24	35	5253794.VBL
1004	PATIENT	37	61	KLAAMEYER, Gaye Wadjarri
1004	IDNUM	72	80	52N37948
1004	IDNUM	81	89	52N37948
1004	STREET	90	99	Schroeder
1004	CITY	100	111	HURSTBRIDGE
1004	STATE	113	115	SA
1004	ZIP	117	121	2464
1004	DATE	156	165	7/12/2004	2004-07-12
1004	DATE	185	194	26/5/2064	2064-05-26
1004	DEPARTMENT	210	221	DAY SURGERY
1004	HOSPITAL	224	257	RENMARK PARINGA DISTRICT HOSPITAL
1004	DOCTOR	261	277	SYBIL RIVA SMIDT
1004	DOCTOR	1901	1903	ME
1004	DATE	1907	1914	27/5/64	2064-05-27
1004	DOCTOR	1947	1955	O Lenski
1005	IDNUM	14	24	10J399538T
1005	MEDICALRECORD	25	36	1033995.KWT
1005	PATIENT	38	63	Atterberry, REGGIE YOLNGU
1005	IDNUM	74	82	10J39953
1005	STREET	83	93	Shady Wood
1005	CITY	94	102	CESSNOCK
1005	STATE	104	107	ACT
1005	ZIP	109	113	3700
1005	DATE	139	148	11/5/2032	2032-05-11
1005	DATE	168	177	21/5/2064	2064-05-21
1005	DEPARTMENT	194	211	DICKINSON 3 NORTH
1005	HOSPITAL	214	228	MOURA HOSPITAL
1005	DOCTOR	232	249	LEONEL MEL Branon
1005	DOCTOR	706	712	C Nixa
1005	DOCTOR	713	725	C Tappendorf
1005	TIME	729	746	10.17 on 19.03.14	2014-03-19T10:17
1005	DATE	3247	3254	22.5.64	2064-05-22
1005	DOCTOR	3285	3293	C Zornes
1006	MEDICALRECORD	1	12	2109904.YSE
1006	PATIENT	13	44	SHANSKY, Nganu Annamarie VANESA
1006	IDNUM	45	53	21A99049
1006	IDNUM	54	62	21A99049
1006	DATE	77	86	30/5/2064	2064-05-30
1006	DOCTOR	1231	1233	UJ
1006	DOCTOR	1234	1236	WN
1006	DATE	1240	1247	29.5.64	2064-05-29
1006	DOCTOR	1280	1287	H Huser
1006	IDNUM	1428	1436	21A99049
1007	MEDICALRECORD	1	12	8889114.NNN
1007	PATIENT	13	36	Newbrough, Jerrod Deane
1007	IDNUM	37	45	88W91145
1007	DATE	61	70	29/5/2064	2064-05-29
1007	DOCTOR	535	546	Lon GRAYDON
1007	DOCTOR	1671	1673	RC
1007	DOCTOR	1674	1676	QF
1007	DATE	1680	1687	27.5.64	2064-05-27
1007	DOCTOR	1717	1724	W Dilts
1007	DATE	1762	1770	previous	2064-05-27
1008	MEDICALRECORD	2	13	4670325.CIW
1008	PATIENT	14	32	Bialczyk, GEOFFREY
1008	IDNUM	33	41	46S03251
1008	DATE	57	66	27/5/2064	2064-05-27
1008	DOCTOR	560	569	K Cazzell
1008	DOCTOR	576	586	K Mcdonagh
1008	TIME	590	607	4:15pm on 20.3.14	2014-03-20T16:15
1008	DATE	781	788	23.5.64	2064-05-23
1008	DOCTOR	819	831	K Windschitl
1009	MEDICALRECORD	1	11	673633.LRE
1009	PATIENT	12	27	CECCHI, Hilario
1009	IDNUM	28	36	67K63346
1009	DATE	52	61	22/5/2064	2064-05-22
1009	DOCTOR	704	706	FF
1009	DOCTOR	727	738	P. Devillez
1009	DATE	2166	2175	22/5/2064	2064-05-22
1011	IDNUM	14	24	15G653429Q
1011	MEDICALRECORD	25	36	1526534.GZQ
1011	PATIENT	38	71	ROTHSCHILD, Paris, Yvonne'Modesto
1011	IDNUM	82	90	15G65342
1011	STREET	91	98	Franich
1011	CITY	99	106	SUNBURY
1011	STATE	108	123	South Australia
1011	ZIP	125	129	6987
1011	DATE	155	165	20/12/2013	2013-12-20
1011	TIME	185	204	12/03/2014 at 11:14	2014-03-12T11:14
1011	DEPARTMENT	216	234	MEDIC/SURGERY WARD
1011	HOSPITAL	235	278	WESTERN DISTRICT HEALTH SERVICE - COLERAINE
1011	DOCTOR	282	309	Tyler ERIK LUIGI-Fitzsimons
1011	DATE	396	404	3.5.2064	2064-05-03
1011	DATE	2967	2974	15.5.64	2064-05-15
1011	DOCTOR	3007	3015	E Netzel
1011	ORGANIZATION	4609	4629	Qwest Communications
1011	HOSPITAL	4631	4673	SOUTH WEST HEALTHCARE - WARRNAMBOOL CAMPUS
1012	MEDICALRECORD	1	12	7317745.VUY
1012	PATIENT	13	33	HICKSON, SHANE-FARAH
1012	IDNUM	34	42	73C77458
1012	IDNUM	43	51	73C77458
1012	DATE	67	75	5/3/2064	2064-05-03
1012	DOCTOR	1480	1482	FD
1012	DOCTOR	1484	1486	LO
1012	DATE	1492	1499	30.5.64	2064-05-30
1012	DOCTOR	1531	1541	S Quintano
1012	IDNUM	2213	2221	73C77458
1012	DATE	2247	2253	5.7.64	2064-05-07
1013	MEDICALRECORD	1	12	9473754.JQJ
1013	PATIENT	13	34	Bolyard, LAURI DONALD
1013	IDNUM	35	43	94U37543
1013	IDNUM	44	52	94U37543
1013	DATE	68	76	5/3/2064	2064-05-03
1013	DOCTOR	1261	1263	CD
1013	DATE	1267	1274	28.5.64	2064-05-28
1013	DOCTOR	1305	1317	X Hargreaves
1014	IDNUM	14	24	42Q306494S
1014	MEDICALRECORD	25	36	4263064.YLS
1014	PATIENT	38	59	YALE, Catrice DELINDA
1014	IDNUM	70	78	42Q30649
1014	STREET	79	86	Milbank
1014	CITY	87	93	MACKAY
1014	STATE	95	98	QLD
1014	ZIP	100	104	6346
1014	DATE	130	140	20/11/2021	2021-11-20
1014	TIME	160	179	20/03/2014 at 10:30	2014-03-20T10:30
1014	DEPARTMENT	191	198	Med Onc
1014	HOSPITAL	199	228	DALBY HOSPITAL HEALTH SERVICE
1014	DOCTOR	233	252	BRITT Elvis Ballowe
1014	DOCTOR	1503	1507	Dick
1014	TIME	1511	1530	10:10hrs on 20/3/14	2014-03-20T10:10
1014	DOCTOR	1581	1589	Lastrape
1014	TIME	1593	1600	1155Hrs	2014-03-20T11:55
1014	DOCTOR	1649	1655	Badeau
1014	TIME	1659	1666	1310Hrs	2014-03-20T13:10
1014	DOCTOR	3491	3501	L. Swingle
1014	DATE	5143	5150	26/5/64	2064-05-26
1015	MEDICALRECORD	1	11	004326.ONG
1015	PATIENT	12	33	Rotch, Forrest LESTER
1015	IDNUM	34	42	00M32655
1015	DATE	58	67	29/5/2064	2064-05-29
1015	DOCTOR	472	474	CI
1015	DATE	478	485	27.5.64	2064-05-27
1015	DOCTOR	516	529	A Schoeninger
1019	MEDICALRECORD	1	12	0562081.PYA
1019	PATIENT	13	36	Aschan, Verdell Tristan
1019	IDNUM	37	45	05Q20816
1019	IDNUM	46	54	05Q20816
1019	DATE	69	77	3/6/2064	2064-06-03
1019	DOCTOR	1262	1264	ZA
1019	DATE	1268	1275	28.5.64	2064-05-28
1019	DOCTOR	1306	1313	B Cusic
1019	DATE	2043	2051	3/6/2064	2064-06-03
1021	IDNUM	13	23	79Z048569U
1021	MEDICALRECORD	24	35	7990485.RXU
1021	PATIENT	37	63	Gerberich, Virgilio-Martha
1021	IDNUM	74	82	79Z04856
1021	IDNUM	83	91	79Z04856
1021	STREET	92	100	Fulready
1021	CITY	101	111	CABOOLTURE
1021	STATE	113	116	QLD
1021	ZIP	118	122	1160
1021	DATE	157	167	21/12/2007	2007-12-21
1021	DATE	187	196	29/5/2064	2064-05-29
1021	DEPARTMENT	213	231	Douglas Hanly Moir
1021	HOSPITAL	234	270	WEST WIMMERA HEALTH SERVICE - KANIVA
1021	DOCTOR	274	295	Kelley Rodney FORBESS
1021	DOCTOR	1714	1716	HC
1021	DOCTOR	1718	1720	MM
1021	DATE	1726	1733	30.5.64	2064-05-30
1021	DOCTOR	1765	1774	T Devotie
1021	IDNUM	2447	2455	79Z04856
1021	DATE	2481	2487	5.7.64	2064-05-07
1021	DATE	2599	2605	6.3.64	2064-06-03
1021	IDNUM	2654	2662	79Z04856
1022	IDNUM	13	23	37W069527D
1022	MEDICALRECORD	24	35	3780695.GSD
1022	PATIENT	37	59	Lorenzana, MEG Lyndsay
1022	IDNUM	70	78	37W06952
1022	IDNUM	79	87	37W06952
1022	STREET	88	98	Alta Verde
1022	CITY	99	108	MOSS VALE
1022	STATE	110	128	Northern Territory
1022	ZIP	130	134	2803
1022	DATE	169	177	8/3/2004	2004-03-08
1022	DATE	197	206	9/10/2063	2063-10-09
1022	DEPARTMENT	223	234	UROLOGY OPD
1022	HOSPITAL	237	261	COLLIE DISTRICT HOSPITAL
1022	DOCTOR	265	279	Jett Omer Syed
1022	AGE	339	341	64
1022	DOCTOR	996	1003	Ference
1022	DOCTOR	1010	1020	I Grantier
1022	DOCTOR	1021	1028	I Menes
1022	TIME	1032	1050	9.50am on 07.08.13	2013-08-07T09:50
1022	DOCTOR	2693	2695	RH
1022	DOCTOR	2697	2699	WM
1022	DATE	2703	2711	10.10.63	2063-10-10
1022	DOCTOR	2744	2753	I Ruhmann
1023	IDNUM	14	24	32A841134C
1023	MEDICALRECORD	25	36	3208411.IKC
1023	PATIENT	38	56	Garthwaite, CRISTA
1023	IDNUM	67	75	32A84113
1023	IDNUM	76	84	32A84113
1023	STREET	85	93	Parkhall
1023	CITY	94	101	BLI BLI
1023	STATE	103	118	South Australia
1023	ZIP	120	124	4627
1023	DATE	159	167	6/3/2008	2008-03-06
1023	TIME	187	206	29/05/2013 at 10:37	2013-05-29T10:37
1023	DEPARTMENT	218	240	PRINCE OF WALESPRIVATE
1023	HOSPITAL	243	270	LAUNCESTON GENERAL HOSPITAL
1023	DOCTOR	274	295	Gregorio Lynwood Puca
1023	DATE	344	350	6.8.63	2063-08-06
1023	DURATION	365	372	2 years	P2Y
1023	DATE	2753	2759	2.7.63	2063-07-02
1023	DOCTOR	2793	2801	J Todora
1023	DATE	4193	4199	6.8.63	2063-08-06
1024	IDNUM	13	23	90W9612824
1024	MEDICALRECORD	24	35	9089612.XFL
1024	PATIENT	37	59	CUMBLIDGE, KALI HOBERT
1024	IDNUM	70	78	90W96128
1024	STREET	79	89	Claibourne
1024	CITY	90	100	PEARCEDALE
1024	STATE	102	105	TAS
1024	ZIP	107	111	3902
1024	DATE	137	146	30/3/1999	1999-03-30
1024	DATE	166	175	18/9/2063	2063-09-18
1024	DEPARTMENT	192	214	PRINCE OF WALESPRIVATE
1024	HOSPITAL	217	254	SHOALHAVEN DISTRICT MEMORIAL HOSPITAL
1024	DOCTOR	258	275	VIDYA SADE Chiola
1024	DOCTOR	1681	1683	BY
1024	DATE	1687	1694	19.9.63	2063-09-19
1024	DOCTOR	1724	1734	X Spritzer
1024	DATE	2756	2766	22/10/2063	2063-10-22
1024	DATE	3122	3131	10/1/2063	2063-10-01
1025	IDNUM	13	23	63F711591F
1025	MEDICALRECORD	24	35	6327115.YEF
1025	PATIENT	37	66	Maggi, RUSSELL KELSI MEREDITH
1025	IDNUM	77	85	63F71159
1025	STREET	86	94	Bautista
1025	CITY	95	107	SUFFOLK PARK
1025	STATE	109	112	ACT
1025	ZIP	114	118	3815
1025	DATE	144	152	1/1/2020	2020-01-01
1025	DATE	172	182	28/10/2063	2063-10-28
1025	DEPARTMENT	199	214	Pathology North
1025	HOSPITAL	217	248	BRAIDWOOD MULTI PURPOSE SERVICE
1025	DOCTOR	252	265	RUFUS Seckler
1025	DOCTOR	296	301	Larry
1025	AGE	335	337	47
1025	DOCTOR	3242	3244	KB
1025	DOCTOR	3245	3247	EY
1025	DATE	3251	3259	29.10.63	2063-10-29
1025	DOCTOR	3290	3300	L Barsness
1025	DOCTOR	5526	5534	L Josich
1026	IDNUM	14	24	68J583108E
1026	MEDICALRECORD	25	36	6835831.AWE
1026	PATIENT	38	56	Gracie, NEAL Flynn
1026	IDNUM	67	75	68J58310
1026	STREET	76	84	Farthing
1026	CITY	85	93	THE OAKS
1026	STATE	95	110	South Australia
1026	ZIP	112	116	7307
1026	DATE	142	151	23/2/1983	1983-02-23
1026	DEPARTMENT	195	218	PRINCE OF WALES PRIVATE
1026	HOSPITAL	219	244	PRINCE ALBERT TENTERFIELD
1026	DOCTOR	248	264	LEVI Ninga Poire
1026	DATE	1463	1470	17.7.63	2063-07-17
1026	DOCTOR	1558	1565	Q Avera
1027	IDNUM	13	23	26F6042665
1027	MEDICALRECORD	24	34	262604.GPR
1027	PATIENT	36	47	Huyna, Gwen
1027	IDNUM	57	65	26F60426
1027	STREET	66	75	Chisholme
1027	CITY	76	84	SMITHTON
1027	ZIP	88	92	7250
1027	DATE	118	127	22/6/2003	2003-06-22
1027	DATE	147	156	17/3/2063	2063-03-17
1027	DEPARTMENT	173	193	8 GOOLAGONG CRESCENT
1027	HOSPITAL	194	217	SCOTT MEMORIAL HOSPITAL
1027	DOCTOR	221	244	Ted Randall WESTERHEIDE
1027	DATE	318	324	3.9.63	2063-09-03
1027	DOCTOR	441	447	Jeffry
1027	DOCTOR	2862	2864	EJ
1027	DOCTOR	2866	2868	JH
1027	DATE	2872	2879	18.3.63	2063-03-18
1027	DOCTOR	2912	2921	F Setzler
1027	HOSPITAL	7823	7880	LISMORE BASE HOSPITAL - RIVERLANDS DRUG & ALCOHOL SERVICE
1027	HOSPITAL	10549	10566	LAVERTON HOSPITAL
1027	DATE	10689	10695	3.9.63	2063-09-03
1027	HOSPITAL	10711	10727	WHYALLA HOSPITAL
1027	DOCTOR	11073	11081	F Duryee
1027	DOCTOR	11099	11111	F F Dearment
1028	IDNUM	13	23	90P453566I
1028	MEDICALRECORD	24	35	9054535.RQI
1028	PATIENT	37	51	BARNO, XIOMARA
1028	IDNUM	62	70	74C63521
1028	STREET	71	84	Silver Meadow
1028	CITY	85	91	WINTON
1028	STATE	93	108	New South Wales
1028	ZIP	110	114	3930
1028	DATE	140	149	4/12/1997	1997-04-12
1028	DATE	169	178	24/5/2063	2063-05-24
1028	DEPARTMENT	195	220	2.23HR STAY SURGICAL UNIT
1028	HOSPITAL	221	241	HEYWOOD RURAL HEALTH
1028	DOCTOR	245	273	DERRICK ANTONE SPRENGELMEYER
1028	DOCTOR	2774	2776	VM
1028	DOCTOR	2778	2780	MG
1028	DATE	2784	2791	27.5.63	2063-05-27
1028	DOCTOR	2822	2830	T Grivno
1029	IDNUM	14	24	95T235173H
1029	MEDICALRECORD	25	35	957235.ETI
1029	PATIENT	37	53	Anstey, Yarramba
1029	IDNUM	64	72	95T23517
1029	STREET	73	85	Maroon Bells
1029	CITY	86	94	BLAXLAND
1029	STATE	96	106	Queensland
1029	ZIP	108	112	6440
1029	DATE	138	148	28/10/1994	1994-10-28
1029	DATE	168	176	8/6/2063	2063-08-06
1029	DEPARTMENT	193	218	INTENSIVE CARE UNIT SOUTH
1029	HOSPITAL	219	249	GRENFELL MULTI PURPOSE SERVICE
1029	DOCTOR	253	272	SIGMUND Brian Macey
1029	DOCTOR	326	329	Ewy
1029	DATE	1800	1806	8/7/63	2063-08-07
1029	DOCTOR	1840	1847	Y Tulis
1029	DOCTOR	1851	1864	Y ALLEN-Rauen
1029	DEPARTMENT	3133	3143	NSW Health
1029	CITY	3144	3153	RIVERVIEW
1029	IDNUM	3154	3166	YO-72-351732
1029	DOCTOR	3190	3195	Jamar
1029	DOCTOR	3200	3204	Jack
1029	DATE	3389	3396	28.8.63	2063-08-28
1029	DOCTOR	3431	3438	I Klamn
1029	DOCTOR	3456	3463	I Lidey
1029	DEPARTMENT	3465	3478	PARKES 9 EAST
1031	IDNUM	13	23	53P256231Q
1031	MEDICALRECORD	24	35	5362562.IDQ
1031	PATIENT	37	60	MAZZARA, JAYMIE Armando
1031	IDNUM	71	79	53P25623
1031	IDNUM	80	88	53P25623
1031	STREET	89	97	W Pippin
1031	CITY	98	106	DRYSDALE
1031	STATE	108	123	South Australia
1031	ZIP	125	129	4127
1031	DATE	164	173	7/12/2004	2004-07-12
1031	DATE	193	202	26/5/2064	2064-05-26
1031	DEPARTMENT	219	226	SYDPATH
1031	HOSPITAL	229	245	CUMMINS HOSPITAL
1031	DOCTOR	249	275	MARYANNA Kiesha CLINKSCALE
1031	DOCTOR	1897	1899	ZW
1031	DATE	1903	1910	27/5/64	2064-05-27
1031	DOCTOR	1943	1951	W Engard
1031	DOCTOR	2794	2800	W Raub
1031	DATE	2802	2808	6.4.64	2064-06-04
1031	DATE	2926	2932	5.3.64	2064-05-03
1032	IDNUM	14	24	01L3773899
1032	MEDICALRECORD	25	36	0143773.XZY
1032	PATIENT	38	54	LUCKADOO, GERARD
1032	IDNUM	65	73	01L37738
1032	STREET	74	83	Millgrove
1032	CITY	84	96	NORTH MACKAY
1032	STATE	98	115	Western Australia
1032	ZIP	117	121	5049
1032	DATE	147	155	1/5/1989	1989-05-01
1032	TIME	175	194	21/08/2013 at 14:42	2013-08-21T14:42
1032	DEPARTMENT	206	211	PaLMS
1032	HOSPITAL	212	239	GUYRA MULTI PURPOSE SERVICE
1032	DOCTOR	243	261	NEIL Raleigh SUDOL
1032	DATE	2634	2642	24/10/63	2063-10-24
1032	DOCTOR	2673	2680	B Soito
1033	IDNUM	13	23	69I398347H
1033	MEDICALRECORD	24	35	6933983.MUH
1033	PATIENT	37	50	NAGATA, Bruno
1033	IDNUM	61	69	69I39834
1033	STREET	70	77	Radleys
1033	CITY	78	86	MAITLAND
1033	STATE	88	90	WA
1033	ZIP	92	96	0812
1033	DATE	122	130	8/3/1999	1999-08-03
1033	TIME	150	169	04/06/2013 at 13:36	2013-06-04T13:36
1033	DEPARTMENT	181	186	PaLMS
1033	HOSPITAL	187	203	KAPUNDA HOSPITAL
1033	DOCTOR	207	228	Lynwood BART HOUCHINS
1033	DATE	301	308	17.9.63	2063-09-17
1033	DOCTOR	1673	1675	AU
1033	DOCTOR	1676	1678	UW
1033	DATE	1682	1688	8.7.63	2063-08-07
1033	DOCTOR	1713	1715	LV
1033	DATE	1715	1721	8.8.63	2063-08-08
1033	DOCTOR	1751	1763	Q Rubinstein
1033	DATE	3484	3491	17.9.63	2063-09-17
1033	DOCTOR	3508	3515	Q Gocek
1034	IDNUM	13	23	17E318405P
1034	MEDICALRECORD	24	35	1713184.BPP
1034	PATIENT	37	54	Cervantsz, Kurtis
1034	IDNUM	65	73	17E31840
1034	IDNUM	74	82	17E31840
1034	STREET	83	92	Tule Lake
1034	CITY	93	100	DAMPIER
1034	STATE	102	104	NT
1034	ZIP	106	110	2340
1034	DATE	145	154	27/1/2000	2000-01-27
1034	TIME	174	193	04/07/2012 at 18:35	2012-07-04T18:35
1034	DEPARTMENT	205	217	SA Pathology
1034	HOSPITAL	220	257	WEST WIMMERA HEALTH SERVICE - RAINBOW
1034	DOCTOR	261	282	VALDA Cherry BELMONTE
1034	DOCTOR	3298	3300	FS
1034	DATE	3303	3309	7/9/62	2062-09-07
1034	DOCTOR	3340	3350	E Langmaid
1035	IDNUM	14	24	38V919364B
1035	MEDICALRECORD	25	36	3889193.PLB
1035	PATIENT	38	48	REUL, Jean
1035	IDNUM	59	67	38V91936
1035	STREET	68	76	Shelgate
1035	CITY	77	84	HADSPEN
1035	STATE	86	94	Victoria
1035	ZIP	96	100	3525
1035	DATE	126	135	5/11/1999	1999-11-05
1035	TIME	155	174	02/07/2012 at 16:21	2012-07-02T16:21
1035	DEPARTMENT	186	196	Hereditary
1035	HOSPITAL	197	234	WEST WIMMERA HEALTH SERVICE - RAINBOW
1035	DOCTOR	238	252	Charley OHYAMA
1035	DOCTOR	271	277	Reiley
1035	DOCTOR	294	297	Val
1035	DATE	2272	2278	9/5/62	2062-09-05
1035	DOCTOR	2310	2316	S Nute
1036	IDNUM	13	23	96R040312J
1036	MEDICALRECORD	24	35	9660403.EGJ
1036	PATIENT	37	60	Oseguera, Lorilee Korey
1036	IDNUM	71	79	96R04031
1036	IDNUM	80	88	96R04031
1036	STREET	89	101	Piccotts End
1036	CITY	102	110	MAITLAND
1036	STATE	112	114	WA
1036	ZIP	116	120	2834
1036	DATE	152	161	7/12/1966	1966-07-12
1036	DATE	180	189	28/8/2062	2062-08-28
1036	DEPARTMENT	206	222	ONCOLOGY (GYNAE)
1036	HOSPITAL	225	246	LYELL MCEWIN HOSPITAL
1036	DOCTOR	250	268	LOISE Jerry Haggan
1036	DOCTOR	728	734	X Beem
1036	DOCTOR	741	749	X Kurien
1036	TIME	753	770	3:55pm on 26.6.12	2012-06-26T15:55
1036	DOCTOR	3047	3049	VP
1036	DATE	3053	3060	29.8.62	2062-08-29
1036	DOCTOR	3092	3099	X Heine
1037	IDNUM	13	23	44N0614707
1037	MEDICALRECORD	24	35	4450614.TBS
1037	PATIENT	37	49	Lesney, DONG
1037	IDNUM	60	68	44N06147
1037	IDNUM	69	77	44N06147
1037	STREET	78	85	Maranie
1037	CITY	86	97	KURRI KURRI
1037	STATE	99	107	Tasmania
1037	ZIP	109	113	2747
1037	DATE	145	154	14/5/1998	1998-05-14
1037	TIME	174	193	17/07/2012 at 18:14	2012-07-17T18:14
1037	DEPARTMENT	205	222	MEDIC/SURGERYWARD
1037	HOSPITAL	225	244	QUAIRADING HOSPITAL
1037	DOCTOR	248	266	Jacky LELIA Martis
1037	AGE	326	328	69
1037	DOCTOR	3364	3366	KH
1037	DATE	3371	3378	20/9/62	2062-09-20
1037	DOCTOR	3412	3419	M Solan
1037	DATE	3560	3568	previous	2064-05-27
1038	IDNUM	14	24	02K081438A
1038	MEDICALRECORD	25	36	0230814.IWA
1038	PATIENT	38	54	OVERTURF, RANDEE
1038	IDNUM	65	73	02K08143
1038	IDNUM	74	82	02K08143
1038	STREET	83	92	Hilliards
1038	CITY	93	102	TOOWOOMBA
1038	STATE	104	112	Victoria
1038	ZIP	114	118	5223
1038	DATE	150	158	6/9/2008	2008-09-06
1038	TIME	175	194	25/07/2012 at 13:11	2012-07-25T13:11
1038	DEPARTMENT	206	209	RHW
1038	HOSPITAL	210	230	CHARLEVILLE HOSPITAL
1038	DOCTOR	234	259	Alonso Frederich MOSIMANN
1038	DATE	2171	2178	28/9/62	2062-09-28
1038	DOCTOR	2209	2220	A Passwater
1039	IDNUM	13	23	22B782387M
1039	MEDICALRECORD	24	35	2207823.XSM
1039	PATIENT	37	50	Murrieta, KAY
1039	IDNUM	61	69	22B78238
1039	IDNUM	70	78	22B78238
1039	STREET	79	92	Shockey Farms
1039	CITY	93	104	ROCKHAMPTON
1039	STATE	106	124	Northern Territory
1039	ZIP	126	130	5136
1039	DATE	162	171	27/6/1989	1989-06-27
1039	DATE	191	201	10/10/2062	2062-10-10
1039	DEPARTMENT	218	226	RECOVERY
1039	HOSPITAL	229	251	GOULBURN BASE HOSPITAL
1039	DOCTOR	255	276	ANNAMARIA Dusty TUNKS
1039	DOCTOR	2552	2554	JZ
1039	DATE	2558	2566	11/10/62	2062-10-11
1039	DOCTOR	2765	2767	LS
1039	DATE	2772	2780	11.10.62	2062-10-11
1039	DOCTOR	2810	2820	F Eslinger
1040	IDNUM	14	24	70X703445U
1040	MEDICALRECORD	25	36	7097034.MNU
1040	PATIENT	38	58	VANDOVER, ULI AVERIE
1040	IDNUM	69	77	70X70344
1040	IDNUM	78	86	70X70344
1040	STREET	87	95	Granniss
1040	CITY	96	105	WONTHAGGI
1040	STATE	107	110	TAS
1040	ZIP	112	116	4342
1040	DATE	148	157	16/1/2001	2001-01-16
1040	DATE	177	187	16/10/2062	2062-10-16
1040	DEPARTMENT	204	224	3/9 JENNIE COX CLOSE
1040	HOSPITAL	227	261	BAIRNSDALE REGIONAL HEALTH SERVICE
1040	DOCTOR	265	290	DOMINGA Delpha Shenefield
1040	DATE	2948	2956	16/10/62	2062-10-16
1040	DOCTOR	2988	2995	U Flatt
1041	IDNUM	13	23	38T7244031
1041	MEDICALRECORD	24	35	3877244.BID
1041	PATIENT	37	59	BOLUDA, Karrie Refugia
1041	IDNUM	70	78	38T72440
1041	IDNUM	79	87	38T72440
1041	STREET	88	95	Anyards
1041	CITY	96	106	COORANBONG
1041	STATE	108	111	QLD
1041	ZIP	113	117	2844
1041	DATE	152	161	19/8/2010	2010-08-19
1041	DATE	181	191	29/10/2062	2062-10-29
1041	DEPARTMENT	208	215	Laverty
1041	HOSPITAL	218	232	BOWEN HOSPITAL
1041	DOCTOR	236	253	Nanda Sheba ANTLE
1041	DOCTOR	351	353	HV
1041	DOCTOR	1865	1867	KI
1041	DATE	1871	1879	30.10.62	2062-10-30
1041	DOCTOR	1913	1923	I Reichler
1041	DOCTOR	2760	2769	I Bustard
1041	DATE	2771	2778	6.11.62	2062-11-06
1041	DATE	2893	2900	5.11.62	2062-11-05
1042	IDNUM	13	23	59L325361O
1042	MEDICALRECORD	24	35	5943253.PEO
1042	PATIENT	37	53	Reinoso, Olimpia
1042	IDNUM	64	72	59L32536
1042	IDNUM	73	81	59L32536
1042	STREET	82	88	Ogilby
1042	CITY	89	97	BELL BAY
1042	STATE	99	116	Western Australia
1042	ZIP	118	122	2371
1042	DATE	154	162	6/7/1999	1999-06-07
1042	TIME	182	201	29/08/2012 at 18:33	2012-08-29T18:33
1042	DEPARTMENT	213	235	3HR STAY SURGICAL UNIT
1042	HOSPITAL	236	273	TIMBOON & DISTRICT HEALTHCARE SERVICE
1042	DOCTOR	277	302	CLAUDE Altagracia William
1042	DOCTOR	2005	2007	PU
1042	DATE	2013	2020	10.2.62	2062-10-02
1042	DOCTOR	2054	2065	N Hernandes
1042	DATE	2068	2077	10.3.2062	2062-10-03
1042	DOCTOR	2866	2875	N Gutmann
1043	IDNUM	14	24	07H446419X
1043	MEDICALRECORD	25	36	0724464.EZX
1043	PATIENT	38	58	Delfs, ANGELO MERTIE
1043	IDNUM	69	77	07H44641
1043	IDNUM	78	86	07H44641
1043	STREET	87	100	Corall Hollow
1043	CITY	101	108	LITHGOW
1043	STATE	110	120	Queensland
1043	ZIP	122	126	2602
1043	DATE	158	167	17/9/2023	2023-09-17
1043	TIME	187	206	26/09/2012 at 11:38	2012-09-26T11:38
1043	DEPARTMENT	218	232	ACUTECARE WARD
1043	HOSPITAL	235	282	BARWON HEALTH - SOUTH GEELONG RENAL UNIT CAMPUS
1043	DOCTOR	286	306	Elanor Daniele Baton
1043	DATE	2690	2698	29/11/62	2062-11-29
1043	DOCTOR	2731	2742	C Magdefrau
1043	DATE	3722	3729	6/12/62	2062-12-06
1044	IDNUM	13	23	28Y046378I
1044	MEDICALRECORD	24	35	2890463.TVI
1044	PATIENT	37	52	Wolbeck, DIEDRA
1044	IDNUM	63	71	28Y04637
1044	STREET	72	81	Gleahaven
1044	CITY	82	90	QUIRINDI
1044	STATE	92	94	WA
1044	ZIP	96	100	5132
1044	DATE	126	135	18/2/2021	2021-02-18
1044	DATE	155	164	19/2/2062	2062-02-19
1044	DEPARTMENT	181	200	Douglass Hanly Moir
1044	HOSPITAL	203	225	BENTLEY HEALTH SERVICE
1044	DOCTOR	229	242	TARKA BRAWNER
1044	DOCTOR	1669	1671	MK
1044	DOCTOR	1672	1674	SZ
1044	DATE	1678	1685	19.2.62	2062-02-19
1044	DOCTOR	1717	1727	H Bjorkman
1044	DOCTOR	2365	2378	Lera BERGFALK
1044	DOCTOR	2386	2402	Everett Bressman
1045	IDNUM	13	23	86U077336R
1045	MEDICALRECORD	24	35	8680773.IQR
1045	PATIENT	37	50	Pollot, MERLE
1045	IDNUM	61	69	86U07733
1045	IDNUM	70	78	86U07733
1045	STREET	79	86	Eppling
1045	CITY	87	94	DROMANA
1045	STATE	96	111	South Australia
1045	ZIP	113	117	2610
1045	DATE	152	160	4/4/1994	1994-04-04
1045	TIME	180	199	06/02/2013 at 11:50	2013-02-06T11:50
1045	DEPARTMENT	211	231	Anatomical Pathology
1045	HOSPITAL	234	255	PORT AUGUSTA HOSPITAL
1045	DOCTOR	259	278	Laurene Keesha JUUL
1045	DOCTOR	297	304	Morelen
1045	DOCTOR	321	326	Roman
1045	DOCTOR	2885	2887	GY
1045	DOCTOR	2889	2891	XG
1045	DATE	2895	2901	4/9/63	2063-04-09
1045	DOCTOR	2931	2938	V Fencl
1046	MEDICALRECORD	2	13	3460984.XLZ
1046	PATIENT	14	27	Lulow, Bailey
1046	IDNUM	28	36	34R09848
1046	DATE	52	60	6/8/2062	2062-08-06
1046	DATE	2225	2231	3.8.62	2062-08-03
1046	DOCTOR	2263	2274	J Schlimmer
1047	IDNUM	13	23	55I799342K
1047	MEDICALRECORD	24	35	5537993.LHK
1047	PATIENT	37	58	DAIRE, Thurman NAIARA
1047	IDNUM	69	77	92N11954
1047	IDNUM	78	86	92N11954
1047	STREET	87	96	Kellerman
1047	CITY	97	109	PORT HEDLAND
1047	STATE	111	119	Victoria
1047	ZIP	121	125	3226
1047	DATE	160	169	15/8/1999	1999-08-15
1047	TIME	189	208	04/06/2012 at 11:52	2012-06-04T11:52
1047	DEPARTMENT	220	237	Forensic Medicine
1047	HOSPITAL	240	265	TIBOOBURRA HEALTH SERVICE
1047	DOCTOR	269	295	Paisley LEILANI Casagranda
1047	DATE	367	375	25.10.62	2062-10-25
1047	DOCTOR	2936	2938	JG
1047	DATE	2942	2948	8/7/62	2062-08-07
1047	DOCTOR	2981	2990	Y Cirioni
1047	DOCTOR	4032	4037	Y Lin
1047	DATE	4981	4989	25.10.62	2062-10-25
1048	IDNUM	13	23	13E710301T
1048	MEDICALRECORD	24	35	1317103.ACT
1048	PATIENT	37	60	MEINBERG, CHERLYN Terry
1048	IDNUM	71	79	13E71030
1048	IDNUM	80	88	13E71030
1048	STREET	89	98	Gladville
1048	CITY	99	110	NEW NORFOLK
1048	STATE	110	127	Western Australia
1048	ZIP	129	133	3779
1048	DATE	168	178	14/10/2002	2002-10-14
1048	DATE	198	206	6/8/2062	2062-08-06
1048	DEPARTMENT	222	230	PARKES 8
1048	HOSPITAL	233	255	ORBOST REGIONAL HEALTH
1048	DOCTOR	259	281	Madge DORIE Swearinger
1048	DOCTOR	741	756	Haley THOMPKINS
1048	DOCTOR	763	772	D Liddell
1048	DOCTOR	777	786	D Lundemo
1048	DOCTOR	794	802	D Fagley
1048	TIME	806	822	3.30pm on 4/6/12	2012-06-04T15:30
1048	DOCTOR	3305	3307	CW
1048	DATE	3311	3317	7/8/62	2062-08-07
1048	DOCTOR	3351	3363	D Shigemitsu
1049	IDNUM	14	24	61A730469C
1049	MEDICALRECORD	25	36	6107304.PXC
1049	PATIENT	38	57	Pedder, MAYE Isaias
1049	IDNUM	68	76	61A73046
1049	IDNUM	77	85	61A73046
1049	STREET	86	94	Amethyst
1049	CITY	95	101	GATTON
1049	STATE	103	118	South Australia
1049	ZIP	120	124	2810
1049	DATE	159	167	1/7/1979	1979-01-07
1049	TIME	187	206	20/06/2012 at 11:39	2012-06-20T11:39
1049	DEPARTMENT	218	221	RHW
1049	HOSPITAL	224	252	QUEANBEYAN DISTRICT HOSPITAL
1049	DOCTOR	256	278	KACI MOLLIE PIETSCHMAN
1049	DATE	2461	2468	23/8/62	2062-08-23
1049	DOCTOR	2498	2506	R Lovett
1050	IDNUM	13	23	29W851517K
1050	MEDICALRECORD	24	35	2988515.ETK
1050	PATIENT	37	53	NERPIO, Clotilde
1050	IDNUM	64	72	29W85151
1050	IDNUM	73	81	29W85151
1050	STREET	82	85	ZOo
1050	CITY	86	93	CORINDA
1050	STATE	95	110	New South Wales
1050	ZIP	112	116	6440
1050	DATE	146	155	5/11/2017	2017-11-05
1050	TIME	175	194	11/07/2012 at 17:17	2012-07-11T17:17
1050	DEPARTMENT	206	225	L7 CONSULTING ROOMS
1050	HOSPITAL	228	245	LAVERTON HOSPITAL
1050	DOCTOR	249	263	GREGORIO Enick
1050	DATE	335	342	26.9.62	2062-09-26
1050	DATE	436	441	today	2062-09-13
1050	DOCTOR	2376	2378	QU
1050	DATE	2383	2390	14/9/62	2062-09-14
1050	DOCTOR	2421	2429	G Artale
1050	DATE	3279	3286	26.9.62	2062-09-26
1050	DOCTOR	3291	3302	G Simonetti
1051	IDNUM	14	24	77T8825757
1051	MEDICALRECORD	25	36	7778825.TOT
1051	PATIENT	38	55	BRAMLITT, Arvilla
1051	IDNUM	66	74	77T88257
1051	IDNUM	75	83	77T88257
1051	STREET	84	95	West Platti
1051	CITY	96	104	GUNNEDAH
1051	STATE	106	108	WA
1051	ZIP	110	114	1630
1051	DATE	146	154	4/5/1995	1995-04-05
1051	TIME	174	193	18/07/2012 at 13:18	2012-07-18T13:18
1051	DEPARTMENT	205	214	EMERGENCY
1051	HOSPITAL	217	241	MANNUM DISTRICT HOSPITAL
1051	DOCTOR	245	265	HANK LAURENCE PASQUA
1051	AGE	325	327	72
1051	DATE	1989	1996	21.9.62	2062-09-21
1051	DOCTOR	2028	2037	U Rumbold
1051	DOCTOR	3059	3068	U Blacher
1051	DATE	3070	3077	26.9.62	2062-09-26
1051	DATE	3149	3156	25.9.62	2062-09-25
1052	IDNUM	13	23	97K483433E
1052	MEDICALRECORD	24	35	9744834.IKE
1052	PATIENT	37	53	BAUTISTA, Darcey
1052	IDNUM	64	72	97K48343
1052	IDNUM	73	81	97K48343
1052	STREET	82	90	Cranmore
1052	CITY	91	105	PORT MACQUARIE
1052	STATE	107	110	VIC
1052	ZIP	112	116	2085
1052	DATE	151	160	28/2/1977	1977-02-28
1052	DATE	180	190	22/10/2062	2062-10-22
1052	DEPARTMENT	207	221	ACUTECARE WARD
1052	HOSPITAL	224	256	QUEEN ELIZABETH II FAMILY CENTRE
1052	DOCTOR	260	280	Oscar GREGORIA WORTZ
1052	DOCTOR	2045	2047	OI
1052	DATE	2052	2060	23.10.62	2062-10-23
1052	DOCTOR	2099	2105	Z Tieu
1053	IDNUM	13	23	55G403581N
1053	MEDICALRECORD	24	35	5524035.XFN
1053	PATIENT	37	65	DUCHESNEY, Corazon Ynez-rose
1053	IDNUM	76	84	55G40358
1053	IDNUM	85	93	55G40358
1053	STREET	94	107	Garden Meadow
1053	CITY	108	120	PORT LINCOLN
1053	STATE	122	125	QLD
1053	ZIP	127	131	6397
1053	DATE	166	175	16/7/1987	1987-07-16
1053	DATE	195	205	23/10/2062	2062-10-23
1053	DEPARTMENT	222	240	South Western Area
1053	HOSPITAL	243	258	NANNUP HOSPITAL
1053	DOCTOR	262	276	Anh SHYLA Conn
1053	DOCTOR	886	897	O Margarita
1053	DOCTOR	913	922	Raefferty
1053	DOCTOR	923	930	O'Drude
1053	DOCTOR	937	943	O Hinz
1053	TIME	947	964	2.55pm on 21/8/12	2012-08-21T14:55
1053	DOCTOR	2752	2754	BA
1053	DATE	2758	2766	24.10.62	2062-10-24
1053	DOCTOR	3235	3237	GL
1053	DATE	3241	3249	24/10/62	2062-10-24
1053	DOCTOR	3279	3288	O Solwold
1054	MEDICALRECORD	2	13	0315245.MAV
1054	PATIENT	14	32	Klepchick, SOLOMON
1054	IDNUM	33	41	03C52454
1054	DATE	57	65	8/9/2062	2062-09-08
1054	DATE	1425	1431	6/9/62	2062-09-06
1054	DOCTOR	1462	1474	C Alexzander
1055	IDNUM	13	23	24U125408G
1055	MEDICALRECORD	24	34	247125.MAW
1055	PATIENT	36	55	Villaneda, WILLIAMS
1055	IDNUM	66	74	24U12540
1055	STREET	75	93	Cooriengah Heights
1055	CITY	94	100	ORBOST
1055	STATE	102	105	QLD
1055	ZIP	107	111	7187
1055	DATE	137	146	2/11/2022	2022-11-02
1055	DATE	166	176	27/11/2062	2062-11-27
1055	DEPARTMENT	193	215	PRINCE OF WALESPRIVATE
1055	HOSPITAL	216	233	KONDININ HOSPITAL
1055	DOCTOR	237	258	GONZALO GUS MIDDLETON
1055	DATE	397	400	now	2062-11-27
1055	DOCTOR	1074	1080	Reggie
1055	DOCTOR	1087	1095	H Bivans
1055	TIME	1099	1114	25/9/12 at 10am	2012-09-25T10:00
1055	DOCTOR	2195	2197	XB
1055	DATE	2201	2209	28/11/62	2062-11-28
1055	DOCTOR	2243	2249	H Fair
1055	DATE	4389	4397	24/12/62	2062-12-24
1055	DOCTOR	4407	4418	H Martinsen
1055	HOSPITAL	4420	4447	THE PRINCE CHARLES HOSPITAL
1056	IDNUM	13	23	82Q146566P
1056	MEDICALRECORD	24	34	826146.NPR
1056	PATIENT	36	54	Lahmers, Evan MOSE
1056	IDNUM	65	73	82Q14656
1056	STREET	74	82	Irondale
1056	CITY	83	92	THIRLMERE
1056	ZIP	96	100	3494
1056	DATE	126	135	17/7/2004	2004-07-17
1056	DATE	155	164	6/11/2063	2063-06-11
1056	DEPARTMENT	181	199	105 HAMRUN CIRCUIT
1056	HOSPITAL	200	239	EDENHOPE AND DISTRICT MEMORIAL HOSPITAL
1056	DOCTOR	243	261	Brent CARSON DALBA
1056	HOSPITAL	677	693	EXMOUTH HOSPITAL
1056	DOCTOR	1898	1900	SM
1056	DATE	1905	1912	6/12/63	2063-06-12
1056	DOCTOR	1944	1954	W Quaranto
1056	DATE	3209	3216	28.6.63	2063-06-28
1056	HOSPITAL	3240	3257	YARRAWONGA HEALTH
1056	DOCTOR	3284	3291	W Vasso
1056	DOCTOR	3310	3320	W. Densley
1057	IDNUM	14	24	03H747414A
1057	MEDICALRECORD	25	36	0327474.EMA
1057	PATIENT	38	57	Nipps, Fred Milford
1057	IDNUM	66	74	03H74741
1057	STREET	75	86	West Taylor
1057	CITY	87	99	MUSWELLBROOK
1057	STATE	101	129	Australian Capital Territory
1057	ZIP	131	135	4614
1057	DATE	161	169	3/3/2029	2029-03-03
1057	DATE	189	198	23/1/2062	2062-01-23
1057	DEPARTMENT	215	229	MACQUARIE WARD
1057	HOSPITAL	230	260	PORTLAND TABULAM HEALTH CENTRE
1057	DOCTOR	264	286	CARLO Antione ALAMILLA
1057	DATE	570	580	22/12/2062	2062-12-22
1057	DATE	1579	1586	21/1/62	2062-01-21
1057	DOCTOR	1619	1627	B Storts
1057	DOCTOR	2590	2609	ROGELIO OSTERMILLER
1057	DOCTOR	2619	2632	Carmen Warhol
1057	DATE	2853	2860	20/2/62	2062-02-20
1057	AGE	2897	2899	38
1057	IDNUM	3019	3027	40M26651
1057	DOCTOR	3212	3218	Xander
1057	DOCTOR	4196	4206	K'Eberling
1057	DOCTOR	4348	4355	Harrier
1057	DOCTOR	4362	4379	Erasmo Greenwaldt
1057	DOCTOR	4408	4413	Kirby
1057	DOCTOR	4504	4518	DEON BALCKWELL
1057	DOCTOR	4548	4553	Tarka
1057	DOCTOR	4792	4806	Brittaney Farr
1057	DOCTOR	5159	5168	Kolkowski
1057	DOCTOR	5493	5508	Montana K'Bouck
1057	DATE	5509	5516	16/2/62	2062-02-16
1057	DOCTOR	5671	5681	Mal Picazo
1057	DATE	5683	5690	19/2/62	2062-02-19
1057	DATE	5698	5705	20/2/62	2062-02-20
1057	DATE	5732	5739	21/2/62	2062-02-21
1057	DEPARTMENT	5782	5822	Tissue Pathology and Diagnostic Oncology
1057	DATE	5836	5843	20/2/62	2062-02-20
1057	IDNUM	6166	6177	40-42665149
1057	DATE	6179	6187	28/11/62	2062-11-28
1057	DOCTOR	6330	6339	K. Caoile
1057	DOCTOR	6357	6367	K. Dintino
1057	TIME	6376	6393	18/12/12 12:18 pm	2012-12-18T12:18
1057	DATE	6419	6426	23.2.62	2062-02-23
1057	DOCTOR	7205	7225	Mariana K'Degasperis
1057	DATE	7226	7233	21/2/62	2062-02-21
1057	DOCTOR	7239	7250	Bill DAMORE
1057	DOCTOR	7631	7649	Beverly K'Hawrylak
1057	DATE	7651	7658	22/2/62	2062-02-22
1057	DATE	7685	7692	13.3.63	2063-03-13
1057	HOSPITAL	7714	7761	EASTERN HEALTH BLACKBURN PUBLIC SURGICAL CENTRE
1057	DOCTOR	8270	8286	K. Maram Burandt
1057	DATE	8288	8295	12/3/63	2063-03-12
1058	IDNUM	13	23	51D867473J
1058	MEDICALRECORD	24	35	5118674.TIJ
1058	PATIENT	37	52	Stemmerman, Pat
1058	IDNUM	63	71	51D86747
1058	STREET	72	81	Lake Elmo
1058	CITY	82	92	YARRA GLEN
1058	STATE	94	97	QLD
1058	ZIP	99	103	6101
1058	DATE	129	138	11/1/2012	2012-11-01
1058	TIME	158	177	13/03/2013 at 12:53	2013-03-13T12:53
1058	DEPARTMENT	189	194	Orana
1058	HOSPITAL	195	213	INNISFAIL HOSPITAL
1058	DOCTOR	217	234	Jardi BRADY Howse
1058	DOCTOR	1791	1793	QL
1058	DATE	1797	1804	16/5/63	2063-05-16
1058	DOCTOR	1838	1846	P Krausz
1058	DATE	1849	1858	20.5.2063	2063-05-20
1059	IDNUM	13	23	19A888531S
1059	MEDICALRECORD	24	35	1908885.IDS
1059	PATIENT	37	52	DECLET, Lavenia
1059	IDNUM	63	71	19A88853
1059	STREET	72	76	Glos
1059	CITY	77	87	STANTHORPE
1059	STATE	89	104	South Australia
1059	ZIP	106	110	2733
1059	DATE	135	144	11/3/2041	2041-03-11
1059	TIME	164	183	01/05/2013 at 16:43	2013-05-01T16:43
1059	DEPARTMENT	195	225	SOUTH SURGICAL ASSESSMENT UNIT
1059	HOSPITAL	226	242	BONALBO HOSPITAL
1059	DOCTOR	246	272	GARRETT ZACHARIAH SWARTLEY
1059	DATE	344	351	10.7.63	2063-07-10
1059	DATE	456	464	May 2063	2063-05
1059	DOCTOR	667	684	TEMPEST Brooksher
1059	DOCTOR	1255	1263	Mitchell
1059	DOCTOR	2541	2543	AT
1059	DOCTOR	2545	2547	JZ
1059	DATE	2551	2557	4/7/63	2063-07-04
1059	DOCTOR	2587	2595	D Grenke
1059	IDNUM	2769	2777	19A88853
1059	DATE	3752	3755	now	2062-11-27
1059	DATE	4839	4846	10.7.63	2063-07-10
1059	DOCTOR	4921	4932	D Sharpnack
1060	IDNUM	13	23	77W819589A
1060	MEDICALRECORD	24	35	7788195.XYA
1060	PATIENT	37	55	Germond, DION Ezra
1060	IDNUM	66	74	77W81958
1060	STREET	75	84	Bronstein
1060	CITY	85	93	KINGAROY
1060	STATE	95	98	QLD
1060	ZIP	100	104	1295
1060	DATE	130	138	7/7/2039	2039-07-07
1060	DATE	158	167	15/8/2063	2063-08-15
1060	DEPARTMENT	184	189	Envoi
1060	HOSPITAL	190	230	BALLARAT HEALTH SERVICES (BASE HOSPITAL)
1060	DOCTOR	234	257	Vance Boleslaws Swatski
1060	DOCTOR	5163	5165	JA
1060	DATE	5169	5176	13/8/63	2063-08-13
1060	DOCTOR	5210	5222	O Didomenico
1060	DOCTOR	6752	6757	Buddy
1060	DEPARTMENT	6759	6768	Peter Mac
1060	CITY	6770	6776	CASINO
1060	DATE	8246	8252	9.5.63	2063-09-05
1060	DOCTOR	8266	8276	O Edelmann
1060	DOCTOR	8297	8305	O Outten
1061	IDNUM	13	23	09E111396X
1061	MEDICALRECORD	24	35	0911113.ZPX
1061	PATIENT	37	54	Cindrich, SHAWNTA
1061	IDNUM	65	73	09E11139
1061	STREET	74	81	Candace
1061	CITY	82	91	WONTHAGGI
1061	STATE	93	110	Western Australia
1061	ZIP	112	116	2807
1061	DATE	142	151	23/7/1991	1991-07-23
1061	DATE	171	180	30/4/2063	2063-04-30
1061	DEPARTMENT	197	215	MEDIC/SURGERY WARD
1061	HOSPITAL	216	242	INVERELL DISTRICT HOSPITAL
1061	DOCTOR	246	272	FREDERICK BRANDEN BERROCAL
1061	DATE	344	351	20.5.63	2063-05-20
1061	HOSPITAL	834	871	WEST WIMMERA HEALTH SERVICE - JEPARIT
1061	DOCTOR	1172	1181	C Schmutz
1061	TIME	1185	1203	11.38am on 28/2/13	2013-02-28T11:38
1061	DOCTOR	2806	2808	NM
1061	DATE	2812	2818	3/5/63	2063-05-03
1061	DOCTOR	2850	2858	C Ingram
1061	HOSPITAL	3623	3639	WHYALLA HOSPITAL
1061	DEPARTMENT	3650	3667	DICKINSON 2 SOUTH
1061	IDNUM	3669	3681	CY-11-113968
1061	DOCTOR	4108	4120	C Budniewski
1061	DATE	4232	4241	20/5/2063	2063-05-20
1061	HOSPITAL	4255	4289	GULARGAMBONE MULTI PURPOSE SERVICE
1061	DOCTOR	4317	4325	C Dudash
1061	DOCTOR	4344	4351	C Ortea
1061	PHONE	4651	4660	8382 9154
1062	IDNUM	14	24	67B131454F
1062	MEDICALRECORD	25	35	670131.LPL
1062	PATIENT	37	51	NISSILA, Reina
1062	IDNUM	62	70	67B13145
1062	STREET	71	91	Parkway  Cannon Hill
1062	CITY	92	100	MAITLAND
1062	STATE	102	112	Queensland
1062	ZIP	114	118	2751
1062	DATE	144	153	12/5/2008	2008-12-05
1062	DATE	173	182	28/5/2063	2063-05-28
1062	DEPARTMENT	199	216	Forensic Medicine
1062	HOSPITAL	217	238	OSBORNE PARK HOSPITAL
1062	DOCTOR	242	262	Gaston Brad KESINGER
1062	DATE	2832	2839	28/5/63	2063-05-28
1062	DOCTOR	2872	2880	Q Nedman
1063	IDNUM	13	23	25X152412O
1063	MEDICALRECORD	24	35	2581524.EGO
1063	PATIENT	37	54	MENZIES, DOMINICK
1063	IDNUM	65	73	25X15241
1063	STREET	74	88	Howard Gleason
1063	CITY	89	97	THE OAKS
1063	STATE	99	114	New South Wales
1063	ZIP	116	120	5075
1063	DATE	146	154	4/7/1974	1974-07-04
1063	DATE	174	183	14/9/2062	2062-09-14
1063	DEPARTMENT	200	221	3HR STAY SURGICALUNIT
1063	HOSPITAL	222	239	WESTMEAD HOSPITAL
1063	DOCTOR	243	263	Mellisa Lauryn DROTT
1063	IDNUM	414	422	25X15241
1063	DOCTOR	1496	1498	TD
1063	DATE	1502	1509	15.9.62	2062-09-15
1063	DOCTOR	1542	1554	F Akiereisen
1064	MEDICALRECORD	1	11	727273.OTB
1064	PATIENT	12	26	Levert, Dorian
1064	IDNUM	27	35	72T27357
1064	DATE	51	59	4/6/2063	2063-04-06
1064	DOCTOR	1126	1128	GG
1064	DATE	1132	1139	29.5.63	2063-05-29
1064	DOCTOR	1172	1179	T Felps
1064	DOCTOR	1185	1197	T Stoudemire
1064	IDNUM	1634	1642	72T27357
1065	IDNUM	14	24	93K874428I
1065	MEDICALRECORD	25	35	934874.LHX
1065	PATIENT	37	60	Parrilla, PRINCE MICHAL
1065	IDNUM	71	79	93K87442
1065	STREET	80	89	Coastland
1065	CITY	90	95	COBAR
1065	STATE	97	112	South Australia
1065	ZIP	114	118	3155
1065	DATE	144	154	19/10/2030	2030-10-19
1065	TIME	174	193	23/07/2012 at 09:32	2012-07-23T09:32
1065	DEPARTMENT	205	208	DHM
1065	HOSPITAL	209	222	TARA HOSPITAL
1065	DOCTOR	226	245	Gale Philip Hindson
1065	DOCTOR	264	283	Arturo Rheinschmidt
1065	DOCTOR	336	344	Gazzillo
1065	DOCTOR	489	504	Stewart Mattoon
1065	IDNUM	505	512	93K8744
1065	DATE	1129	1136	25/9/62	2062-09-25
1065	DOCTOR	1168	1175	Y Farha
1065	DATE	1863	1869	9/3/62	2062-09-03
1065	DOCTOR	1918	1928	MILES Fung
1066	IDNUM	13	23	51G894487Q
1066	MEDICALRECORD	24	34	512894.MWS
1066	PATIENT	36	45	Noe, Wade
1066	IDNUM	56	64	51G89448
1066	STREET	65	69	Rudd
1066	CITY	70	78	MANDURAH
1066	STATE	80	97	Western Australia
1066	ZIP	99	103	3647
1066	DATE	129	139	17/10/1992	1992-10-17
1066	DATE	159	168	19/9/2063	2063-09-19
1066	DEPARTMENT	185	207	3HR STAY SURGICAL UNIT
1066	HOSPITAL	208	230	MANILLA HEALTH SERVICE
1066	DOCTOR	234	246	JAE WARSTLER
1066	DATE	320	328	17/10/63	2063-10-17
1066	HOSPITAL	483	503	OMEO DISTRICT HEALTH
1066	DOCTOR	892	894	MI
1066	DATE	898	905	20.9.63	2063-09-20
1066	DOCTOR	1018	1026	N Tomkus
1066	DOCTOR	1035	1044	N Ivanova
1066	TIME	1048	1066	4:54pm on 17.07.13	2013-07-17T16:54
1066	DOCTOR	1098	1105	N Hiltz
1066	COUNTRY	2614	2626	South Africa
1066	DATE	2630	2634	2057	2057
1066	IDNUM	2636	2644	51G89448
1066	ORGANIZATION	2644	2657	YRC Worldwide
1066	DOCTOR	3562	3571	N Jemenez
1066	DATE	3844	3852	17/10/63	2063-10-17
1066	DEPARTMENT	3854	3864	Hereditary
1066	HOSPITAL	3865	3901	CHILDERS MULTIPURPOSE HEALTH SERVICE
1066	DOCTOR	4655	4666	N. Dierking
1066	DOCTOR	4684	4693	N. Virgen
1066	TIME	4700	4716	09/08/13 6:20 pm	2013-08-09T18:20
1067	MEDICALRECORD	1	11	091825.OLN
1067	PATIENT	12	28	Parrilla, Karrak
1067	IDNUM	29	37	09D82554
1067	DATE	52	61	27/9/2062	2062-09-27
1067	IDNUM	153	160	09D8255
1067	IDNUM	165	172	09D8255
1067	DOCTOR	834	836	LB
1067	DATE	840	847	25.9.62	2062-09-25
1067	DOCTOR	878	886	B Harrod
1068	IDNUM	14	24	67Z946603H
1068	MEDICALRECORD	25	36	6799466.AIH
1068	PATIENT	38	52	Wurth, JEFFERY
1068	IDNUM	63	71	67Z94660
1068	STREET	72	87	Golden Pheasant
1068	CITY	88	95	EMERALD
1068	STATE	97	115	Northern Territory
1068	ZIP	117	121	8045
1068	DATE	147	156	29/4/2017	2017-04-29
1068	DATE	176	185	16/1/2062	2062-01-16
1068	DEPARTMENT	202	265	Cure For Life Foundation Neuro-oncology Laboratory Adult Cancer
1068	HOSPITAL	266	287	HAY DISTRICT HOSPITAL
1068	DOCTOR	291	312	JEFFRY FREDERICK Sero
1068	DOCTOR	364	372	Teschler
1068	IDNUM	586	594	67Z94660
1068	DATE	2730	2737	17.1.62	2062-01-17
1068	DOCTOR	2769	2777	P Eggett
1068	DATE	4608	4615	14/2/62	2062-02-14
1068	DEPARTMENT	4639	4655	ST GEORGEPRIVATE
1068	DOCTOR	4884	4893	P Uselton
1069	IDNUM	13	23	88Q547551T
1069	MEDICALRECORD	24	35	8865475.PET
1069	PATIENT	37	58	NICOME, Osvaldo Ciana
1069	IDNUM	69	77	88Q54755
1069	IDNUM	78	86	88Q54755
1069	STREET	87	93	Tupper
1069	CITY	94	103	TRAFALGAR
1069	STATE	105	107	WA
1069	ZIP	109	113	1885
1069	DATE	148	156	1/7/2002	2002-01-07
1069	TIME	176	195	19/03/2013 at 15:58	2013-03-19T15:58
1069	DEPARTMENT	207	225	South Eastern Area
1069	HOSPITAL	228	270	WESTERN DISTRICT HEALTH SERVICE - HAMILTON
1069	DOCTOR	274	295	DARA Jackelyn Stempel
1069	DOCTOR	1979	1981	MP
1069	DATE	1986	1993	22/5/63	2063-05-22
1069	DOCTOR	2026	2038	V Drumheiser
1069	DATE	2495	2502	30/5/63	2063-05-30
1070	IDNUM	14	24	36M568519B
1070	MEDICALRECORD	25	36	3645685.EZB
1070	PATIENT	38	62	Gualdoni, MARIYA Setsuko
1070	IDNUM	73	81	36M56851
1070	IDNUM	82	90	36M56851
1070	STREET	91	96	Foray
1070	CITY	97	105	HAHNDORF
1070	STATE	107	122	South Australia
1070	ZIP	124	128	4218
1070	DATE	161	169	7/9/2005	2005-09-07
1070	TIME	189	208	20/03/2013 at 14:29	2013-03-20T14:29
1070	DEPARTMENT	220	228	Pathwest
1070	HOSPITAL	231	255	WAIKERIE HEALTH SERVICES
1070	DOCTOR	259	277	Orval JEROLD BRINN
1070	DATE	362	366	2061	2061
1070	DATE	2158	2165	23/5/63	2063-05-23
1070	DOCTOR	2198	2205	J Shoen
1071	IDNUM	13	23	94J688678K
1071	MEDICALRECORD	24	34	943688.QTU
1071	PATIENT	36	62	Beerling, FRANKIE'MARSHALL
1071	IDNUM	73	81	94J68867
1071	IDNUM	82	90	94J68867
1071	LOCATION-OTHER	91	103	P.O. BOX 246
1071	CITY	104	113	FRANKSTON
1071	STATE	115	125	Queensland
1071	ZIP	127	131	6063
1071	DATE	166	175	22/8/1979	1979-08-22
1071	TIME	195	214	16/04/2013 at 19:56	2013-04-16T19:56
1071	DEPARTMENT	226	248	PRINCE OF WALESPRIVATE
1071	HOSPITAL	250	290	NORTH EASTERN SOLDIERS MEMORIAL HOSPITAL
1071	DOCTOR	294	321	Rosette ROSALEE Bottiglieri
1071	DOCTOR	1791	1793	PY
1071	DATE	1797	1804	19.6.63	2063-06-19
1071	DOCTOR	2599	2601	IP
1071	DATE	2605	2612	19.6.63	2063-06-19
1071	DOCTOR	2643	2651	X Dottin
1071	DATE	3865	3872	25/6/63	2063-06-25
1072	MEDICALRECORD	1	12	4216096.IQT
1072	PATIENT	13	43	CHEEK, Warlpiri CATHERINE NEVA
1072	IDNUM	44	52	42F60963
1072	IDNUM	53	61	42F60963
1072	DATE	76	84	6/5/2064	2064-05-06
1072	DOCTOR	1232	1234	TO
1072	DOCTOR	1235	1237	HO
1072	DATE	1241	1248	29.5.64	2064-05-29
1072	DOCTOR	1281	1287	M Rady
1072	IDNUM	1428	1436	42F60963
1072	DATE	1772	1778	5/6/64	2064-06-05
1074	MEDICALRECORD	2	13	6382005.WLE
1074	PATIENT	14	40	Senethavilouk, Leonardo JC
1074	IDNUM	41	49	63W20058
1074	DATE	65	73	5/6/2064	2064-05-06
1074	DATE	121	125	2062	2062
1074	DOCTOR	672	677	Holtz
1074	TIME	681	688	11.20am	2014-04-03T11:20
1074	DOCTOR	762	771	R. Lanfor
1074	DATE	1048	1054	6/5/64	2064-06-05
1075	IDNUM	13	23	05F402391A
1075	MEDICALRECORD	24	35	0524023.ZDA
1075	PATIENT	37	52	SUNFORD, Maisie
1075	IDNUM	63	71	05F40239
1075	IDNUM	72	80	05F40239
1075	STREET	81	89	Linksley
1075	CITY	90	99	MERIMBULA
1075	STATE	101	103	WA
1075	ZIP	103	107	5421
1075	DATE	139	148	2/11/2003	2003-11-02
1075	DATE	168	177	23/7/2062	2062-07-23
1075	DEPARTMENT	194	234	Tissue Pathology and Diagnostic Oncology
1075	HOSPITAL	237	253	HEATHCOTE HEALTH
1075	DOCTOR	257	275	Senaida RYAN Hubel
1075	AGE	348	350	63
1075	DOCTOR	754	762	B Kemick
1075	TIME	766	784	11:15am on 21.5.12	2012-05-21T11:15
1075	DOCTOR	2851	2853	PK
1075	DATE	2857	2864	24.7.62	2062-07-24
1075	DOCTOR	2896	2905	B Braxton
1075	DOCTOR	5936	5943	B Baiza
1075	DOCTOR	5972	5981	B Stelter
1075	DATE	5983	5989	1.7.62	2062-07-01
1075	DATE	6067	6074	30.7.62	2062-07-30
1076	MEDICALRECORD	1	12	6305234.OYJ
1076	PATIENT	13	34	STEUART, Tatiana Mana
1076	IDNUM	35	43	63B52345
1076	IDNUM	44	52	63B52345
1076	DATE	68	76	8/9/2062	2062-09-08
1076	DOCTOR	1122	1124	KS
1076	DATE	1128	1134	8.8.62	2062-08-08
1076	DOCTOR	1166	1176	P Bergsman
1077	IDNUM	14	24	84S123317U
1077	MEDICALRECORD	25	35	847123.HCU
1077	PATIENT	37	60	BEDDOME, Josephina BILL
1077	IDNUM	71	79	84S12331
1077	STREET	80	86	Runner
1077	CITY	87	99	MAROOCHYDORE
1077	STATE	101	109	Victoria
1077	ZIP	111	115	1480
1077	DATE	141	149	1/9/1977	1977-01-09
1077	TIME	169	188	13/06/2012 at 15:02	2012-06-13T15:02
1077	DEPARTMENT	200	215	ENVOI Pathology
1077	HOSPITAL	218	244	GUNDAGAI DISTRICT HOSPITAL
1077	DOCTOR	248	274	Gudrun STEPHANIE Dorenfeld
1077	DATE	2556	2563	16.8.62	2062-08-16
1077	DOCTOR	2594	2601	U Sozio
1078	IDNUM	13	23	32P154365D
1078	MEDICALRECORD	24	34	325154.JRP
1078	PATIENT	36	51	INGALSBE, Ammie
1078	IDNUM	62	70	32P15436
1078	STREET	71	77	Teresi
1078	CITY	78	88	SPRINGWOOD
1078	STATE	90	105	South Australia
1078	ZIP	107	111	3266
1078	DATE	137	145	6/4/1989	1989-04-06
1078	TIME	165	184	27/06/2012 at 18:05	2012-06-27T18:05
1078	DEPARTMENT	196	205	Peter Mac
1078	HOSPITAL	206	227	WYONG PUBLIC HOSPITAL
1078	DOCTOR	231	253	Yang DEBBI Pfotenhauer
1078	AGE	313	315	78
1078	DOCTOR	4197	4199	GQ
1078	DATE	4203	4210	30/8/62	2062-08-30
1078	DOCTOR	4244	4253	J Gasaway
1079	IDNUM	13	23	05Y994675X
1079	MEDICALRECORD	24	35	0599946.TOX
1079	PATIENT	37	50	Rod, Brittney
1079	IDNUM	61	69	05Y99467
1079	IDNUM	70	78	05Y99467
1079	STREET	79	86	Vervain
1079	CITY	87	95	COOKTOWN
1079	STATE	97	112	New South Wales
1079	ZIP	114	118	3165
1079	DATE	153	162	16/3/1999	1999-03-16
1079	TIME	182	201	25/07/2012 at 16:43	2012-07-25T16:43
1079	DEPARTMENT	213	230	DICKINSON 3 SOUTH
1079	HOSPITAL	233	249	MAREEBA HOSPITAL
1079	DOCTOR	253	269	Koori DAKU Bijou
1079	DOCTOR	2885	2887	DF
1079	DATE	2892	2899	28.9.62	2062-09-28
1079	DOCTOR	2931	2938	B Halik
1080	IDNUM	13	23	10C8763828
1080	MEDICALRECORD	24	35	1018763.VGW
1080	PATIENT	37	48	Klei, Chase
1080	IDNUM	59	67	10C87638
1080	STREET	68	77	Duckettes
1080	CITY	78	86	MERRIMAC
1080	STATE	88	90	SA
1080	ZIP	92	96	1110
1080	DATE	122	130	5/9/1988	1988-09-05
1080	DATE	150	159	23/1/2062	2062-01-23
1080	DEPARTMENT	176	195	INTENSIVE CARE UNIT
1080	HOSPITAL	198	232	YEA AND DISTRICT MEMORIAL HOSPITAL
1080	DOCTOR	236	254	JAKE Taylor LINZEY
1080	DOCTOR	2505	2507	OF
1080	DOCTOR	2509	2511	SZ
1080	DATE	2515	2522	24.1.62	2062-01-24
1080	DOCTOR	2555	2565	C Allevato
1081	MEDICALRECORD	1	12	8446156.WFR
1081	PATIENT	13	31	Samuelsen, Carissa
1081	IDNUM	32	40	84M61568
1081	IDNUM	41	49	84M61568
1081	DATE	65	74	25/1/2062	2062-01-25
1081	AGE	139	141	32
1081	DOCTOR	1982	1984	TI
1081	DATE	1988	1995	24/1/62	2062-01-24
1081	DOCTOR	2025	2035	V Nicolaus
1082	IDNUM	14	24	32I636740A
1082	MEDICALRECORD	25	36	3236367.LAA
1082	PATIENT	38	56	Ebbs, DWAYNE GLENN
1082	IDNUM	67	75	32I63674
1082	STREET	76	85	Hustlings
1082	CITY	86	98	PORT LINCOLN
1082	STATE	100	118	Northern Territory
1082	ZIP	120	124	5066
1082	DATE	150	160	23/11/1986	1986-11-23
1082	TIME	180	199	20/03/2013 at 11:58	2013-03-20T11:58
1082	DEPARTMENT	211	220	EMERGENCY
1082	HOSPITAL	223	245	KARRATHA HEALTH CAMPUS
1082	DOCTOR	249	268	Jude Alphonse LAVEY
1082	AGE	328	330	81
1082	DATE	2032	2039	23/5/63	2063-05-23
1082	DOCTOR	2070	2080	J Chrisman
1083	IDNUM	13	23	53Z237598L
1083	MEDICALRECORD	24	35	5392375.ZVL
1083	PATIENT	37	66	Lanteigne, Yong Tiera ANDREAS
1083	IDNUM	77	85	53Z23759
1083	IDNUM	86	94	53Z23759
1083	STREET	95	101	Zarick
1083	CITY	102	114	BATEMANS BAY
1083	STATE	116	144	Australian Capital Territory
1083	ZIP	146	150	3722
1083	DATE	182	191	12/4/1979	1979-12-04
1083	TIME	211	230	02/04/2013 at 08:56	2013-04-02T08:56
1083	DEPARTMENT	242	251	Peter Mac
1083	HOSPITAL	254	276	KARRATHA HEALTH CAMPUS
1083	DOCTOR	280	300	MELODI Inger LOVERDI
1083	DOCTOR	319	326	Lathern
1083	AGE	395	397	88
1083	DOCTOR	781	787	Westby
1083	DOCTOR	794	800	K Greg
1083	TIME	804	823	11.00am on 02.04.13	2013-04-02T11:00
1083	DOCTOR	1741	1743	TK
1083	DOCTOR	1745	1747	QF
1083	DATE	1751	1757	5.6.63	2063-06-05
1083	DOCTOR	1790	1796	K Riek
1083	DATE	2345	2352	13/6/63	2063-06-13
1084	IDNUM	13	23	11V368656U
1084	MEDICALRECORD	24	35	1183686.PRU
1084	PATIENT	37	64	Bohnsack, Wendolyn HIPOLITO
1084	IDNUM	75	83	11V36865
1084	IDNUM	84	92	11V36865
1084	IDNUM	93	101	11V36865
1084	STREET	102	108	Belfry
1084	CITY	109	120	COOBER PEDY
1084	STATE	122	124	NT
1084	ZIP	126	130	6018
1084	DATE	165	173	1/9/2008	2008-09-01
1084	DATE	193	201	3/7/2063	2063-07-03
1084	DEPARTMENT	218	231	DARLING POINT
1084	HOSPITAL	234	268	YEA AND DISTRICT MEMORIAL HOSPITAL
1084	DOCTOR	272	293	Gale HEATH Thiengtham
1084	DATE	365	371	5.8.63	2063-08-05
1084	DATE	397	403	8.7.63	2063-08-07
1084	DATE	573	578	today	2062-09-13
1084	DATE	746	750	2060	2060
1084	DOCTOR	1258	1268	D Bielicki
1084	DOCTOR	1279	1286	D Lemma
1084	TIME	1290	1305	10:35 on 1/5/13	2013-05-01T10:35
1084	DOCTOR	2925	2927	PM
1084	DOCTOR	2929	2931	WH
1084	DATE	2935	2941	4/7/63	2063-07-04
1084	DOCTOR	2971	2982	D Arvanitis
1084	DATE	5201	5207	8.7.63	2063-08-07
1084	DATE	5785	5793	5.8.2063	2063-08-05
1084	HOSPITAL	5808	5824	BILOELA HOSPITAL
1084	DOCTOR	5855	5862	D Halas
1084	DATE	5955	5964	19/7/2063	2063-07-19
1084	IDNUM	6009	6017	11V36865
1084	DOCTOR	6125	6134	D Bombich
1084	DATE	6149	6158	22/7/2063	2063-07-22
1084	DATE	6339	6348	23/7/2063	2063-07-23
1084	PATIENT	6514	6530	Joaquina VINEGAR
1084	IDNUM	7038	7044	118368
1085	IDNUM	14	24	69S389714C
1085	MEDICALRECORD	25	36	6963897.EMC
1085	PATIENT	38	50	IVORY, BELLE
1085	IDNUM	61	69	69S38971
1085	STREET	70	82	Saint Andrew
1085	CITY	83	88	COOMA
1085	STATE	90	93	ACT
1085	ZIP	95	99	2090
1085	DATE	125	133	6/9/1995	1995-06-09
1085	DATE	153	162	17/7/2063	2063-07-17
1085	DEPARTMENT	179	197	105 HAMRUN CIRCUIT
1085	HOSPITAL	200	219	STANTHORPE HOSPITAL
1085	DOCTOR	223	247	Virgilio Yarran ZABROCKI
1085	DATE	2361	2368	18.7.63	2063-07-18
1085	DOCTOR	2399	2407	R Picton
1085	DATE	2976	2983	10/1/63	2063-10-01
1086	IDNUM	13	23	80J9896735
1086	MEDICALRECORD	24	35	8039896.SIN
1086	PATIENT	37	60	SICKINGER, ERLINE Addie
1086	IDNUM	71	79	74W15132
1086	STREET	80	96	White Pine Knoll
1086	CITY	97	102	DUBBO
1086	STATE	104	132	Australian Capital Territory
1086	ZIP	134	138	5630
1086	DATE	164	173	4/11/1982	1982-04-11
1086	DATE	193	202	24/7/2063	2063-07-24
1086	DEPARTMENT	219	232	PARKES 4 EAST
1086	HOSPITAL	235	249	MONTO HOSPITAL
1086	DOCTOR	253	277	Emerson Bennett LEWALLEN
1086	DOCTOR	945	953	Portland
1086	DOCTOR	960	969	S Olivero
1086	TIME	973	994	15:25 on the 22/05/13	2013-05-22T15:25
1086	DOCTOR	1235	1237	LZ
1086	DATE	1241	1248	25.7.63	2063-07-25
1086	DOCTOR	1278	1285	S Haros
1086	DOCTOR	1291	1300	S Debbins
1086	DATE	2317	2324	16.8.63	2063-08-16
1086	DOCTOR	2354	2362	S Fearon
1086	DOCTOR	2368	2376	S Lahaye
1086	DEPARTMENT	2378	2387	Peter Mac
1086	HOSPITAL	2400	2423	THOMAS EMBLING HOSPITAL
1087	IDNUM	13	23	48F000621W
1087	MEDICALRECORD	24	35	4820006.HDW
1087	PATIENT	37	49	Samyn, Kayce
1087	IDNUM	60	68	48F00062
1087	IDNUM	69	77	48F00062
1087	STREET	78	93	Liddington Hall
1087	CITY	94	101	YEPPOON
1087	STATE	103	121	Northern Territory
1087	ZIP	123	127	4053
1087	DATE	162	171	26/7/2004	2004-07-26
1087	DATE	191	199	3/9/2063	2063-09-03
1087	DEPARTMENT	216	239	POST OPERATIVE RECOVERY
1087	HOSPITAL	242	258	BILOELA HOSPITAL
1087	DOCTOR	262	284	MIGDALIA KARLA Hueston
1087	DATE	356	363	11.9.63	2063-09-11
1087	DOCTOR	1965	1967	GZ
1087	DOCTOR	1968	1970	MO
1087	DATE	1973	1979	4.9.63	2063-09-04
1087	DOCTOR	2009	2020	G Kunselman
1087	DATE	2656	2663	11.9.63	2063-09-11
1088	IDNUM	14	24	96B021789F
1088	MEDICALRECORD	25	36	9600217.WYF
1088	PATIENT	38	58	STURN, KAMI LUCIENNE
1088	IDNUM	69	77	96B02178
1088	IDNUM	78	86	96B02178
1088	STREET	87	99	Brandon Oaks
1088	CITY	100	109	NEWCASTLE
1088	STATE	111	119	Tasmania
1088	ZIP	121	125	2207
1088	DATE	160	169	28/2/1998	1998-02-28
1088	TIME	189	208	11/06/2013 at 11:11	2013-06-11T11:11
1088	DEPARTMENT	220	238	Radiation Oncology
1088	HOSPITAL	241	289	EASTERN EYRE HEALTH AND AGED CARE - CLEVE CAMPUS
1088	DOCTOR	293	316	Franklin HORACIO DERKAS
1088	DATE	3371	3378	14.8.63	2063-08-14
1088	DOCTOR	3409	3419	Z Lagrimas
1089	IDNUM	13	23	01F803396E
1089	MEDICALRECORD	24	35	0128033.YQE
1089	PATIENT	37	50	LICATA, Hyman
1089	IDNUM	60	68	01F80339
1089	IDNUM	69	77	01F80339
1089	STREET	78	86	Churston
1089	CITY	87	96	MOUNT ISA
1089	STATE	98	126	Australian Capital Territory
1089	ZIP	128	132	6105
1089	DATE	167	177	12/11/2002	2002-11-12
1089	TIME	197	216	29/05/2013 at 18:31	2013-05-29T18:31
1089	DEPARTMENT	228	238	NSW Health
1089	HOSPITAL	241	259	GERALDTON HOSPITAL
1089	DOCTOR	263	276	MERVIN Gowans
1089	DOCTOR	295	305	Majerowski
1089	DATE	340	346	6.8.63	2063-08-06
1089	DOCTOR	2061	2063	EL
1089	DOCTOR	2066	2068	JI
1089	DATE	2072	2078	2.7.63	2063-07-02
1089	DOCTOR	2109	2120	A Achenbach
1089	DATE	3084	3090	6.8.63	2063-08-06
1090	IDNUM	14	24	75P643695Z
1090	MEDICALRECORD	25	36	7556436.ZPZ
1090	PATIENT	38	55	Helm, Grant BILLY
1090	IDNUM	66	74	75P64369
1090	IDNUM	75	83	75P64369
1090	STREET	84	90	Armell
1090	CITY	91	99	LONGFORD
1090	STATE	101	104	ACT
1090	ZIP	106	110	6011
1090	DATE	145	154	27/7/1999	1999-07-27
1090	DATE	174	183	20/8/2063	2063-08-20
1090	DEPARTMENT	200	227	DEPT OF CORRECTIVE SERVICES
1090	HOSPITAL	228	256	PALMERSTON REGIONAL HOSPITAL
1090	DOCTOR	260	280	Janell ROSETTA NUBER
1090	DATE	2483	2490	21/8/63	2063-08-21
1090	DOCTOR	2523	2530	T Dahme
1091	MEDICALRECORD	1	12	2247637.PKH
1091	PATIENT	13	29	Chacon, Tallulah
1091	IDNUM	30	38	22L76375
1091	IDNUM	39	47	22L76375
1091	DATE	63	72	16/8/2063	2063-08-16
1091	DOCTOR	1255	1257	ZA
1091	DOCTOR	1258	1260	SQ
1091	DATE	1264	1271	15.8.63	2063-08-15
1091	DOCTOR	1301	1309	H Tovias
1092	IDNUM	13	23	43C364612S
1092	MEDICALRECORD	24	35	4313646.DGS
1092	PATIENT	37	50	Vasile, DENNY
1092	IDNUM	61	69	43C36461
1092	STREET	70	79	Girralong
1092	CITY	80	89	RASMUSSEN
1092	STATE	91	119	Australian Capital Territory
1092	ZIP	121	125	2083
1092	DATE	151	161	15/10/1996	1996-10-15
1092	DATE	181	190	21/8/2063	2063-08-21
1092	DEPARTMENT	207	223	ST GEORGEPRIVATE
1092	HOSPITAL	226	266	MURRAY BRIDGE SOLDIERS MEMORIAL HOSPITAL
1092	DOCTOR	270	286	TESSA Tiana Maud
1092	DOCTOR	879	888	M Zeisler
1092	TIME	892	908	14:30 on 19/6/13	2013-06-19T14:30
1092	DOCTOR	2305	2307	CY
1092	DATE	2311	2318	22/8/63	2063-08-22
1092	DOCTOR	3918	3920	VJ
1092	DATE	3924	3931	22/8/63	2063-08-22
1092	DOCTOR	3961	3970	I Washpun
111	IDNUM	13	23	01Z395670B
111	MEDICALRECORD	24	34	019395.RSB
111	PATIENT	36	52	WILLARS, Felicia
111	IDNUM	63	71	01Z39567
111	STREET	72	80	Casimere
111	CITY	81	86	COLAC
111	ZIP	90	94	5139
111	DATE	120	129	22/3/1999	1999-03-22
111	DATE	149	158	12/2/2063	2063-02-12
111	DEPARTMENT	175	183	Pathwest
111	HOSPITAL	184	214	TOWNSVILLE UNIVERSITY HOSPITAL
111	DOCTOR	218	247	Fernando DEAN Brain-MANGANARO
111	DOCTOR	942	957	Ahmad-Teichmann
111	DOCTOR	964	974	A. Bussell
111	DOCTOR	3977	3979	VM
111	DOCTOR	3981	3983	OD
111	DATE	3987	3994	13.2.63	2063-02-13
111	DOCTOR	4024	4033	A Hessell
111	ORGANIZATION	5254	5264	Humana Inc
111	HOSPITAL	5266	5308	SOUTH WEST HEALTHCARE - WARRNAMBOOL CAMPUS
111	ORGANIZATION	7365	7382	W.W. Grainger Inc
111	HOSPITAL	7384	7417	BELLINGER RIVER DISTRICT HOSPITAL
162	IDNUM	13	23	22Q9965284
162	MEDICALRECORD	24	35	2269965.GXM
162	PATIENT	37	52	POLEE, Shawanna
162	IDNUM	63	71	22Q99652
162	STREET	72	79	W Aspen
162	CITY	80	89	LEONGATHA
162	STATE	91	93	SA
162	ZIP	95	99	3165
162	DATE	125	134	5/10/1980	1980-10-05
162	TIME	154	173	09/12/2013 at 13:47	2013-12-09T13:47
162	DEPARTMENT	185	202	CORONARYCARE UNIT
162	HOSPITAL	203	251	MOUNT BARKER DISTRICT SOLDIERS MEMORIAL HOSPITAL
162	DOCTOR	255	274	KULIN Luther HANSEL
162	DATE	320	326	4/3/64	2064-03-04
162	DOCTOR	1730	1732	KO
162	DATE	1736	1743	2/12/63	2063-02-12
162	DOCTOR	1808	1817	P Sheerin
162	DATE	3019	3025	3/4/64	2064-03-04
162	PHONE	3276	3285	8382 9154
162	DOCTOR	3354	3364	P. Ameling
162	DOCTOR	3369	3379	P. Feighan
162	TIME	3386	3402	24/12/13 4:06 pm	2013-12-24T16:06
180	IDNUM	13	23	64Z288335J
180	MEDICALRECORD	24	35	6492883.JOJ
180	PATIENT	37	47	Renn, LONG
180	IDNUM	58	66	64Z28833
180	IDNUM	67	75	64Z28833
180	STREET	76	84	Spinaker
180	CITY	85	92	KAPUNDA
180	STATE	94	97	QLD
180	ZIP	99	103	2069
180	DATE	138	147	22/2/2032	2032-02-22
180	DATE	167	175	1/7/2063	2063-01-07
180	DEPARTMENT	192	210	OPERATING THEATRES
180	HOSPITAL	213	234	BOORT DISTRICT HEALTH
180	DOCTOR	238	258	Bernetta LUANA Mcfan
180	AGE	319	321	35
180	DURATION	363	370	2 years	P2Y
180	DOCTOR	1274	1283	Q Cocroft
180	DOCTOR	1290	1300	Q. Pezzulo
180	TIME	1308	1338	5th of November 2013 at 1:30pm	2013-11-05T13:30
180	DOCTOR	2379	2381	DD
180	DATE	2385	2391	1.8.63	2063-01-08
180	DOCTOR	2421	2428	Q Pruyn
24	IDNUM	13	23	38I037645D
24	MEDICALRECORD	24	35	3830376.KND
24	PATIENT	37	58	LAURANGE, Seema JORGE
24	IDNUM	69	77	38I03764
24	STREET	78	84	Ridler
24	CITY	85	92	NORTHAM
24	STATE	94	96	WA
24	ZIP	98	102	2573
24	DATE	128	137	23/3/2010	2010-03-23
24	TIME	154	173	24/09/2013 at 13:22	2013-09-24T13:22
24	DEPARTMENT	185	198	SEALS Central
24	HOSPITAL	201	229	MILDURA BASE PUBLIC HOSPITAL
24	DOCTOR	233	257	Val Josh Danilo-Longbine
24	DATE	304	311	5/12/63	2063-12-05
24	DOCTOR	797	805	I. Nicks
24	TIME	809	845	2:45pm on the 24th of September 2013	2013-09-24T14:45
24	DOCTOR	2274	2276	FU
24	DOCTOR	2277	2279	YK
24	DATE	2283	2291	27.11.63	2063-11-27
24	DOCTOR	2321	2330	I Pugmire
24	DATE	3404	3411	3/12/63	2063-12-03
24	DOCTOR	3535	3550	WALLACE CAMERON
24	HOSPITAL	3803	3820	BLACKALL HOSPITAL
24	CITY	3831	3844	ALICE SPRINGS
24	DATE	3921	3928	5/12/63	2063-12-05
24	HOSPITAL	3973	3994	HAY DISTRICT HOSPITAL
24	CITY	4005	4014	TRAFALGAR
250	IDNUM	13	23	70R239451A
250	MEDICALRECORD	24	35	7062394.NEA
250	PATIENT	37	52	NEGRETE, JESSIE
250	IDNUM	63	71	70R23945
250	STREET	72	83	Cheney Pond
250	CITY	84	94	NARACOORTE
250	STATE	96	98	WA
250	ZIP	100	104	2292
250	DATE	130	138	3/4/2013	2013-03-04
250	DATE	158	168	25/11/2063	2063-11-25
250	DEPARTMENT	185	203	CARDIOTHORACIC ICU
250	HOSPITAL	204	223	HERVEY BAY HOSPITAL
250	DOCTOR	227	244	Sandy Neal Moorer
250	DATE	1758	1774	26th of November	2063-11-26
250	DOCTOR	1855	1862	T. Dyal
250	DOCTOR	1869	1885	Gaylord Steinger
250	DOCTOR	1886	1901	RUSSEL CHOPELAS
250	TIME	1905	1942	16:07pm on the 23rd of September 2013	2013-09-23T16:07
250	DOCTOR	1949	1951	ES
250	DOCTOR	1953	1955	TQ
250	DATE	1959	1967	26.11.63	2063-11-26
250	DOCTOR	1997	2003	T Sarp
353	IDNUM	13	23	28N3505103
353	MEDICALRECORD	24	34	285350.NCA
353	PATIENT	36	59	BASTEDO, SKYLAR Jenelle
353	IDNUM	70	78	28N35051
353	STREET	79	86	Almeria
353	CITY	87	94	ALDGATE
353	ZIP	98	102	2727
353	DATE	128	136	5/5/1999	1999-05-05
353	DATE	156	165	22/5/2063	2063-05-22
353	DEPARTMENT	182	198	UROLOGY DAY ONLY
353	HOSPITAL	199	242	LIGHTNING RIDGE MULTIPURPOSE HEALTH SERVICE
353	DOCTOR	246	269	JEREMY JEFFRY SMOLINSKY
353	DATE	318	324	3/7/63	2063-07-03
353	DOCTOR	2218	2220	HZ
353	DATE	2224	2231	23/5/63	2063-05-23
353	DOCTOR	2262	2272	H Delarosa
353	DATE	5033	5039	3/7/63	2063-07-03
353	DEPARTMENT	5064	5071	Laverty
353	DOCTOR	5773	5786	H. Princiotta
353	DOCTOR	5804	5815	H. Weckerly
353	TIME	5822	5838	10/04/13 1:49 pm	2013-04-10T13:49
358	IDNUM	14	24	86J371568R
358	MEDICALRECORD	25	35	863371.PRV
358	PATIENT	37	56	TENNIES, ANTIONETTE
358	IDNUM	67	75	86J37156
358	IDNUM	76	84	86J37156
358	STREET	85	92	Metcalf
358	CITY	93	104	GOONDIWINDI
358	STATE	106	114	Tasmania
358	ZIP	116	120	2530
358	DATE	155	164	25/5/1991	1991-05-25
358	TIME	184	203	16/03/2013 at 18:21	2013-03-16T18:21
358	DEPARTMENT	215	231	Envoi Specialist
358	HOSPITAL	232	261	WARIALDA MULTIPURPOSE SERVICE
358	DOCTOR	265	283	SHILOH SHERON Erie
358	DOCTOR	302	307	Agron
358	DATE	365	371	5.1.63	2063-05-01
358	DOCTOR	2648	2650	VZ
358	DATE	2654	2661	20.5.63	2063-05-20
358	DOCTOR	2693	2700	V Stoud
358	DATE	2703	2712	21.5.2063	2063-05-21
358	DOCTOR	3504	3512	V Weldin
358	DATE	3887	3893	5.1.63	2063-05-01
358	DOCTOR	3898	3907	V Maresco
47	IDNUM	14	24	34F3916260
47	MEDICALRECORD	25	36	3423916.GQA
47	PATIENT	38	53	LETLOW, Evelynn
47	IDNUM	64	72	34F39162
47	IDNUM	73	81	34F39162
47	STREET	82	94	Braithwaithe
47	CITY	95	99	EDEN
47	STATE	101	109	Victoria
47	ZIP	111	115	4818
47	DATE	150	159	20/6/1997	1997-06-20
47	DATE	179	187	5/2/2063	2063-02-05
47	DEPARTMENT	204	219	DAYSURGERY UNIT
47	HOSPITAL	222	251	WOMENS AND CHILDRENS HOSPITAL
47	DOCTOR	255	278	SHELDON LAURENCE Mulzer
47	DOCTOR	875	886	K. Standrew
47	TIME	890	924	9:40am on the 3rd of December 2013	2013-12-03T09:40
47	DOCTOR	1839	1841	HZ
47	DATE	1845	1851	6.2.63	2063-02-06
47	DOCTOR	1881	1888	K Pipho
470	IDNUM	13	23	55X992584L
470	MEDICALRECORD	24	34	558992.NVM
470	PATIENT	36	56	Economides, Leopoldo
470	IDNUM	67	75	55X99258
470	STREET	76	86	Off Summer
470	CITY	87	101	LAKES ENTRANCE
470	STATE	103	131	Australian Capital Territory
470	ZIP	133	137	2165
470	DATE	163	173	28/10/2015	2015-10-28
470	TIME	192	211	24/06/2013 at 09:19	2013-06-24T09:19
470	DEPARTMENT	223	240	Forensic Medicine
470	HOSPITAL	241	290	GOULBURN VALLEY HEALTH - CENTRE FOR OLDER PERSONS
470	DOCTOR	294	315	Tommie Herschel Uglow
470	DOCTOR	1210	1226	OZELL MARTINDALE
470	TIME	1230	1248	1:53pm on 24.06.13	2013-06-24T13:53
470	DOCTOR	1252	1260	P Angers
470	DOCTOR	1262	1271	P Petters
470	DOCTOR	1276	1283	P. Zent
470	DOCTOR	1510	1522	Perry Lavell
470	TIME	1526	1544	2:05pm on 24.06.13	2013-06-24T14:05
470	DOCTOR	3837	3839	IF
470	DATE	3843	3850	27.8.63	2063-08-27
470	DOCTOR	3880	3888	Y Wakins
470	DOCTOR	3894	3902	Y Sorell
473	IDNUM	13	23	13T023532U
473	MEDICALRECORD	24	35	1370235.KHU
473	PATIENT	37	52	Serabia, Danita
473	IDNUM	63	71	13T02353
473	IDNUM	72	80	13T02353
473	STREET	81	90	Bush Pond
473	CITY	91	101	HERVEY BAY
473	STATE	103	106	QLD
473	ZIP	108	112	3111
473	DATE	144	153	10/6/1988	1988-06-10
473	DATE	173	181	6/8/2063	2063-08-06
473	DEPARTMENT	197	214	Forensic Medicine
473	HOSPITAL	217	234	MENINGIE HOSPITAL
473	DOCTOR	238	257	Evita LOIDA WOETZEL
473	TIME	913	931	4:25pm on 4/6/2013	2013-06-04T16:25
473	DOCTOR	939	946	D. Roya
473	DOCTOR	955	967	D. Reitmeyer
473	DOCTOR	2289	2291	OE
473	DATE	2295	2301	7.8.63	2063-08-07
473	DOCTOR	2331	2340	D Buergel
473	DOCTOR	3497	3506	D Chasten
528	IDNUM	14	24	61P044690C
528	MEDICALRECORD	25	36	6160446.ZCC
528	PATIENT	38	65	Humphreys, WARREN JACQUETTA
528	IDNUM	75	83	61P04469
528	STREET	84	91	Kellogg
528	CITY	92	102	TOWNSVILLE
528	STATE	104	107	VIC
528	ZIP	109	113	2558
528	DATE	139	148	15/1/2001	2001-01-15
528	DEPARTMENT	192	205	SEALS central
528	HOSPITAL	208	232	COLLIE DISTRICT HOSPITAL
528	DOCTOR	236	254	JAYSON ANGEL Iossa
528	AGE	521	523	66
528	DOCTOR	1009	1019	Kreighbaum
528	DOCTOR	1028	1037	S Hoppins
528	TIME	1041	1060	12.37am on 07.08.13	2013-08-07T12:37
528	DOCTOR	1705	1711	Koning
528	DOCTOR	1712	1718	Randal
528	DOCTOR	1727	1733	Gulden
528	TIME	1737	1755	1.05pm on 07.08.13	2013-08-07T13:05
528	DOCTOR	3966	3968	UK
528	DOCTOR	3970	3972	IS
528	DATE	3976	3984	10.10.63	2063-10-10
528	DOCTOR	4017	4027	S Wojenski
545	IDNUM	13	23	28L064759L
545	MEDICALRECORD	24	35	2840647.OXL
545	PATIENT	37	63	Schempp, FRANKIE Nathanial
545	IDNUM	74	82	28L06475
545	IDNUM	83	91	28L06475
545	STREET	92	98	E Swan
545	CITY	99	103	EDEN
545	STATE	105	107	WA
545	ZIP	109	113	6910
545	DATE	148	157	20/9/2018	2018-09-20
545	DATE	175	185	29/10/2063	2063-10-29
545	DEPARTMENT	202	220	CORONARY CARE UNIT
545	HOSPITAL	223	239	HEATHCOTE HEALTH
545	DOCTOR	243	265	Laurence MELIDA MARVEL
545	DOCTOR	823	835	Shiverdecker
545	DOCTOR	842	851	G Tidball
545	DOCTOR	859	868	G Learman
545	TIME	872	888	15.05 on 27/8/13	2013-08-27T15:05
545	DOCTOR	3012	3014	KB
545	DATE	3018	3026	29/10/63	2063-10-29
545	DOCTOR	3057	3063	G Maas
545	DATE	3454	3457	now	2062-11-27
545	IDNUM	3498	3506	28L06475
545	DOCTOR	3560	3568	G. Thode
545	DATE	3572	3579	2/10/63	2063-10-02
563	IDNUM	14	24	86I185717T
563	MEDICALRECORD	25	35	863185.TDS
563	PATIENT	37	54	BOCHE, CONCEPCION
563	IDNUM	64	72	86I18571
563	STREET	73	82	Elmendorf
563	CITY	83	88	DERBY
563	STATE	90	108	Northern Territory
563	ZIP	110	114	5321
563	DATE	140	150	28/10/1985	1985-10-28
563	TIME	170	189	22/01/2013 at 14:28	2013-01-22T14:28
563	DEPARTMENT	201	212	ACT Genetic
563	DOCTOR	216	239	Ethan Florentino Hevrin
563	DOCTOR	649	651	EF
563	DATE	655	662	25.3.63	2063-03-25
563	DOCTOR	693	703	U Vigueras
563	DATE	1983	1990	13/4/63	2063-04-13
563	HOSPITAL	2022	2088	JACARANDA PLACE V QUEENSLAND ADOLESCENT EXTENDED TREATMENT CENTRE
563	DATE	2129	2137	4/3/2063	2063-04-03
563	DOCTOR	2169	2181	PEARL Beskom
563	DOCTOR	2186	2194	U Stauss
563	DOCTOR	2199	2209	U Sandhaus
563	DOCTOR	2726	2741	CHIARA Gennaria
563	DOCTOR	2946	2965	U. Humberto Bernson
583	IDNUM	14	24	97Z786665F
583	MEDICALRECORD	25	36	9797866.ROF
583	PATIENT	38	50	Katis, Linda
583	IDNUM	61	69	97Z78666
583	STREET	70	77	Langner
583	CITY	78	86	PORTLAND
583	STATE	88	90	SA
583	ZIP	92	96	2582
583	DATE	122	131	18/6/1989	1989-06-18
583	DATE	151	160	14/4/2063	2063-04-14
583	DEPARTMENT	177	196	INTENSIVE CARE UNIT
583	DOCTOR	200	221	Randall Joaquin Waren
583	DATE	270	276	5.6.63	2063-06-05
583	DATE	295	302	27.4.63	2063-04-27
583	DOCTOR	771	776	Busie
583	DOCTOR	2138	2140	TT
583	DATE	2144	2151	15/4/63	2063-04-15
583	DOCTOR	2181	2187	Z Ravo
583	DOCTOR	6847	6857	Z. Werblow
583	HOSPITAL	6861	6884	MOUNT PLEASANT HOSPITAL
583	DOCTOR	7560	7570	Z. Muraoka
583	HOSPITAL	7574	7609	WEST WIMMERA HEALTH SERVICE - NHILL
583	DATE	7684	7690	5.6.63	2063-06-05
583	HOSPITAL	7704	7738	COLLARENEBRI MULTI PURPOSE SERVICE
583	DOCTOR	7770	7788	V. Ottilie Rogstad
59	IDNUM	14	24	55V707723N
59	MEDICALRECORD	25	36	5587077.GJN
59	PATIENT	38	56	HOLWAY, Jaime SADE
59	IDNUM	67	75	55V70772
59	STREET	76	88	Robert Evans
59	CITY	89	98	THIRLMERE
59	STATE	100	103	TAS
59	ZIP	105	109	3632
59	DATE	135	143	1/6/2034	2034-01-06
59	DATE	163	171	6/7/2062	2062-06-07
59	DEPARTMENT	188	209	Hunter Area Pathology
59	HOSPITAL	210	236	RIVERLAND GENERAL HOSPITAL
59	DOCTOR	240	255	ALEC Marty Dies
59	DATE	304	311	28.6.62	2062-06-28
59	DOCTOR	1977	1979	QM
59	DATE	1984	1991	6.12.62	2062-06-12
59	DOCTOR	2022	2031	O Feusier
59	IDNUM	2724	2726	O5
59	IDNUM	2728	2730	O5
59	HOSPITAL	2906	2935	WARIALDA MULTIPURPOSE SERVICE
59	DATE	3737	3744	28.6.62	2062-06-28
59	DOCTOR	3875	3882	Patrice
59	DOCTOR	3886	3895	O Weynand
59	DEPARTMENT	3897	3906	EMERGENCY
59	DOCTOR	4215	4220	Tarka
59	DOCTOR	4224	4233	O. Songer
59	DEPARTMENT	4235	4244	StVincent
591	IDNUM	14	24	13R838781W
591	MEDICALRECORD	25	36	1368387.VEW
591	PATIENT	38	59	ROSWELL, CLETUS ALANA
591	IDNUM	70	78	13R83878
591	STREET	79	85	Wannyl
591	CITY	86	92	BURNIE
591	STATE	94	122	Australian Capital Territory
591	ZIP	124	128	1003
591	DATE	154	163	13/7/1991	1991-07-13
591	DATE	183	192	16/1/2062	2062-01-16
591	DEPARTMENT	209	223	ACUTECARE WARD
591	HOSPITAL	226	241	MURGON HOSPITAL
591	DOCTOR	245	260	SCOT DALE Pouge
591	DOCTOR	2013	2015	QE
591	DOCTOR	2016	2018	BA
591	DATE	2022	2029	17.1.62	2062-01-17
591	DOCTOR	2066	2076	C Maritato
591	DATE	2824	2831	20/3/63	2063-03-20
634	MEDICALRECORD	2	13	1886003.XWV
634	PATIENT	14	32	MARSICO, Rosemarie
634	IDNUM	33	41	18V60039
634	DATE	57	66	19/3/2064	2064-03-19
634	DOCTOR	1308	1310	MY
634	DOCTOR	1312	1314	CW
634	DATE	1318	1325	18.3.64	2064-03-18
634	DOCTOR	1354	1362	D Gelder
636	MEDICALRECORD	1	12	6666204.MSD
636	PATIENT	13	28	Ciraolo, Melisa
636	IDNUM	29	37	66R62044
636	DATE	53	62	19/3/2064	2064-03-19
636	DOCTOR	1305	1307	PO
636	DOCTOR	1309	1311	ZC
636	DATE	1315	1322	18.3.64	2064-03-18
636	DOCTOR	1352	1358	S Odeh
637	IDNUM	13	23	40B4707569
637	MEDICALRECORD	24	34	400470.UOR
637	PATIENT	36	49	Levien, Tracy
637	IDNUM	59	67	40B47075
637	STREET	68	78	Pine Croft
637	CITY	79	89	WOOLGOOLGA
637	STATE	89	106	Western Australia
637	ZIP	108	112	1240
637	DATE	138	148	28/10/1994	1994-10-28
637	DATE	168	177	18/3/2064	2064-03-18
637	DEPARTMENT	194	205	DAY SURGERY
637	HOSPITAL	206	230	COLLIE DISTRICT HOSPITAL
637	DOCTOR	234	252	Ezra Marlin HALLEE
637	DOCTOR	1898	1913	ALPHONSO Ubaldo
637	DOCTOR	1919	1921	HN
637	DOCTOR	1923	1925	TY
637	DATE	1929	1936	19.3.64	2064-03-19
637	DOCTOR	1966	1974	G Bedney
637	IDNUM	2082	2090	24O65140
637	DOCTOR	3252	3263	G Schlinker
639	IDNUM	14	24	45F352363X
639	MEDICALRECORD	25	36	4523523.QJX
639	PATIENT	38	53	Caradonna, HUGO
639	IDNUM	64	72	45F35236
639	IDNUM	73	81	45F35236
639	STREET	82	86	Lunn
639	CITY	87	96	DEVONPORT
639	STATE	98	106	Victoria
639	ZIP	108	112	2319
639	DATE	147	156	18/3/1991	1991-03-18
639	DATE	176	185	21/1/2063	2063-01-21
639	DEPARTMENT	202	217	ENVOI Pathology
639	HOSPITAL	218	244	THE QUEEN ELIZABETH CENTRE
639	DOCTOR	248	266	Celsa Cassi Korgie
639	AGE	326	328	77
639	DOCTOR	3781	3783	AS
639	DATE	3787	3794	22/1/63	2063-01-22
639	DOCTOR	3825	3832	L Ngoun
639	DOCTOR	5969	5978	L Laducer
639	DATE	6594	6601	23/3/64	2064-03-23
641	IDNUM	13	23	93B373421G
641	MEDICALRECORD	24	35	9303734.FEG
641	PATIENT	37	52	LIZOTTE, ASHTON
641	IDNUM	63	71	93B37342
641	IDNUM	72	80	93B37342
641	STREET	81	90	Butterfly
641	CITY	91	98	ALDGATE
641	STATE	100	103	ACT
641	ZIP	105	109	5640
641	DATE	141	150	20/8/1994	1994-08-20
641	DEPARTMENT	194	210	WEST GYNAECOLOGY
641	HOSPITAL	213	232	BLACKWATER HOSPITAL
641	DOCTOR	236	259	CARISSA JAQUELINE Bobak
641	DOCTOR	313	321	Sansouci
641	AGE	332	334	73
641	ORGANIZATION	827	838	Textron Inc
641	DOCTOR	1146	1155	Z Rolstad
641	TIME	1159	1175	17.25 on 7/11/12	2012-11-07T17:25
641	DOCTOR	1648	1655	Z Fedor
641	TIME	1659	1675	17.45 on 7/11/12	2012-11-07T17:45
641	DOCTOR	4030	4032	VI
641	DATE	4037	4044	1/10/62	2062-01-10
641	DOCTOR	4077	4084	Z Giehl
641	DATE	6651	6660	23/3/2064	2064-03-23
641	DOCTOR	6700	6714	WINDY Hennings
642	MEDICALRECORD	2	13	5193935.UZP
642	PATIENT	14	35	STEAGELL, Fae Malcolm
642	IDNUM	36	44	51X39357
642	DATE	60	69	24/3/2064	2064-03-24
642	DOCTOR	417	419	YN
642	TIME	430	450	15.1.2014 at 11:12am	2014-01-15T11:12
642	DOCTOR	566	579	Trena Dilbert
642	DOCTOR	586	588	BS
642	DOCTOR	589	591	FF
642	DOCTOR	592	594	KN
642	TIME	598	622	11:27am on the 14.1.2014	2014-01-14T11:27
642	DOCTOR	758	760	JU
642	DOCTOR	762	764	QM
642	DATE	768	775	18.3.64	2064-03-18
642	DOCTOR	805	812	O Behun
642	DOCTOR	1450	1459	O Carline
642	HOSPITAL	1461	1469	KARITANE
643	IDNUM	13	23	67Q435696G
643	MEDICALRECORD	24	35	6764356.YPG
643	PATIENT	37	57	Jowers, Keneth DAREN
643	IDNUM	68	76	67Q43569
643	STREET	77	83	Leaton
643	CITY	84	93	THIRLMERE
643	STATE	95	97	WA
643	ZIP	99	103	3902
643	DATE	129	138	16/2/2007	2007-02-16
643	TIME	158	177	24/06/2013 at 10:58	2013-06-24T10:58
643	DEPARTMENT	189	201	SA Pathology
643	HOSPITAL	202	222	MERCY HEALTH SERVICE
643	DOCTOR	226	247	SHELIA Harvey TRABERT
643	DOCTOR	1388	1390	EC
643	DATE	1395	1402	27/8/63	2063-08-27
643	DOCTOR	1433	1443	R Trevisan
644	IDNUM	13	23	08Y637302C
644	MEDICALRECORD	24	34	089637.KBH
644	PATIENT	36	52	Hardwick, Tamala
644	IDNUM	63	71	08Y63730
644	STREET	72	78	Buffum
644	CITY	79	89	ULVERSTONE
644	STATE	91	99	Victoria
644	ZIP	101	105	3113
644	DATE	131	141	24/12/1999	1999-12-24
644	TIME	161	180	21/03/2013 at 16:21	2013-03-21T16:21
644	DEPARTMENT	192	209	BILLINGTON CENTRE
644	HOSPITAL	210	231	MOLONG HEALTH SERVICE
644	DOCTOR	235	260	Chauncey GREGORIO ALFIERI
644	DOCTOR	1885	1887	GZ
644	DATE	1891	1898	24/5/63	2063-05-24
644	DOCTOR	1928	1940	B Doeberling
645	IDNUM	14	24	72I486712X
645	MEDICALRECORD	25	36	7234867.CGX
645	PATIENT	38	51	Koors, Moises
645	IDNUM	62	70	72I48671
645	STREET	71	92	Northwest Pacific Elm
645	CITY	93	100	WINDSOR
645	STATE	102	104	NT
645	ZIP	106	110	2073
645	DATE	136	145	30/5/2008	2008-05-30
645	TIME	165	184	26/04/2013 at 12:23	2013-04-26T12:23
645	DEPARTMENT	196	211	ACUTE CARE WARD
645	HOSPITAL	212	240	BRUCE ROCK MEMORIAL HOSPITAL
645	DOCTOR	244	266	LAZARO Iesha LINDEMUTH
645	DOCTOR	1620	1622	WF
645	DATE	1626	1632	6/1/63	2063-06-01
645	DOCTOR	1704	1713	T Bucklew
645	DATE	1716	1724	7.4.2063	2063-07-04
646	MEDICALRECORD	1	11	301507.URB
646	PATIENT	12	32	COUNTS, Rickey ANGEL
646	IDNUM	33	41	30E50776
646	DATE	57	66	12/2/2062	2062-02-12
646	DOCTOR	1134	1136	XR
646	DOCTOR	1138	1140	XM
646	DATE	1144	1150	9.2.62	2062-02-09
646	DOCTOR	1183	1194	I Gamberini
647	MEDICALRECORD	1	11	353389.KTT
647	PATIENT	12	27	Doolittle, Olin
647	IDNUM	28	36	35I38947
647	DATE	52	61	18/3/2063	2063-03-18
647	DOCTOR	517	519	WC
647	DATE	524	531	17/3/63	2063-03-17
647	DOCTOR	565	571	JWally
647	DATE	574	582	3.3.2063	2063-03-03
648	IDNUM	14	24	09S129787Z
648	MEDICALRECORD	25	36	0961297.VSZ
648	PATIENT	38	60	Riddley, Judson Rufina
648	IDNUM	71	79	09S12978
648	STREET	80	90	Lazy Point
648	CITY	91	100	BELLINGEN
648	STATE	102	112	Queensland
648	ZIP	114	118	5732
648	DATE	144	153	17/1/2010	2010-01-17
648	TIME	173	192	27/11/2012 at 18:56	2012-11-27T18:56
648	DEPARTMENT	204	208	WEST
648	HOSPITAL	209	227	GERALDTON HOSPITAL
648	DOCTOR	231	251	BRET HARLAND MCENANY
648	DOCTOR	1520	1522	IP
648	DOCTOR	1524	1526	LJ
648	DATE	1530	1537	30/1/62	2062-01-30
648	DOCTOR	1567	1578	B Klemencic
649	IDNUM	13	23	67O249835I
649	MEDICALRECORD	24	35	6752498.KNI
649	PATIENT	37	54	HETTENHAUSEN, SON
649	IDNUM	65	73	67O24983
649	IDNUM	74	82	67O24983
649	STREET	83	94	Silversmith
649	CITY	95	105	YARRAWONGA
649	STATE	107	125	Northern Territory
649	ZIP	127	131	4371
649	DATE	166	176	12/11/1985	1985-12-11
649	TIME	196	215	26/11/2012 at 08:14	2012-11-26T08:14
649	DEPARTMENT	227	252	INTENSIVE CARE UNIT SOUTH
649	HOSPITAL	255	268	ROMA HOSPITAL
649	DOCTOR	272	295	MADELINE Jindalee Kazmi
649	DOCTOR	937	943	Q Dure
649	DOCTOR	955	964	Q Jumalon
649	DOCTOR	969	980	Q Wadzinski
649	DOCTOR	988	996	Q Siptak
649	TIME	1000	1016	10am on 26/11/12	2012-11-26T10:00
649	DOCTOR	2326	2328	YT
649	DATE	2332	2339	29/1/62	2062-01-29
649	DOCTOR	2373	2382	Q Edouard
649	DOCTOR	3606	3618	Q Cauterucci
649	DATE	4014	4020	2/6/62	2062-02-06
650	IDNUM	14	24	62S021442H
650	MEDICALRECORD	25	36	6270214.MFH
650	PATIENT	38	47	Moll, KEN
650	IDNUM	58	66	62S02144
650	STREET	67	71	Yale
650	CITY	72	82	ANDERGROVE
650	STATE	84	87	TAS
650	ZIP	89	93	2042
650	DATE	119	128	10/3/2010	2010-10-03
650	DEPARTMENT	172	187	Pathology North
650	HOSPITAL	188	230	WESTERN DISTRICT HEALTH SERVICE - HAMILTON
650	DOCTOR	234	250	Nick Lily Cosper
650	DOCTOR	304	311	MITCHEL
650	DATE	333	340	9.12.63	2063-09-12
650	DATE	363	369	3.2.63	2063-03-02
650	DATE	540	546	2/5/62	2062-02-05
650	DOCTOR	1150	1161	R Korthauer
650	TIME	1165	1184	11.00am on 02.01.13	2013-01-02T11:00
650	DOCTOR	1473	1487	Warner Cusmano
650	DOCTOR	1494	1499	R Ubl
650	TIME	1503	1522	12.55pm on 02.01.13	2013-01-02T12:55
650	DOCTOR	1907	1909	IF
650	DOCTOR	1911	1913	PN
650	DATE	1917	1923	3.5.63	2063-03-05
650	DOCTOR	1954	1961	R Snode
650	DOCTOR	2801	2814	Freddie Iiams
650	HOSPITAL	2816	2835	BRIDGETOWN HOSPITAL
650	DOCTOR	3994	4007	GENARO TREVOR
650	HOSPITAL	4009	4031	COBRAM DISTRICT HEALTH
650	DATE	4425	4432	25.3.63	2063-03-25
650	DOCTOR	4545	4553	R Foller
650	DATE	5495	5501	3.2.63	2063-03-02
650	DOCTOR	5530	5543	Yarran HLADIK
650	HOSPITAL	5545	5575	GRENFELL MULTI PURPOSE SERVICE
650	DATE	5826	5833	9.12.63	2063-09-12
650	DEPARTMENT	5848	5851	RHW
650	DEPARTMENT	5877	5895	CORONARY CARE UNIT
650	CITY	5897	5909	MCLAREN VALE
650	DOCTOR	5927	5939	HARRIS ENNES
650	AGE	5971	5973	57
650	IDNUM	6418	6426	62S02144
650	PATIENT	6427	6431	JUAN
650	DOCTOR	12115	12123	R Maltez
650	HOSPITAL	12125	12163	CLONCURRY MULTI-PURPOSE HEALTH SERVICE
650	DOCTOR	12366	12379	Koori Challis
650	HOSPITAL	12381	12397	QUILPIE HOSPITAL
651	IDNUM	13	23	36B871751C
651	MEDICALRECORD	24	35	3608717.NEC
651	PATIENT	37	50	Bousum, MISTI
651	IDNUM	61	69	36B87175
651	STREET	70	78	Mc Neile
651	CITY	79	89	STANTHORPE
651	STATE	91	106	New South Wales
651	ZIP	108	112	5410
651	DATE	138	147	24/8/2002	2002-08-24
651	DEPARTMENT	191	208	DICKINSON 3 SOUTH
651	HOSPITAL	211	246	WAGGA WAGGA RURAL REFERRAL HOSPITAL
651	DOCTOR	250	271	Roselle KRIS Delcueto
651	DOCTOR	1598	1600	SH
651	DATE	1604	1611	21.8.63	2063-08-21
651	DOCTOR	1642	1652	F Holladay
652	IDNUM	13	23	94X892819K
652	MEDICALRECORD	24	35	9498928.CZK
652	PATIENT	37	53	Prowant, Emanuel
652	IDNUM	64	72	94X89281
652	STREET	73	80	Maybank
652	CITY	81	91	YARRA GLEN
652	STATE	93	95	SA
652	ZIP	97	101	6282
652	DATE	127	136	24/9/1996	1996-09-24
652	TIME	156	175	22/04/2013 at 13:42	2013-04-22T13:42
652	DEPARTMENT	187	212	2.23HR STAY SURGICAL UNIT
652	HOSPITAL	213	228	GLENSIDE CAMPUS
652	DOCTOR	232	250	ADELAIDE Jude Aidt
652	DOCTOR	1169	1171	ZV
652	DATE	1175	1182	25/6/63	2063-06-25
652	DOCTOR	1212	1221	Y Faulcon
653	MEDICALRECORD	2	12	990764.KER
653	PATIENT	13	29	Harkley, WOODROW
653	IDNUM	30	38	99B76441
653	DATE	54	63	22/8/2063	2063-08-22
653	DOCTOR	1089	1091	WE
653	DATE	1095	1102	19.8.63	2063-08-19
653	DOCTOR	1132	1144	Y Nordstrand
654	MEDICALRECORD	1	12	5797944.TMS
654	PATIENT	13	26	Pilat, Ashton
654	IDNUM	27	35	57Y79447
654	DATE	51	60	29/1/2062	2062-01-29
654	DOCTOR	649	651	QG
654	DOCTOR	652	654	YB
654	DATE	658	665	28.1.62	2062-01-28
654	DOCTOR	699	706	N Lorah
654	DATE	1319	1327	previous	2064-05-27
654	DATE	1346	1355	13.4.2061	2061-04-13
654	IDNUM	1357	1365	57Y79447
655	IDNUM	13	23	21H534884N
655	MEDICALRECORD	24	35	2125348.VLN
655	PATIENT	37	59	Holze, DORTHEA Gilbert
655	IDNUM	70	78	21H53488
655	STREET	79	87	Plaister
655	CITY	88	95	DROMANA
655	STATE	97	100	TAS
655	ZIP	102	106	6931
655	DATE	132	141	23/7/1996	1996-07-23
655	TIME	161	180	24/04/2013 at 11:13	2013-04-24T11:13
655	DEPARTMENT	192	196	Lowy
655	HOSPITAL	199	226	WALCHA MULTIPURPOSE SERVICE
655	DOCTOR	230	253	AUGUST Chang DIGIROLAMO
655	DOCTOR	1939	1941	HV
655	DOCTOR	1943	1945	MQ
655	DATE	1949	1956	28.6.63	2063-06-28
655	DOCTOR	1988	2000	F Ripplinger
657	IDNUM	14	24	26L316481M
657	MEDICALRECORD	25	36	2643164.XDM
657	PATIENT	38	58	SEAWELL, Ehtel JAMAR
657	IDNUM	69	77	26L31648
657	STREET	78	88	Pelhamdale
657	CITY	89	96	WARWICK
657	STATE	98	100	SA
657	ZIP	102	106	5138
657	DATE	132	142	16/11/2004	2004-11-16
657	DEPARTMENT	186	191	PaLMS
657	HOSPITAL	192	212	CAIRNS BASE HOSPITAL
657	DOCTOR	216	230	MICHAL Holtsoi
657	DATE	280	287	25.3.64	2064-03-25
657	DOCTOR	629	631	IR
657	TIME	642	662	15.1.2014 at 11:12am	2014-01-15T11:12
657	DOCTOR	778	792	LIZBETH Verant
657	DOCTOR	799	801	QS
657	DOCTOR	802	804	KI
657	DOCTOR	805	807	DV
657	TIME	811	836	11:27 am on the 14.1.2014	2014-01-14T11:27
657	DOCTOR	972	974	PT
657	DOCTOR	976	978	WA
657	DATE	982	989	18.3.64	2064-03-18
657	DOCTOR	1019	1030	G Timperman
657	DOCTOR	1669	1679	G Andringa
657	HOSPITAL	1681	1706	TIBOOBURRA HEALTH SERVICE
657	DATE	1982	1989	25.3.64	2064-03-25
658	MEDICALRECORD	1	12	8334374.MYV
658	PATIENT	13	29	LIPPOLD, BEAULAH
658	IDNUM	30	38	83H43744
658	DATE	54	63	25/3/2064	2064-03-25
658	DOCTOR	974	976	WE
658	DOCTOR	978	980	NF
658	DATE	984	991	23.3.64	2064-03-23
658	DOCTOR	1021	1028	V Lubow
659	IDNUM	13	23	57R276859P
659	MEDICALRECORD	24	35	5762768.NXP
659	PATIENT	37	54	Vanschaick, VIARA
659	IDNUM	65	73	57R27685
659	IDNUM	74	82	57R27685
659	STREET	83	93	Windbridge
659	CITY	94	105	HEALESVILLE
659	STATE	107	122	South Australia
659	ZIP	124	128	3025
659	DATE	163	172	29/9/1997	1997-09-29
659	TIME	192	211	20/01/2014 at 11:46	2014-01-20T11:46
659	DEPARTMENT	223	242	INTENSIVE CARE UNIT
659	HOSPITAL	245	270	BROKEN HILL BASE HOSPITAL
659	DOCTOR	274	294	Tyesha ARIE Vavricek
659	DOCTOR	1747	1749	ZN
659	DOCTOR	1751	1753	XM
659	DATE	1757	1764	23.3.64	2064-03-23
659	DOCTOR	1796	1802	N Muna
659	DOCTOR	2600	2609	N Eckberg
660	IDNUM	13	23	52V058465O
660	MEDICALRECORD	24	35	5280584.PPO
660	PATIENT	37	58	POQUE, MEGHAN Collene
660	IDNUM	69	77	52V05846
660	IDNUM	78	86	52V05846
660	STREET	87	93	Random
660	CITY	94	100	COROWA
660	STATE	102	105	VIC
660	ZIP	107	111	2179
660	DATE	146	155	29/4/2015	2015-04-29
660	DATE	175	184	23/3/2064	2064-03-23
660	DEPARTMENT	201	206	Envoi
660	HOSPITAL	209	226	TOCUMWAL HOSPITAL
660	DOCTOR	230	248	LAURE EUN Allerman
660	DOCTOR	267	275	Vienneau
660	DOCTOR	280	285	Kieth
660	AGE	426	428	49
660	AGE	474	476	45
660	DOCTOR	2466	2468	UG
660	DATE	2472	2479	24/3/64	2064-03-24
660	DOCTOR	2514	2522	O Frittz
661	IDNUM	13	23	10R079414X
661	MEDICALRECORD	24	35	1060794.EKX
661	PATIENT	37	63	STEARMAN, CLARENCE Sweeney
661	IDNUM	74	82	10R07941
661	STREET	83	94	Sunset View
661	CITY	95	103	HAHNDORF
661	STATE	105	113	Tasmania
661	ZIP	115	119	4870
661	DATE	145	154	27/4/1985	1985-04-27
661	TIME	174	193	20/01/2014 at 12:30	2014-01-20T12:30
661	DEPARTMENT	205	227	ST VINCENT'S PATHOLOGY
661	HOSPITAL	228	248	CRYSTAL BROOK CAMPUS
661	DOCTOR	252	269	MYRON DEE SCHERTZ
661	DATE	531	533	54	54-15
661	DOCTOR	892	899	D Maxcy
661	DOCTOR	905	913	D Darden
661	TIME	917	948	1300 onthe 20th of January 2014	2014-01-20T13:00
661	DOCTOR	1638	1640	FT
661	DATE	1644	1651	23.3.64	2064-03-23
661	DOCTOR	1681	1690	D Gertner
662	IDNUM	14	24	84B929823S
662	MEDICALRECORD	25	36	8409298.GJS
662	PATIENT	38	51	NEELLY, ERICK
662	IDNUM	62	70	84B92982
662	STREET	71	83	North Salado
662	CITY	84	91	WYNDHAM
662	STATE	93	108	South Australia
662	ZIP	110	114	4512
662	DATE	140	149	16/6/2021	2021-06-16
662	DEPARTMENT	193	210	DICKINSON 2 SOUTH
662	HOSPITAL	211	230	STANTHORPE HOSPITAL
662	DOCTOR	234	249	BRAD EWAN CARIN
662	DOCTOR	1082	1086	Cole
662	DOCTOR	1093	1102	V Merchen
662	TIME	1106	1123	10.15 on 14.03.13	2013-03-14T10:15
662	DOCTOR	1377	1385	Aristide
662	DOCTOR	1392	1401	V Roethle
662	TIME	1405	1422	10.15 on 14.03.13	2013-03-14T10:15
662	DOCTOR	1884	1886	ZI
662	DATE	1890	1897	17.5.63	2063-05-17
662	DOCTOR	1928	1936	V Wynott
663	IDNUM	13	23	89F7914306
663	MEDICALRECORD	24	34	891791.LIB
663	PATIENT	36	50	Ferreri, Eddie
663	IDNUM	61	69	89F79143
663	STREET	70	82	Crooked Yard
663	CITY	83	89	WESTON
663	STATE	91	93	SA
663	ZIP	95	99	6940
663	DATE	125	133	6/4/1995	1995-06-04
663	TIME	151	170	22/01/2014 at 14:04	2014-01-22T14:04
663	DEPARTMENT	182	199	DICKINSON 2 SOUTH
663	HOSPITAL	200	234	YEA AND DISTRICT MEMORIAL HOSPITAL
663	DOCTOR	238	259	VINCENZO Aidan Helger
663	DATE	315	319	2063	2063-14
663	DATE	498	508	April 2063	2063-04
663	DOCTOR	1841	1843	SD
663	DATE	1847	1854	25/3/64	2064-03-25
663	DOCTOR	1884	1892	W Grasso
663	IDNUM	3045	3053	89F79143
663	DOCTOR	3138	3152	W Vollenweider
664	MEDICALRECORD	1	12	4707225.XWZ
664	PATIENT	13	26	Vegh, Melonie
664	IDNUM	27	35	47B72258
664	DATE	51	60	21/9/2063	2063-09-21
664	DOCTOR	736	743	Numbers
664	DOCTOR	751	760	K Treider
664	DOCTOR	768	777	K Krysiak
664	TIME	781	799	17.07.13 at 3:47pm	2013-07-17T15:47
664	DOCTOR	801	803	CS
664	DATE	807	814	20.9.63	2063-09-20
664	DOCTOR	844	853	K Fecteau
665	IDNUM	14	24	95X842546I
665	MEDICALRECORD	25	35	959842.OMS
665	PATIENT	37	59	HORAK, Kathern Wilbert
665	IDNUM	70	78	95X84254
665	STREET	79	89	Holly Dene
665	CITY	90	101	KIAMA DOWNS
665	STATE	103	106	VIC
665	ZIP	108	112	2821
665	DATE	138	147	5/10/1989	1989-05-10
665	DEPARTMENT	191	208	MEDIC/SURGERYWARD
665	HOSPITAL	209	246	LOURDES HOSPITAL & COMMUNITY SERVICES
665	DOCTOR	250	267	Elvis EARL Elward
665	DOCTOR	1248	1250	CN
665	DATE	1254	1260	9.3.63	2063-09-03
665	DOCTOR	1291	1300	Z Sadvary
666	IDNUM	13	23	16O443405T
666	MEDICALRECORD	24	34	165443.LAN
666	PATIENT	36	51	WAREHIME, JESUS
666	IDNUM	62	70	16O44340
666	STREET	71	76	Wills
666	CITY	77	86	TOOWOOMBA
666	STATE	88	103	New South Wales
666	ZIP	105	109	5141
666	DATE	135	143	5/7/2033	2033-07-05
666	DATE	163	173	22/10/2063	2063-10-22
666	DEPARTMENT	190	200	Hereditary
666	HOSPITAL	201	215	DERBY HOSPITAL
666	DOCTOR	219	239	Theo Brenton REDISKE
666	DOCTOR	2518	2520	WY
666	DOCTOR	2521	2523	ZM
666	DATE	2528	2536	23.10.63	2063-10-23
666	DOCTOR	2615	2624	E Fallago
666	DOCTOR	2625	2634	E Lueders
666	DOCTOR	2635	2649	E Dickensheets
666	TIME	2653	2670	4:58pm on 20.8.13	2013-08-20T16:58
666	DOCTOR	2702	2711	E Neidert
667	IDNUM	13	23	74K464563C
667	MEDICALRECORD	24	35	7444645.PIC
667	PATIENT	37	48	Abed, FRITZ
667	IDNUM	59	67	74K46456
667	STREET	68	75	Kiernan
667	CITY	76	84	SCARNESS
667	STATE	86	103	Western Australia
667	ZIP	105	109	2097
667	DATE	135	143	7/6/1987	1987-07-06
667	TIME	163	182	23/08/2013 at 16:03	2013-08-23T16:03
667	DEPARTMENT	194	207	SEALS Central
667	HOSPITAL	208	240	QUEEN ELIZABETH II FAMILY CENTRE
667	DOCTOR	244	265	Eddy WALLACE Escandon
667	DATE	337	344	10.2.63	2063-10-02
667	DOCTOR	1786	1788	BQ
667	DOCTOR	1789	1791	OW
667	DATE	1795	1803	28.10.63	2063-10-28
667	DOCTOR	1837	1846	S Thibert
667	DATE	3236	3243	10.2.63	2063-10-02
668	MEDICALRECORD	2	12	222485.OEE
668	PATIENT	13	29	Freudiger, Blake
668	IDNUM	30	38	22H48551
668	DATE	54	62	2/3/2064	2064-03-02
668	DOCTOR	909	911	EG
668	DATE	915	922	26/3/64	2064-03-26
668	DOCTOR	951	959	H Brazen
669	IDNUM	13	23	43Y186479W
669	MEDICALRECORD	24	35	4391864.TZW
669	PATIENT	37	54	HOLZNECHT, THOMAS
669	IDNUM	65	73	43Y18647
669	STREET	74	80	Medley
669	CITY	81	88	LISMORE
669	STATE	90	105	South Australia
669	ZIP	107	111	3898
669	DATE	137	145	3/1/2011	2011-01-03
669	TIME	165	184	20/08/2013 at 11:13	2013-08-20T11:13
669	DEPARTMENT	196	218	ST VINCENT'S PATHOLOGY
669	HOSPITAL	219	236	BARALABA HOSPITAL
669	DOCTOR	240	257	Roy ANDY Yurchiak
669	DOCTOR	1304	1306	DV
669	DATE	1310	1318	23/10/63	2063-10-23
669	DOCTOR	1354	1363	M Carthew
669	DOCTOR	1686	1693	M Chudy
669	DATE	1695	1704	2/10/2063	2063-10-02
669	DOCTOR	1748	1757	M Lievano
669	DOCTOR	1765	1785	Narelle TALAYUMPTEWA
669	DOCTOR	2116	2127	M Lauridsen
669	DATE	2128	2136	22/11/63	2063-11-22
670	MEDICALRECORD	2	12	017106.NIV
670	PATIENT	13	27	ONSTAD, ASHLIE
670	IDNUM	28	36	01U10653
670	DATE	52	62	15/11/2063	2063-11-15
670	DOCTOR	1383	1385	XW
670	DATE	1391	1399	14.11.63	2063-11-14
670	DOCTOR	1431	1443	A Hohenstein
671	IDNUM	13	23	58Q137586N
671	MEDICALRECORD	24	35	5861375.XQN
671	PATIENT	37	49	Donges, RENE
671	IDNUM	60	68	58Q13758
671	IDNUM	69	77	58Q13758
671	STREET	78	87	E Nichols
671	CITY	88	96	NATHALIA
671	STATE	98	106	Victoria
671	ZIP	108	112	3854
671	DATE	147	156	17/9/1997	1997-09-17
671	DATE	176	186	25/12/2063	2063-12-25
671	DEPARTMENT	203	221	INTENSIVECARE UNIT
671	HOSPITAL	224	243	CANTERBURY HOSPITAL
671	DOCTOR	247	267	ROLANDE OSMA Turkmay
671	AGE	361	363	71
671	DOCTOR	869	874	Forss
671	DOCTOR	881	889	P Teller
671	TIME	893	912	12:40pm on 23.10.13	2013-10-23T12:40
671	DOCTOR	2239	2241	KF
671	DOCTOR	2242	2244	VH
671	DATE	2248	2256	26.12.63	2063-12-26
671	DOCTOR	2290	2298	P Finnel
672	IDNUM	13	23	79I738444Y
672	MEDICALRECORD	24	34	793738.MLL
672	PATIENT	36	48	Noori, Britt
672	IDNUM	59	67	79I73844
672	STREET	68	77	Garraween
672	CITY	78	85	TANUNDA
672	STATE	87	97	Queensland
672	ZIP	99	103	6327
672	DATE	129	138	25/6/1983	1983-06-25
672	TIME	158	177	05/11/2013 at 12:43	2013-11-05T12:43
672	DEPARTMENT	189	203	ACUTECARE WARD
672	HOSPITAL	204	225	WILLIAMSTOWN HOSPITAL
672	DOCTOR	229	250	Tyler Reginald REBERA
672	DATE	321	328	14.1.63	2063-01-14
672	DATE	411	414	now	2062-11-27
672	DOCTOR	1849	1851	QR
672	DOCTOR	1854	1856	VD
672	DATE	1860	1866	8.1.63	2063-01-08
672	DOCTOR	1899	1907	D Levell
672	DATE	3002	3009	14.1.63	2063-01-14
673	MEDICALRECORD	2	13	3718595.AHH
673	PATIENT	14	28	REITLER, OZARA
673	IDNUM	29	37	37E85950
673	DATE	53	63	25/12/2063	2063-12-25
673	DOCTOR	889	891	PC
673	DOCTOR	893	895	HA
673	DATE	899	907	16.12.63	2063-12-16
673	DOCTOR	941	953	I Bonnenfant
674	MEDICALRECORD	1	12	8508795.PCP
674	PATIENT	13	31	KOLP, YOLNGU Huong
674	IDNUM	32	40	85A87956
674	DATE	55	63	3/3/2064	2064-03-03
674	DOCTOR	250	263	Johnson-CUNAS
674	DOCTOR	1285	1287	YJ
674	DATE	1291	1298	26.3.64	2064-03-26
674	DOCTOR	1329	1337	X Vivyan
676	IDNUM	13	23	43W890619Y
676	MEDICALRECORD	24	35	4388906.EXY
676	PATIENT	37	62	GALLIHUGH, Valentin Shona
676	IDNUM	73	81	43W89061
676	STREET	82	94	Diablo Vista
676	CITY	95	101	CEDUNA
676	STATE	103	113	Queensland
676	ZIP	115	119	4307
676	DATE	145	154	13/7/1991	1991-07-13
676	DATE	174	183	16/1/2062	2062-01-16
676	DEPARTMENT	200	210	St Vincent
676	HOSPITAL	213	234	PORT AUGUSTA HOSPITAL
676	DOCTOR	238	258	KENNITH Mikel Frayer
676	DOCTOR	312	319	Kapnick
676	DOCTOR	2022	2024	FS
676	DOCTOR	2025	2027	HL
676	DATE	2031	2038	17.1.62	2062-01-17
676	DOCTOR	2075	2086	L Hillerman
676	DATE	2834	2841	20/3/63	2063-03-20
676	DATE	3067	3072	/3/64	2064-03
677	IDNUM	14	24	64O491577J
677	MEDICALRECORD	25	36	6454915.TTJ
677	PATIENT	38	63	Czarnecki, Gaylord KIMIKO
677	IDNUM	74	82	64O49157
677	STREET	83	96	Old Clubhouse
677	CITY	97	107	WELLINGTON
677	STATE	109	112	ACT
677	ZIP	114	118	5462
677	DATE	144	153	11/9/2034	2034-11-09
677	TIME	173	192	29/01/2014 at 12:18	2014-01-29T12:18
677	DEPARTMENT	204	220	ONCOLOGY (GYNAE)
677	HOSPITAL	223	236	TARA HOSPITAL
677	DOCTOR	240	260	GINO MITCHELL GIANNI
677	AGE	320	322	34
677	DATE	341	345	2061	2061
677	DOCTOR	3260	3262	GG
677	DATE	3266	3272	3/1/64	2064-03-01
677	DOCTOR	3305	3315	Q Mccawley
678	IDNUM	13	23	12K512535S
678	MEDICALRECORD	24	34	123512.PIO
678	PATIENT	36	59	THOMURE, SHAWN Bradford
678	IDNUM	70	78	12K51253
678	STREET	79	92	Gunsight Fire
678	CITY	93	103	CAMPERDOWN
678	STATE	105	120	South Australia
678	ZIP	122	126	4873
678	DATE	152	161	28/2/1992	1992-02-28
678	TIME	181	200	28/01/2014 at 19:48	2014-01-28T19:48
678	DEPARTMENT	212	225	PARKES 4 EAST
678	HOSPITAL	228	256	ROYAL PRINCE ALFRED HOSPITAL
678	DOCTOR	260	276	GERRY Lupe SPUCK
678	DOCTOR	295	301	Weston
678	DOCTOR	2318	2320	KR
678	DATE	2324	2330	1/3/64	2064-03-01
678	DOCTOR	2364	2371	E Worek
679	IDNUM	13	23	33B113483D
679	MEDICALRECORD	24	35	3301134.WKD
679	PATIENT	37	52	ARRISON, Lenard
679	IDNUM	63	71	33B11348
679	IDNUM	72	80	33B11348
679	STREET	81	88	Sowerby
679	CITY	89	100	CASTLEMAINE
679	STATE	102	105	QLD
679	ZIP	107	111	8011
679	DATE	146	155	3/12/2019	2019-12-03
679	DATE	175	184	23/3/2064	2064-03-23
679	DEPARTMENT	201	218	BILLINGTON CENTRE
679	HOSPITAL	221	239	GUMERACHA HOSPITAL
679	DOCTOR	243	264	Sharolyn Urmila HISEL
679	DOCTOR	1296	1306	J Schweitz
679	DOCTOR	1314	1321	J Tagge
679	DOCTOR	1326	1335	J Brawner
679	DOCTOR	1343	1356	J Yannantuono
679	TIME	1360	1381	0926hrs on 21.01.2014	2014-01-21T09:26
679	DOCTOR	3567	3569	TO
679	DOCTOR	3570	3572	KD
679	DATE	3576	3583	24.3.64	2064-03-24
679	DOCTOR	3615	3623	J Shanaa
680	IDNUM	13	23	91X133542M
680	MEDICALRECORD	24	34	919133.NLF
680	PATIENT	36	55	MARTIG, Jack Nestor
680	IDNUM	66	74	91X13354
680	STREET	75	86	St Wilfrids
680	CITY	87	96	MOUNT ISA
680	STATE	98	101	QLD
680	ZIP	103	107	1597
680	DATE	133	142	13/4/2020	2020-04-13
680	TIME	162	180	15/01/2014at 13:48	2014-01-15T13:48
680	DEPARTMENT	192	201	EMERGENCY
680	HOSPITAL	202	223	ROYAL HOBART HOSPITAL
680	DOCTOR	227	249	ANDRES JOESPH Triblett
680	DOCTOR	387	391	Vath
680	DOCTOR	1922	1924	GI
680	DATE	1928	1935	18/3/64	2064-03-18
680	DOCTOR	1966	1975	Y Bethell
681	IDNUM	13	23	49T264500U
681	MEDICALRECORD	24	35	4972645.AAU
681	PATIENT	37	61	Cartelli, Carter TEODORO
681	IDNUM	72	80	49T26450
681	IDNUM	81	89	49T26450
681	STREET	90	99	Calverton
681	CITY	100	108	SAN REMO
681	STATE	110	113	QLD
681	ZIP	115	119	4004
681	DATE	154	163	24/3/1973	1973-03-24
681	TIME	183	202	08/01/2014 at 19:40	2014-01-08T19:40
681	DEPARTMENT	214	229	Envoi Pathology
681	HOSPITAL	232	256	COLLIE DISTRICT HOSPITAL
681	DOCTOR	260	275	Lyman RODGERSON
681	DOCTOR	1842	1844	PN
681	DATE	1848	1855	11/3/64	2064-03-11
681	DOCTOR	1886	1892	M Ebia
682	IDNUM	14	24	07Q285668D
682	MEDICALRECORD	25	36	0762856.PVD
682	PATIENT	38	62	STEINKAMP, HUONG Collene
682	IDNUM	73	81	07Q28566
682	STREET	82	87	Gomez
682	CITY	88	94	NERANG
682	STATE	96	99	VIC
682	ZIP	101	105	5262
682	DATE	131	140	15/2/1995	1995-02-15
682	DATE	160	168	5/2/2063	2063-02-05
682	DEPARTMENT	185	194	Peter Mac
682	HOSPITAL	197	234	INGLEWOOD MULTIPURPOSE HEALTH SERVICE
682	DOCTOR	238	257	TYSON WALTON DOLHON
682	DOCTOR	1035	1044	B Brydges
682	DOCTOR	1051	1060	B Mordini
682	DOCTOR	4310	4312	ND
682	DATE	4316	4322	4/3/64	2064-03-04
682	DOCTOR	4352	4359	B Olsby
683	IDNUM	13	23	28H8865165
683	MEDICALRECORD	24	35	2828865.ERO
683	PATIENT	37	54	Porreca, MADALINE
683	IDNUM	65	73	28H88651
683	IDNUM	74	82	28H88651
683	STREET	83	91	Conkling
683	CITY	92	98	CASINO
683	STATE	100	103	NSW
683	ZIP	105	109	3704
683	DATE	140	149	24/5/2000	2000-05-24
683	DATE	169	178	24/3/2064	2064-03-24
683	DEPARTMENT	195	206	Hunter Area
683	HOSPITAL	209	246	INGLEWOOD MULTIPURPOSE HEALTH SERVICE
683	DOCTOR	250	270	CRISTOPHER SCHELLING
683	DOCTOR	300	311	Weingartner
683	DOCTOR	986	992	Moises
683	DOCTOR	1021	1028	G Nusom
683	TIME	1032	1050	1:35pm on 22.01.14	2014-01-22T13:35
683	DOCTOR	4988	4990	PZ
683	DOCTOR	4991	4993	WU
683	DATE	4997	5004	25.3.64	2064-03-25
683	DOCTOR	5035	5047	G Eisenbeisz
683	DOCTOR	7646	7655	G Koebley
683	DOCTOR	7663	7673	G Readnour
684	IDNUM	13	23	76D807674X
684	MEDICALRECORD	24	34	761807.PTM
684	PATIENT	36	50	Simard, ALYSHA
684	IDNUM	61	69	76D80767
684	STREET	70	80	Farrowdene
684	CITY	81	89	GRENFELL
684	STATE	91	108	Western Australia
684	ZIP	110	114	2825
684	DATE	140	149	12/6/1995	1995-12-06
684	TIME	169	188	28/01/2014 at 08:36	2014-01-28T08:36
684	HOSPITAL	200	230	DELEGATE MULTI PURPOSE SERVICE
684	DOCTOR	234	255	MARLON Randal Hubbert
684	DOCTOR	459	472	Horacio GLYNN
684	TIME	480	498	28/1/14 at 12:17pm	2014-01-28T12:17
684	DOCTOR	3047	3049	OZ
684	DATE	3053	3060	30/3/64	2064-03-30
684	DOCTOR	3094	3103	U Ahlborn
685	IDNUM	14	24	33Z927632F
685	MEDICALRECORD	25	36	3399276.IHF
685	PATIENT	38	55	Schiffert, JOELLA
685	IDNUM	66	74	33Z92763
685	STREET	75	87	Wortley Moor
685	CITY	88	96	GRENFELL
685	STATE	98	115	Western Australia
685	ZIP	117	121	2539
685	DATE	147	157	12/10/1987	1987-10-12
685	TIME	177	196	29/01/2014 at 09:51	2014-01-29T09:51
685	DEPARTMENT	208	235	DEPT OF CORRECTIVE SERVICES
685	HOSPITAL	236	252	GAYNDAH HOSPITAL
685	DOCTOR	256	280	GRAHAM PHILLIP SELTRECHT
685	DOCTOR	299	304	Emory
685	DOCTOR	2141	2143	NP
685	DATE	2147	2153	2/3/64	2064-03-02
685	DOCTOR	2186	2193	J Morck
688	IDNUM	13	23	54R528581R
688	MEDICALRECORD	24	35	5465285.WDR
688	PATIENT	37	50	LINFORD, LIEN
688	IDNUM	61	69	54R52858
688	IDNUM	70	78	54R52858
688	STREET	79	86	Duckett
688	CITY	87	96	JINDABYNE
688	STATE	96	99	TAS
688	ZIP	100	104	4119
688	DATE	139	149	20/11/1995	1995-11-20
688	TIME	169	188	28/01/2014 at 16:27	2014-01-28T16:27
688	DEPARTMENT	200	220	ANATOMICAL PATHOLOGY
688	HOSPITAL	223	243	WYALKATCHEM HOSPITAL
688	DOCTOR	247	265	MERIDITH ROSE Lowe
688	DOCTOR	1846	1848	OA
688	DATE	1852	1858	3/1/64	2064-03-01
688	DOCTOR	1893	1901	O Lenzen
689	IDNUM	13	23	02N549649Z
689	MEDICALRECORD	24	35	0255496.LYZ
689	PATIENT	37	58	Lowers, TEISHA Weston
689	IDNUM	69	77	02N54964
689	STREET	78	93	South Claremont
689	CITY	94	99	COBAR
689	STATE	101	116	New South Wales
689	ZIP	118	122	4172
689	DATE	148	157	18/1/2012	2012-01-18
689	TIME	177	196	23/01/2014 at 15:19	2014-01-23T15:19
689	DEPARTMENT	208	237	MOLECULAR DIAGNOSTIC ONCOLOGY
689	HOSPITAL	238	278	BALLARAT HEALTH SERVICES (BASE HOSPITAL)
689	DOCTOR	282	303	Julian Keenan FINSTER
689	DURATION	372	381	18 months	P18M
689	DOCTOR	3519	3521	KQ
689	DOCTOR	3523	3525	MY
689	DATE	3529	3535	3.3.64	2064-03-03
689	DOCTOR	3663	3665	EO
689	DOCTOR	3666	3668	OE
689	DATE	3672	3678	6.4.64	2064-06-04
689	DOCTOR	3709	3715	C Ruta
690	IDNUM	13	23	23E140497K
690	MEDICALRECORD	24	35	2311404.ZUK
690	PATIENT	37	56	Maddux, JERI Dillon
690	IDNUM	67	75	23E14049
690	STREET	76	86	Lears Glen
690	CITY	87	94	STANLEY
690	STATE	96	114	Northern Territory
690	ZIP	116	120	3104
690	DATE	146	155	26/6/2004	2004-06-26
690	TIME	175	194	18/12/2012 at 14:21	2012-12-18T14:21
690	DEPARTMENT	206	221	Envoi pathology
690	HOSPITAL	222	246	MANNUM DISTRICT HOSPITAL
690	DOCTOR	250	269	Lindsey Elvin BIJOU
690	DOCTOR	2353	2355	SF
690	DATE	2359	2366	21.2.62	2062-02-21
690	DOCTOR	2397	2406	H Knoepke
690	DATE	4735	4742	18/3/63	2063-03-18
690	HOSPITAL	4757	4779	ORBOST REGIONAL HEALTH
690	DOCTOR	4805	4820	DILLON Helowicz
690	HOSPITAL	4843	4861	TOM PRICE HOSPITAL
691	IDNUM	13	23	81A271555T
691	MEDICALRECORD	24	35	8102715.PPT
691	PATIENT	37	49	GEMES, GRACE
691	IDNUM	60	68	81A27155
691	IDNUM	69	77	81A27155
691	STREET	78	88	Grand Park
691	CITY	89	104	NOWRA-BOMADERRY
691	STATE	106	134	Australian Capital Territory
691	ZIP	136	140	6907
691	DATE	172	181	10/5/1979	1979-10-05
691	DATE	201	209	4/7/2064	2064-04-07
691	DEPARTMENT	226	241	ACUTE CARE WARD
691	HOSPITAL	244	292	MOUNT BARKER DISTRICT SOLDIERS MEMORIAL HOSPITAL
691	DOCTOR	296	319	Elvie Marisela Duquaine
691	DOCTOR	2653	2655	KC
691	DOCTOR	2656	2658	WQ
691	DATE	2662	2668	4.8.64	2064-04-08
691	DOCTOR	2700	2713	W Vannorsdell
694	IDNUM	14	24	55K010865O
694	MEDICALRECORD	25	36	5540108.QOO
694	PATIENT	38	50	CHECA, Mayah
694	IDNUM	61	69	55K01086
694	IDNUM	70	78	55K01086
694	STREET	79	94	Brooktree Ranch
694	CITY	95	102	PENGUIN
694	STATE	104	119	South Australia
694	ZIP	121	125	7119
694	DATE	157	166	17/2/1994	1994-02-17
694	TIME	186	205	25/06/2012 at 19:22	2012-06-25T19:22
694	DEPARTMENT	217	239	PRINCE OF WALESPRIVATE
694	HOSPITAL	240	256	REDLAND HOSPITAL
694	DOCTOR	260	280	LETISHA MYRA Echavez
694	DATE	352	360	30.10.63	2063-10-30
694	AGE	375	377	72
694	DOCTOR	2496	2498	GE
694	DATE	2502	2509	28.8.62	2062-08-28
694	DOCTOR	2544	2554	O Wilhelmi
694	DATE	4270	4278	30.10.63	2063-10-30
695	IDNUM	13	23	50O892572N
695	MEDICALRECORD	24	35	5058925.SGN
695	PATIENT	37	56	Blatt, TAUNYA Pedro
695	IDNUM	67	75	50O89257
695	STREET	76	81	Lorie
695	CITY	82	90	MANDURAH
695	STATE	92	107	South Australia
695	ZIP	109	113	2381
695	DATE	139	148	21/9/2001	2001-09-21
695	TIME	168	187	19/06/2012 at 20:09	2012-06-19T20:09
695	DEPARTMENT	199	215	STGEORGE PRIVATE
695	HOSPITAL	218	238	SUNBURY DAY HOSPITAL
695	DOCTOR	242	269	LOURDES EVANGELINE CARDONIA
695	DOCTOR	2127	2129	QF
695	DATE	2133	2140	22/8/62	2062-08-22
695	DOCTOR	2172	2182	P Hollberg
695	DATE	2920	2928	27/12/62	2062-12-27
696	IDNUM	13	23	34Y632872I
696	MEDICALRECORD	24	35	3496328.TFI
696	PATIENT	37	59	SPEISER, LOVELLA POSEY
696	IDNUM	70	78	34Y63287
696	IDNUM	79	87	34Y63287
696	STREET	88	94	Clarks
696	CITY	95	109	PEREGIAN BEACH
696	STATE	111	113	NT
696	ZIP	115	119	2647
696	DATE	154	163	25/5/1992	1992-05-25
696	DATE	183	192	27/8/2062	2062-08-27
696	DEPARTMENT	209	221	RENAL CLINIC
696	HOSPITAL	224	247	COWRA DISTRICT HOSPITAL
696	DOCTOR	251	267	Chia Brooke RHEE
696	DATE	339	347	30.10.63	2063-10-30
696	AGE	362	364	75
696	DOCTOR	2258	2260	EL
696	DATE	2264	2271	28/8/62	2062-08-28
696	DOCTOR	2303	2309	D Fulp
696	DATE	4261	4269	30.10.63	2063-10-30
697	IDNUM	14	24	82U753930Q
697	MEDICALRECORD	25	36	8277539.IAQ
697	PATIENT	38	63	Zirker, Nathaniel DHIRRIL
697	IDNUM	74	82	82U75393
697	STREET	83	92	Timberlee
697	CITY	93	104	TEA GARDENS
697	STATE	106	108	SA
697	ZIP	110	114	6397
697	DATE	140	150	27/11/1988	1988-11-27
697	TIME	170	189	22/08/2012 at 16:35	2012-08-22T16:35
697	DEPARTMENT	201	211	Hereditary
697	HOSPITAL	214	243	WARIALDA MULTIPURPOSE SERVICE
697	DOCTOR	247	264	Andres Partington
697	DATE	336	344	30.10.62	2062-10-30
697	DOCTOR	477	479	ZB
697	DOCTOR	1659	1661	CK
697	DATE	1666	1674	25.10.62	2062-10-25
697	DOCTOR	1706	1713	W Revel
697	DATE	3076	3084	30.10.62	2062-10-30
697	DATE	3105	3108	now	2062-11-27
698	IDNUM	13	23	87Y535547P
698	MEDICALRECORD	24	35	8795355.KSP
698	PATIENT	37	53	Brownle, RENALDO
698	IDNUM	64	72	87Y53554
698	STREET	73	78	Daned
698	CITY	79	87	RICHMOND
698	STATE	89	97	Tasmania
698	ZIP	99	103	0800
698	DATE	129	138	18/2/1986	1986-02-18
698	TIME	158	177	03/09/2012 at 13:36	2012-09-03T13:36
698	DEPARTMENT	189	206	DICKINSON 2 NORTH
698	HOSPITAL	207	231	CUNDERDIN HEALTH SERVICE
698	DOCTOR	235	257	STANFORD Francis SKIFF
698	DOCTOR	407	409	AX
698	DOCTOR	3277	3279	WP
698	DATE	3283	3290	11.6.62	2062-11-06
698	DOCTOR	3323	3332	X Brandow
699	IDNUM	13	23	61H3848464
699	MEDICALRECORD	24	35	6123848.MRK
699	PATIENT	37	55	Laris, Brad CRISSY
699	IDNUM	66	74	61H38484
699	STREET	75	81	Animbo
699	CITY	82	87	DERBY
699	STATE	89	107	Northern Territory
699	ZIP	109	113	4158
699	DATE	139	148	24/4/1987	1987-04-24
699	TIME	168	187	18/07/2012 at 10:29	2012-07-18T10:29
699	DEPARTMENT	199	203	IMVS
699	HOSPITAL	206	225	NARRANDERA HOSPITAL
699	DOCTOR	229	248	Donn Turlku Cadlett
699	AGE	309	311	80
699	DOCTOR	2087	2089	SW
699	DATE	2093	2100	21.9.62	2062-09-21
699	DOCTOR	2132	2144	Q Saltarelli
699	DOCTOR	3502	3515	Q Freudenberg
706	IDNUM	13	23	19D405904T
706	MEDICALRECORD	24	35	1914059.BMT
706	PATIENT	37	51	ILLAR, BRADLEY
706	IDNUM	62	70	19D40590
706	STREET	71	80	East Como
706	CITY	81	89	COOKTOWN
706	STATE	91	119	Australian Capital Territory
706	ZIP	121	125	3956
706	DATE	151	160	10/7/1990	1990-07-10
706	TIME	180	199	04/11/2013 at 13:13	2013-11-04T13:13
706	DEPARTMENT	211	231	Anatomical Pathology
706	HOSPITAL	234	252	NORMANTON HOSPITAL
706	DOCTOR	256	277	BRANT Scotty Alghamdi
706	DATE	349	356	13.4.64	2064-04-13
706	DOCTOR	2960	2962	IZ
706	DATE	2963	2969	7/1/63	2063-01-07
706	DOCTOR	3077	3079	LJ
706	DATE	3080	3086	8/1/63	2063-01-08
706	DOCTOR	3530	3532	EG
706	DATE	3536	3542	7/1/63	2063-01-07
706	DOCTOR	3573	3581	E Lavere
706	DATE	6475	6482	13.4.64	2064-04-13
707	IDNUM	13	23	30V006763E
707	MEDICALRECORD	24	35	3080067.PIE
707	PATIENT	37	59	Seargent, MARNA PENNIE
707	IDNUM	70	78	30V00676
707	IDNUM	79	87	30V00676
707	STREET	88	95	Dacosta
707	CITY	96	101	BOWEN
707	STATE	103	113	Queensland
707	ZIP	115	119	6020
707	DATE	151	159	2/6/1988	1988-06-02
707	TIME	179	198	26/09/2012 at 12:10	2012-09-26T12:10
707	DEPARTMENT	210	223	SEALS Central
707	HOSPITAL	226	254	MILDURA BASE PUBLIC HOSPITAL
707	DOCTOR	258	283	DOUGLASS Mandang Elizando
707	DOCTOR	983	993	Retterbush
707	DOCTOR	1013	1019	J Stai
707	DOCTOR	1023	1029	J Bynd
707	TIME	1033	1050	145pm on 26.09.12	2012-09-26T13:45
707	DOCTOR	2061	2063	GX
707	DATE	2067	2075	29.11.62	2062-11-29
707	DOCTOR	2108	2122	J Wickenhauser
708	IDNUM	14	24	97R027811M
708	MEDICALRECORD	25	36	9760278.EDM
708	PATIENT	38	60	KENNETH, Dudley JEMIMA
708	IDNUM	71	79	97R02781
708	STREET	80	87	Guilfoy
708	CITY	88	96	URRAWEEN
708	STATE	98	101	QLD
708	ZIP	103	107	5171
708	DATE	133	142	15/6/2007	2007-06-15
708	TIME	162	181	20/02/2013 at 07:20	2013-02-20T07:20
708	DEPARTMENT	193	206	PARKES 9 EAST
708	HOSPITAL	207	224	TOCUMWAL HOSPITAL
708	DOCTOR	228	246	PABLO DOYLE PONZIO
708	DATE	318	325	30.4.63	2063-04-30
708	DOCTOR	3205	3207	VJ
708	DATE	3211	3218	24.4.63	2063-04-24
708	DOCTOR	3252	3262	X Millikan
708	DATE	3265	3274	27.4.2063	2063-04-27
708	DATE	5956	5963	30.4.63	2063-04-30
708	DOCTOR	5968	5975	X Rezak
709	MEDICALRECORD	0	11	1836287.TZY
709	PATIENT	12	35	WITHERELL, GERRY Samuel
709	IDNUM	36	44	18I62877
709	IDNUM	45	53	18I62877
709	DATE	69	78	4/12/2062	2062-12-04
709	DOCTOR	790	796	Zsohar
709	DOCTOR	824	834	D Mosimann
709	DOCTOR	839	849	D Scherman
709	TIME	853	870	4:30pm on 26.9.12	2012-09-26T16:30
709	DOCTOR	3145	3147	KI
709	DATE	3151	3159	26.11.62	2062-11-26
709	DOCTOR	3192	3202	D Weyrauch
709	DOCTOR	5637	5648	D Pappajohn
710	IDNUM	14	24	66F7488372
710	MEDICALRECORD	25	36	6617488.IUG
710	PATIENT	38	62	Darmody, Casandra Naveah
710	IDNUM	73	81	66F74883
710	IDNUM	82	90	66F74883
710	STREET	91	98	N Gates
710	CITY	99	105	WESTON
710	STATE	107	124	Western Australia
710	ZIP	126	130	1490
710	DATE	165	173	7/3/2011	2011-07-03
710	DATE	193	201	8/8/2062	2062-08-08
710	DEPARTMENT	218	228	OBSTETRICS
710	HOSPITAL	231	271	MURRAY BRIDGE SOLDIERS MEMORIAL HOSPITAL
710	DOCTOR	275	301	Oswaldo Junior MIRCHANDANI
710	DOCTOR	1130	1140	R Melikian
710	DOCTOR	1144	1150	R Oman
710	TIME	1154	1170	9.18am on 6/6/12	2012-06-06T09:18
710	DOCTOR	3233	3235	XO
710	DATE	3239	3245	8/9/62	2062-08-09
710	DOCTOR	3277	3287	R Stothard
711	IDNUM	13	23	87W349686R
711	MEDICALRECORD	24	35	8783496.WQR
711	PATIENT	37	58	FINAN, ALAYNA Felecia
711	IDNUM	69	77	87W34968
711	STREET	78	88	Crownstone
711	CITY	89	95	TEMORA
711	STATE	97	112	New South Wales
711	ZIP	114	118	7012
711	DATE	144	153	8/10/1994	1994-08-10
711	DATE	173	182	15/1/2062	2062-01-15
711	DEPARTMENT	197	215	Molecular Oncology
711	HOSPITAL	218	242	ST GEORGE HOSPITAL (QLD)
711	DOCTOR	246	265	URSULA KRISTAL Raju
711	DATE	314	321	13.8.63	2063-08-13
711	HOSPITAL	431	474	WESTERN DISTRICT HEALTH SERVICE - COLERAINE
711	DOCTOR	1147	1157	W Oullette
711	TIME	1161	1180	15:05pm on 13.11.12	2012-11-13T15:05
711	DOCTOR	2939	2941	BH
711	DOCTOR	2942	2944	AX
711	DATE	2948	2955	16.1.62	2062-01-16
711	DOCTOR	2989	2996	W Broas
711	DOCTOR	5213	5221	W Devall
711	DATE	5649	5656	13.8.63	2063-08-13
712	IDNUM	13	23	45S360744A
712	MEDICALRECORD	24	35	4573607.LLA
712	PATIENT	37	60	Conterras, Oriana KENNY
712	IDNUM	71	79	45S36074
712	IDNUM	80	88	45S36074
712	STREET	89	99	Carls Farm
712	CITY	100	111	ALSTONVILLE
712	STATE	113	116	VIC
712	ZIP	118	122	5279
712	DATE	157	166	19/8/2027	2027-08-19
712	DEPARTMENT	210	226	UROLOGY DAY ONLY
712	HOSPITAL	229	245	WESTERN HOSPITAL
712	DOCTOR	249	266	Byron RONALD BUTZ
712	DATE	315	322	25.9.63	2063-09-25
712	DOCTOR	967	977	K Prevento
712	TIME	981	998	16:45 on 12.12.12	2012-12-12T16:45
712	DOCTOR	2944	2946	LH
712	DOCTOR	2947	2949	WE
712	DATE	2953	2960	15.2.62	2062-02-15
712	DOCTOR	2994	3004	K Maslonka
712	DATE	4813	4820	25.9.63	2063-09-25
713	IDNUM	14	24	93O381802J
713	MEDICALRECORD	25	36	9353818.AGJ
713	PATIENT	38	51	Ruud, SHANTAE
713	IDNUM	62	70	93O38180
713	IDNUM	71	79	93O38180
713	STREET	80	88	Hagerman
713	CITY	89	101	PORT HEDLAND
713	STATE	103	105	NT
713	ZIP	107	111	2326
713	DATE	143	151	2/6/1980	1980-02-06
713	DATE	171	181	10/10/2062	2062-10-10
713	DEPARTMENT	198	212	4 JABIRU PLACE
713	HOSPITAL	213	228	GATTON HOSPITAL
713	DOCTOR	232	258	Adolfo Quentin Vandestreek
713	DOCTOR	902	911	Giuffrida
713	DOCTOR	918	926	Z Conces
713	TIME	930	947	12.45pm on 8/8/12	2012-08-08T12:45
713	DOCTOR	2284	2286	ES
713	DATE	2290	2298	10/11/62	2062-10-11
713	DOCTOR	2328	2337	Z Bentler
713	DOCTOR	3301	3307	Z Hurt
714	IDNUM	13	23	14G082750U
714	MEDICALRECORD	24	35	1420827.PCU
714	PATIENT	37	62	CAVAGNARO, Yannick COOPER
714	IDNUM	73	81	14G08275
714	IDNUM	82	90	14G08275
714	STREET	91	98	W Adams
714	CITY	99	108	THIRLMERE
714	STATE	110	113	QLD
714	ZIP	115	119	2455
714	DATE	154	163	3/11/1978	1978-11-03
714	TIME	183	202	19/12/2012 at 10:50	2012-12-19T10:50
714	DEPARTMENT	214	227	PARKES 4 EAST
714	HOSPITAL	230	268	EUGOWRA MEMORIAL MULTI PURPOSE SERVICE
714	DOCTOR	272	292	MARYBELLE TIA Smoldt
714	DOCTOR	616	620	Isle
714	DOCTOR	627	634	E Basch
714	TIME	638	655	12:40 on 19.12.12	2012-12-19T12:40
714	DOCTOR	2281	2283	QC
714	DOCTOR	2285	2287	KU
714	DATE	2292	2299	22.2.62	2062-02-22
714	DOCTOR	2333	2341	E Morini
714	DATE	3134	3141	25/3/64	2064-03-25
715	IDNUM	13	23	35X682519F
715	MEDICALRECORD	24	35	3596825.DXF
715	PATIENT	37	53	LIVERS, Ara LING
715	IDNUM	62	70	35X68251
715	STREET	71	80	High Lake
715	CITY	81	91	MADDINGLEY
715	STATE	93	108	South Australia
715	ZIP	110	114	1138
715	DATE	140	148	7/7/2000	2000-07-07
715	TIME	168	187	30/01/2013 at 11:41	2013-01-30T11:41
715	DEPARTMENT	199	211	SA Pathology
715	HOSPITAL	214	241	TASMAN MULTI-PURPOSE CENTRE
715	DOCTOR	245	269	FRANCISCA Onatah VILCHIS
715	DATE	443	447	2062	2062
715	DOCTOR	3441	3443	VE
715	DOCTOR	3447	3449	QH
715	DATE	3453	3459	3.3.63	2063-03-03
715	DOCTOR	3495	3505	S Krolczyk
716	IDNUM	14	24	93T6136775
716	MEDICALRECORD	25	36	9376136.STO
716	PATIENT	38	54	Lauthern, CHARIS
716	IDNUM	65	73	93T61367
716	STREET	74	80	Thiele
716	CITY	81	90	DEVONPORT
716	STATE	92	109	Western Australia
716	ZIP	111	115	3614
716	DATE	141	149	7/7/2000	2000-07-07
716	TIME	169	188	14/01/2013 at 12:46	2013-01-14T12:46
716	DEPARTMENT	200	214	Pathology West
716	HOSPITAL	217	242	PAMBULA DISTRICT HOSPITAL
716	DOCTOR	246	268	FLORENE Noemi BROUWERS
716	DOCTOR	1128	1138	X Hackborn
716	DOCTOR	1145	1153	X Golson
716	DOCTOR	1157	1168	X Stromeski
716	TIME	1172	1189	14/1/13 at 1515hr	2013-01-14T15:15
716	DOCTOR	2241	2243	XM
716	DATE	2248	2255	17/3/63	2063-03-17
716	DOCTOR	2286	2294	X Majano
716	DOCTOR	3696	3708	X Kemmerling
717	IDNUM	13	23	41P634725W
717	MEDICALRECORD	24	35	4166347.HOW
717	PATIENT	37	61	KEENETH, Tiffani Jessica
717	IDNUM	72	80	41P63472
717	IDNUM	81	89	41P63472
717	STREET	90	99	Concordia
717	CITY	100	115	GREENWELL POINT
717	STATE	117	125	Victoria
717	ZIP	127	131	3689
717	DATE	166	176	21/11/1090	1090-11-21
717	TIME	196	215	18/02/2013 at 09:44	2013-02-18T09:44
717	DEPARTMENT	227	245	MEDIC/SURGERY WARD
717	HOSPITAL	248	314	JACARANDA PLACE V QUEENSLAND ADOLESCENT EXTENDED TREATMENT CENTRE
717	DOCTOR	318	337	Rodger Beau TUGGLES
717	DOCTOR	538	545	Lazcano
717	DOCTOR	1628	1633	Emons
717	DOCTOR	1640	1647	M Frase
717	DOCTOR	1651	1660	M Harrold
717	TIME	1661	1679	18/2/13 at 12.05pm	2013-02-18T12:05
717	DOCTOR	3263	3265	EO
717	DATE	3269	3276	21/4/63	2063-04-21
717	DOCTOR	3307	3313	M Poor
718	MEDICALRECORD	1	12	0947557.WJF
718	PATIENT	13	27	Strebe, Billie
718	IDNUM	28	36	09M75578
718	IDNUM	37	45	09M75578
718	IDNUM	46	54	09M75578
718	DATE	70	79	14/9/2062	2062-09-14
718	DOCTOR	683	690	A Genna
718	DOCTOR	697	707	A Jarnigan
718	DOCTOR	711	720	A Bignall
718	DOCTOR	724	732	A Deneen
718	TIME	736	753	3.13pm on 4/12/12	2012-12-04T15:13
718	DOCTOR	899	901	YI
718	DATE	906	912	7/2/62	2062-02-07
718	DOCTOR	945	958	A Pfotenhauer
719	IDNUM	14	24	57I775841O
719	MEDICALRECORD	25	36	5737758.LEO
719	PATIENT	38	59	Concilio, Desiree Joe
719	IDNUM	70	78	57I77584
719	IDNUM	79	87	57I77584
719	STREET	88	106	East Field Service
719	CITY	107	115	MANDURAH
719	STATE	117	132	New South Wales
719	ZIP	134	138	3767
719	DATE	173	183	29/11/2007	2007-11-29
719	DATE	203	212	6/12/2063	2063-06-12
719	DEPARTMENT	229	244	Envoi pathology
719	HOSPITAL	247	281	YEA AND DISTRICT MEMORIAL HOSPITAL
719	DOCTOR	285	307	Micheal ERWIN KERSCHER
719	DOCTOR	2383	2390	P Corbo
719	DOCTOR	2397	2405	P Cooper
719	TIME	2409	2427	3.55pm on 10.04.13	2013-04-10T15:55
719	DOCTOR	3023	3025	VH
719	DOCTOR	3028	3030	DV
719	DATE	3034	3041	13.6.63	2063-06-13
719	DOCTOR	3074	3082	P Kimbro
720	IDNUM	13	23	78Z376790Z
720	MEDICALRECORD	24	35	7893767.ZAZ
720	PATIENT	37	60	Windover, Emilio Edison
720	IDNUM	71	79	78Z37679
720	STREET	80	88	Podsmead
720	CITY	89	100	MOUNT ELIZA
720	STATE	102	120	Northern Territory
720	ZIP	122	126	6256
720	DATE	152	161	7/11/2004	2004-07-11
720	TIME	181	200	18/03/2013 at 13:45	2013-03-18T13:45
720	DEPARTMENT	212	229	DICKINSON 3 NORTH
720	HOSPITAL	232	251	KUNUNOPPIN HOSPITAL
720	DOCTOR	255	282	NICKI ESTRELLA Kriegshauser
720	DATE	354	361	15.8.63	2063-08-15
720	AGE	376	378	63
720	DOCTOR	1273	1285	LANNY Causby
720	DOCTOR	1293	1302	U Sobania
720	DOCTOR	1303	1309	U Wyre
720	DOCTOR	1310	1319	U Perocho
720	DOCTOR	1320	1331	U Shuemaker
720	TIME	1335	1353	16:38pm on 18/3/13	2013-03-18T16:38
720	DOCTOR	3141	3143	GT
720	DATE	3147	3154	21.5.63	2063-05-21
720	DOCTOR	3186	3194	U Mceady
720	DATE	5178	5185	15.8.63	2063-08-15
721	IDNUM	14	24	36V397758H
721	MEDICALRECORD	25	36	3683977.PVH
721	PATIENT	38	62	Holpp, Warrina RANDY JOE
721	IDNUM	73	81	36V39775
721	IDNUM	82	90	36V39775
721	STREET	91	95	Good
721	CITY	96	104	BONGAREE
721	STATE	106	109	QLD
721	ZIP	111	115	2217
721	DATE	150	160	23/11/1994	1994-11-23
721	DATE	180	188	8/7/2063	2063-07-08
721	DEPARTMENT	205	210	Orana
721	HOSPITAL	213	232	CUNNAMULLA HOSPITAL
721	DOCTOR	236	252	Donny KOLASINSKI
721	DOCTOR	283	290	Alfonzo
721	DATE	336	343	16.7.63	2063-07-16
721	DATE	421	426	today	2062-09-13
721	DOCTOR	766	777	Dana Salada
721	DOCTOR	784	797	I Windsheimer
721	DOCTOR	802	812	I Lampkins
721	DOCTOR	820	826	I Skok
721	TIME	830	846	2.50pm on 6/5/13	2013-05-06T14:50
721	DOCTOR	2956	2958	MR
721	DATE	2962	2968	9/7/63	2063-07-09
721	DOCTOR	3001	3008	I Proby
721	DOCTOR	5414	5422	I Vivyan
721	DATE	5990	5997	16.7.63	2063-07-16
722	IDNUM	13	23	56N098616T
722	MEDICALRECORD	24	35	5650986.DRT
722	PATIENT	37	56	Mcgowan, MULGA BILL
722	IDNUM	67	75	56N09861
722	IDNUM	76	84	56N09861
722	STREET	85	96	Fitzstephen
722	CITY	97	106	GILGANDRA
722	STATE	108	116	Tasmania
722	ZIP	118	122	4821
722	DATE	157	166	18/8/2014	2014-08-18
722	DATE	186	195	7/10/2063	2063-07-10
722	DEPARTMENT	212	221	Peter Mac
722	HOSPITAL	224	249	MURRUMBAH-HARDEN HOSPITAL
722	DOCTOR	253	272	LUCIEN KENNY GUIDOS
722	DATE	341	348	18/7/63	2063-07-18
722	DATE	486	491	today	2062-09-13
722	DOCTOR	1058	1066	Cremeans
722	DOCTOR	1088	1098	N Doerksen
722	TIME	1102	1119	10:20am on 8.5.13	2013-05-08T10:20
722	DOCTOR	3833	3835	TO
722	DATE	3839	3846	7.11.63	2063-07-11
722	DOCTOR	3880	3889	N Kiphart
722	DOCTOR	6728	6736	N Shonka
722	DATE	7531	7538	18/7/63	2063-07-18
723	IDNUM	13	23	04J0197740
723	MEDICALRECORD	24	34	043019.SSM
723	PATIENT	36	48	MISSEY, Dara
723	IDNUM	59	67	04J01977
723	IDNUM	68	76	04J01977
723	STREET	77	83	Galata
723	CITY	84	99	LAUNCHING PLACE
723	STATE	101	129	Australian Capital Territory
723	ZIP	131	135	1240
723	DATE	170	179	3/11/2019	2019-11-03
723	TIME	199	218	21/03/2013 at 19:51	2013-03-21T19:51
723	DEPARTMENT	230	247	7.ACUTE CARE WARD
723	HOSPITAL	248	279	ST VINCENT'S HOSPITAL (LISMORE)
723	DOCTOR	283	302	DAYSI NEELY Goetsch
723	DOCTOR	321	328	Daggett
723	DOCTOR	333	341	Sabataso
723	DOCTOR	346	354	Benedith
723	DATE	393	397	2047	2047
723	DOCTOR	2100	2102	GZ
723	DATE	2106	2113	24/5/63	2063-05-24
723	DOCTOR	2146	2155	C Keleman
723	DOCTOR	3348	3356	C Inloes
724	MEDICALRECORD	2	12	250610.PGI
724	PATIENT	13	28	INGA, GARY Adam
724	IDNUM	29	37	25A61062
724	DATE	53	61	5/8/2063	2063-08-05
724	DATE	207	212	today	2062-09-13
724	DOCTOR	883	885	YX
724	DOCTOR	887	889	PR
724	DATE	893	900	30.7.63	2063-07-30
724	DOCTOR	930	938	Q Shanaa
725	IDNUM	13	23	83W640681V
725	MEDICALRECORD	24	35	8386406.VDV
725	PATIENT	37	50	Gelinas, MARK
725	IDNUM	61	69	83W64068
725	IDNUM	70	78	83W64068
725	STREET	79	92	East Shalford
725	CITY	93	101	LOBETHAL
725	STATE	103	106	TAS
725	ZIP	108	112	2594
725	DATE	147	156	10/5/1994	1994-10-05
725	TIME	176	195	16/07/2013 at 08:26	2013-07-16T08:26
725	DEPARTMENT	207	225	Radiation Oncology
725	HOSPITAL	228	254	ALPINE HEALTH (MYRTLEFORD)
725	DOCTOR	258	277	Romelia Shyla GUDAT
725	AGE	314	316	73
725	AGE	407	409	27
725	DOCTOR	1075	1081	Rodney
725	DOCTOR	1103	1113	V Fiorillo
725	DOCTOR	1114	1122	V Eaglen
725	TIME	1126	1143	10.20 on 16.07.13	2013-07-16T10:20
725	DOCTOR	2322	2324	YH
725	DATE	2328	2335	19.9.63	2063-09-19
725	DOCTOR	2367	2373	V Last
726	IDNUM	13	23	04O341539G
726	MEDICALRECORD	24	35	0453415.KZG
726	PATIENT	37	51	Cheek, Palmira
726	IDNUM	62	70	04O34153
726	STREET	71	82	Hestercombe
726	CITY	83	90	BARGARA
726	STATE	92	94	WA
726	ZIP	96	100	2652
726	DATE	126	135	10/3/2006	2006-03-10
726	DATE	155	164	6/11/2063	2063-06-11
726	DEPARTMENT	181	203	3HR STAY SURGICAL UNIT
726	HOSPITAL	206	224	GREENWICH HOSPITAL
726	DOCTOR	228	250	Roscoe GRAHAM Habowski
726	DOCTOR	816	827	A Yampolsky
726	DOCTOR	828	839	A Temblador
726	DOCTOR	840	847	A Remey
726	DOCTOR	848	856	A Shorts
726	TIME	860	876	9.50 on 04.09.13	2013-09-04T09:50
726	DOCTOR	3200	3202	WF
726	DOCTOR	3204	3206	XR
726	DATE	3210	3217	7.11.63	2063-07-11
726	DOCTOR	3248	3258	A Vaughner
727	IDNUM	14	24	52K362697P
727	MEDICALRECORD	25	36	5233626.ZUP
727	PATIENT	38	49	SCELZO, Rea
727	IDNUM	60	68	52K36269
727	STREET	69	78	Judy Witt
727	CITY	79	92	DRUMMOND COVE
727	STATE	94	102	Tasmania
727	ZIP	104	108	2204
727	DATE	134	144	11/11/2010	2010-11-11
727	TIME	164	183	13/08/2013 at 18:01	2013-08-13T18:01
727	DEPARTMENT	195	209	INTENSIVE CARE
727	HOSPITAL	212	249	ALBURY WODONGA HEALTH - ALBURY CAMPUS
727	DOCTOR	253	275	DIERDRE Kylee MOYNIHAN
727	AGE	312	314	57
727	DOCTOR	3424	3426	CQ
727	DATE	3430	3438	16/10/63	2063-10-16
727	DOCTOR	3471	3478	O Tomas
727	DOCTOR	4186	4200	VANNESSA Pabst
728	IDNUM	13	23	10G383655Y
728	MEDICALRECORD	24	35	1023836.OPY
728	PATIENT	37	55	BISSONETTE, HAROLD
728	IDNUM	66	74	10G38365
728	STREET	75	82	Lottery
728	CITY	83	89	NAIRNE
728	STATE	91	94	VIC
728	ZIP	96	100	4422
728	DATE	126	135	30/6/1987	1987-06-30
728	DATE	155	163	7/4/2064	2064-04-07
728	DEPARTMENT	180	189	Peter Mac
728	HOSPITAL	192	216	MURRAY DISTRICT HOSPITAL
728	DOCTOR	220	240	WYNETTE SALLY DEPPEN
728	DOCTOR	3373	3375	AJ
728	DOCTOR	3376	3378	CS
728	DATE	3382	3388	8.4.64	2064-04-08
728	DOCTOR	3420	3429	D Swayzer
729	IDNUM	13	23	31X984514J
729	MEDICALRECORD	24	34	319984.OCL
729	PATIENT	36	52	LAWTER, Hortense
729	IDNUM	64	72	31X98451
729	STREET	73	80	Jaypore
729	CITY	81	89	WILLUNGA
729	STATE	91	94	TAS
729	ZIP	96	100	6317
729	DATE	126	134	3/3/2018	2018-03-03
729	TIME	154	173	27/11/2012 at 16:38	2012-11-27T16:38
729	DEPARTMENT	185	199	MACQUARIE WARD
729	HOSPITAL	200	216	ROSEBUD HOSPITAL
729	DOCTOR	220	256	Jardi Adnyamathanha ERNESTO-BRUSCHKE
729	DOCTOR	3043	3045	NF
729	DATE	3049	3056	30/1/62	2062-01-30
729	DOCTOR	3086	3098	I Allenbrand
730	IDNUM	13	23	89U004662R
730	MEDICALRECORD	24	35	8970046.RGR
730	PATIENT	37	56	Feliciano, Sherrell
730	IDNUM	67	75	89U00466
730	STREET	76	90	Sterling Ranch
730	CITY	91	98	HADSPEN
730	STATE	100	117	Western Australia
730	ZIP	119	123	4345
730	DATE	149	157	8/2/1996	1996-08-02
730	DATE	177	186	12/5/2062	2062-12-05
730	DEPARTMENT	203	216	SEALS central
730	HOSPITAL	219	236	LAVERTON HOSPITAL
730	DOCTOR	240	259	BRYCE Chang Tameron
730	DOCTOR	2450	2452	TV
730	DATE	2456	2463	12.4.62	2062-12-04
730	DOCTOR	2498	2507	W Brizeno
731	IDNUM	13	23	53D854972M
731	MEDICALRECORD	24	35	5318549.TFM
731	PATIENT	37	50	Klang, Alline
731	IDNUM	61	69	53D85497
731	IDNUM	70	78	53D85497
731	STREET	79	84	Dight
731	CITY	85	96	GOONDIWINDI
731	STATE	98	101	VIC
731	ZIP	103	107	2424
731	DATE	142	150	2/4/2025	2025-02-04
731	DEPARTMENT	194	257	Cure For Life Foundation Neuro-oncology Laboratory Adult Cancer
731	HOSPITAL	260	294	ROYAL TALBOT REHABILITATION CENTRE
731	DOCTOR	298	315	BELVA JAIME Hamic
731	DOCTOR	346	352	Docimo
731	DOCTOR	1814	1816	GT
731	DATE	1820	1828	25.12.62	2062-12-25
731	DOCTOR	1859	1871	P Easterling
732	MEDICALRECORD	2	13	6826265.VXL
732	PATIENT	14	25	DANSER, KIP
732	IDNUM	26	34	68H62658
732	IDNUM	35	43	68H62658
732	DATE	59	69	21/12/2062	2062-12-21
732	DOCTOR	537	543	Haspel
732	DOCTOR	550	557	Q Devoe
732	TIME	561	579	4:26pm on 16.10.12	2012-10-16T16:26
732	DOCTOR	974	976	WK
732	DATE	980	988	19.12.62	2062-12-19
732	DOCTOR	1019	1025	Q Homa
733	IDNUM	13	23	16D747637U
733	MEDICALRECORD	24	35	1617476.KSU
733	PATIENT	37	51	Younce, REGGIE
733	IDNUM	62	70	16D74763
733	IDNUM	71	79	16D74763
733	STREET	80	88	S Orange
733	CITY	89	97	WAUCHOPE
733	STATE	99	116	Western Australia
733	ZIP	118	122	4514
733	DATE	157	167	22/12/2007	2007-12-22
733	DATE	187	196	13/4/2064	2064-04-13
733	DEPARTMENT	213	236	POW L7 CONSULTING ROOMS
733	HOSPITAL	239	269	DELEGATE MULTI PURPOSE SERVICE
733	DOCTOR	273	294	THOMASINA Dann ICARDO
733	DOCTOR	313	318	Keehn
733	DOCTOR	3082	3084	BV
733	DATE	3088	3095	14.4.64	2064-04-14
733	DOCTOR	3127	3136	E Platter
733	DOCTOR	4974	4983	E Rotunno
735	IDNUM	13	23	80N596946P
735	MEDICALRECORD	24	35	8055969.LRP
735	PATIENT	37	58	Vanderzanden, BARRETT
735	IDNUM	69	77	80N59694
735	IDNUM	78	86	80N59694
735	STREET	87	98	Poplar Hill
735	CITY	99	107	BALLARAT
735	STATE	109	112	QLD
735	ZIP	114	118	3739
735	DATE	153	163	22/12/2007	2007-12-22
735	DATE	183	192	13/4/2064	2064-04-13
735	DEPARTMENT	209	226	DICKINSON 3 SOUTH
735	HOSPITAL	229	245	GAYNDAH HOSPITAL
735	DOCTOR	249	271	Cindy SHANDI PARKERSON
735	DOCTOR	290	297	Luedtke
735	DOCTOR	3081	3083	JM
735	DATE	3087	3094	14.4.64	2064-04-14
735	DOCTOR	3126	3135	X Borodec
735	DOCTOR	4914	4922	X Stelle
735	DATE	5386	5395	16/4/2064	2064-04-16
748	IDNUM	13	23	95R378553O
748	MEDICALRECORD	24	35	9563785.NJO
748	PATIENT	37	61	LAURICELLA, TRACEE Santo
748	IDNUM	72	80	95R37855
748	STREET	81	91	Brock Hill
748	CITY	92	103	HEALESVILLE
748	STATE	105	107	SA
748	ZIP	109	113	6461
748	DATE	139	149	16/11/2004	2004-11-16
748	DEPARTMENT	192	202	OBSTETRICS
748	HOSPITAL	203	243	MURRAY BRIDGE SOLDIERS MEMORIAL HOSPITAL
748	DOCTOR	247	263	Cameron CHAPPARO
748	DATE	313	320	29.4.64	2064-04-29
748	DATE	347	354	25.3.64	2064-03-25
748	DOCTOR	696	698	TC
748	DOCTOR	699	701	FI
748	TIME	709	729	15.1.2014 at 11:12am	2014-01-15T11:12
748	DOCTOR	845	861	Kirsten LACOURSE
748	DOCTOR	868	870	VA
748	DOCTOR	871	873	GA
748	DOCTOR	874	876	GW
748	TIME	880	905	11:27 am on the 14.1.2014	2014-01-14T11:27
748	DOCTOR	1040	1042	TQ
748	DOCTOR	1044	1046	BY
748	DATE	1050	1057	18.3.64	2064-03-18
748	DOCTOR	1087	1097	Y Wehmeyer
748	DOCTOR	1737	1748	Y Contreres
748	HOSPITAL	1750	1791	CENTRAL GIPPSLAND HEALTH SERVICE (MAFFRA)
748	DATE	2067	2074	25.3.64	2064-03-25
748	DATE	2185	2192	29.4.64	2064-04-29
748	HOSPITAL	2218	2238	MATER ADULT HOSPITAL
748	DOCTOR	2493	2503	Y Bostwick
749	MEDICALRECORD	1	12	4253996.CEW
749	PATIENT	13	27	HIBNER, LEIGHA
749	IDNUM	28	36	42N39961
749	DATE	52	61	19/4/2064	2064-04-19
749	DOCTOR	193	209	BOLESLAWS ORKWIS
749	CITY	211	221	CABOOLTURE
749	DOCTOR	1282	1284	VY
749	DATE	1288	1295	15.4.64	2064-04-15
749	DOCTOR	1327	1337	M Reinhart
750	MEDICALRECORD	1	12	0034107.RZF
750	PATIENT	13	27	FASTLABEN, KUM
750	IDNUM	28	36	00J41076
750	DATE	52	61	27/4/2064	2064-04-27
750	DOCTOR	1253	1255	TJ
750	DOCTOR	1286	1297	B Piganelli
750	DATE	1945	1952	27/4/64	2064-04-27
751	IDNUM	13	23	21B011528Q
751	MEDICALRECORD	24	34	210011.PGV
751	PATIENT	36	50	Rardin, SYDNEY
751	IDNUM	61	69	21B01152
751	STREET	70	75	Nadin
751	CITY	76	83	WALGETT
751	STATE	85	88	ACT
751	ZIP	90	94	3067
751	DATE	120	129	26/2/2037	2037-02-26
751	TIME	149	168	25/02/2014 at 10:25	2014-02-25T10:25
751	DEPARTMENT	180	185	North
751	HOSPITAL	186	204	KALAMUNDA HOSPITAL
751	DOCTOR	209	229	LINO Galen Desforges
751	DOCTOR	884	891	Jacquet
751	TIME	896	914	10:15am on 25/2/14	2014-02-25T10:15
751	DOCTOR	922	933	G. Hosseini
751	DOCTOR	2610	2612	MC
751	DOCTOR	2638	2647	G Tarallo
751	IDNUM	3299	3307	21B01152
751	DATE	3520	3529	29/4/2064	2064-04-29
754	IDNUM	13	23	79X031686Z
754	MEDICALRECORD	24	35	7980316.VQZ
754	PATIENT	37	52	MIZELL, Fabiola
754	IDNUM	63	71	79X03168
754	STREET	72	81	Barkworth
754	CITY	82	92	WATTLEGLEN
754	STATE	94	96	NT
754	ZIP	98	102	4818
754	DATE	128	137	5/11/1997	1997-05-11
754	DEPARTMENT	181	184	DHM
754	HOSPITAL	187	204	COLEDALE HOSPITAL
754	DOCTOR	208	227	Quincy Randy DICKEY
754	DOCTOR	3450	3452	QH
754	DATE	3456	3463	22/4/64	2064-04-22
754	DOCTOR	3498	3504	U Mais
755	MEDICALRECORD	1	12	5328819.WPT
755	PATIENT	13	31	Pergande, WARRIGAL
755	IDNUM	32	40	53G88198
755	DATE	56	65	21/4/2064	2064-04-21
755	DOCTOR	1422	1424	KF
755	DOCTOR	1425	1427	LI
755	DATE	1431	1438	20.4.64	2064-04-20
755	DOCTOR	1472	1481	N Lonsway
755	DEPARTMENT	2100	2114	ACUTECARE WARD
756	IDNUM	14	24	58K753592T
756	MEDICALRECORD	25	36	5847535.YHT
756	PATIENT	38	61	SEMBRAT, ERNIE Eldridge
756	IDNUM	72	80	58K75359
756	STREET	81	86	Myhre
756	CITY	87	94	WINGHAM
756	STATE	96	99	QLD
756	ZIP	101	105	2309
756	DATE	131	139	7/3/1984	1984-07-03
756	TIME	159	178	19/02/2014 at 06:43	2014-02-19T06:43
756	DEPARTMENT	190	202	RENAL CLINIC
756	HOSPITAL	203	221	DOOMADGEE HOSPITAL
756	DOCTOR	226	249	DARREN LUCIANO Thielman
756	DOCTOR	2747	2749	PB
756	DOCTOR	2773	2784	N. Deshaies
756	DATE	4564	4573	23/4/2064	2064-04-23
757	IDNUM	13	23	06G784650B
757	MEDICALRECORD	24	35	0627846.NCB
757	PATIENT	37	50	DOMAS, Krissy
757	IDNUM	61	69	06G78465
757	STREET	70	77	Wildley
757	HOSPITAL	78	107	DORRIGO MULTI PURPOSE SERVICE
757	CITY	108	117	RASMUSSEN
757	STATE	119	134	South Australia
757	ZIP	136	140	4812
757	DATE	166	175	6/12/1968	1968-12-06
757	TIME	195	214	13/02/2014 at 13:46	2014-02-13T13:46
757	DEPARTMENT	226	231	PaLMS
757	HOSPITAL	232	271	CENTRAL GIPPSLAND HEALTH SERVICE (SALE)
757	DOCTOR	275	294	TAMA DUDLEY Poulsen
757	AGE	370	373	100
757	DOCTOR	1607	1609	GE
757	DATE	1613	1620	16/4/64	2064-04-16
757	DOCTOR	1652	1660	C Debiew
758	MEDICALRECORD	1	12	8065239.PBW
758	PATIENT	13	40	Kilfoyle, GERMAINE CALANDRA
758	IDNUM	41	49	80Q52395
758	IDNUM	50	58	80Q52395
758	DATE	74	83	23/4/2064	2064-04-23
758	DOCTOR	1508	1510	DK
758	DOCTOR	1512	1514	HX
758	DATE	1518	1525	22.4.64	2064-04-22
758	DOCTOR	1592	1599	V Selma
759	IDNUM	14	24	85U305667V
759	MEDICALRECORD	25	36	8573056.RTV
759	PATIENT	38	57	Struchen, AUGUSTINE
759	IDNUM	68	76	85U30566
759	STREET	77	88	Shaw Fields
759	CITY	89	99	DAYLESFORD
759	STATE	101	118	Western Australia
759	ZIP	120	124	3991
759	DATE	150	159	27/9/2019	2019-09-27
759	TIME	179	198	14/02/2014 at 13:58	2014-02-14T13:28
759	DEPARTMENT	210	220	NSW Health
759	HOSPITAL	221	248	THE PRINCE CHARLES HOSPITAL
759	DOCTOR	252	270	Denis Garth Leicht
759	DOCTOR	2745	2747	LM
759	DOCTOR	2749	2751	NU
759	DATE	2755	2762	19.4.64	2064-04-19
759	DOCTOR	2793	2803	V Balancia
760	MEDICALRECORD	1	12	3364266.GOE
760	PATIENT	13	35	Chapparo, PATRICK Rumi
760	IDNUM	36	44	33Q42662
760	DATE	60	69	28/4/2064	2064-04-28
760	DOCTOR	1720	1722	QG
760	DOCTOR	1723	1725	HV
760	DATE	1729	1736	27.4.64	2064-04-27
760	DOCTOR	1767	1775	K Sansom
760	DOCTOR	2689	2702	PAUL SAKUMOTO
761	IDNUM	14	24	91M447783M
761	MEDICALRECORD	25	36	9144477.VJM
761	PATIENT	38	59	TANDUS, DAMION DORIAN
761	IDNUM	70	78	91M44778
761	STREET	79	87	Ivy Hill
761	CITY	88	96	MERRIMAC
761	STATE	98	106	Tasmania
761	ZIP	108	112	5302
761	DATE	138	147	25/5/2022	2022-05-25
761	DATE	167	176	27/4/2064	2064-04-27
761	DEPARTMENT	193	203	OBSTETRICS
761	HOSPITAL	206	240	WILSON MEMORIAL COMMUNITY HOSPITAL
761	DOCTOR	244	264	Mickey Jacquetta Ohl
761	DOCTOR	1301	1307	Reglin
761	DOCTOR	1314	1324	JEROME Hua
761	TIME	1328	1346	12:53 on 25.2.2014	2014-02-25T12:53
761	DOCTOR	4215	4217	MK
761	DOCTOR	4219	4221	AN
761	DATE	4225	4232	28.4.64	2064-04-28
761	DOCTOR	4262	4269	Y Merna
761	DOCTOR	5781	5795	Deetta TAMARGO
762	IDNUM	13	23	59I468731V
762	MEDICALRECORD	24	35	5934687.KFV
762	PATIENT	37	54	Eschbaugh, JEWELL
762	IDNUM	65	73	59I46873
762	STREET	74	82	Stillson
762	CITY	83	91	KAMBALDA
762	STATE	93	95	SA
762	ZIP	97	101	2206
762	DATE	127	135	5/2/1992	1992-05-02
762	TIME	155	174	20/02/2014 at 16:42	2014-02-20T16:42
762	DEPARTMENT	186	197	Hunter Area
762	HOSPITAL	200	236	TRANGIE MULTI PURPOSE HEALTH SERVICE
762	DOCTOR	240	265	KUPARR Alfredo Lane-Holms
762	DOCTOR	1180	1182	LJ
762	DOCTOR	1183	1185	MU
762	DATE	1189	1196	23.4.64	2064-04-23
762	DOCTOR	2574	2576	VY
762	DOCTOR	2578	2580	MX
762	DATE	2584	2591	23.4.64	2064-04-23
762	DOCTOR	2621	2631	N Pontillo
762	ORGANIZATION	4475	4498	New York Life Insurance
762	HOSPITAL	4500	4519	NARRANDERA HOSPITAL
763	IDNUM	13	23	60A169690G
763	MEDICALRECORD	24	35	6001696.YAG
763	PATIENT	37	62	COTTRELL, LYNELLE Wilbert
763	IDNUM	73	81	60A16969
763	STREET	82	91	Bullivant
763	CITY	92	100	BATHURST
763	STATE	102	120	Northern Territory
763	ZIP	122	126	2469
763	DATE	152	162	27/12/2013	2013-12-27
763	TIME	182	201	16/01/2014 at 10:23	2014-01-16T10:23
763	DEPARTMENT	213	240	DEPT OF CORRECTIVE SERVICES
763	DOCTOR	245	267	Rod ALEJANDRO SCHUEREN
763	DOCTOR	729	747	Laurice PANGILINAN
763	TIME	766	784	1017Hrs on 16.1.14	2014-01-16T10:17
763	DOCTOR	792	801	S. Dubill
763	DOCTOR	3200	3210	S. Dayhuff
763	DATE	5804	5811	23/3/64	2064-03-23
764	IDNUM	14	24	27W189758P
764	MEDICALRECORD	25	36	2781897.NVP
764	PATIENT	38	55	Gorsky, Nathanial
764	IDNUM	66	74	27W18975
764	STREET	75	86	Wilson Fold
764	CITY	87	93	INGHAM
764	STATE	95	113	Northern Territory
764	ZIP	115	119	5234
764	DATE	145	154	12/2/2001	2001-02-12
764	DATE	174	183	28/4/2064	2064-04-28
764	DEPARTMENT	200	217	ST GEORGE PRIVATE
764	HOSPITAL	220	248	PENOLA WAR MEMORIAL HOSPITAL
764	DOCTOR	252	273	Malcom HORACIO Strose
764	DOCTOR	303	309	Mcneff
764	DOCTOR	3798	3800	KJ
764	DATE	3804	3811	29/4/64	2064-04-29
764	DOCTOR	3842	3851	G Pearson
766	IDNUM	13	23	48N780606A
766	MEDICALRECORD	24	35	4857806.CRA
766	PATIENT	37	64	Cichowski, Sebastian WILBUR
766	IDNUM	75	83	48N78060
766	STREET	84	92	Gafzelle
766	CITY	93	102	INVERLOCH
766	STATE	104	106	SA
766	ZIP	108	112	6951
766	DATE	137	146	19/2/1996	1996-02-19
766	TIME	166	185	13/02/2014 at 09:50	2014-02-13T09:50
766	DEPARTMENT	197	210	PARKES 4 EAST
766	HOSPITAL	211	227	ANGLISS HOSPITAL
766	DOCTOR	232	257	EMMITT ANDERSON ROBBINSON
766	DOCTOR	2079	2085	Winker
766	DOCTOR	2106	2116	L. Kababik
766	DATE	3482	3489	20/4/64	2064-04-20
766	DEPARTMENT	3577	3595	South Western Area
766	HOSPITAL	3597	3613	QUILPIE HOSPITAL
766	IDNUM	3631	3639	L85/7806
768	IDNUM	13	23	06K711664I
768	MEDICALRECORD	24	35	0637116.RMI
768	PATIENT	37	52	BEEVERS, Catina
768	IDNUM	63	71	06K71166
768	STREET	72	79	Currong
768	CITY	80	89	NEWCASTLE
768	STATE	91	101	Queensland
768	ZIP	103	107	7262
768	DATE	133	141	2/5/1992	1992-05-02
768	TIME	161	180	20/02/2014 at 16:42	2014-02-20T16:42
768	DEPARTMENT	192	209	BILLINGTON CENTRE
768	HOSPITAL	212	252	MONASH MEDICAL CENTRE - MOORABBIN CAMPUS
768	DOCTOR	256	285	Woodrow LOREN WOODROW-Buffalo
768	DATE	370	376	5.5.64	2064-05-05
768	DOCTOR	381	387	ARandy
768	DOCTOR	1514	1516	LA
768	DOCTOR	1517	1519	RZ
768	DATE	1523	1530	23.4.64	2064-04-23
768	DOCTOR	2913	2915	AE
768	DOCTOR	2917	2919	WC
768	DATE	2923	2930	23.4.64	2064-04-23
768	DOCTOR	2960	2969	A Strader
768	DOCTOR	4633	4642	A Yearick
768	ORGANIZATION	4807	4812	Yahoo
768	HOSPITAL	4814	4838	VICTORIAN HEART HOSPITAL
772	MEDICALRECORD	1	12	5428327.GIR
772	PATIENT	13	26	Tomich, Daryl
772	IDNUM	27	35	54G83272
772	DATE	51	59	5/6/2064	2064-05-06
772	DOCTOR	544	546	XG
772	DOCTOR	548	550	GY
772	DATE	554	561	30.4.64	2064-04-30
772	DOCTOR	591	599	O Tugman
774	MEDICALRECORD	1	12	7594336.UDC
774	PATIENT	13	27	Dueitt, Elisha
774	IDNUM	28	36	75X43367
774	DATE	52	60	5/6/2064	2064-05-06
774	DOCTOR	544	546	ZH
774	DOCTOR	548	550	QG
774	DATE	554	561	30.4.64	2064-04-30
774	DOCTOR	591	601	T Kluemper
775	IDNUM	14	24	33T4536394
775	MEDICALRECORD	25	36	3374536.JYL
775	PATIENT	38	64	Rickenbacker, DERICK RANAE
775	IDNUM	75	83	33T45363
775	STREET	84	95	North Texas
775	CITY	96	105	MANSFIELD
775	STATE	107	115	Victoria
775	ZIP	117	121	6390
775	DATE	147	155	9/4/2027	2027-04-09
775	DATE	173	181	4/4/2059	2059-04-04
775	DEPARTMENT	198	211	MACQUARIEWARD
775	HOSPITAL	212	237	ROCKHAMPTON BASE HOSPITAL
775	DOCTOR	241	258	EMMITT WEISENFLUH
775	DOCTOR	889	895	Simler
775	DOCTOR	919	928	H Zourkos
775	TIME	932	951	14.01pm on 02.02.09	2009-02-02T14:01
775	DOCTOR	1403	1408	Grims
775	DOCTOR	1415	1424	H Maschke
775	TIME	1428	1447	15.00pm on 02.02.09	2009-02-02T15:00
775	DOCTOR	3306	3308	FU
775	DATE	3309	3315	5.4.59	2059-04-05
775	DOCTOR	3346	3354	H Conary
776	IDNUM	13	23	07D293049G
776	MEDICALRECORD	24	35	0712930.KXG
776	PATIENT	37	56	HACKE, Keenan Angus
776	IDNUM	67	75	07D29304
776	STREET	76	81	Moons
776	CITY	82	88	MOONIE
776	STATE	90	93	QLD
776	ZIP	95	99	3414
776	DATE	125	133	9/8/1987	1987-08-09
776	TIME	153	172	20/02/2014 at 14:18	2014-02-20T14:18
776	DEPARTMENT	184	201	DICKINSON 2 NORTH
776	HOSPITAL	202	231	BARRABA MULTI PURPOSE SERVICE
776	DOCTOR	235	254	DEWEY HANK Nunziato
776	DOCTOR	1744	1746	XX
776	DATE	1750	1757	23.4.64	2064-04-23
776	DOCTOR	1788	1797	A Sudbury
776	DOCTOR	1813	1825	A Manusyants
777	IDNUM	13	23	02H175646F
777	MEDICALRECORD	24	34	022175.QMP
777	PATIENT	36	49	DRESNER, ERIK
777	IDNUM	59	67	02H17564
777	ORGANIZATION	68	90	First Data Corporation
777	CITY	91	99	ARMIDALE
777	STATE	99	107	Tasmania
777	ZIP	109	113	3005
777	DATE	139	148	26/7/1983	1983-07-26
777	TIME	168	187	25/02/2014 at 08:28	2014-02-25T08:28
777	DEPARTMENT	199	209	Immunology
777	HOSPITAL	210	240	ESPERANCE MULTI PURPOSE CENTRE
777	DOCTOR	244	262	CHANG JAMAL NOVIDA
777	DOCTOR	1911	1913	AD
777	DOCTOR	1915	1917	FF
777	DATE	1921	1928	28.4.64	2064-04-28
777	DOCTOR	1958	1966	B Driere
778	IDNUM	14	24	76Q925955A
778	MEDICALRECORD	25	36	7669259.OOA
778	PATIENT	38	54	GRENNAY, LIZETTE
778	IDNUM	65	73	76Q92595
778	STREET	74	85	Putney High
778	CITY	86	94	MAITLAND
778	STATE	96	106	Queensland
778	ZIP	108	112	3869
778	DATE	138	147	27/8/2024	2024-08-27
778	DATE	167	176	4/12/2064	2064-04-12
778	DEPARTMENT	193	211	OPERATING THEATRES
778	HOSPITAL	214	229	NEWMAN HOSPITAL
778	DOCTOR	233	251	Pura PAMULA KOPPES
778	DOCTOR	270	275	Gaudy
778	AGE	413	415	20
778	DOCTOR	2790	2792	GG
778	DOCTOR	2793	2795	GS
778	DATE	2799	2806	13.4.64	2064-04-13
778	DOCTOR	2838	2846	P Tables
778	DOCTOR	3648	3656	P Moisey
779	IDNUM	13	23	34N945013I
779	MEDICALRECORD	24	35	3459450.DJI
779	PATIENT	37	49	MAZZARA, Val
779	IDNUM	60	68	34N94501
779	STREET	69	79	Blackhurst
779	CITY	80	88	SEA LAKE
779	STATE	90	118	Australian Capital Territory
779	ZIP	120	124	4505
779	DATE	150	159	5/11/1992	1992-11-05
779	TIME	179	198	10/02/2014 at 11:20	2014-02-10T11:20
779	DEPARTMENT	210	228	INTENSIVECARE UNIT
779	HOSPITAL	231	267	TRANGIE MULTI PURPOSE HEALTH SERVICE
779	DOCTOR	271	287	Von MERLIN Selca
779	DOCTOR	3017	3019	HE
779	DATE	3023	3030	13.4.64	2064-04-13
779	DOCTOR	3061	3072	I Enrriquez
779	DOCTOR	3088	3094	I Kast
780	IDNUM	14	24	39R717620H
780	MEDICALRECORD	25	36	3967176.FBH
780	PATIENT	38	55	Fryson, CLEVELAND
780	IDNUM	66	74	39R71762
780	STREET	75	86	Carrs Ridge
780	CITY	87	94	BUNBURY
780	STATE	96	98	SA
780	ZIP	100	104	3659
780	DATE	130	139	24/3/2008	2008-03-24
780	TIME	159	178	07/02/2014 at 15:23	2014-02-07T15:23
780	DEPARTMENT	190	220	SOUTH SURGICAL ASSESSMENT UNIT
780	HOSPITAL	221	235	BOWEN HOSPITAL
780	DOCTOR	239	257	Brooks Pete Nicome
780	DOCTOR	2228	2230	KS
780	DOCTOR	2231	2233	RH
780	DATE	2237	2244	12.4.64	2064-04-12
780	DOCTOR	2278	2285	J Coots
780	DOCTOR	2293	2302	J Bingert
780	DOCTOR	3034	3046	J Mclaughlan
780	DOCTOR	4611	4618	J Magos
780	DATE	4619	4626	21/4/64	2064-04-21
780	DOCTOR	4683	4691	J Warntz
780	DOCTOR	5089	5096	J Panak
781	IDNUM	13	23	03A667920C
781	MEDICALRECORD	24	34	030667.ZGA
781	PATIENT	36	48	Syck, KEENAN
781	IDNUM	59	67	03A66792
781	STREET	68	73	Labau
781	CITY	74	85	BONNY HILLS
781	STATE	87	97	Queensland
781	ZIP	99	103	5262
781	DATE	129	137	4/3/2003	2003-03-04
781	TIME	157	176	07/02/2014 at 14:20	2014-02-07T14:20
781	DEPARTMENT	188	206	OPERATING THEATRES
781	HOSPITAL	207	244	ALBURY WODONGA HEALTH - ALBURY CAMPUS
781	DOCTOR	248	266	Doyle Brock-GEHMAN
781	DOCTOR	1523	1525	SB
781	DATE	1529	1536	12.4.64	2064-04-12
781	DOCTOR	1567	1582	B Messerschmidt
782	IDNUM	13	23	61W688088L
782	MEDICALRECORD	24	35	6186880.VVL
782	PATIENT	37	60	Hattub, LEOPOLDO DANIAL
782	IDNUM	71	79	61W68808
782	STREET	80	98	Southwest Elmgrove
782	CITY	99	109	RED CLIFFS
782	STATE	111	114	QLD
782	ZIP	116	120	3555
782	DATE	146	154	2/4/2038	2038-02-04
782	DATE	174	182	4/8/2064	2064-04-08
782	DEPARTMENT	199	211	Southern IML
782	HOSPITAL	212	257	MARYBOROUGH DISTRICT HEALTH SERVICE (DUNOLLY)
782	DOCTOR	261	287	CORNELIUS Seth CASSELBERRY
782	DOCTOR	2581	2583	DU
782	DOCTOR	2584	2586	SQ
782	DATE	2590	2596	4.9.64	2064-04-09
782	DOCTOR	2627	2635	Q Sanden
783	IDNUM	14	24	81O289936W
783	MEDICALRECORD	25	35	815289.YKR
783	PATIENT	37	52	Buzby, VALENTIN
783	IDNUM	63	71	81O28993
783	STREET	72	83	Beulah Park
783	CITY	84	92	COCKATOO
783	STATE	94	97	ACT
783	ZIP	99	103	3317
783	DATE	128	136	6/6/2002	2002-06-06
783	TIME	156	175	06/02/2014 at 09:20	2014-02-06T09:20
783	DEPARTMENT	187	205	Douglas Hanly Moir
783	HOSPITAL	206	245	CENTRAL GIPPSLAND HEALTH SERVICE (SALE)
783	DOCTOR	249	267	BRITT ELIJAH PENHA
783	DOCTOR	2301	2303	DO
783	DATE	2307	2313	4.8.64	2064-04-08
783	DOCTOR	2343	2354	V Sagastume
783	DOCTOR	2370	2379	V Calvert
784	MEDICALRECORD	1	12	3933099.ZME
784	PATIENT	13	31	SCHLEMMER, Dorthey
784	IDNUM	32	40	39K30999
784	DATE	56	64	7/4/2064	2064-04-07
784	DOCTOR	1749	1751	SZ
784	DOCTOR	1752	1754	EY
784	DATE	1758	1766	19.12.63	2063-12-19
784	DOCTOR	1798	1809	J Tourville
785	IDNUM	13	23	50B900853Q
785	MEDICALRECORD	24	34	500900.WNI
785	PATIENT	36	50	ULRICH, Irving
785	IDNUM	61	69	50B90085
785	STREET	70	76	Aldrid
785	CITY	77	84	WINGHAM
785	STATE	86	94	Victoria
785	ZIP	96	100	3105
785	DATE	126	135	22/3/2014	2014-03-22
785	TIME	155	174	01/02/2014 at 16:33	2014-02-01T16:33
785	DEPARTMENT	186	204	MEDIC/SURGERY WARD
785	HOSPITAL	205	246	COLLINSVILLE MULTI-PURPOSE HEALTH SERVICE
785	DOCTOR	250	269	Freddy Royal MARCOS
785	DOCTOR	2878	2880	PM
785	DOCTOR	2882	2884	AY
785	DATE	2888	2894	4.5.64	2064-04-05
785	DOCTOR	2928	2938	Y Chumbley
785	DOCTOR	2944	2953	Y Simmers
786	IDNUM	14	24	18X921911Y
786	MEDICALRECORD	25	35	189921.YCD
786	PATIENT	37	50	Prinz, Conrad
786	IDNUM	61	69	18X92191
786	STREET	70	78	Neuharth
786	CITY	79	90	MEEKATHARRA
786	STATE	92	94	WA
786	ZIP	96	100	3054
786	DATE	126	134	1/9/2003	2003-09-01
786	TIME	154	173	30/01/2014 at 13:48	2014-01-30T13:48
786	DEPARTMENT	185	200	DAYSURGERY UNIT
786	HOSPITAL	201	228	ALEXANDRA DISTRICT HOSPITAL
786	DOCTOR	232	260	WARNER DJARRUN WESTON-BEYSER
786	DOCTOR	2610	2612	IJ
786	DOCTOR	2614	2616	CQ
786	DATE	2620	2626	3.3.64	2064-03-03
786	DOCTOR	2658	2665	D Ducey
786	ORGANIZATION	4047	4062	Parker Hannifin
786	HOSPITAL	4064	4100	SWAN HILL DISTRICT HEALTH [SWAN HILL
787	IDNUM	13	23	39P522869J
787	MEDICALRECORD	24	35	3955228.RZJ
787	PATIENT	37	53	DOLPHIN, BRONWYN
787	IDNUM	64	72	39P52286
787	STREET	73	83	Twin Creek
787	CITY	84	92	HAMILTON
787	STATE	94	109	South Australia
787	ZIP	111	115	2204
787	DATE	141	150	14/1/1984	1984-01-14
787	DATE	170	178	1/3/2064	2064-03-01
787	DEPARTMENT	195	210	Envoi Pathology
787	HOSPITAL	211	226	BOONAH HOSPITAL
787	DOCTOR	230	247	Cordell Mal JUSTE
787	DOCTOR	657	675	Chester Schweikert
787	DOCTOR	697	707	I Mattiace
787	TIME	711	717	4.05pm	2064-03-01T16:05
787	DOCTOR	956	965	I Buzzard
787	DOCTOR	987	993	I Ziff
787	TIME	997	1003	4.05pm	2064-03-01T16:05
787	DOCTOR	2800	2802	DE
787	DOCTOR	2805	2807	JA
787	DATE	2811	2817	3.2.64	2064-03-02
787	DOCTOR	2850	2857	R Tynan
788	MEDICALRECORD	1	12	8746538.GUS
788	PATIENT	13	36	ELLIES, CARINA NICHOLAS
788	IDNUM	37	45	87L65382
788	DATE	61	69	3/3/2064	2064-03-03
788	DOCTOR	1121	1123	OT
788	DOCTOR	1124	1126	SN
788	DATE	1130	1136	3.2.64	2064-03-02
788	DOCTOR	1168	1176	W Selsor
789	MEDICALRECORD	2	13	4526739.VPB
789	PATIENT	14	29	Mabane, NATISHA
789	IDNUM	30	38	45H67398
789	DATE	54	63	15/4/2064	2064-04-15
789	DATE	105	114	15.4.2064	2064-04-15
789	DOCTOR	1863	1865	PE
789	DATE	1869	1875	2.3.64	2064-03-02
789	DOCTOR	1908	1916	L Cheirs
789	DOCTOR	3521	3535	Julian CHIPMAN
789	DATE	4452	4461	15.4.2064	2064-04-15
789	DOCTOR	4466	4474	L Vosmus
789	DOCTOR	4494	4505	MONICA Tinn
790	MEDICALRECORD	1	11	669274.VJL
790	PATIENT	12	25	VERNON, MERRI
790	IDNUM	26	34	66Y27483
790	DATE	50	58	3/2/2064	2064-03-02
790	DOCTOR	726	728	JK
790	DATE	732	738	3.1.64	2064-03-01
790	DOCTOR	768	774	Q Hool
791	IDNUM	14	24	14V295892U
791	MEDICALRECORD	25	36	1482958.YGU
791	PATIENT	38	59	Marcon, Tyrone Milton
791	IDNUM	69	77	14V29589
791	STREET	78	85	Leigton
791	CITY	86	94	GUNNEDAH
791	STATE	96	99	ACT
791	ZIP	101	105	1106
791	DATE	131	140	25/3/2040	2040-03-25
791	TIME	160	179	28/01/2014 at 14:23	2014-01-28T14:23
791	DEPARTMENT	191	204	DARLING POINT
791	HOSPITAL	205	247	SOUTH WEST HEALTHCARE - WARRNAMBOOL CAMPUS
791	DOCTOR	251	260	Cruz Dohm
791	DOCTOR	1330	1332	FR
791	DATE	1336	1342	1/3/64	2064-03-01
791	DOCTOR	1373	1382	E Gniewek
792	IDNUM	13	23	72R316950D
792	MEDICALRECORD	24	34	726316.YNB
792	PATIENT	36	47	YANEK, Tara
792	IDNUM	58	66	72R31695
792	STREET	67	73	Paloma
792	CITY	74	77	HAY
792	STATE	79	87	Victoria
792	ZIP	89	93	3043
792	DATE	119	128	4/12/2022	2022-04-12
792	DATE	148	157	26/3/2064	2064-03-26
792	DEPARTMENT	174	182	PARKES 8
792	HOSPITAL	183	209	THE QUEEN ELIZABETH CENTRE
792	DOCTOR	213	238	JEROMY STACEY Mac-DIAMICO
792	DOCTOR	780	785	Louge
792	DOCTOR	809	815	Garret
792	TIME	819	838	0933 on the 24/1/14	2014-01-24T09:33
792	DOCTOR	1894	1896	XN
792	DOCTOR	1898	1900	SY
792	DATE	1904	1911	30.3.64	2064-03-30
792	DOCTOR	1941	1949	T Oyuela
793	IDNUM	13	23	20N336018M
793	MEDICALRECORD	24	35	2053360.CXM
793	PATIENT	37	49	Kwek, Marvin
793	IDNUM	60	68	20N33601
793	IDNUM	69	77	20N33601
793	STREET	78	85	Bartram
793	CITY	86	96	CABOOLTURE
793	STATE	98	106	Tasmania
793	ZIP	108	112	4365
793	DATE	144	153	27/2/2032	2032-02-27
793	DATE	173	182	29/3/2064	2064-03-29
793	DEPARTMENT	199	221	ST VINCENT'S PATHOLOGY
793	HOSPITAL	222	243	THE MORNINGTON CENTRE
793	DOCTOR	247	271	VIRGILIO Blake FRANSISCO
793	DOCTOR	302	307	Masin
793	DOCTOR	796	809	Adnyamathanha
793	DOCTOR	837	844	H Tumey
793	TIME	845	865	art 11:10 on 27/1/14	2014-01-27T11:10
793	DOCTOR	1741	1743	RE
793	DATE	1747	1754	30/3/64	2064-03-30
793	DOCTOR	1784	1794	H Forguson
794	IDNUM	14	24	41E937867X
794	MEDICALRECORD	25	35	411937.XRS
794	PATIENT	37	49	Hipp, WENDIE
794	IDNUM	60	68	41E93786
794	STREET	69	74	Calow
794	CITY	75	82	PENGUIN
794	ZIP	86	90	1429
794	DATE	116	126	13/11/1997	1997-11-13
794	TIME	146	165	23/01/2014 at 08:13	2014-01-23T08:13
794	DEPARTMENT	177	195	Radiation Oncology
794	HOSPITAL	196	227	DENTAL HEALTH SERVICES VICTORIA
794	DOCTOR	231	255	Dannie Kendrick BARRANCA
794	DATE	304	310	1.3.64	2064-03-01
794	DOCTOR	361	370	Cappleman
794	HOSPITAL	385	404	DONNYBROOK HOSPITAL
794	DOCTOR	1725	1727	TE
794	DATE	1731	1738	25/3/64	2064-03-25
794	DOCTOR	1770	1780	M Mountain
794	DATE	3743	3749	1.3.64	2064-03-01
795	MEDICALRECORD	1	11	090968.YGO
795	PATIENT	12	32	Surface, Cassi Hyman
795	IDNUM	33	41	09A96892
795	DATE	57	66	30/3/2064	2064-03-30
795	DOCTOR	733	735	CY
795	DOCTOR	737	739	SG
795	DATE	743	750	25.3.64	2064-03-25
795	DOCTOR	780	786	A Gaal
796	IDNUM	13	23	20S659873R
796	MEDICALRECORD	24	35	2076598.UJR
796	PATIENT	37	52	DURETTE, Shelby
796	IDNUM	63	71	20S65987
796	STREET	72	84	Lake Potomac
796	CITY	85	92	DAMPIER
796	STATE	94	102	Victoria
796	ZIP	104	108	2049
796	DATE	134	143	6/12/2004	2004-12-06
796	TIME	162	181	22/01/2014 at 15:47	2014-01-22T15:47
796	DEPARTMENT	193	198	PaLMS
796	HOSPITAL	199	248	MARYBOROUGH DISTRICT HEALTH SERVICE (MARYBOROUGH)
796	DOCTOR	252	265	COLIN HAUSNER
796	DATE	334	341	14.4.64	2064-04-14
796	DATE	426	434	Oct 2063	2063-10
796	DOCTOR	902	911	Johnathon
796	DOCTOR	919	927	G Paynes
796	DOCTOR	939	949	G Mccalebb
796	DOCTOR	954	961	G Junge
796	DOCTOR	969	976	G Arbon
796	TIME	980	997	16:20 on 22.01.14	2014-01-22T16:20
796	DOCTOR	1564	1566	VD
796	DOCTOR	1567	1569	KN
796	DATE	1573	1580	23.3.64	2064-03-23
796	DOCTOR	1611	1623	G Momplaisir
796	IDNUM	3463	3471	20S65987
796	DATE	4304	4311	14.4.64	2064-04-14
796	IDNUM	4367	4375	20S65987
797	IDNUM	14	24	77O680931Z
797	MEDICALRECORD	25	36	7756809.JEZ
797	PATIENT	38	58	Bunts, POLLY BRIGIDA
797	IDNUM	69	77	77O68093
797	IDNUM	78	86	77O68093
797	STREET	87	94	Kingman
797	CITY	95	108	CENTRAL COAST
797	STATE	110	113	QLD
797	ZIP	115	119	3025
797	DATE	154	163	10/3/1978	1978-10-03
797	DATE	183	192	24/3/2064	2064-03-24
797	DEPARTMENT	209	229	8 GOOLAGONG CRESCENT
797	HOSPITAL	232	244	LAURA CAMPUS
797	DOCTOR	248	267	Una Saoirse Cecilia
797	DOCTOR	286	295	Deangelis
797	AGE	353	355	55
797	DOCTOR	968	970	FO
797	DOCTOR	974	983	U Snorton
797	DATE	991	1009	24th of March 2064	2064-03-24
797	DOCTOR	3487	3489	UY
797	DOCTOR	3491	3493	KJ
797	DATE	3497	3504	25.3.64	2064-03-25
797	DOCTOR	3534	3547	U Englebrecht
798	IDNUM	13	23	35K6009903
798	MEDICALRECORD	24	34	354600.ZYA
798	PATIENT	36	59	Elford, CATHLEEN VIVIEN
798	IDNUM	70	78	35K60099
798	STREET	79	87	Hernando
798	CITY	88	100	CAMPBELLTOWN
798	STATE	102	112	Queensland
798	ZIP	114	118	2229
798	DATE	144	153	28/2/2014	2014-02-28
798	DATE	173	182	23/3/2064	2064-03-23
798	DEPARTMENT	199	214	DAYSURGERY UNIT
798	HOSPITAL	215	235	DAVID BERRY HOSPITAL
798	DOCTOR	239	263	Asa Beau Marty-Whitinger
798	DOCTOR	750	771	Renita Byron-STGEORGE
798	DOCTOR	778	788	I Maderios
798	TIME	792	809	19:55 on 21.01.14	2014-01-21T19:55
798	DOCTOR	1949	1951	PM
798	DATE	1955	1962	24.3.64	2064-03-24
798	DOCTOR	1993	1999	I Nary
798	DOCTOR	2015	2024	I Prenatt
799	MEDICALRECORD	1	12	5602018.MVT
799	PATIENT	13	31	KADLUBOWSKI, LEILA
799	IDNUM	32	40	56C20184
799	IDNUM	41	49	56C20184
799	DATE	65	74	26/3/2064	2064-03-26
799	DOCTOR	589	595	N Dado
799	TIME	599	618	17:10pm on 20.01.14	2014-01-20T17:10
799	DOCTOR	976	978	SK
799	DATE	982	989	25/3/64	2064-03-25
799	DOCTOR	1055	1057	XQ
799	DOCTOR	1058	1060	VO
799	DATE	1064	1071	23.3.64	2064-03-23
799	DOCTOR	1102	1109	N Ocano
800	IDNUM	11	21	04Y3229060
800	MEDICALRECORD	22	32	049322.XCR
800	PATIENT	34	50	CONCATELLI, EMIL
800	IDNUM	61	69	04Y32290
800	STREET	70	79	Markovich
800	CITY	80	89	SOUTHPORT
800	ZIP	93	97	3186
800	DATE	123	133	20/12/1987	1987-12-20
800	TIME	153	172	19/01/2014 at 16:17	2014-01-19T16:17
800	DEPARTMENT	184	198	Pathology West
800	HOSPITAL	199	214	WARREN HOSPITAL
800	DOCTOR	218	239	LANNY Wally Sodervick
800	DOCTOR	395	401	Fagnan
800	DOCTOR	2063	2065	VJ
800	DOCTOR	2066	2068	NP
800	DATE	2072	2079	22.3.64	2064-03-22
800	DOCTOR	2114	2120	C Nath
801	IDNUM	13	23	25P923864N
801	MEDICALRECORD	24	34	256923.UQM
801	PATIENT	36	51	Stratman, Ivory
801	IDNUM	62	70	25P92386
801	STREET	71	79	N Harvey
801	CITY	80	92	POINT VERNON
801	STATE	92	95	TAS
801	ZIP	97	101	6506
801	DATE	127	136	30/8/2003	2003-08-30
801	TIME	156	175	17/01/2014 at 08:56	2014-01-17T08:56
801	DEPARTMENT	187	227	Tissue Pathology and Diagnostic Oncology
801	HOSPITAL	228	254	ROYAL NORTH SHORE HOSPITAL
801	DOCTOR	258	281	Keith REFUGIO TRUEHEART
801	DOCTOR	2071	2073	LZ
801	DATE	2077	2084	19/3/64	2064-03-19
801	DOCTOR	2115	2122	H Junor
801	DEPARTMENT	2417	2447	SOUTH SURGICAL ASSESSMENT UNIT
801	IDNUM	2468	2475	25-PYGJ
801	IDNUM	2476	2481	25692
801	PATIENT	2482	2491	Herbig, H
801	IDNUM	2492	2501	256923864
801	DOCTOR	2532	2542	H Delauder
801	IDNUM	2543	2551	25P92386
802	IDNUM	14	24	83L944823W
802	MEDICALRECORD	25	36	8349448.FHW
802	PATIENT	38	53	CARABALLO, Liam
802	IDNUM	64	72	83L94482
802	IDNUM	73	81	83L94482
802	STREET	82	89	Nillera
802	CITY	90	100	CONDOBOLIN
802	STATE	102	119	Western Australia
802	ZIP	121	125	3235
802	DATE	157	166	21/9/1984	1984-09-21
802	DEPARTMENT	210	232	3HR STAY SURGICAL UNIT
802	HOSPITAL	235	272	WEST WIMMERA HEALTH SERVICE - RAINBOW
802	DOCTOR	276	298	Norene Mickey MACHALEK
802	DOCTOR	2586	2588	OE
802	DATE	2592	2599	16/1/14	2014-01-16
802	DOCTOR	2629	2637	V Teters
803	IDNUM	13	23	31H064971E
803	MEDICALRECORD	24	34	313064.XUD
803	PATIENT	36	58	BOULTINGHOUSE, STEPHAN
803	IDNUM	69	77	31H06497
803	STREET	78	88	W Burville
803	CITY	89	100	KOO-WEE-RUP
803	ZIP	104	108	3174
803	DATE	134	143	23/3/1988	1988-03-23
803	TIME	163	182	14/01/2014 at 11:33	2014-01-14T11:33
803	DEPARTMENT	194	211	Forensic Medicine
803	HOSPITAL	212	249	ALBURY WODONGA HEALTH - ALBURY CAMPUS
803	DOCTOR	253	272	Monroe Emanuel Bigg
803	DOCTOR	1425	1427	BD
803	DATE	1431	1439	17/32064	2064-03-17
803	DOCTOR	1846	1848	GS
803	DATE	1852	1859	15.3.64	2064-03-15
803	DOCTOR	2414	2416	YC
803	DATE	2420	2428	17/32064	2064-03-17
803	DOCTOR	2461	2469	K Hatman
804	MEDICALRECORD	1	11	529665.UIY
804	PATIENT	12	47	BARNDT, FERMIN LUIGI EFRAIN ROBERTO
804	IDNUM	48	56	52Z66583
804	DATE	72	81	18/3/2064	2064-03-18
804	DOCTOR	1734	1736	BQ
804	DATE	1740	1747	16/3/64	2064-03-16
804	DOCTOR	1778	1787	Y Derting
805	IDNUM	14	24	10V696897Y
805	MEDICALRECORD	25	35	108696.WXT
805	PATIENT	37	54	Hourihan, Numbers
805	IDNUM	65	73	10V69689
805	STREET	74	82	Comptons
805	CITY	83	91	THE OAKS
805	ZIP	95	99	1004
805	DATE	124	133	11/7/2001	2001-07-11
805	DATE	153	162	12/3/2064	2064-03-12
805	DEPARTMENT	179	183	IMVS
805	HOSPITAL	184	203	BRIDGETOWN HOSPITAL
805	DOCTOR	207	227	COLBY Irving ARMIJOS
805	DOCTOR	281	288	RANDALL
805	DOCTOR	547	549	CQ
805	DOCTOR	665	676	D Lengacher
805	TIME	680	713	10:40 on the 10th of January 2014	2014-01-10T10:40
805	DOCTOR	1792	1794	WA
805	DATE	1798	1805	15.3.64	2064-03-15
805	DOCTOR	1835	1844	D Ruebush
805	ORGANIZATION	2759	2777	Target Corporation
805	HOSPITAL	2779	2793	DERBY HOSPITAL
806	IDNUM	13	23	68R617945H
806	MEDICALRECORD	24	35	6866179.MPH
806	PATIENT	37	49	Meals, Cliff
806	IDNUM	60	68	68R61794
806	STREET	69	77	Lancraft
806	CITY	78	88	NARACOORTE
806	STATE	90	105	New South Wales
806	ZIP	105	109	5308
806	DATE	135	144	18/8/1992	1992-08-18
806	TIME	164	183	18/12/2013 at 10:40	2013-12-18T10:40
806	DEPARTMENT	195	212	DICKINSON 2 NORTH
806	HOSPITAL	213	245	TAMWORTH RURAL REFERRAL HOSPITAL
806	DOCTOR	249	272	LESLIE ALONSO Mccammack
806	DOCTOR	1000	1002	MM
806	DOCTOR	1004	1006	MK
806	DATE	1010	1017	21.2.63	2063-02-21
806	DOCTOR	1049	1057	S Nannen
807	IDNUM	13	23	89J318804S
807	MEDICALRECORD	24	35	8933188.BKS
807	PATIENT	37	66	Suchecki, COLLEN Cristin NEDA
807	IDNUM	77	85	89J31880
807	STREET	86	97	Bridle Path
807	CITY	98	105	WARWICK
807	STATE	107	122	South Australia
807	ZIP	124	128	4694
807	DATE	154	163	27/7/2033	2033-07-27
807	TIME	183	202	12/04/2012 at 14:22	2012-04-12T14:22
807	DEPARTMENT	214	224	St Vincent
807	HOSPITAL	225	257	TUMBARUMBA MULTI PURPOSE SERVICE
807	DOCTOR	261	284	NOLAN Thaddeus PAULSETH
807	DATE	603	607	2062	2062
807	DOCTOR	2414	2416	EO
807	DATE	2420	2427	14.6.62	2062-06-14
807	DOCTOR	2458	2468	X Petretti
807	DOCTOR	3160	3172	LOU ARENSTAM
808	IDNUM	14	24	47F338862B
808	MEDICALRECORD	25	35	472338.WQG
808	PATIENT	37	54	Selvig, Antonette
808	IDNUM	64	72	47F33886
808	STREET	73	80	Rowhook
808	CITY	81	90	THIRLMERE
808	ZIP	94	98	6229
808	DATE	124	132	3/8/2009	2009-08-03
808	TIME	152	171	03/09/2012 at 09:21	2012-09-03T09:21
808	DEPARTMENT	183	246	Cure For Life Foundation Neuro-oncology Laboratory Adult Cancer
808	HOSPITAL	247	276	TRUNDLE MULTI PURPOSE SERVICE
808	DOCTOR	280	304	JOHNATHON VINCENZO BURGY
808	DOCTOR	486	488	RH
808	DOCTOR	1841	1843	UH
808	DATE	1848	1855	5/11/62	2062-11-05
808	DOCTOR	1892	1903	L Klingaman
809	IDNUM	13	23	68W939710M
809	MEDICALRECORD	24	34	688939.TEB
809	PATIENT	36	47	Niten, BILL
809	IDNUM	58	66	68W93971
809	STREET	67	85	West Linden Church
809	CITY	86	96	KORUMBURRA
809	STATE	98	116	Northern Territory
809	ZIP	118	122	4107
809	DATE	148	157	4/10/1997	1997-04-10
809	TIME	177	196	03/09/2012 at 09:24	2012-09-03T09:24
809	DEPARTMENT	208	222	Pathology West
809	HOSPITAL	223	278	ROBINVALE DISTRICT HEALTH SERVICES - MANANGATANG CAMPUS
809	DOCTOR	282	299	BURTON Duane MOIR
809	DOCTOR	318	325	Penhall
809	DOCTOR	330	337	STEWART
809	DOCTOR	474	476	XU
809	DOCTOR	2103	2105	KP
809	DATE	2110	2117	11.5.62	2062-11-05
809	DOCTOR	2151	2163	Z Bruckmeier
810	IDNUM	14	24	52X370978S
810	MEDICALRECORD	25	36	5293709.UWS
810	PATIENT	38	60	Echavez, JACKLYN AFTON
810	IDNUM	71	79	52X37097
810	IDNUM	80	88	52X37097
810	STREET	89	98	Rodriques
810	CITY	99	108	ULLADULLA
810	STATE	110	120	Queensland
810	ZIP	122	126	5307
810	DATE	161	170	11/5/1991	1991-11-05
810	TIME	190	209	10/09/2012 at 14:16	2012-09-10T14:16
810	DEPARTMENT	221	239	MEDIC/SURGERY WARD
810	HOSPITAL	242	260	BUNDABERG HOSPITAL
810	DOCTOR	264	282	ERIN Minga ZEGARRA
810	DOCTOR	302	307	Somes
810	DOCTOR	475	477	YQ
810	DOCTOR	1970	1972	RP
810	DATE	1976	1984	15.11.62	2062-11-15
810	DOCTOR	2250	2252	RA
810	DATE	2256	2264	13/11/62	2062-11-13
810	DOCTOR	2301	2314	O Kranawetter
810	DOCTOR	4021	4031	O Haarstad
811	MEDICALRECORD	1	12	9426727.XNO
811	PATIENT	13	28	Pasquale, Rusty
811	IDNUM	29	37	94G67278
811	IDNUM	38	46	94G67278
811	DATE	62	71	11/9/2062	2062-11-09
811	DOCTOR	1425	1427	RT
811	DATE	1430	1437	11.7.62	2062-11-07
811	DOCTOR	1470	1482	Y Al-mansour
812	IDNUM	13	23	42C692843X
812	MEDICALRECORD	24	35	4206928.MJX
812	PATIENT	37	53	Celmer, CHER LEE
812	IDNUM	64	72	42C69284
812	STREET	73	87	Fashion Island
812	CITY	88	96	CESSNOCK
812	STATE	98	106	Victoria
812	ZIP	108	112	3835
812	DATE	138	147	16/9/2002	2002-09-16
812	TIME	167	186	05/09/2012 at 19:24	2012-09-05T19:24
812	DEPARTMENT	198	215	Forensic Medicine
812	HOSPITAL	218	255	LOURDES HOSPITAL & COMMUNITY SERVICES
812	DOCTOR	259	275	Efrain Mcdonalds
812	DOCTOR	306	314	Everette
812	DOCTOR	3946	3948	TB
812	DATE	3952	3959	8.11.62	2062-11-08
812	DOCTOR	3992	4001	M Clukies
812	DATE	5146	5153	22/4/64	2064-04-22
813	MEDICALRECORD	2	12	471143.BCD
813	PATIENT	13	26	BLUTO, Golden
813	IDNUM	27	35	47D14300
813	DATE	51	61	13/11/2062	2062-11-13
813	DOCTOR	164	166	NK
813	DOCTOR	1264	1266	HH
813	DATE	1270	1277	8/11/62	2062-11-08
813	DOCTOR	1312	1323	K Burkowski
814	IDNUM	13	23	95Z164169L
814	MEDICALRECORD	24	35	9591641.RYL
814	PATIENT	37	57	CALLES, Xander Randy
814	IDNUM	68	76	95Z16416
814	IDNUM	77	85	95Z16416
814	STREET	86	92	Throne
814	CITY	93	102	INVERLOCH
814	STATE	104	107	TAS
814	ZIP	109	113	3813
814	DATE	148	157	1/11/1994	1994-01-11
814	DATE	174	184	11/12/2062	2062-11-12
814	DEPARTMENT	201	214	CPC Pathology
814	HOSPITAL	217	237	ROYAL PERTH HOSPITAL
814	DOCTOR	241	265	Terrence DERRICK Carrico
814	DATE	337	344	29.4.64	2064-04-29
814	DOCTOR	442	444	GI
814	DOCTOR	2780	2782	SW
814	DATE	2786	2794	13.11.62	2062-11-13
814	DOCTOR	2847	2849	KW
814	DATE	2853	2861	14.11.62	2062-11-14
814	DOCTOR	2894	2903	Z Gaulden
814	DATE	4671	4678	29.4.64	2064-04-29
815	IDNUM	13	23	16Q765027X
815	MEDICALRECORD	24	35	1667650.FUX
815	PATIENT	37	58	BARKETT, HAMISH TWANA
815	IDNUM	69	77	16Q76502
815	STREET	78	92	Warburton Oaks
815	CITY	93	100	STAWELL
815	STATE	102	112	Queensland
815	ZIP	114	118	2607
815	DATE	144	153	23/6/1997	1997-06-23
815	DATE	173	183	12/11/2062	2062-11-12
815	DEPARTMENT	200	207	Med Onc
815	HOSPITAL	208	238	BARADINE MULTI PURPOSE SERVICE
815	DOCTOR	242	261	RORY Aristide Maese
815	DOCTOR	510	512	AR
815	DOCTOR	1325	1334	E Cambria
815	TIME	1338	1355	14.12 on 10.09.12	2012-09-10T14:12
815	DOCTOR	3359	3361	DQ
815	DATE	3365	3373	13.11.62	2062-11-13
815	DOCTOR	3404	3413	E Braziel
816	IDNUM	14	24	74N785076F
816	MEDICALRECORD	25	36	7457850.UPF
816	PATIENT	38	51	Wela, Milovan
816	IDNUM	62	70	74N78507
816	STREET	71	80	Luddenham
816	CITY	81	89	INVERELL
816	STATE	91	94	TAS
816	ZIP	96	100	2401
816	DATE	126	135	11/5/2015	2015-11-05
816	TIME	155	174	12/09/2012 at 09:49	2012-09-12T09:49
816	DEPARTMENT	186	196	Hereditary
816	HOSPITAL	197	214	CORRIGIN HOSPITAL
816	DOCTOR	218	238	Arlie BENTON Pankake
816	DOCTOR	269	276	MITCHEL
816	COUNTRY	375	382	Vietnam
816	DOCTOR	427	429	IJ
816	DOCTOR	854	856	JS
816	DATE	860	868	15.11.62	2062-11-15
816	DOCTOR	901	911	S Spearing
817	IDNUM	13	23	22J806134O
817	MEDICALRECORD	24	35	2238061.JKO
817	PATIENT	37	53	SCHWEIM, Candace
817	IDNUM	64	72	22J80613
817	IDNUM	73	81	22J80613
817	STREET	82	87	Osmer
817	CITY	88	101	CENTRAL COAST
817	STATE	103	111	Victoria
817	ZIP	113	117	4703
817	DATE	152	160	7/1/2000	2000-01-07
817	TIME	180	199	12/09/2012 at 18:10	2012-09-12T18:10
817	DEPARTMENT	211	231	Anatomical Pathology
817	HOSPITAL	234	249	WARREN HOSPITAL
817	DOCTOR	253	272	Tammera Dusty Alway
817	DATE	344	351	4.12.62	2062-12-04
817	DOCTOR	448	450	IX
817	DOCTOR	3858	3860	YO
817	DATE	3864	3872	15.11.62	2062-11-15
817	DOCTOR	3905	3915	G Hermenau
817	DATE	5900	5907	4.12.62	2062-12-04
817	DOCTOR	5912	5919	G Scheu
817	DATE	6004	6012	26.11.62	2062-11-26
818	MEDICALRECORD	1	12	2756887.LCN
818	PATIENT	13	24	KRUL, Brice
818	IDNUM	25	33	27N68874
818	IDNUM	34	42	27N68874
818	DATE	58	68	16/11/2062	2062-11-16
818	DOCTOR	847	854	H Conti
818	DOCTOR	861	870	H Salameh
818	DOCTOR	871	879	H Twardy
818	TIME	883	899	9.30 on 12.09.12	2012-09-12T09:30
818	DOCTOR	2677	2679	VO
818	DATE	2683	2691	15.11.62	2062-11-15
818	DOCTOR	2724	2732	H Notley
819	IDNUM	14	24	85J609709W
819	MEDICALRECORD	25	36	8536097.AYW
819	PATIENT	38	59	NUTTER, Khadijah Iona
819	IDNUM	70	78	85J60970
819	STREET	79	88	Leechpool
819	CITY	89	102	ALICE SPRINGS
819	STATE	104	107	TAS
819	ZIP	109	113	2902
819	DATE	139	148	21/3/1997	1997-03-21
819	TIME	168	187	14/09/2012 at 18:41	2012-09-14T18:41
819	DEPARTMENT	199	212	SEALS central
819	HOSPITAL	213	232	WOLLONGONG HOSPITAL
819	DOCTOR	236	256	Freeman Myles Potvin
819	DOCTOR	501	503	QS
819	DOCTOR	2270	2272	KU
819	DATE	2276	2284	19/11/62	2062-11-19
819	DOCTOR	2317	2325	W Bailey
820	IDNUM	13	23	43F730867E
820	MEDICALRECORD	24	35	4327308.PTE
820	PATIENT	37	46	MEDI, RAY
820	IDNUM	57	65	43F73086
820	STREET	66	70	Raub
820	CITY	71	76	TUMUT
820	STATE	78	80	SA
820	ZIP	82	86	5332
820	DATE	112	121	10/5/1996	1996-05-10
820	TIME	141	160	18/09/2012 at 13:14	2012-09-18T13:14
820	DEPARTMENT	172	189	DICKINSON 3 SOUTH
820	HOSPITAL	190	225	WAGGA WAGGA RURAL REFERRAL HOSPITAL
820	DOCTOR	229	255	Jeffery AUGUSTINE Dismukes
820	DATE	304	311	4.12.62	2062-12-04
820	DOCTOR	455	457	QI
820	DOCTOR	1592	1594	LO
820	DATE	1598	1606	21.11.62	2062-11-21
820	DOCTOR	1637	1644	K Kiesz
820	DOCTOR	2110	2118	K Raczka
820	DATE	2923	2930	4.12.62	2062-12-04
820	DATE	2977	2980	now	2062-11-27
820	DATE	3044	3052	previous	2064-05-27
821	MEDICALRECORD	2	12	648320.TEO
821	PATIENT	13	26	Gregoire, SAM
821	IDNUM	27	35	64W32071
821	DATE	51	59	5/8/2064	2064-05-08
821	DATE	118	126	5.8.2064	2064-05-08
821	DOCTOR	1872	1874	CO
821	DATE	1878	1885	19/3/64	2064-03-19
821	DOCTOR	1916	1929	Y Jasionowski
821	DEPARTMENT	2224	2237	MACQUARIEWARD
821	IDNUM	2258	2271	90-BTNC 91552
821	DOCTOR	2272	2279	Suga, Y
821	IDNUM	2280	2289	900750915
821	DOCTOR	2319	2328	Y Halonen
821	IDNUM	2329	2337	90B75091
821	DATE	3602	3610	5.8.2064	2064-05-08
821	HOSPITAL	3625	3673	AUSTIN HEALTH - HEIDELBERG REPATRIATION HOSPITAL
821	DOCTOR	3700	3712	Basham, Hugh
821	DATE	3713	3721	5.6.2064	2064-05-06
821	HOSPITAL	3749	3775	HILLSTON DISTRICT HOSPITAL
821	CITY	3785	3796	KIAMA DOWNS
821	IDNUM	3816	3824	90B75091
822	IDNUM	13	23	11T351773Y
822	MEDICALRECORD	24	35	1173517.TKY
822	PATIENT	37	52	LASATER, SHONNA
822	IDNUM	63	71	11T35177
822	STREET	72	79	Periton
822	CITY	80	89	REDCLIFFE
822	STATE	91	93	WA
822	ZIP	95	99	1160
822	DATE	124	133	15/6/1986	1986-06-15
822	TIME	153	172	04/03/2014 at 16:23	2014-03-04T16:23
822	DEPARTMENT	184	189	Orana
822	HOSPITAL	192	225	CRANBOURNE INTEGRATED CARE CENTRE
822	DOCTOR	229	253	JINGALU GASTON Marasigan
822	DOCTOR	1434	1436	LV
822	DOCTOR	1437	1439	XU
822	DATE	1443	1449	7.5.64	2064-05-07
822	DOCTOR	1481	1489	E Grossi
823	MEDICALRECORD	1	12	8511911.UJT
823	PATIENT	13	39	Tidrington, Helga MIREILLE
823	IDNUM	40	48	85C19117
823	IDNUM	49	57	85C19117
823	DATE	73	81	5/9/2064	2064-05-09
823	DOCTOR	1472	1474	XE
823	DOCTOR	1475	1477	HX
823	DATE	1481	1487	5.7.64	2064-05-07
823	DOCTOR	1517	1526	S Luchini
826	IDNUM	14	24	90G9737807
826	MEDICALRECORD	25	36	9029737.WBS
826	PATIENT	38	52	Giffith, Penni
826	IDNUM	63	71	90G97378
826	STREET	72	78	Yalkin
826	CITY	79	93	LAKES ENTRANCE
826	STATE	95	103	Victoria
826	ZIP	105	109	5033
826	DATE	135	145	11/10/2000	2000-11-10
826	TIME	165	184	06/02/2014 at 13:30	2014-02-06T13:30
826	DEPARTMENT	196	210	ACUTECARE WARD
826	HOSPITAL	211	251	MONASH MEDICAL CENTRE - MOORABBIN CAMPUS
826	DOCTOR	256	281	Williams AIDEN Luczkowiak
826	DOCTOR	5579	5581	EA
826	DOCTOR	5601	5608	X Chism
826	DATE	9919	9926	13/4/64	2064-04-13
826	ORGANIZATION	9986	10006	Wachovia Corporation
826	HOSPITAL	10007	10025	KALAMUNDA HOSPITAL
826	DATE	10857	10863	5/6/64	2064-06-05
827	IDNUM	13	23	48C094848A
827	MEDICALRECORD	24	35	4810948.LWA
827	PATIENT	37	53	LINTHICUM, TEDDY
827	IDNUM	64	72	48C09484
827	STREET	73	87	Lower Bedfords
827	CITY	88	94	INGHAM
827	STATE	96	99	QLD
827	ZIP	101	105	3289
827	DATE	131	140	11/9/2000	2000-09-11
827	TIME	160	179	23/01/2014 at 11:30	2014-01-23T11:30
827	DEPARTMENT	191	202	UROLOGY OPD
827	HOSPITAL	203	219	BUNBURY HOSPITAL
827	DOCTOR	224	236	KIETH HACKEN
827	DOCTOR	3051	3053	FX
827	DOCTOR	3074	3083	L. Nedeau
827	DATE	5368	5374	3/3/64	2064-03-03
828	IDNUM	13	23	12M8331588
828	MEDICALRECORD	24	35	1248331.NVV
828	PATIENT	37	51	Resendes, Paul
828	IDNUM	62	70	12M83315
828	STREET	71	85	Southern Night
828	CITY	86	97	GEORGE TOWN
828	STATE	99	102	VIC
828	ZIP	104	108	3448
828	DATE	134	143	30/3/1989	1989-03-30
828	TIME	163	182	30/01/2014 at 14:00	2014-01-30T14:00
828	DEPARTMENT	194	209	Envoi Pathology
828	HOSPITAL	210	233	COBAR DISTRICT HOSPITAL
828	DOCTOR	238	265	CHRISTOPHER DELMAR Stremcha
828	DOCTOR	2777	2779	NM
828	DOCTOR	2800	2809	E. Cessor
828	DATE	5335	5341	5/4/64	2064-04-05
829	IDNUM	14	24	27Q615755U
829	MEDICALRECORD	25	36	2766157.PNU
829	PATIENT	38	49	STYERS, Del
829	IDNUM	60	68	27Q61575
829	STREET	69	75	Blease
829	CITY	76	84	NARROGIN
829	STATE	86	89	VIC
829	ZIP	91	95	3758
829	DATE	121	129	9/2/2012	2012-02-09
829	TIME	149	168	21/01/2014 at 10:24	2014-01-21T10:24
829	DEPARTMENT	180	203	POW L7 CONSULTING ROOMS
829	HOSPITAL	204	233	MERRIWA MULTI PURPOSE SERVICE
829	DOCTOR	238	262	JACINTO Emerson DELGENIO
829	DOCTOR	639	646	F Sacks
829	DATE	647	654	23.3.64	2064-03-23
829	DOCTOR	1936	1946	F Bigusiak
829	DATE	3280	3287	26/3/64	2064-03-26
830	IDNUM	13	23	75M7368131
830	MEDICALRECORD	24	35	7547368.EID
830	PATIENT	37	51	STABS, Marylou
830	IDNUM	62	70	75M73681
830	STREET	71	79	Blackmar
830	CITY	80	92	SUFFOLK PARK
830	STATE	94	109	South Australia
830	ZIP	111	115	4374
830	DATE	141	150	28/3/2024	2024-03-28
830	TIME	170	189	19/12/2013 at 18:00	2013-12-19T18:00
830	DEPARTMENT	201	219	INTENSIVECARE UNIT
830	HOSPITAL	220	238	GERALDTON HOSPITAL
830	DOCTOR	242	267	Marion HASSIE Mroczkowski
830	DOCTOR	3969	3971	DP
830	DOCTOR	3992	3999	T. Lule
830	DATE	6629	6636	26/2/63	2063-02-26
831	IDNUM	13	23	49W586122Y
831	MEDICALRECORD	24	35	4985861.FHY
831	PATIENT	37	53	Picciano, Nestor
831	IDNUM	64	72	49W58612
831	STREET	73	81	Bouterse
831	CITY	82	88	NERANG
831	STATE	90	92	SA
831	ZIP	94	98	2229
831	DATE	124	133	26/2/2031	2031-02-26
831	TIME	153	172	17/12/2013 at 12:10	2013-12-17T12:10
831	DEPARTMENT	184	201	DICKINSON 2 NORTH
831	HOSPITAL	202	224	KARRATHA HEALTH CAMPUS
831	DOCTOR	229	245	Dwain GAIL Hasse
831	DOCTOR	2356	2358	VH
831	DATE	4333	4341	previous	2064-05-27
831	DATE	4362	4372	19/12/2060	2060-12-19
831	DATE	5226	5233	25/2/63	2063-02-25
831	DOCTOR	5235	5246	M Mcgilvray
832	MEDICALRECORD	2	13	5403687.HZX
832	PATIENT	14	31	Drouillard, DEVON
832	IDNUM	32	40	54A36872
832	DATE	56	65	19/2/2063	2063-02-19
832	DOCTOR	1611	1613	YV
832	DOCTOR	1637	1646	N. Aiello
832	DATE	2679	2686	15/2/63	2063-02-15
833	IDNUM	13	23	02W388887F
833	MEDICALRECORD	24	35	0283888.WUF
833	PATIENT	37	50	RINDONE, ELMO
833	IDNUM	61	69	02W38888
833	STREET	70	78	Mishawum
833	CITY	79	92	ENCOUNTER BAY
833	STATE	94	109	South Australia
833	ZIP	111	115	1314
833	DATE	141	149	9/1/2027	2027-01-09
833	TIME	169	188	12/12/2013 at 12:00	2013-12-12T12:00
833	DEPARTMENT	200	211	UROLOGY OPD
833	HOSPITAL	212	238	ST GEORGE'S HEALTH SERVICE
833	DOCTOR	243	264	SCOT VIRGILIO Trodden
833	DOCTOR	1581	1583	CD
833	DOCTOR	1604	1613	B. Elward
833	DATE	3881	3888	19/2/63	2063-02-19
834	IDNUM	13	23	76F2281970
834	MEDICALRECORD	24	35	7622281.XTA
834	PATIENT	37	50	Tedesko, NYLA
834	IDNUM	61	69	76F22819
834	STREET	70	75	Rooke
834	CITY	76	83	BUNBURY
834	STATE	85	87	WA
834	ZIP	89	93	2304
834	DATE	119	128	24/9/2014	2014-09-24
834	TIME	148	167	11/12/2013 at 09:34	2013-12-11T09:34
834	DEPARTMENT	179	192	MACQUARIEWARD
834	HOSPITAL	193	220	LEIGH CREEK HEALTH SERVICES
834	DOCTOR	225	247	KIRK Joesph HIRSCHHORN
834	DOCTOR	534	542	Mcfarlan
834	TIME	574	592	9:28am on 11/12/13	2013-12-11T09:28
834	DOCTOR	600	610	U. Landrey
834	DOCTOR	867	873	Rebold
834	TIME	877	896	10:28am on 11/12/13	2013-12-11T10:28
834	DOCTOR	904	913	U. Adolph
834	DOCTOR	1086	1091	Homme
834	TIME	1095	1114	10:28am on 11/12/13	2013-12-11T10:28
834	DOCTOR	1122	1132	U. Moncier
834	DOCTOR	1331	1337	Vandon
834	TIME	1341	1360	10:28am on 11/12/13	2013-12-11T10:28
834	DOCTOR	1368	1378	U. Wiedman
834	DOCTOR	1555	1559	Ying
834	TIME	1563	1582	10:28am on 11/12/13	2013-12-11T10:28
834	DOCTOR	1590	1600	U. Esqueda
834	DOCTOR	2189	2191	MP
834	DOCTOR	2214	2224	Kai Karman
834	DATE	4757	4766	20/2/2063	2063-02-20
835	IDNUM	14	24	81J0007949
835	MEDICALRECORD	25	36	8130007.ZLZ
835	PATIENT	38	54	Montfort, Olinda
835	IDNUM	65	73	81J00079
835	STREET	74	83	Painswick
835	CITY	84	96	QUAKERS HILL
835	STATE	98	126	Australian Capital Territory
835	ZIP	128	132	4873
835	DATE	158	167	17/7/2009	2009-07-17
835	TIME	187	206	05/12/2013 at 13:17	2013-12-05T13:17
835	DEPARTMENT	218	236	OPERATING THEATRES
835	HOSPITAL	237	284	COOLAMON-GANMAIN MULTI PURPOSE SERVICE HOSPITAL
835	DOCTOR	289	311	Judson MICHAEL SAVILLA
835	DOCTOR	1647	1649	DM
835	DOCTOR	1672	1683	V Gonterman
835	DATE	3294	3301	2/12/63	2063-02-12
835	DATE	3534	3541	18/2/63	2063-02-18
836	IDNUM	13	23	55T840103U
836	MEDICALRECORD	24	35	5578401.BKU
836	PATIENT	37	54	Eischens, ARNOLDO
836	IDNUM	65	73	55T84010
836	STREET	74	83	Levington
836	CITY	84	94	SPRINGWOOD
836	STATE	96	111	South Australia
836	ZIP	113	117	2576
836	DATE	143	153	23/12/2036	2036-12-23
836	TIME	173	192	04/12/2013 at 12:00	2013-12-04T12:00
836	DEPARTMENT	204	220	Envoi Specialist
836	HOSPITAL	221	233	LAURA CAMPUS
836	DOCTOR	238	257	Pablo CLARK MALENKE
836	DOCTOR	2673	2675	YC
836	DOCTOR	2699	2713	N Hergenroeder
836	DATE	4144	4151	13/2/63	2063-02-13
837	IDNUM	13	23	02P970162D
837	MEDICALRECORD	24	34	025970.EQF
837	PATIENT	36	53	EBERHART, SHEILAH
837	IDNUM	64	72	02P97016
837	STREET	73	81	Alkoomie
837	CITY	82	101	SAINT GEORGES BASIN
837	ZIP	105	109	2365
837	DATE	135	144	25/9/1999	1999-09-25
837	TIME	164	183	25/06/2013 at 08:59	2013-06-25T08:59
837	DEPARTMENT	195	212	ST GEORGE PRIVATE
837	HOSPITAL	213	245	TERANG & MORTLAKE HEALTH SERVICE
837	DOCTOR	249	270	Derrick Mauro Fedrick
837	DATE	316	323	10/9/63	2063-09-10
837	DOCTOR	2062	2064	DQ
837	DATE	2069	2076	27/8/63	2063-08-27
837	DOCTOR	2109	2119	C Mcdevitt
837	DATE	4121	4128	30/8/63	2063-08-30
837	DATE	4684	4691	10.9.63	2063-09-10
837	HOSPITAL	4713	4737	ROYAL HOSPITAL FOR WOMEN
837	DOCTOR	4773	4781	C Citrin
837	HOSPITAL	4914	4929	NEWMAN HOSPITAL
838	IDNUM	14	24	23G571010O
838	MEDICALRECORD	25	35	232571.BEB
838	PATIENT	37	56	MEZZANOTTE, Pearlie
838	IDNUM	67	75	23G57101
838	STREET	76	83	Winrose
838	CITY	84	94	KORUMBURRA
838	STATE	96	99	VIC
838	ZIP	101	105	3144
838	DATE	131	140	27/5/2036	2036-05-27
838	TIME	160	179	09/07/2013 at 12:19	2013-07-09T12:19
838	DEPARTMENT	191	208	DICKINSON 3 NORTH
838	HOSPITAL	209	227	PETER JAMES CENTRE
838	DOCTOR	231	256	Alonso Robt Adan-NEYMEYER
838	DATE	325	332	18/9/63	2063-09-18
838	DOCTOR	1903	1905	KF
838	DOCTOR	1907	1909	TQ
838	DATE	1913	1920	12.9.63	2063-09-12
838	DOCTOR	1951	1959	D Tinkle
838	DATE	3518	3525	18/9/63	2063-09-18
838	DATE	3692	3699	24.9.63	2063-09-24
838	HOSPITAL	3721	3759	EAST WIMMERA HEALTH SERVICE - CHARLTON
838	DOCTOR	3794	3803	D Goolden
839	IDNUM	13	23	81D592178W
839	MEDICALRECORD	24	35	8115921.TWW
839	PATIENT	37	61	Steinberg, Katheryn Mora
839	IDNUM	72	80	81D59217
839	STREET	81	95	Lower Bedfords
839	CITY	96	102	GOOLWA
839	STATE	104	106	WA
839	ZIP	108	112	2047
839	DATE	138	147	16/4/2022	2022-04-16
839	TIME	167	186	05/10/2012 at 14:57	2012-10-05T14:57
839	DEPARTMENT	198	209	UROLOGY OPD
839	HOSPITAL	210	233	TUMUT DISTRICT HOSPITAL
839	DOCTOR	237	258	Jeremiah ELMO FINSTAD
839	DOCTOR	289	296	Brittle
839	DOCTOR	501	503	MP
839	DOCTOR	2270	2272	HF
839	DATE	2276	2284	12.10.62	2062-12-10
839	DOCTOR	2321	2329	V Sultan
839	DATE	5007	5015	18.10.63	2063-10-18
839	DEPARTMENT	5060	5075	DAYSURGERY UNIT
839	IDNUM	5946	5957	81D59217.W8
839	DEPARTMENT	6010	6026	Envoi Specialist
839	DOCTOR	6062	6069	Stewart
839	DOCTOR	6077	6087	V Papelian
839	HOSPITAL	6089	6113	NAMBOUR GENERAL HOSPITAL
840	IDNUM	14	24	39Z513136F
840	MEDICALRECORD	25	35	399513.EIR
840	PATIENT	37	52	KRALIK, Claudio
840	IDNUM	63	71	39Z51313
840	STREET	72	80	Mcdewell
840	CITY	81	89	HAHNDORF
840	STATE	91	109	Northern Territory
840	ZIP	111	115	6628
840	DATE	141	150	13/2/2007	2007-02-13
840	TIME	170	189	19/09/2012 at 13:56	2012-09-19T13:56
840	DEPARTMENT	201	220	Douglass Hanly Moir
840	HOSPITAL	221	248	ST HELENS DISTRICT HOSPITAL
840	DOCTOR	252	271	MILES Jeremiah DROZ
840	DATE	320	327	17.1.62	2062-01-17
840	DATE	354	362	28.12.62	2062-12-28
840	DOCTOR	486	488	KD
840	DOCTOR	1370	1372	TZ
840	DATE	1376	1384	22.11.62	2062-11-22
840	DOCTOR	1415	1424	K Robbins
840	DOCTOR	3430	3438	K Magnan
840	DEPARTMENT	3440	3458	OPERATING THEATRES
840	DATE	3679	3687	21.12.62	2062-12-21
840	DOCTOR	3721	3733	FAUSTO Kedra
840	DEPARTMENT	3735	3745	Anatomical
840	DEPARTMENT	4629	4654	INTENSIVE CARE UNIT SOUTH
840	ORGANIZATION	4725	4737	Devon Energy
840	DEPARTMENT	4749	4762	PATHOLOGYWEST
840	DOCTOR	5003	5010	Jamison
840	DATE	5978	5982	2061	2061
840	DOCTOR	6415	6423	Violette
840	DATE	6543	6556	December 2061	2061-12
840	DATE	6674	6682	28.12.62	2062-12-28
840	DOCTOR	6718	6726	K Tuffey
840	HOSPITAL	6728	6752	VICTORIAN HEART HOSPITAL
840	HOSPITAL	6889	6904	GATTON HOSPITAL
840	DOCTOR	6913	6920	K Cokel
840	DOCTOR	6928	6936	K Sobran
840	IDNUM	7071	7082	KZ-95-13136
840	DATE	7355	7362	17.1.62	2062-01-17
840	DEPARTMENT	7392	7408	ONCOLOGY (GYNAE)
840	DOCTOR	7826	7833	K Bruss
841	MEDICALRECORD	1	11	441495.UKJ
841	PATIENT	12	26	MOUNGER, BRYAN
841	IDNUM	27	35	44D49574
841	DATE	51	60	16/7/2063	2063-07-16
841	DOCTOR	746	748	SO
841	DATE	752	759	11.7.63	2063-07-11
841	DOCTOR	790	797	K Sharr
841	IDNUM	1285	1293	44D49574
842	MEDICALRECORD	1	12	1842341.MIZ
842	PATIENT	13	29	Mcgaughan, CYRUS
842	IDNUM	30	38	18M23414
842	DATE	54	64	22/11/2062	2062-11-22
842	DOCTOR	194	196	MO
842	DOCTOR	623	625	YE
842	DATE	629	637	21.11.62	2062-11-21
842	DOCTOR	668	677	D Sumstad
843	MEDICALRECORD	2	13	6632551.BDH
843	PATIENT	14	24	Chor, VINA
843	IDNUM	25	33	66I25510
843	DATE	49	59	29/11/2062	2062-11-29
843	DOCTOR	822	824	LR
843	DATE	828	836	26/11/62	2062-11-26
843	DOCTOR	868	875	R Nelon
844	MEDICALRECORD	1	11	714037.UDV
844	PATIENT	12	28	Mimms, SATURNINA
844	IDNUM	29	37	71M03771
844	IDNUM	38	46	71M03771
844	DATE	62	72	29/11/2062	2062-11-29
844	DATE	132	136	2056	2056
844	DOCTOR	260	262	IU
844	DOCTOR	571	577	Ramjan
844	DOCTOR	584	593	S Schmunk
844	TIME	597	615	16:20pm on 21.9.12	2012-09-21T16:20
844	DOCTOR	777	779	JS
844	DATE	783	791	26.11.62	2062-11-26
844	DOCTOR	825	836	S Schmucker
845	IDNUM	13	23	29J158876P
845	MEDICALRECORD	24	35	2931588.SQP
845	PATIENT	37	57	Salmans, Trent VONDA
845	IDNUM	66	74	29J15887
845	STREET	75	81	Antrim
845	CITY	82	90	SEA LAKE
845	STATE	92	107	New South Wales
845	ZIP	109	113	2204
845	DATE	139	148	20/9/2013	2013-09-20
845	TIME	168	187	24/09/2012 at 19:59	2012-09-24T19:59
845	DEPARTMENT	199	217	MEDIC/SURGERY WARD
845	DOCTOR	221	242	ROYAL WILBUR Entrikin
845	DOCTOR	1639	1641	KR
845	DATE	1645	1653	27.11.62	2062-11-27
845	DOCTOR	1684	1693	H Behanna
846	IDNUM	14	24	87F179924Y
846	MEDICALRECORD	25	36	8721799.HLY
846	PATIENT	38	52	PLAINY, KAREEN
846	IDNUM	63	71	87F17992
846	STREET	72	79	Storrie
846	CITY	80	86	BOWRAL
846	STATE	88	105	Western Australia
846	ZIP	107	111	4163
846	DATE	137	145	8/5/1988	1988-08-05
846	DATE	165	175	26/11/2062	2062-11-26
846	DEPARTMENT	192	263	MOLECULAR AND CLINICAL GENETICS/ TISSUE PATHOLOGY & DIAGNOSTIC ONCOLOGY
846	HOSPITAL	264	280	GOSFORD HOSPITAL
846	DOCTOR	284	307	DONNY Columbus Paustian
846	DOCTOR	1852	1854	YC
846	DATE	1858	1866	27.11.62	2062-11-27
846	DOCTOR	1897	1909	V Rajaratnam
847	IDNUM	13	23	08W779782J
847	MEDICALRECORD	24	35	0887797.VHJ
847	PATIENT	37	51	Morgia, Karrak
847	IDNUM	62	70	08W77978
847	IDNUM	71	79	08W77978
847	STREET	80	89	Bass Lake
847	CITY	90	99	BELLINGEN
847	STATE	101	103	NT
847	ZIP	105	109	3563
847	DATE	144	153	19/3/1990	1990-03-19
847	TIME	173	192	25/09/2012 at 16:47	2012-09-25T16:47
847	DEPARTMENT	204	222	Molecular Oncology
847	HOSPITAL	225	242	KONDININ HOSPITAL
847	DOCTOR	246	267	VANITA LAREE Mcgready
847	DOCTOR	388	390	PT
847	DOCTOR	2666	2668	ZK
847	DATE	2672	2680	29.11.62	2062-11-29
847	DOCTOR	2711	2719	A Joines
848	MEDICALRECORD	1	11	567700.WKC
848	PATIENT	12	27	HEINIGER, GRANT
848	IDNUM	28	36	56S70084
848	DATE	52	59	/4/2062	2062-04
848	DOCTOR	1525	1527	IU
848	DATE	1531	1539	29/11/62	2062-11-29
848	DOCTOR	1573	1580	P Neddo
849	IDNUM	14	24	20C640140M
849	MEDICALRECORD	25	36	2006401.MBM
849	PATIENT	38	56	ASMAN, TARKA SHAWN
849	IDNUM	67	75	20C64014
849	STREET	76	85	Ravenhill
849	CITY	86	95	GLADSTONE
849	STATE	97	107	Queensland
849	ZIP	109	113	2793
849	DATE	139	148	20/2/1999	1999-02-20
849	DEPARTMENT	192	209	MEDIC/SURGERYWARD
849	HOSPITAL	210	252	GOULBURN VALLEY HEALTH - SHEPPARTON CAMPUS
849	DOCTOR	256	279	Malcolm JEROLD Gochnour
849	DOCTOR	636	638	JM
849	DOCTOR	2249	2251	KZ
849	DATE	2255	2263	30.11.62	2062-11-30
849	DOCTOR	2297	2306	D Balcomb
849	DATE	4080	4088	previous	2064-05-27
849	DATE	4104	4108	2059	2059
849	DOCTOR	5864	5869	D Kun
850	IDNUM	13	23	35G422857L
850	MEDICALRECORD	24	35	3524228.OTL
850	PATIENT	37	50	URSERY, Irvin
850	IDNUM	61	69	35G42285
850	STREET	70	75	Rance
850	CITY	76	91	GREENWELL POINT
850	STATE	93	95	SA
850	ZIP	97	101	3956
850	DATE	127	136	27/4/1981	1981-04-27
850	TIME	156	175	03/10/2012 at 09:52	2012-10-03T09:52
850	DEPARTMENT	187	197	Immunology
850	HOSPITAL	198	216	LONGREACH HOSPITAL
850	DOCTOR	220	237	CLAUD Eli LAGUIRE
850	DOCTOR	429	431	XU
850	DOCTOR	2401	2403	KP
850	DATE	2406	2413	5/12/62	2062-12-05
850	DOCTOR	2444	2453	I Hodgdon
851	IDNUM	14	24	82C443815U
851	IDNUM	25	36	8204438.DOU
851	PATIENT	38	51	POLKA, SHARYN
851	MEDICALRECORD	62	70	82C44381
851	IDNUM	71	79	82C44381
851	STREET	80	86	Lovers
851	CITY	87	96	DEVONPORT
851	STATE	98	106	Victoria
851	ZIP	108	112	3377
851	DATE	147	155	3/3/1995	1995-03-03
851	DEPARTMENT	199	216	DICKINSON 3 NORTH
851	HOSPITAL	219	235	WHYALLA HOSPITAL
851	DOCTOR	239	260	Lynell TOMIKA SADVARY
851	DATE	332	340	12.11.63	2063-12-11
851	DOCTOR	2076	2078	LV
851	DOCTOR	2079	2081	PZ
851	DATE	2085	2092	15.1.62	2062-01-15
851	DOCTOR	2128	2137	W Kaldahl
851	DATE	3933	3941	12.11.63	2063-12-11
852	IDNUM	13	23	66M382115P
852	MEDICALRECORD	24	35	6643821.ENP
852	PATIENT	37	59	STOYER, Cristy Ardelia
852	IDNUM	70	78	66M38211
852	IDNUM	79	87	66M38211
852	STREET	88	93	Escot
852	CITY	94	100	PICTON
852	STATE	102	110	Tasmania
852	ZIP	112	116	3717
852	DATE	151	160	17/6/2001	2001-06-17
852	TIME	180	199	08/10/2012 at 16:16	2012-10-08T16:16
852	DEPARTMENT	211	220	EMERGENCY
852	HOSPITAL	223	243	HEYWOOD RURAL HEALTH
852	DOCTOR	247	262	Eldridge SCHMAL
852	DOCTOR	2469	2471	IQ
852	DATE	2475	2483	12/10/62	2062-12-10
852	DOCTOR	2516	2525	P Parnell
853	IDNUM	13	23	61Q164822O
853	MEDICALRECORD	24	35	6161648.GFO
853	PATIENT	37	48	Guay, LUCIE
853	IDNUM	59	67	61Q16482
853	STREET	68	77	W Goodman
853	CITY	78	83	COLAC
853	STATE	85	95	Queensland
853	ZIP	97	101	6509
853	DATE	127	136	12/3/2000	2000-12-03
853	TIME	156	175	04/10/2012 at 20:01	2012-10-04T20:01
853	DEPARTMENT	187	205	Douglas Hanly Moir
853	HOSPITAL	206	225	MOUNT ISA  HOSPITAL
853	DOCTOR	229	254	Isidro LOU Kerry-Herriges
853	DOCTOR	540	542	FC
853	DOCTOR	1840	1842	DS
853	DATE	1847	1854	12.7.62	2062-12-07
853	DOCTOR	1889	1898	Q Wraight
853	DATE	4375	4383	19.12.62	2062-12-19
853	HOSPITAL	4569	4616	BARWON HEALTH - SOUTH GEELONG RENAL UNIT CAMPUS
853	DOCTOR	5098	5114	MILTON Holsapple
853	DATE	5116	5124	18.12.62	2062-12-18
854	IDNUM	14	24	35Z914131J
854	MEDICALRECORD	25	36	3599141.IEJ
854	PATIENT	38	57	Bohn, VIATRIX ESTER
854	IDNUM	68	76	35Z91413
854	STREET	77	83	Widdin
854	CITY	84	92	QUIRINDI
854	STATE	94	96	NT
854	ZIP	98	102	0834
854	DATE	128	137	24/7/2013	2013-07-24
854	TIME	157	176	04/10/2012 at 04:30	2012-10-04T04:30
854	DEPARTMENT	188	192	West
854	HOSPITAL	195	218	COBAR DISTRICT HOSPITAL
854	DOCTOR	222	251	PETE MILLARD DEAN-Messersmith
854	DOCTOR	487	489	CG
854	DATE	1808	1815	7/12/62	2062-12-07
854	DOCTOR	1846	1859	J Stolzenberg
854	DATE	4466	4474	19.12.62	2062-12-19
854	HOSPITAL	4511	4536	FITZROY CROSSING HOSPITAL
854	DOCTOR	5008	5022	King Carbonara
854	DATE	5024	5034	18.12.2062	2062-12-18
855	IDNUM	13	23	93V935289R
855	MEDICALRECORD	24	35	9389352.XZR
855	PATIENT	37	52	ZICARI, Luciana
855	IDNUM	63	71	93V93528
855	STREET	72	82	Birkenhead
855	CITY	83	93	ANDERGROVE
855	STATE	95	123	Australian Capital Territory
855	ZIP	125	129	5493
855	DATE	155	163	9/3/2010	2010-09-03
855	TIME	183	202	04/10/2012 at 15:44	2012-10-04T15:44
855	DEPARTMENT	214	222	Pathwest
855	HOSPITAL	223	257	BAIRNSDALE REGIONAL HEALTH SERVICE
855	DOCTOR	261	282	TERRY Orville PADMORE
855	DOCTOR	477	479	JG
855	DOCTOR	1750	1752	HO
855	DATE	1756	1763	12/7/62	2062-12-07
855	DOCTOR	1794	1803	X Turnbow
856	IDNUM	13	23	04N636048C
856	MEDICALRECORD	24	35	0456360.LVC
856	PATIENT	37	52	TIPLER, Orville
856	IDNUM	63	71	04N63604
856	STREET	72	82	Haselrigge
856	CITY	83	90	HADSPEN
856	STATE	92	95	ACT
856	ZIP	97	101	1490
856	DATE	127	136	15/1/1990	1990-01-15
856	DEPARTMENT	180	192	RENAL CLINIC
856	HOSPITAL	193	210	GOODOOGA HOSPITAL
856	DOCTOR	214	237	KOREY Leopoldo Rollings
856	DOCTOR	2077	2079	KR
856	DOCTOR	2080	2082	RY
856	DATE	2086	2094	20/12/62	2062-12-20
856	DOCTOR	2127	2137	Y Eckerman
857	IDNUM	14	24	62J656106L
857	MEDICALRECORD	25	35	623656.EAQ
857	PATIENT	37	58	BUELER, Ching WENDELL
857	IDNUM	69	77	62J65610
857	STREET	78	87	Brookfall
857	CITY	88	97	SINGLETON
857	ZIP	101	105	4550
857	DATE	131	140	18/9/1994	1994-09-18
857	TIME	160	179	22/10/2012 at 09:37	2012-10-22T09:37
857	DEPARTMENT	191	201	OBSTETRICS
857	HOSPITAL	202	242	BALLARAT HEALTH SERVICES (BASE HOSPITAL)
857	DOCTOR	246	269	Tjingali Deshawn Takeda
857	DOCTOR	300	304	Ames
857	DOCTOR	309	314	Meury
857	DATE	1367	1375	24.12.62	2062-12-24
857	DOCTOR	1406	1416	Q Sorenson
858	IDNUM	13	23	20F677264U
858	MEDICALRECORD	24	34	202677.FPL
858	PATIENT	36	52	WENSKOSKI, DAVIS
858	IDNUM	63	71	20F67726
858	STREET	72	86	Captain Dement
858	CITY	87	95	QUIRINDI
858	STATE	97	125	Australian Capital Territory
858	ZIP	127	131	2844
858	DATE	157	166	13/5/2005	2005-05-13
858	DEPARTMENT	210	215	Envoi
858	HOSPITAL	216	246	BARADINE MULTI PURPOSE SERVICE
858	DOCTOR	250	272	ANTONIA JESUS Clementi
858	DOCTOR	1836	1838	IO
858	DATE	1842	1850	25.12.62	2062-12-25
858	DOCTOR	1881	1891	F Groetsch
859	IDNUM	13	23	41W278112F
859	MEDICALRECORD	24	35	4182781.EHF
859	PATIENT	37	54	Keitsock, Cedrick
859	IDNUM	65	73	41W27811
859	STREET	74	81	Raccoon
859	CITY	82	94	BEACONSFIELD
859	STATE	96	113	Western Australia
859	ZIP	115	119	3165
859	DATE	145	153	2/1/2024	2024-01-02
859	DEPARTMENT	197	219	PRINCE OF WALESPRIVATE
859	HOSPITAL	220	236	BONALBO HOSPITAL
859	DOCTOR	240	266	HOLLIS JORGE JULIO-Eldreth
859	DATE	338	344	4.1.62	2062-01-04
859	DOCTOR	761	779	JINGALU-Oberholzer
859	DOCTOR	786	796	K Pechacek
859	TIME	800	816	17.05 o 18.10.12	2012-10-18T17:05
859	DOCTOR	2403	2405	UL
859	DOCTOR	2407	2409	JJ
859	DATE	2413	2421	21.12.62	2062-12-21
859	DOCTOR	2452	2459	K Danby
859	DATE	4997	5003	4.1.62	2062-01-04
859	DOCTOR	5130	5139	K Marungo
860	IDNUM	13	23	99T399171N
860	MEDICALRECORD	24	34	997399.ETC
860	PATIENT	36	49	Armson, Viara
860	IDNUM	60	68	99T39917
860	STREET	69	74	Weant
860	CITY	75	83	URRAWEEN
860	STATE	85	100	New South Wales
860	ZIP	102	106	3763
860	DATE	132	142	27/11/1982	1982-11-27
860	TIME	162	181	17/10/2012 at 20:55	2012-10-17T20:55
860	HOSPITAL	193	222	MERRIWA MULTI PURPOSE SERVICE
860	DOCTOR	226	249	BENJAMIN Normand LEITAO
860	DOCTOR	1431	1433	YQ
860	DATE	1437	1445	21.12.62	2062-12-21
860	DOCTOR	1478	1488	Y Vallance
861	IDNUM	13	23	10K990029Z
861	MEDICALRECORD	24	34	104990.BHY
861	PATIENT	36	50	Paone, Kendall
861	IDNUM	61	69	10K99002
861	STREET	70	81	Sunny Hills
861	CITY	82	93	NEW NORFOLK
861	STATE	95	98	VIC
861	ZIP	100	104	3399
861	DATE	130	138	5/1/1994	1994-01-05
861	TIME	158	177	24/10/2012 at 16:43	2012-10-24T16:43
861	DEPARTMENT	189	208	L7 CONSULTING ROOMS
861	HOSPITAL	209	246	BIGGENDEN MULTIPURPOSE HEALTH SERVICE
861	DOCTOR	250	271	Edgardo ISAIAH JASMIN
861	DOCTOR	1362	1364	OA
861	DATE	1368	1376	27/12/62	2062-12-27
861	DOCTOR	1918	1920	BN
861	DATE	1924	1932	27.12.62	2062-12-27
861	DOCTOR	1963	1971	D Steier
861	DOCTOR	3439	3454	Gerald SPANICEK
861	HOSPITAL	3458	3477	PROSERPINE HOSPITAL
861	DATE	3907	3916	28/1/2062	2062-01-28
861	DOCTOR	3936	3948	Stefan OTANO
861	HOSPITAL	3950	3976	WEE WAA COMMUNITY HOSPITAL
862	IDNUM	14	24	78G910187H
862	MEDICALRECORD	25	36	7829101.WTH
862	PATIENT	38	51	TAMAYO, DONTE
862	IDNUM	62	70	78G91018
862	STREET	71	81	Creek Tree
862	CITY	82	90	GUNNEDAH
862	STATE	92	107	New South Wales
862	ZIP	109	113	7215
862	DATE	139	148	22/7/2004	2004-07-22
862	DATE	168	178	25/12/2062	2062-12-25
862	DEPARTMENT	195	212	ST GEORGE PRIVATE
862	HOSPITAL	213	229	AUGUSTA HOSPITAL
862	DOCTOR	233	251	COLTON Stacey Sais
862	AGE	288	290	63
862	DOCTOR	778	788	S Chavarin
862	TIME	792	811	11:50am on 23.10.12	2012-10-23T11:50
862	DATE	2093	2102	27/122062	2062-12-27
862	DATE	2562	2570	26.12.62	2062-12-26
862	DATE	3119	3127	27.12.62	2062-12-27
862	DOCTOR	3158	3170	S Allegretti
863	IDNUM	13	23	25C941145Q
863	MEDICALRECORD	24	34	251941.ELO
863	PATIENT	36	58	TOURVILLE, Maisha Nick
863	IDNUM	69	77	25C94114
863	IDNUM	78	86	25C94114
863	STREET	87	97	Rock Coast
863	CITY	98	108	HERVEY BAY
863	STATE	110	112	NT
863	ZIP	114	118	3617
863	DATE	153	162	18/3/2015	2015-03-18
863	TIME	182	201	26/10/2012 at 20:12	2012-10-26T20:12
863	DEPARTMENT	213	230	DICKINSON 2 SOUTH
863	DOCTOR	234	257	SANTIAGO LUCIUS Mudgett
863	DOCTOR	276	286	Ochakovsky
863	DOCTOR	303	308	Tupaj
863	DOCTOR	1793	1795	VN
863	DATE	1800	1807	1.12.62	2062-12-01
863	DOCTOR	1838	1845	G Bugna
864	IDNUM	13	23	46U642004B
864	MEDICALRECORD	24	35	4676420.AKB
864	PATIENT	37	62	Colondres, EUMARRAH Aidan
864	IDNUM	73	81	46U64200
864	STREET	82	95	East Highland
864	CITY	96	103	STAWELL
864	STATE	105	108	TAS
864	ZIP	110	114	5158
864	DATE	140	149	7/11/1989	1989-11-07
864	TIME	169	188	30/10/2012 at 12:32	2012-10-30T12:32
864	DEPARTMENT	200	205	North
864	HOSPITAL	206	241	WEST WIMMERA HEALTH SERVICE - NHILL
864	DOCTOR	245	265	RALPH GENE TURNBAUGH
864	DOCTOR	1552	1554	ZJ
864	DATE	1558	1564	3.1.62	2062-01-03
864	DOCTOR	1594	1599	LJake
865	IDNUM	14	24	04Q663152K
865	MEDICALRECORD	25	36	0466631.PFK
865	PATIENT	38	52	Ludden, Maizie
865	IDNUM	63	71	04Q66315
865	STREET	72	78	Beulah
865	CITY	79	87	COOKTOWN
865	STATE	89	92	QLD
865	ZIP	94	98	5455
865	DATE	124	133	5/11/2013	2013-11-05
865	DATE	153	162	3/12/2062	2062-12-03
865	DEPARTMENT	179	190	ACT Genetic
865	HOSPITAL	193	218	KEMPSEY DISTRICT HOSPITAL
865	DOCTOR	222	240	KAYLEEN Dodie Town
865	DOCTOR	271	278	Jackley
865	DATE	324	331	29.4.64	2064-04-29
865	DATE	358	364	6.1.63	2063-01-06
865	DATE	1962	1968	3.1.62	2062-01-03
865	DOCTOR	1999	2007	A Sether
865	DATE	3558	3564	6.1.63	2063-01-06
865	DATE	3933	3940	29.4.64	2064-04-29
866	IDNUM	13	23	25H264010V
866	MEDICALRECORD	24	35	2522640.DBV
866	PATIENT	37	63	KOLODZIESKI, ADAM BENEDICT
866	IDNUM	74	82	25H26401
866	STREET	83	92	Myddleton
866	CITY	93	107	NAMBUCCA HEADS
866	STATE	109	126	Western Australia
866	ZIP	128	132	4383
866	DATE	158	167	29/7/2027	2027-07-29
866	TIME	187	206	29/10/2012 at 18:54	2012-10-29T18:54
866	DEPARTMENT	218	243	2.23HR STAY SURGICAL UNIT
866	HOSPITAL	246	266	MERCY HEALTH SERVICE
866	DOCTOR	270	293	YSABELLA LESLI STICKLEN
866	DOCTOR	3503	3505	PG
866	DOCTOR	3507	3509	TI
866	DATE	3513	3520	2.12.62	2062-12-02
866	DOCTOR	3551	3558	F Dover
867	IDNUM	13	23	73D284078E
867	MEDICALRECORD	24	34	731284.BSW
867	PATIENT	36	51	Celani, AGUSTIN
867	IDNUM	62	70	73D28407
867	STREET	71	80	Maplehill
867	CITY	81	90	REDCLIFFE
867	STATE	92	95	QLD
867	ZIP	97	101	5451
867	DATE	127	136	16/2/2010	2010-02-16
867	TIME	156	175	31/10/2012 at 13:59	2012-10-31T13:59
867	DEPARTMENT	187	205	Radiation Oncology
867	HOSPITAL	206	221	WARREN HOSPITAL
867	DOCTOR	225	246	Phillip Ronald BULLEN
867	DOCTOR	1882	1884	OT
867	DATE	1888	1894	1.3.62	2062-01-03
867	DOCTOR	1925	1938	T Hochstatter
867	DOCTOR	3388	3398	T Erxleben
867	DATE	3399	3406	16.1.62	2062-01-16
867	HOSPITAL	3443	3462	DONNYBROOK HOSPITAL
867	DOCTOR	3933	3943	T Soderman
867	DATE	3945	3952	15.1.62	2062-01-15
868	IDNUM	14	24	31A305126M
868	MEDICALRECORD	25	35	310305.DHR
868	PATIENT	37	58	Geibel, LAURI-DARLINE
868	IDNUM	68	76	31A30512
868	STREET	77	85	Crisanto
868	CITY	86	94	BAY VIEW
868	STATE	96	99	TAS
868	ZIP	101	105	5044
868	DATE	131	141	23/10/2008	2008-10-23
868	DATE	161	170	3/12/2062	2062-12-03
868	DEPARTMENT	187	206	INTENSIVE CARE UNIT
868	HOSPITAL	207	231	NAMBOUR GENERAL HOSPITAL
868	DOCTOR	235	257	Lyman JAMISON Martinov
868	DATE	332	339	16.1.62	2062-01-16
868	DATE	2386	2392	3/1/62	2062-01-03
868	DATE	3060	3066	3.1.62	2062-01-03
868	DOCTOR	3098	3111	I Hendricksen
868	HOSPITAL	5206	5234	COOLAH MULTI PURPOSE SERVICE
868	DATE	5851	5858	16.1.62	2062-01-16
868	HOSPITAL	5877	5893	WARWICK HOSPITAL
868	DOCTOR	5982	5990	I Honour
869	IDNUM	13	23	52R906085X
869	MEDICALRECORD	24	34	526906.AVN
869	PATIENT	36	50	HAYERTZ, Abram
869	IDNUM	61	69	52R90608
869	STREET	70	77	Nilsson
869	CITY	78	88	BEECHWORTH
869	STATE	90	108	Northern Territory
869	ZIP	110	114	7185
869	DATE	140	149	22/2/2007	2007-02-22
869	TIME	169	188	07/11/2012 at 09:05	2012-11-07T09:05
869	DEPARTMENT	200	205	Envoi
869	HOSPITAL	206	225	STANTHORPE HOSPITAL
869	DOCTOR	229	248	Zack Wandjoo-Marotz
869	DOCTOR	1533	1535	NF
869	DOCTOR	1537	1539	AF
869	DATE	1543	1549	1.9.62	2062-01-09
869	DOCTOR	1583	1592	N Roseman
870	IDNUM	14	24	73I507933J
870	MEDICALRECORD	25	35	733507.XKJ
870	PATIENT	37	52	Clopper, Taunya
870	IDNUM	63	71	73I50793
870	STREET	72	83	Birch Knoll
870	CITY	84	97	ENCOUNTER BAY
870	STATE	99	107	Tasmania
870	ZIP	109	113	3373
870	DATE	139	148	30/6/1975	1975-06-30
870	TIME	168	187	08/11/2012 at 12:03	2012-11-08T12:08
870	DEPARTMENT	199	216	CORONARYCARE UNIT
870	HOSPITAL	217	236	WOLLONGONG HOSPITAL
870	DOCTOR	240	263	LAVONA GLEN HERGENRETER
870	DATE	1727	1734	1.11.62	2062-01-11
870	DOCTOR	1765	1774	S Ahlberg
871	IDNUM	13	23	21E528991R
871	MEDICALRECORD	24	34	211528.ZZE
871	PATIENT	36	46	PADRO, GUS
871	IDNUM	57	65	21E52899
871	STREET	66	76	West Woods
871	CITY	77	84	SUNBURY
871	ZIP	88	92	3546
871	DATE	118	127	13/6/1981	1981-06-13
871	TIME	147	166	12/11/2012 at 09:18	2012-11-12T09:18
871	DEPARTMENT	178	201	POST OPERATIVE RECOVERY
871	HOSPITAL	202	229	CROOKWELL DISTRICT HOSPITAL
871	DOCTOR	233	253	ARNULFO JOE BRANNICK
871	DOCTOR	331	338	G Kings
871	DATE	340	349	14.2.2062	2062-02-14
871	DOCTOR	1052	1054	ZW
871	DATE	1059	1066	10/1/62	2062-01-10
871	DOCTOR	1100	1109	G Taranto
871	DATE	1112	1121	16.1.2062	2062-01-16
871	DOCTOR	2668	2676	G Braget
871	DATE	2678	2687	14.2.2062	2062-02-14
871	DOCTOR	2717	2723	Witham
872	IDNUM	13	23	89B648059A
872	MEDICALRECORD	24	35	8906480.OZA
872	PATIENT	37	56	BEAVIN, EFFIE Hyman
872	IDNUM	67	75	89B64805
872	STREET	76	85	Moon Hall
872	CITY	86	99	ALICE SPRINGS
872	STATE	101	111	Queensland
872	ZIP	113	117	4106
872	DATE	143	152	24/2/1982	1982-02-24
872	TIME	172	191	09/11/2012 at 11:13	2012-11-09T11:13
872	DEPARTMENT	203	206	DHM
872	HOSPITAL	207	249	UPPER MURRAY HEALTH AND COMMUNITY SERVICES
872	DOCTOR	253	271	MAUD Danny Demiter
872	DOCTOR	2005	2007	JQ
872	DATE	2011	2018	14/1/62	2062-01-14
872	DOCTOR	2181	2183	LZ
872	DOCTOR	2185	2187	FF
872	DATE	2192	2199	14.1.62	2062-01-14
872	DOCTOR	2234	2241	V Miley
873	IDNUM	14	24	37X679018I
873	MEDICALRECORD	25	36	3786790.DUI
873	PATIENT	38	60	PAULSEN, JUNIPER Brian
873	IDNUM	71	79	37X67901
873	STREET	80	85	Tryna
873	CITY	86	95	JINDABYNE
873	STATE	97	115	Northern Territory
873	ZIP	117	121	3170
873	DATE	147	156	13/3/2002	2002-03-13
873	DATE	176	185	24/1/2062	2062-01-24
873	DEPARTMENT	202	209	Laverty
873	DOCTOR	213	231	Jerald TOMMY Himel
873	DOCTOR	389	396	J Denis
873	DEPARTMENT	397	409	RENAL CLINIC
873	IDNUM	430	442	JS-86-790183
873	DATE	443	449	5.6.62	2062-06-05
873	DATE	1518	1525	25.1.62	2062-01-25
873	DOCTOR	1559	1566	J Matot
873	IDNUM	3220	3232	JS-86-790183
873	DATE	3233	3241	5.6.2062	2062-06-05
873	DOCTOR	3581	3599	VINCENT Latourette
874	IDNUM	13	23	95T690176R
874	MEDICALRECORD	24	35	9576901.SQR
874	PATIENT	37	55	Bub, Kenneth Nubia
874	IDNUM	66	74	95T69017
874	STREET	75	84	Fernville
874	CITY	85	97	BANORA POINT
874	STATE	99	102	TAS
874	ZIP	104	108	5211
874	DATE	134	143	15/3/2008	2008-03-15
874	TIME	163	182	27/11/2012 at 02:58	2012-11-27T02:58
874	DEPARTMENT	194	208	ACUTECARE WARD
874	HOSPITAL	211	227	KALEEYA HOSPITAL
874	DOCTOR	231	251	Davida Whitney Exton
874	DOCTOR	2550	2552	AU
874	DOCTOR	2554	2556	OQ
874	DATE	2560	2567	29/1/62	2062-01-29
874	DOCTOR	2600	2608	X Millen
874	IDNUM	3076	3082	95T690
875	IDNUM	13	23	16K391024C
875	MEDICALRECORD	24	34	164391.AGL
875	PATIENT	36	48	Raabe, Maram
875	IDNUM	59	67	16K39102
875	IDNUM	68	76	16K39102
875	STREET	77	85	Log Hill
875	CITY	86	95	BELLINGEN
875	STATE	97	107	Queensland
875	ZIP	109	113	3689
875	DATE	145	154	28/5/2019	2019-05-28
875	DATE	174	183	30/1/2062	2062-01-30
875	DEPARTMENT	200	213	DARLING POINT
875	HOSPITAL	216	233	GOODOOGA HOSPITAL
875	DOCTOR	237	256	LAVERNE SON PROMISE
875	DATE	401	404	now	2062-11-27
875	DOCTOR	962	972	Hangartner
875	TIME	976	992	10am on 28.11.12	2012-11-28T10:00
875	DOCTOR	2390	2392	EF
875	DATE	2396	2402	1.1.62	2062-01-01
875	DOCTOR	2435	2441	CEdgar
875	DATE	3430	3436	7/2/62	2062-02-07
876	IDNUM	14	24	64H311082L
876	MEDICALRECORD	25	35	642311.CVG
876	PATIENT	37	49	BORYS, Taryn
876	IDNUM	60	68	64H31108
876	STREET	69	78	Greenwing
876	CITY	79	87	QUIRINDI
876	STATE	89	92	ACT
876	ZIP	94	98	4817
876	DATE	124	133	29/6/1997	1997-06-29
876	DATE	153	162	30/1/2062	2062-01-30
876	DEPARTMENT	179	200	3HR STAY SURGICALUNIT
876	HOSPITAL	201	221	CHARLEVILLE HOSPITAL
876	DOCTOR	225	247	BRADLY BENEDICT Sammer
876	DATE	301	307	1.8.62	2062-01-08
876	DATE	336	342	3.9.63	2063-09-03
876	DATE	1960	1966	1/1/62	2062-01-01
876	DOCTOR	2001	2010	R Gilliss
876	DATE	6111	6117	1.8.62	2062-01-08
876	DOCTOR	6149	6157	R Blythe
876	DATE	6315	6321	3.9.63	2063-09-03
876	DOCTOR	6366	6373	R Soula
876	HOSPITAL	6375	6391	QUILPIE HOSPITAL
877	MEDICALRECORD	1	12	8599129.KCW
877	PATIENT	13	29	ABELLERA, KUPARR
877	IDNUM	30	38	85Y91293
877	DATE	54	63	14/8/2062	2062-08-14
877	DOCTOR	1230	1232	KQ
877	DATE	1237	1243	2/6/62	2062-02-06
877	DOCTOR	1276	1283	W Keath
877	DOCTOR	1289	1297	W Persch
878	IDNUM	13	23	42U933099F
878	MEDICALRECORD	24	35	4279330.ZXF
878	PATIENT	37	49	RONAN, Davis
878	IDNUM	60	68	42U93309
878	STREET	69	78	Fawn Wood
878	CITY	79	82	MOE
878	STATE	84	87	TAS
878	ZIP	89	93	2197
878	DATE	119	128	11/1/1986	1986-01-11
878	TIME	148	167	10/05/2013 at 18:46	2013-05-10T18:46
878	DEPARTMENT	179	189	NSW Health
878	HOSPITAL	190	215	MILTON ULLADULLA HOSPITAL
878	DOCTOR	219	242	Malcolm BASIL Strausner
878	DATE	314	321	18.7.63	2063-07-18
878	DOCTOR	1789	1791	VJ
878	DOCTOR	1794	1796	AU
878	DATE	1800	1807	15.7.63	2063-07-15
878	DOCTOR	1838	1849	K Mcauliffe
878	DATE	3186	3193	18.7.63	2063-07-18
878	DATE	3257	3265	previous	2064-05-27
878	DATE	3314	3317	now	2062-11-27
879	IDNUM	14	24	63L5349576
879	MEDICALRECORD	25	36	6345349.NTQ
879	PATIENT	38	49	AGGAS, Nick
879	IDNUM	60	68	63L53495
879	STREET	69	77	Greybert
879	CITY	78	85	PENGUIN
879	STATE	87	90	VIC
879	ZIP	92	96	3461
879	DATE	120	129	24/9/2009	2009-09-24
879	TIME	149	168	28/11/2012 at 21:57	2012-11-28T21:57
879	DEPARTMENT	180	187	Laverty
879	HOSPITAL	188	222	BAIRNSDALE REGIONAL HEALTH SERVICE
879	DOCTOR	226	249	LUCIEN Jefferey DEERING
879	DOCTOR	597	604	Tidrick
879	DATE	2949	2955	1/1/62	2062-01-01
879	DOCTOR	2988	2997	P Pitorak
880	MEDICALRECORD	1	12	1136559.COY
880	PATIENT	13	23	RAMBO, Kai
880	IDNUM	24	32	11I65591
880	DATE	48	57	14/9/2062	2062-09-14
880	DOCTOR	1584	1586	PQ
880	DATE	1590	1596	7/2/62	2062-02-07
880	DOCTOR	1629	1640	E Ochiltree
881	IDNUM	14	24	32Z256864K
881	MEDICALRECORD	25	35	329256.WRK
881	PATIENT	37	50	CULLIFER, IRA
881	IDNUM	61	69	32Z25686
881	STREET	70	75	Espie
881	CITY	76	83	WHYALLA
881	STATE	85	88	TAS
881	ZIP	91	95	4879
881	DATE	121	130	3/11/1990	1990-11-03
881	TIME	150	169	04/12/2012 at 09:15	2012-12-04T09:15
881	DEPARTMENT	181	198	Laverty Pathology
881	HOSPITAL	199	216	GOODOOGA HOSPITAL
881	DOCTOR	220	243	ABDUL Marcus Levi-Holen
881	DATE	2482	2488	6.2.62	2062-02-06
881	DOCTOR	2523	2529	J Soni
881	DOCTOR	2535	2544	J Templer
881	DATE	4130	4137	23/2/62	2062-02-23
881	DOCTOR	4164	4171	J Cuffy
881	DOCTOR	4175	4186	J Sherfield
881	HOSPITAL	4188	4205	RIVERTON HOSPITAL
882	IDNUM	13	23	90V276922S
882	MEDICALRECORD	24	34	908276.YGF
882	PATIENT	36	53	Virzi, VELVA Troy
882	IDNUM	64	72	90V27692
882	STREET	73	81	Vivienne
882	CITY	82	89	OLD BAR
882	STATE	91	94	ACT
882	ZIP	96	100	4347
882	DATE	126	135	24/6/2022	2022-06-24
882	TIME	155	174	06/12/2012 at 09:26	2012-12-06T09:26
882	DEPARTMENT	186	199	PARKES 4 EAST
882	HOSPITAL	200	237	LAKE CARGELLIGO MULTI PURPOSE SERVICE
882	DOCTOR	241	272	Manual NATHANAEL KUPARR-BRAUMAN
882	DOCTOR	681	691	X Felicano
882	TIME	695	713	10:00am on 6.12.12	2012-12-06T10:00
882	DOCTOR	952	961	X Rachell
882	TIME	965	983	10:00am on 6.12.12	2012-12-06T10:00
882	DOCTOR	2454	2456	VR
882	DATE	2461	2467	2.9.62	2062-02-09
882	DOCTOR	2499	2508	X Vautier
882	HOSPITAL	5311	5334	MOREE DISTRICT HOSPITAL
882	DATE	5408	5417	26/2/2062	2062-02-26
882	HOSPITAL	5442	5471	DORRIGO MULTI PURPOSE SERVICE
882	DOCTOR	6024	6031	X Seyal
883	MEDICALRECORD	1	12	6421262.HEN
883	PATIENT	13	28	FALKER, Marlena
883	IDNUM	29	37	64F12622
883	DATE	53	62	19/3/2063	2063-03-19
883	DOCTOR	1432	1434	JA
883	DATE	1439	1445	2.9.62	2062-02-09
883	DOCTOR	1477	1486	Q Whiddon
884	IDNUM	14	24	69J908838M
884	MEDICALRECORD	25	35	693908.WJW
884	PATIENT	37	62	Bailard, GREGORIA-ROGELIO
884	IDNUM	73	81	69J90883
884	STREET	82	89	Wimslow
884	CITY	90	97	GOSFORD
884	STATE	99	101	WA
884	ZIP	103	107	2869
884	DATE	132	140	4/3/2018	2018-04-03
884	TIME	160	179	06/12/2012 at 09:08	2012-12-06T09:08
884	DEPARTMENT	191	206	Pathology North
884	HOSPITAL	207	239	ARMIDALE RURAL REFERRAL HOSPITAL
884	DOCTOR	243	270	GENARO Tjingali VANDESTEENE
884	CITY	491	502	STRATHALBYN
884	DATE	1838	1844	2/8/62	2062-02-08
884	DOCTOR	1875	1885	R Iannuzzi
885	MEDICALRECORD	1	12	3377482.KVH
885	PATIENT	13	23	Smola, KEN
885	IDNUM	24	32	33S74824
885	IDNUM	33	41	33S74824
885	DATE	57	66	14/2/2062	2062-02-14
885	DOCTOR	1466	1468	XB
885	DOCTOR	1470	1472	BH
885	DATE	1476	1483	13.2.62	2062-02-13
885	DOCTOR	1514	1521	J Gomey
886	IDNUM	13	23	91O768206Q
886	MEDICALRECORD	24	35	9157682.AQQ
886	PATIENT	37	56	STELLO, VIRGIL'Gema
886	IDNUM	67	75	91O76820
886	IDNUM	76	84	91O76820
886	STREET	85	94	Craigweil
886	CITY	95	100	DERBY
886	STATE	102	105	ACT
886	ZIP	107	111	2610
886	DATE	146	156	28/10/2005	2005-10-28
886	TIME	176	195	05/12/2012 at 17:48	2012-12-05T17:48
886	DEPARTMENT	207	225	South Eastern Area
886	HOSPITAL	228	247	MILLMERRAN HOSPITAL
886	DOCTOR	251	270	Chae Claude STEFFEN
886	DOCTOR	3173	3175	HZ
886	DOCTOR	3177	3179	SQ
886	DATE	3183	3189	2/8/62	2062-02-08
886	DOCTOR	3223	3231	Y Rabelo
886	DATE	4432	4438	5/8/64	2064-05-08
887	IDNUM	14	24	96S640803P
887	MEDICALRECORD	25	36	9676408.CIP
887	PATIENT	38	60	Federer, Jaxon Refugia
887	IDNUM	71	79	96S64080
887	STREET	80	85	Nanti
887	CITY	86	95	BUSSELTON
887	STATE	97	105	Victoria
887	ZIP	107	111	1240
887	DATE	137	146	11/3/1997	1997-11-03
887	TIME	163	182	06/12/2012 at 15:43	2012-12-06T15:43
887	DEPARTMENT	194	201	Laverty
887	HOSPITAL	202	217	WINTON HOSPITAL
887	DOCTOR	221	241	Duane OREN DEMERITTE
887	DATE	400	404	2046	2046
887	DURATION	410	419	4-5 month	P4.5M
887	DATE	2476	2482	2.9.62	2062-02-09
887	DOCTOR	2514	2524	Z Zarlenga
888	IDNUM	13	23	60C480212J
888	MEDICALRECORD	24	34	600480.FDH
888	PATIENT	36	55	Dolce, Gerry FELIPE
888	IDNUM	66	74	60C48021
888	STREET	75	82	Olivera
888	CITY	83	89	URUNGA
888	STATE	91	93	SA
888	ZIP	95	99	6509
888	DATE	125	133	1/4/1983	1983-01-04
888	TIME	153	172	07/12/2012 at 16:40	2012-12-07T16:40
888	DEPARTMENT	184	199	Envoi pathology
888	HOSPITAL	200	215	BOONAH HOSPITAL
888	DOCTOR	219	243	EMILIO MELVIN DEVILLIERS
888	DOCTOR	1365	1367	CL
888	DOCTOR	1369	1371	JU
888	DATE	1375	1382	2.12.62	2062-12-02
888	DOCTOR	1413	1424	R Pyanowski
889	IDNUM	13	23	28Y411271S
889	MEDICALRECORD	24	35	2894112.SCS
889	PATIENT	37	59	Plesha, DWAYNE Charity
889	IDNUM	70	78	28Y41127
889	STREET	79	84	Gamay
889	CITY	85	93	CURLEWIS
889	STATE	95	123	Australian Capital Territory
889	ZIP	125	129	2490
889	DATE	153	162	14/9/2014	2014-09-14
889	DEPARTMENT	206	209	SXR
889	HOSPITAL	212	235	TUMUT DISTRICT HOSPITAL
889	DOCTOR	239	255	RICH MARLIN KITZ
889	DOCTOR	3416	3418	YX
889	DOCTOR	3420	3422	VM
889	DATE	3425	3432	13.2.62	2062-02-13
889	DOCTOR	3463	3471	G Minott
890	IDNUM	13	23	49Q012129D
890	MEDICALRECORD	24	35	4960121.GYD
890	PATIENT	37	54	MODESTE, Lashanda
890	IDNUM	63	71	49Q01212
890	IDNUM	72	80	49Q01212
890	STREET	81	88	Maddock
890	CITY	89	101	MOUNT MORGAN
890	STATE	103	118	New South Wales
890	ZIP	120	124	3623
890	DATE	159	168	14/4/1985	1985-04-14
890	DATE	187	196	12/2/2062	2062-02-12
890	DEPARTMENT	213	224	UROLOGY OPD
890	HOSPITAL	227	243	GAYNDAH HOSPITAL
890	DOCTOR	247	271	KRISTOPHER KELLEY ROSEUM
890	DOCTOR	1971	1973	YH
890	DOCTOR	1975	1977	AJ
890	DATE	1981	1988	14.1.62	2062-01-14
890	DOCTOR	2019	2028	H Hadsall
891	IDNUM	13	23	96M132287M
891	MEDICALRECORD	24	34	964132.GVT
891	PATIENT	36	52	Schmeiser, HILDE
891	IDNUM	63	71	96M13228
891	STREET	72	81	Greystead
891	CITY	82	95	DRUMMOND COVE
891	STATE	97	125	Australian Capital Territory
891	ZIP	127	131	7277
891	DATE	157	166	12/4/1988	1988-12-04
891	DATE	186	195	2/12/2062	2062-02-12
891	DEPARTMENT	212	224	RENAL CLINIC
891	DOCTOR	228	251	LEONEL Lyndon LENDERMAN
891	DATE	356	363	19.3.62	2062-03-19
891	DOCTOR	368	377	Z Viereck
891	DOCTOR	2049	2051	LO
891	DATE	2056	2063	13/2/62	2062-02-13
891	DOCTOR	2094	2103	Z Mcindoe
891	DATE	2106	2115	14.2.2062	2062-02-14
891	DOCTOR	4570	4583	Boori DESIMAS
891	DATE	5338	5345	19.3.62	2062-03-19
891	DOCTOR	5350	5359	Z Kastner
891	HOSPITAL	5372	5395	SCOTT MEMORIAL HOSPITAL
891	CITY	5397	5405	HILL TOP
891	DOCTOR	5419	5435	COURTNEY GELBACH
891	DOCTOR	5436	5453	Laraine Farinacci
892	MEDICALRECORD	2	13	3883340.YLI
892	DOCTOR	14	33	IACUZIO, Jeramy WAN
892	IDNUM	34	42	38U33409
892	DATE	57	66	14/2/2062	2062-02-14
892	DATE	526	533	12.2.62	2062-02-12
892	DOCTOR	564	571	J Dutil
893	IDNUM	13	23	96R355052R
893	MEDICALRECORD	24	35	9663550.NGR
893	PATIENT	37	57	PHANTHANOUVON, Harry
893	IDNUM	68	76	96R35505
893	STREET	77	89	George River
893	CITY	90	102	MOUNT MORGAN
893	STATE	104	106	SA
893	ZIP	108	112	0907
893	DATE	138	147	25/9/1991	1991-09-25
893	DEPARTMENT	191	201	OBSTETRICS
893	HOSPITAL	202	222	CAIRNS BASE HOSPITAL
893	DOCTOR	226	248	FLORENCIO BURTON ZIEMS
893	DATE	555	562	13/2/62	2062-02-13
893	DOCTOR	563	565	LV
893	DOCTOR	1853	1855	ZV
893	DATE	1860	1867	14/2/62	2062-02-14
893	DOCTOR	1900	1911	Y Eclarinal
894	IDNUM	13	23	17I956900C
894	MEDICALRECORD	24	34	173956.YCC
894	PATIENT	36	51	Janeiro, SONDRA
894	IDNUM	62	70	17I95690
894	STREET	71	82	Trout Brook
894	CITY	83	93	CONDOBOLIN
894	STATE	95	110	New South Wales
894	ZIP	112	116	6842
894	DATE	142	152	19/12/2003	2003-12-19
894	TIME	172	191	11/12/2012 at 20:07	2012-12-11T20:07
894	DEPARTMENT	203	220	Laverty Pathology
894	HOSPITAL	221	246	NARACOORTE HEALTH SERVICE
894	DOCTOR	250	275	Patrice ALAN Colby-Gryder
894	DURATION	358	363	16 yr	P16Y
894	DOCTOR	1947	1949	HP
894	DATE	1953	1960	14.2.62	2062-02-14
894	DOCTOR	1993	2004	M Brandsrud
894	DATE	3327	3333	4/3/63	2063-03-04
894	DOCTOR	3378	3387	M Branyon
894	HOSPITAL	3389	3408	BARWON HEALTH NORTH
895	IDNUM	14	24	65E077068L
895	MEDICALRECORD	25	35	651077.ARX
895	PATIENT	37	56	Lauderdale, Silvana
895	IDNUM	67	75	65E07706
895	STREET	76	83	Timahoe
895	CITY	84	96	SAINT ARNAUD
895	STATE	98	106	Tasmania
895	ZIP	108	112	1680
895	DATE	138	146	6/8/2007	2007-06-08
895	DATE	166	175	13/2/2062	2062-02-13
895	DEPARTMENT	192	222	SOUTH SURGICAL ASSESSMENT UNIT
895	HOSPITAL	223	266	WESTERN DISTRICT HEALTH SERVICE - COLERAINE
895	DOCTOR	270	290	Duncan RONNIE Mursch
895	DATE	368	376	2.2.2062	2062-02-02
895	DOCTOR	381	391	R Losinger
895	DATE	480	484	2060	2060
895	DATE	1629	1636	13/2/62	2062-02-13
895	DOCTOR	1672	1678	R Fray
895	DATE	1681	1690	15.2.2062	2062-02-15
895	DATE	2953	2961	2.2.2062	2062-02-02
895	DOCTOR	2967	2976	R Onifade
895	DOCTOR	2996	3002	Magoun
896	MEDICALRECORD	1	11	868677.XFS
896	PATIENT	12	26	SANGES, Orinda
896	IDNUM	27	35	86W67792
896	DATE	51	60	25/3/2063	2063-03-25
896	DATE	128	132	2062	2062
896	DATE	167	171	2060	2060
896	DATE	183	187	2058	2058
896	DOCTOR	864	866	DE
896	DATE	870	877	24/3/63	2063-03-24
896	DOCTOR	907	916	G Lasecki
896	DOCTOR	922	930	G Sefcik
896	IDNUM	1276	1284	23A09702
897	IDNUM	13	23	44S698975F
897	MEDICALRECORD	24	35	4476989.UOF
897	PATIENT	37	55	SNETSINGER, KRISTI
897	IDNUM	66	74	44S69897
897	IDNUM	75	83	44S69897
897	STREET	84	92	S Joliet
897	CITY	93	98	TUMUT
897	STATE	100	103	VIC
897	ZIP	105	109	3841
897	DATE	144	154	25/11/2000	2000-11-25
897	TIME	174	193	12/12/2012 at 10:29	2012-12-12T10:29
897	DEPARTMENT	205	218	CPC Pathology
897	HOSPITAL	221	250	COOTAMUNDRA DISTRICT HOSPITAL
897	DOCTOR	254	276	JODY JIMMIE Pignatelli
897	DATE	348	355	28.8.63	2063-08-28
897	DATE	437	442	today	2062-09-13
897	DOCTOR	2729	2731	XL
897	DOCTOR	2732	2734	YX
897	DATE	2738	2745	15.2.62	2062-02-15
897	DOCTOR	2777	2785	L Hirota
897	IDNUM	5201	5209	44S69897
897	DATE	5516	5523	28.8.63	2063-08-28
897	IDNUM	5655	5664	44S69897O
898	IDNUM	14	24	92O719033N
898	MEDICALRECORD	25	36	9257190.JJN
898	PATIENT	38	53	MORRISON, Gerda
898	IDNUM	64	72	92O71903
898	STREET	73	78	Radha
898	CITY	79	89	STANTHORPE
898	STATE	91	94	QLD
898	ZIP	96	100	3224
898	DATE	126	136	14/12/2002	2002-12-14
898	DATE	155	164	14/2/2062	2062-02-14
898	DEPARTMENT	181	186	Envoi
898	HOSPITAL	189	217	GLEN INNES DISTRICT HOSPITAL
898	DOCTOR	221	239	WAYNE Adolph Ocran
898	DOCTOR	344	354	Z Silveira
898	DATE	356	365	17.3.2063	2063-03-17
898	DATE	1950	1957	15.2.62	2062-02-15
898	DOCTOR	1988	1996	Z Babson
899	MEDICALRECORD	1	12	5047400.YEW
899	PATIENT	13	29	Cloepfil, Turlku
899	IDNUM	30	38	50K74009
899	DATE	54	63	22/2/2062	2062-02-22
899	DOCTOR	245	252	Fickett
899	DEPARTMENT	301	319	MEDIC/SURGERY WARD
899	DOCTOR	1042	1044	JS
899	DATE	1048	1055	16.2.62	2062-02-16
899	DOCTOR	1087	1096	O Ruschel
900	MEDICALRECORD	1	12	0827601.NZE
900	PATIENT	13	38	Trautwein, Donovan Jeremy
900	IDNUM	39	47	08G76015
900	DATE	63	72	20/2/2062	2062-02-20
900	DOCTOR	646	648	AJ
900	DATE	652	659	16.2.62	2062-02-16
900	DOCTOR	692	698	C Sowl
901	IDNUM	13	23	29Y361008Q
901	MEDICALRECORD	24	35	2993610.CVQ
901	PATIENT	37	52	STALLS, MICHEAL
901	IDNUM	63	71	29Y36100
901	STREET	72	80	Redhills
901	CITY	81	89	WOODSIDE
901	STATE	91	93	SA
901	ZIP	95	99	4102
901	DATE	125	134	12/7/1999	1999-07-12
901	TIME	154	173	14/12/2012 at 15:43	2012-12-14T15:43
901	DEPARTMENT	185	203	MEDIC/SURGERY WARD
901	HOSPITAL	204	228	VICTORIAN HEART HOSPITAL
901	DOCTOR	232	258	ROCCO Chantelle Blomstrand
901	DOCTOR	1615	1617	TX
901	DOCTOR	1619	1621	TI
901	DATE	1626	1633	19.2.62	2062-02-19
901	DOCTOR	1665	1675	H Ravenell
902	IDNUM	14	24	87U482066Y
902	MEDICALRECORD	25	36	8774820.RQY
902	PATIENT	38	56	Huie, KATHRYN YUNA
902	IDNUM	67	75	87U48206
902	STREET	76	80	Keim
902	CITY	81	87	BOURKE
902	STATE	89	91	WA
902	ZIP	93	97	3620
902	DATE	123	132	25/8/1973	1973-08-25
902	TIME	152	171	17/12/2012 at 09:08	2012-12-17T09:08
902	DEPARTMENT	183	190	PARKES8
902	HOSPITAL	191	219	THE QUEEN ELIZABETH HOSPITAL
902	DOCTOR	223	241	HOBERT Heath HILTS
902	DATE	2174	2181	19/2/62	2062-02-19
902	DOCTOR	2212	2222	V Eckmeyer
903	MEDICALRECORD	1	11	084083.ZFM
903	PATIENT	12	32	SCHOLLMEYER, MERISSA
903	IDNUM	33	41	08L08392
903	DATE	57	66	22/2/2062	2062-02-22
903	DOCTOR	536	551	LIONEL-Longwith
903	DOCTOR	570	581	A Hollerman
903	TIME	585	600	5pm on 17.12.12	2012-12-17T17:00
903	DOCTOR	1854	1856	UA
903	DATE	1860	1867	19.2.62	2062-02-19
903	DOCTOR	1898	1906	A Fabian
904	IDNUM	13	23	55H004072S
904	MEDICALRECORD	24	34	552004.BUH
904	PATIENT	36	53	GRIVAS, Penni Hal
904	IDNUM	64	72	55H00407
904	STREET	73	77	Noon
904	CITY	78	85	KYABRAM
904	STATE	87	90	TAS
904	ZIP	92	96	2621
904	DATE	122	130	3/1/2013	2013-03-01
904	DATE	150	159	20/2/2062	2062-02-20
904	DEPARTMENT	176	180	HAPS
904	HOSPITAL	181	205	PORTLAND DISTRICT HEALTH
904	DOCTOR	209	226	KOORI Lou Leisher
904	DATE	307	314	25/3/63	2063-03-25
904	DOCTOR	742	754	AUGUST YONTS
904	DOCTOR	776	783	P Pargo
904	DOCTOR	791	802	P Manocchia
904	TIME	806	825	15.40pm on 19/12/12	2012-12-19T15:40
904	DATE	2407	2414	23/2/62	2062-02-23
904	DOCTOR	2790	2792	HG
904	DOCTOR	2794	2796	TO
904	DATE	2801	2808	21/2/62	2062-02-21
904	DOCTOR	2842	2849	P Berta
904	DATE	9990	9997	25/3/63	2063-03-25
904	DOCTOR	10014	10026	P Armbrester
904	DATE	10577	10584	25/3/63	2063-03-25
904	HOSPITAL	10605	10632	QUIRINDI COMMUNITY HOSPITAL
904	DOCTOR	10668	10676	P Keeler
904	ORGANIZATION	10724	10747	American Electric Power
904	HOSPITAL	10749	10773	NOARLUNGA HEALTH SERVICE
904	DOCTOR	10778	10784	P Kees
904	IDNUM	10815	10823	55H00407
904	DOCTOR	11703	11709	P Cran
904	DATE	11716	11723	18/3/63	2063-03-18
905	MEDICALRECORD	2	13	7696059.IDD
905	PATIENT	14	29	SPEGAL, Clarita
905	IDNUM	30	38	76Z60593
905	DATE	54	63	23/2/2062	2062-02-23
905	DATE	101	110	23.2.2062	2062-02-23
905	DOCTOR	135	145	U Burstein
905	DATE	1094	1101	21.2.62	2062-02-21
905	DOCTOR	1133	1143	U Behrends
905	DATE	2899	2908	23.2.2062	2062-02-23
905	DOCTOR	2933	2939	U Oyen
906	IDNUM	13	23	34V725999M
906	MEDICALRECORD	24	34	348725.ZXY
906	PATIENT	36	51	LINSDAU, JEROLD
906	IDNUM	62	70	34V72599
906	STREET	71	79	Dowrelio
906	CITY	80	91	ALSTONVILLE
906	STATE	93	96	ACT
906	ZIP	98	102	4744
906	DATE	126	135	29/8/2010	2010-08-29
906	TIME	155	174	18/12/2012 at 09:03	2012-12-18T09:03
906	DEPARTMENT	186	193	Med Onc
906	HOSPITAL	194	234	MONASH MEDICAL CENTRE - MOORABBIN CAMPUS
906	DOCTOR	238	264	Jean KENDALL Rocco-KAUMANS
906	DOCTOR	1900	1902	YO
906	DATE	1906	1913	20/2/62	2062-02-20
906	DOCTOR	1943	1954	I Szopinski
906	HOSPITAL	6137	6155	MACQUARIE HOSPITAL
906	DATE	6229	6238	19/3/2063	2063-03-19
906	HOSPITAL	6262	6278	GIN GIN HOSPITAL
906	DOCTOR	6832	6840	I Shirer
907	IDNUM	13	23	08E575398H
907	MEDICALRECORD	24	35	0815753.ZXH
907	PATIENT	37	53	Langsdale, YELIZ
907	IDNUM	64	72	08E57539
907	IDNUM	73	81	08E57539
907	STREET	82	89	Raiders
907	CITY	90	99	ROBINVALE
907	STATE	101	103	NT
907	ZIP	105	109	6415
907	DATE	144	153	11/2/1990	1990-02-11
907	DATE	173	182	21/2/2062	2062-02-21
907	DEPARTMENT	199	239	Tissue Pathology and Diagnostic Oncology
907	HOSPITAL	242	278	EIDSVOLD MULTIPURPOSE HEALTH SERVICE
907	DOCTOR	282	291	LYLE GAZO
907	DOCTOR	3170	3172	CY
907	DOCTOR	3174	3176	QF
907	DATE	3180	3187	22/1/62	2062-01-22
907	DOCTOR	3218	3230	B Westerhoff
908	IDNUM	14	24	03I347905G
908	MEDICALRECORD	25	36	0333479.BPG
908	PATIENT	38	55	MURANAKA, NOELENE
908	IDNUM	66	74	03I34790
908	STREET	75	86	Alder Creek
908	CITY	87	95	LONGFORD
908	STATE	97	105	Tasmania
908	ZIP	107	111	2017
908	DATE	137	146	27/5/1999	1999-05-27
908	DEPARTMENT	190	205	ENVOI Pathology
908	HOSPITAL	206	237	COOMA HOSPITAL & HEALTH SERVICE
908	DOCTOR	241	267	Lazaro Dudley Yong-Yeatman
908	DATE	365	372	25/3/63	2063-03-25
908	DATE	3620	3627	22.2.62	2062-02-22
908	DOCTOR	3659	3668	C Markert
908	DATE	8695	8702	23/3/63	2063-03-23
908	HOSPITAL	8763	8780	BLACKALL HOSPITAL
908	DOCTOR	8817	8825	C Emilio
908	ORGANIZATION	8882	8908	Hexion Specialty Chemicals
908	HOSPITAL	8910	8940	TOOSEY AGED AND COMMUNITY CARE
908	DOCTOR	8945	8950	Luigi
908	HOSPITAL	8988	9014	INVERELL DISTRICT HOSPITAL
908	IDNUM	9022	9034	c33J47905-G0
908	PATIENT	9034	9039	CRene
908	HOSPITAL	9107	9122	WANTIRNA HEALTH
908	DOCTOR	9624	9633	C. Hutton
908	DATE	9640	9647	19/3/63	2063-03-19
908	DATE	9648	9656	19/32063	2063-03-19
909	MEDICALRECORD	1	12	6114789.QKO
909	PATIENT	13	35	BERTONCINI, Gayle Jena
909	IDNUM	36	44	61F47896
909	IDNUM	45	53	61F47896
909	DATE	69	78	14/4/2063	2063-04-14
909	DOCTOR	739	749	Q Caughorn
909	TIME	753	770	10.10am on 2/1/13	2013-01-02T10:10
909	DOCTOR	2023	2025	LJ
909	DATE	2030	2036	3/5/63	2063-05-03
909	DOCTOR	2067	2074	Q Guill
909	DEPARTMENT	2872	2891	L7 CONSULTING ROOMS
909	IDNUM	2893	2902	Q11478963
909	DOCTOR	3752	3762	Q Ankersen
909	DATE	3991	3998	17/3/63	2063-03-17
910	IDNUM	14	24	35O2173633
910	MEDICALRECORD	25	36	3552173.RJJ
910	PATIENT	38	53	WANGER, KATELIN
910	IDNUM	64	72	35O21736
910	STREET	73	82	W Newport
910	CITY	83	92	LEONGATHA
910	STATE	94	96	WA
910	ZIP	98	102	3549
910	DATE	128	137	19/2/2003	2003-02-19
910	TIME	157	176	01/01/2013 at 17:01	2013-01-01T17:01
910	DEPARTMENT	188	206	INTENSIVECARE UNIT
910	HOSPITAL	207	228	WAR MEMORIAL HOSPITAL
910	DOCTOR	232	257	FREDRICK Geoffrey Barrack
910	DATE	1423	1429	4/3/63	2063-03-04
910	DOCTOR	1462	1471	J Horuath
911	IDNUM	13	23	30S099970I
911	MEDICALRECORD	24	34	307099.YTB
911	PATIENT	36	50	WEAR, Ezequiel
911	IDNUM	61	69	30S09997
911	STREET	70	76	Tilson
911	CITY	77	83	COROWA
911	STATE	85	100	South Australia
911	ZIP	102	106	6398
911	DATE	132	141	10/4/2004	2004-04-10
911	DATE	161	169	5/3/2063	2063-03-05
911	DEPARTMENT	186	199	DARLING POINT
911	HOSPITAL	200	224	CUNDERDIN HEALTH SERVICE
911	DOCTOR	228	242	Hayden GLASPIE
911	DATE	314	320	2.3.63	2063-03-02
911	DOCTOR	701	708	Disalvi
911	DOCTOR	715	725	K Ekstrand
911	DOCTOR	729	737	K Mervin
911	TIME	741	757	3.59pm on 3/1/13	2013-01-03T15:59
911	DOCTOR	1270	1272	KT
911	DATE	1277	1283	6/3/63	2063-03-06
911	DOCTOR	1316	1324	K Sweets
911	DOCTOR	2117	2131	MARLIN DOCKERY
911	HOSPITAL	2133	2157	ST GEORGE HOSPITAL (QLD)
911	HOSPITAL	2225	2248	COBAR DISTRICT HOSPITAL
911	CITY	2261	2270	BUNINYONG
911	DATE	2621	2628	17.3.63	2063-03-17
911	DOCTOR	2634	2645	K Bevington
911	DEPARTMENT	2647	2660	SEALS central
911	DATE	3598	3604	2.3.63	2063-03-02
911	DOCTOR	3633	3649	Aristide MCMAKIN
911	HOSPITAL	3651	3692	CENTRAL GIPPSLAND HEALTH SERVICE (MAFFRA)
912	IDNUM	13	23	14C839280D
912	MEDICALRECORD	24	35	1408392.VAD
912	PATIENT	37	54	Candanoza, JULIET
912	IDNUM	65	73	14C83928
912	STREET	74	84	Old Canada
912	CITY	85	92	MULWALA
912	STATE	94	122	Australian Capital Territory
912	ZIP	124	128	6733
912	DATE	154	163	3/10/1981	1981-10-03
912	TIME	183	202	07/01/2013 at 03:10	2013-01-07T03:10
912	DEPARTMENT	214	229	Pathology North
912	HOSPITAL	230	249	MOUNT ISA  HOSPITAL
912	DOCTOR	253	273	MERVIN MAXWELL LENIG
912	DOCTOR	1169	1171	HH
912	DATE	1176	1182	9/3/63	2063-03-09
912	DOCTOR	1215	1223	C Nahari
913	MEDICALRECORD	2	13	6299603.KVM
913	PATIENT	14	31	Mullens, VIVIENNE
913	IDNUM	32	40	62Y96033
913	DATE	56	65	23/8/2063	2063-08-23
913	DATE	1077	1084	21/8/63	2063-08-21
913	DOCTOR	1115	1124	R Weisman
913	IDNUM	1343	1351	62Y96033
914	IDNUM	13	23	83P551296X
914	MEDICALRECORD	24	34	836551.GYR
914	PATIENT	36	49	Arms, TANGELA
914	IDNUM	60	68	83P55129
914	STREET	69	75	Russet
914	CITY	76	82	NEWMAN
914	ZIP	86	90	6262
914	DATE	116	125	8/12/2023	2023-08-12
914	TIME	145	164	07/01/2013 at 08:58	2013-01-07T08:58
914	DEPARTMENT	176	192	ONCOLOGY (GYNAE)
914	HOSPITAL	193	229	WIMMERA HEALTH CARE GROUP - DIMBOOLA
914	DOCTOR	233	254	KENTON Sol STROBRIDGE
914	DOCTOR	285	290	Facey
914	DOCTOR	295	298	Von
914	DOCTOR	2069	2071	KV
914	DATE	2075	2081	3/9/63	2063-03-09
914	DOCTOR	2115	2126	S Guildford
914	DATE	2129	2138	3.10.2063	2063-03-10
915	IDNUM	13	23	41L581254F
915	MEDICALRECORD	24	34	414581.HNM
915	PATIENT	36	50	Harty, Woodrow
915	IDNUM	61	69	41L58125
915	STREET	70	78	Waelchli
915	CITY	79	93	ANTHONY LAGOON
915	ZIP	97	101	3220
915	DATE	127	136	14/7/1994	1994-07-14
915	TIME	156	175	04/01/2013 at 16:47	2013-01-04T16:47
915	DEPARTMENT	187	195	Pathwest
915	HOSPITAL	196	214	LONGREACH HOSPITAL
915	DOCTOR	218	235	MONTE Lane JOBSON
915	DOCTOR	2577	2579	EF
915	DATE	2584	2590	9/3/63	2063-03-09
915	DOCTOR	2626	2634	K Herner
915	DATE	2867	2870	now	2062-11-27
916	MEDICALRECORD	2	13	9935023.CHO
916	PATIENT	14	32	EISENBARTH, Jazmin
916	IDNUM	33	41	99I50231
916	DATE	57	66	3/11/2063	2063-03-11
916	DATE	660	666	3/9/63	2063-03-09
916	DOCTOR	697	710	Z Delossantos
917	IDNUM	13	23	94M484919N
917	MEDICALRECORD	24	34	944484.YEZ
917	PATIENT	36	54	Cappelli, Alphonse
917	IDNUM	65	73	94M48491
917	STREET	74	83	Stockheld
917	CITY	84	90	CASINO
917	STATE	92	95	QLD
917	ZIP	97	101	5273
917	DATE	127	136	29/5/1993	1993-05-29
917	DATE	156	164	3/9/2063	2063-09-03
917	DEPARTMENT	181	186	Envoi
917	HOSPITAL	187	202	BAMAGA HOSPITAL
917	DOCTOR	206	225	MOHAMMED ADAN BAKES
917	DOCTOR	1262	1264	OI
917	DATE	1269	1276	3/10/63	2063-03-10
917	DOCTOR	1309	1319	Z Vellucci
918	IDNUM	13	23	51I4050778
918	MEDICALRECORD	24	35	5134050.TUW
918	PATIENT	37	53	Stiehl, FLETCHER
918	IDNUM	64	72	51I40507
918	STREET	73	81	Mossrock
918	CITY	82	95	COONABARABRAN
918	STATE	97	100	TAS
918	ZIP	102	106	6335
918	DATE	132	142	16/12/1983	1983-12-16
918	TIME	162	181	08/01/2013 at 09:02	2013-01-08T09:02
918	DEPARTMENT	193	214	3HR STAY SURGICALUNIT
918	HOSPITAL	215	259	ROCHESTER AND ELMORE DISTRICT HEALTH SERVICE
918	DOCTOR	263	282	Gale Lazaro Brazeau
918	DOCTOR	2288	2290	KC
918	DOCTOR	2292	2294	ZN
918	DATE	2297	2304	3.10.63	2063-03-10
918	DOCTOR	2339	2348	O Metrick
919	IDNUM	14	24	25R2443876
919	MEDICALRECORD	25	35	256244.JVT
919	PATIENT	37	50	Leiber, LAMAR
919	IDNUM	61	69	25R24438
919	LOCATION-OTHER	70	81	PO BOX 1000
919	CITY	82	89	DAMPIER
919	STATE	91	94	TAS
919	ZIP	96	100	6385
919	DATE	124	133	27/8/1998	1998-08-27
919	DATE	153	162	10/3/2063	2063-03-10
919	DEPARTMENT	179	206	DEPT OF CORRECTIVE SERVICES
919	HOSPITAL	207	262	ROBINVALE DISTRICT HEALTH SERVICES - MANANGATANG CAMPUS
919	DOCTOR	266	284	Cory KIRBY Wanberg
919	DATE	1874	1881	11/3/63	2063-03-11
919	DOCTOR	1914	1925	H Finlayson
920	MEDICALRECORD	1	11	308026.ZXL
920	PATIENT	12	25	LEVICK, ELMER
920	IDNUM	26	34	30V02698
920	DATE	50	59	12/3/2063	2063-03-12
920	DOCTOR	1818	1820	DO
920	DATE	1825	1832	11/3/63	2063-03-11
920	DOCTOR	1865	1875	H Bekerman
921	IDNUM	14	24	04F9663944
921	MEDICALRECORD	25	35	042966.HYK
921	PATIENT	37	50	Gorey, Ayesha
921	IDNUM	61	69	04F96639
921	STREET	70	89	Babylon Farmingdale
921	CITY	90	105	NOWRA-BOMADERRY
921	STATE	107	117	Queensland
921	ZIP	119	123	4515
921	DATE	149	158	14/8/2013	2013-08-14
921	TIME	178	197	08/01/2013 at 13:46	2013-01-08T13:46
921	DEPARTMENT	209	223	MACQUARIE WARD
921	HOSPITAL	224	246	PINGELLY HEALTH CENTRE
921	DOCTOR	250	279	Mason ULYSSES NAPOLEON-MCSTAY
921	DATE	1603	1610	11/3/63	2063-03-11
921	DOCTOR	1644	1651	A Reamy
921	DATE	1654	1663	12.3.2063	2063-03-12
921	DOCTOR	2986	2996	A Glausier
922	MEDICALRECORD	1	12	5209973.NFT
922	PATIENT	13	40	BOTHMAN, MALIAH PROVIDENCIA
922	IDNUM	41	49	52B99735
922	IDNUM	50	58	52B99735
922	DATE	74	83	13/3/2063	2063-03-13
922	DOCTOR	1540	1542	FY
922	DOCTOR	1544	1546	WR
922	DATE	1550	1557	3.12.63	2063-03-12
922	DOCTOR	1590	1600	O Strecker
923	IDNUM	13	23	73S598200E
923	MEDICALRECORD	24	35	7375982.CBE
923	PATIENT	37	60	SPERANZA, Tracey Kareem
923	IDNUM	71	79	73S59820
923	STREET	80	92	Cyril Magnin
923	CITY	93	98	BERRI
923	STATE	100	102	SA
923	ZIP	104	108	2606
923	DATE	134	143	20/2/2008	2008-02-20
923	DATE	163	172	3/10/2063	2063-03-10
923	DEPARTMENT	189	202	PARKES 4 EAST
923	HOSPITAL	203	242	CENTRAL GIPPSLAND HEALTH SERVICE (SALE)
923	DOCTOR	246	268	ZACKARY Jarlu STATIRES
923	DOCTOR	322	327	Plona
923	DOCTOR	849	858	T Rudlong
923	DOCTOR	865	872	T Sheen
923	TIME	876	892	1720hr on 8/1/13	2013-01-08T17:20
923	DOCTOR	1216	1228	T Halgrimson
923	DOCTOR	1235	1243	T Maginn
923	TIME	1247	1263	1730hr on 8/1/13	2013-01-08T17:30
923	DOCTOR	3143	3145	PN
923	DATE	3150	3157	3/11/63	2063-03-11
923	DOCTOR	3188	3202	T Fleischacker
924	IDNUM	14	24	31O618368N
924	MEDICALRECORD	25	35	315618.IRW
924	PATIENT	37	60	PROVENZO, Lovella BRANT
924	IDNUM	71	79	31O61836
924	STREET	80	87	Loreley
924	CITY	88	93	JUNEE
924	STATE	95	110	South Australia
924	ZIP	112	116	2705
924	DATE	142	152	18/11/2011	2011-11-18
924	DATE	172	181	11/3/2063	2063-03-11
924	DEPARTMENT	198	211	PARKES 4 EAST
924	HOSPITAL	212	240	DENMAN MULTI PURPOSE SERVICE
924	DOCTOR	244	263	Cortez ERIC WHIPPIE
924	DATE	350	359	26.3.2063	2063-03-26
924	DOCTOR	364	372	I Credle
924	DOCTOR	511	515	Hugo
924	DATE	3132	3139	12/3/63	2063-03-12
924	DOCTOR	3224	3234	I Clarence
924	DOCTOR	3241	3252	I Lounsbery
924	TIME	3256	3273	11.39am on 9/1/13	2013-01-09T11:39
924	DOCTOR	3306	3314	I Malawy
924	DATE	3317	3326	13.3.2063	2063-03-13
924	DATE	7735	7744	26.3.2063	2063-03-26
924	DOCTOR	7749	7759	I Sharplin
924	DOCTOR	7784	7792	I Danner
924	DEPARTMENT	7794	7805	DAY SURGERY
924	HOSPITAL	7817	7835	BUSSELTON HOSPITAL
925	IDNUM	13	23	89L639326V
925	MEDICALRECORD	24	34	894639.JGR
925	PATIENT	36	50	LAZARZ, GISELE
925	IDNUM	61	69	89L63932
925	STREET	70	82	North Willow
925	CITY	83	93	BURPENGARY
925	STATE	95	110	New South Wales
925	ZIP	112	116	1158
925	DATE	142	152	24/11/2017	2017-11-24
925	TIME	172	191	09/01/2013 at 15:38	2013-01-09T15:38
925	DEPARTMENT	203	220	Forensic Medicine
925	HOSPITAL	221	239	FRANKSTON HOSPITAL
925	DOCTOR	243	262	Lewis Javier Stokel
925	DOCTOR	362	369	Trudics
925	DOCTOR	1763	1765	DF
925	DOCTOR	1767	1769	BW
925	DATE	1773	1780	3.12.63	2063-03-12
925	DOCTOR	1813	1823	W Poczobut
926	IDNUM	13	23	94P411933U
926	MEDICALRECORD	24	34	945411.ZIJ
926	PATIENT	36	51	Canary, Michiko
926	IDNUM	62	70	94P41193
926	STREET	71	79	Burnwood
926	CITY	80	86	CAMDEN
926	STATE	88	98	Queensland
926	ZIP	100	104	3567
926	DATE	130	140	24/11/2017	2017-11-24
926	TIME	160	179	06/05/2013 at 09:20	2013-05-06T09:20
926	DEPARTMENT	191	201	2.PARKES 8
926	HOSPITAL	202	218	IPSWICH HOSPITAL
926	DOCTOR	222	242	ADALBERTO KASEY GALO
926	DOCTOR	2846	2848	YJ
926	DOCTOR	2851	2853	EV
926	DATE	2857	2863	7.8.63	2063-08-07
926	DOCTOR	2895	2903	X Klages
927	MEDICALRECORD	2	13	4244320.XED
927	PATIENT	14	31	ODIN, WARRIYANGGA
927	IDNUM	32	40	42L43208
927	IDNUM	41	49	42L43208
927	DATE	65	74	13/3/2063	2063-03-13
927	DATE	1558	1565	12/3/63	2063-03-12
927	DOCTOR	1596	1604	M Maline
928	IDNUM	13	23	00H553040M
928	MEDICALRECORD	24	35	0025530.MAM
928	PATIENT	37	55	Lopilato, ANNMARIE
928	IDNUM	66	74	00H55304
928	STREET	75	82	Majilla
928	CITY	83	91	WORRAGEE
928	STATE	93	108	New South Wales
928	ZIP	110	114	2745
928	DATE	140	148	7/8/2009	2009-08-07
928	DEPARTMENT	192	201	Peter Mac
928	HOSPITAL	204	227	NORTH MIDLANDS HOSPITAL
928	DOCTOR	231	257	JASON IRA Reginald-Hackerd
928	DATE	329	336	26.3.63	2063-03-26
928	DOCTOR	1731	1733	WE
928	DOCTOR	1735	1737	FL
928	DATE	1741	1748	13/3/63	2063-03-13
928	DOCTOR	1779	1790	A Leibowitz
928	DATE	3685	3692	26.3.63	2063-03-26
928	DOCTOR	3813	3823	A Kapichok
929	IDNUM	13	23	58D5731087
929	MEDICALRECORD	24	34	581573.EBV
929	PATIENT	36	56	OLIGSCHLAEGER, JARED
929	IDNUM	67	75	58D57310
929	LOCATION-OTHER	76	87	PO  BOX 224
929	CITY	88	95	HOWLONG
929	STATE	97	107	Queensland
929	ZIP	109	113	2289
929	DATE	139	147	6/2/1987	1987-06-02
929	TIME	167	186	14/01/2013 at 09:16	2013-01-14T09:16
929	DEPARTMENT	198	207	EMERGENCY
929	HOSPITAL	208	247	SYDNEY HOSPITAL AND SYDNEY EYE HOSPITAL
929	DOCTOR	251	271	Jarrod WALTER KOPFER
929	DOCTOR	1975	1977	KL
929	DOCTOR	1979	1981	NX
929	DATE	1985	1992	16.3.63	2063-03-16
929	DOCTOR	2023	2031	O Arentz
930	IDNUM	13	23	79V174066F
930	MEDICALRECORD	24	34	798174.BPQ
930	PATIENT	36	54	DEBARTOLO, BALADJI
930	IDNUM	65	73	79V17406
930	STREET	74	81	Finnell
930	CITY	82	88	BOURKE
930	STATE	90	98	Victoria
930	ZIP	100	104	2300
930	DATE	130	138	5/7/1985	1985-05-07
930	TIME	158	177	14/01/2013 at 09:17	2013-01-14T09:17
930	DEPARTMENT	189	198	StVincent
930	HOSPITAL	199	224	BALLINA DISTRICT HOSPITAL
930	DOCTOR	228	248	BARNEY Carol DOMIANO
930	DOCTOR	267	272	Elias
930	DOCTOR	1461	1463	RY
930	DATE	1467	1474	16.3.63	2063-03-16
930	DOCTOR	1505	1514	D Plouffe
930	DOCTOR	1520	1530	D Johnstad
933	MEDICALRECORD	1	11	366195.CEM
933	PATIENT	12	27	BLEICH, WILLIAN
933	IDNUM	28	36	36R19511
933	DATE	52	61	18/3/2063	2063-03-18
933	DOCTOR	535	543	I Mullet
933	DOCTOR	550	560	I Landacre
933	TIME	564	581	13.45 on 11.01.13	2013-01-11T13:45
933	DOCTOR	611	619	I Svinth
934	IDNUM	14	24	57I896973Z
934	MEDICALRECORD	25	36	5738969.THZ
934	PATIENT	38	73	MOMPER, Waylon Tyrone Donnell CECIL
934	IDNUM	84	92	57I89697
934	IDNUM	93	101	57I89697
934	STREET	102	114	Jones Branch
934	CITY	115	123	COOKTOWN
934	STATE	125	127	NT
934	ZIP	129	133	3996
934	DATE	165	174	13/3/1996	1996-03-13
934	TIME	194	213	29/01/2013 at 20:42	2013-01-29T20:42
934	DEPARTMENT	225	243	OPERATING THEATRES
934	HOSPITAL	246	262	BUNBURY HOSPITAL
934	DOCTOR	265	284	NILSA VERTIE CZOSEK
934	DOCTOR	303	308	AARON
934	DATE	2159	2165	3/2/63	2063-03-02
934	DOCTOR	2195	2203	W Varaza
934	DOCTOR	2857	2864	W Chafe
935	IDNUM	13	23	05E827031I
935	MEDICALRECORD	24	34	051827.BID
935	PATIENT	36	50	Dastrup, ERROL
935	IDNUM	61	69	05E82703
935	STREET	70	88	Holme Wood Heysham
935	CITY	89	98	BROADFORD
935	STATE	100	115	New South Wales
935	ZIP	117	121	0815
935	DATE	147	156	16/6/1997	1997-06-16
935	TIME	176	195	17/01/2013 at 08:58	2013-01-17T08:58
935	DEPARTMENT	207	223	ONCOLOGY (GYNAE)
935	HOSPITAL	224	243	HERVEY BAY HOSPITAL
935	DOCTOR	247	272	ZACHARIAH MONROE Boroughs
935	DATE	347	355	4.7.2063	2063-07-04
935	DOCTOR	384	393	B Garling
935	DOCTOR	2094	2096	BK
935	DATE	2100	2107	19.3.63	2063-03-19
935	DOCTOR	2139	2150	B Mcfarland
935	DATE	2153	2162	20.3.2063	2063-03-20
936	IDNUM	13	23	63A847189Q
936	MEDICALRECORD	24	34	630847.CXY
936	PATIENT	36	49	Dumas, JONELL
936	IDNUM	60	68	63A84718
936	STREET	69	75	Zoumar
936	CITY	76	81	COOMA
936	STATE	83	91	Victoria
936	ZIP	93	97	1825
936	DATE	123	133	23/12/2036	2036-12-23
936	TIME	153	172	17/01/2013 at 08:57	2013-01-17T08:57
936	DEPARTMENT	184	202	MEDIC/SURGERY WARD
936	HOSPITAL	203	240	NARROMINE HOSPITAL & COMMUNITY HEALTH
936	DOCTOR	244	267	DHIRRIL Felix BROSCIOUS
936	DOCTOR	2141	2143	OD
936	DATE	2147	2154	19/3/63	2063-03-19
936	DOCTOR	2501	2503	UJ
936	DATE	2507	2514	18/3/63	2063-03-18
936	DOCTOR	2547	2554	Q Blain
937	IDNUM	14	24	84S4480470
937	MEDICALRECORD	25	36	8474480.LTC
937	PATIENT	38	50	OLIVE, KEIKO
937	IDNUM	61	69	84S44804
937	IDNUM	70	78	84S44804
937	STREET	79	85	Gondek
937	CITY	86	96	RUTHERFORD
937	STATE	98	100	WA
937	ZIP	102	106	6074
937	DATE	141	150	17/5/2003	2003-05-17
937	TIME	170	189	23/01/2013 at 19:07	2013-01-23T19:07
937	DEPARTMENT	201	218	DICKINSON 2 SOUTH
937	HOSPITAL	221	241	OMEO DISTRICT HEALTH
937	DOCTOR	245	258	Ja Vena LASLO
937	DATE	3379	3386	25.3.63	2063-03-25
937	DOCTOR	3418	3427	V Rothgeb
937	DATE	4314	4321	16/1/63	2063-01-16
938	MEDICALRECORD	1	12	3255690.APK
938	PATIENT	13	24	SPAR, ABDUL
938	IDNUM	25	33	32O56900
938	DATE	49	58	25/3/2063	2063-03-25
938	DOCTOR	705	707	LF
938	DATE	712	719	20/3/63	2063-03-20
938	DOCTOR	750	758	J Regner
938	DOCTOR	764	774	J Forguson
939	MEDICALRECORD	1	12	0693093.COF
939	PATIENT	13	29	BIERLE, Norberto
939	IDNUM	30	38	06Y30930
939	DATE	54	63	24/3/2063	2063-03-24
939	DOCTOR	742	744	XN
939	DATE	749	756	20/3/63	2063-03-20
939	DOCTOR	789	800	C Rosenfeld
940	IDNUM	13	23	11B181012E
940	MEDICALRECORD	24	35	1101810.EGE
940	PATIENT	37	56	FAZZI, CLAYTON'EMMA
940	IDNUM	67	75	11B18101
940	STREET	76	85	Cityhomes
940	CITY	86	99	CENTRAL COAST
940	STATE	101	103	SA
940	ZIP	105	109	5601
940	DATE	135	144	17/2/2009	2009-02-17
940	DATE	164	173	19/3/2063	2063-03-19
940	DEPARTMENT	190	213	POST OPERATIVE RECOVERY
940	HOSPITAL	214	243	DALBY HOSPITAL HEALTH SERVICE
940	DOCTOR	247	267	Desmond Carol CORRAO
940	DATE	338	344	2.3.63	2063-03-02
940	DOCTOR	2464	2466	SZ
940	DATE	2471	2478	20/3/63	2063-03-20
940	DOCTOR	2511	2520	D Harnage
940	DOCTOR	2526	2536	D Ruffaner
940	DATE	4545	4551	2/3/63	2063-03-02
940	DOCTOR	4595	4605	D Cuaresma
940	HOSPITAL	4607	4648	COLLINSVILLE MULTI-PURPOSE HEALTH SERVICE
941	MEDICALRECORD	1	12	8540303.FEZ
941	PATIENT	13	27	Stuever, LOUIE
941	IDNUM	28	36	85L03032
941	DATE	52	61	26/3/2063	2063-03-26
941	DOCTOR	1515	1517	JM
941	DOCTOR	1518	1520	BA
941	DOCTOR	1522	1524	KP
941	DATE	1528	1535	23/3/63	2063-03-23
941	DOCTOR	1565	1572	R Welms
941	DOCTOR	2167	2181	LEIGHANN HYSON
941	DOCTOR	2189	2204	William Difiore
942	IDNUM	14	24	33H051470I
942	MEDICALRECORD	25	35	332051.KUA
942	PATIENT	37	58	SCHWARTZBACH, Mellisa
942	IDNUM	69	77	33H05147
942	STREET	78	88	Brambletye
942	CITY	89	97	YARRAGON
942	STATE	97	100	TAS
942	ZIP	102	106	6333
942	DATE	132	140	5/6/2014	2014-06-05
942	TIME	160	179	18/01/2013 at 12:21	2013-01-18T12:21
942	DEPARTMENT	191	208	CORONARYCARE UNIT
942	HOSPITAL	209	237	CONDOBOLIN DISTRICT HOSPITAL
942	DOCTOR	241	261	EFRAIN Kamila GUCKIN
942	AGE	321	323	53
942	DOCTOR	899	906	K Allen
942	DOCTOR	914	921	K Dedaj
942	TIME	925	942	2.30pm on 18/1/13	2013-01-18T14:30
942	DATE	960	967	20/3/63	2063-03-20
942	DATE	1224	1231	23/3/63	2063-03-23
942	DOCTOR	1266	1274	K Reifel
943	IDNUM	13	23	48L823086H
943	MEDICALRECORD	24	35	4848230.WSH
943	PATIENT	37	55	RUSHTON, FILIBERTO
943	IDNUM	66	74	48L82308
943	STREET	75	85	East Huron
943	CITY	86	94	WESTBURY
943	STATE	96	98	WA
943	ZIP	100	104	2209
943	DATE	130	138	7/8/1989	1989-08-07
943	TIME	158	177	21/01/2013 at 09:11	2013-01-21T09:11
943	DEPARTMENT	189	198	StVincent
943	HOSPITAL	199	231	JERILDERIE MULTI PURPOSE SERVICE
943	DOCTOR	235	260	Kennith BERNARDO PLATANIA
943	DATE	332	339	26.3.63	2063-03-26
943	IDNUM	442	450	48L82308
943	DOCTOR	2317	2319	UA
943	DOCTOR	2321	2323	SH
943	DATE	2327	2334	23/3/63	2063-03-23
943	DOCTOR	2364	2370	LLeigh
943	DATE	4563	4570	26.3.63	2063-03-26
944	IDNUM	13	23	96H854045P
944	MEDICALRECORD	24	35	9638540.LNP
944	PATIENT	37	56	LUCAS, SAMUAL-Siena
944	IDNUM	67	75	96H85404
944	STREET	76	89	N Rock Spring
944	CITY	90	98	GOULBURN
944	STATE	100	102	WA
944	ZIP	104	108	4407
944	DATE	134	143	16/8/2022	2022-08-16
944	DEPARTMENT	187	191	HAPS
944	HOSPITAL	192	219	SACRED HEART HEALTH SERVICE
944	DOCTOR	223	245	MITCHEL WALTON Hollack
944	DOCTOR	1033	1035	CE
944	DOCTOR	1037	1039	VD
944	DATE	1043	1050	25.3.63	2063-03-25
944	DOCTOR	1081	1091	Z Mokriski
945	IDNUM	14	24	54E974103Y
945	MEDICALRECORD	25	36	5419741.AIY
945	PATIENT	38	59	Costin, FOSTER Eilene
945	IDNUM	69	77	54E97410
945	STREET	78	89	Balderstone
945	CITY	90	97	BUNBURY
945	STATE	99	116	Western Australia
945	ZIP	118	122	4208
945	DATE	148	156	7/5/1994	1994-07-05
945	DATE	176	185	25/3/2063	2063-03-25
945	DEPARTMENT	202	224	PRINCE OF WALESPRIVATE
945	HOSPITAL	225	267	SOUTH WEST HEALTHCARE - WARRNAMBOOL CAMPUS
945	DOCTOR	271	296	Tynisha SAFFRON Fulginiti
945	DATE	345	352	22.7.63	2063-07-22
945	DATE	2765	2772	25/3/63	2063-03-25
945	DOCTOR	2807	2814	N Gritz
945	DATE	5190	5193	now	2062-11-27
945	DATE	5255	5262	22.7.63	2063-07-22
946	IDNUM	13	23	74V575051J
946	MEDICALRECORD	24	35	7485750.PEJ
946	PATIENT	37	59	WESTLUND, MAGNOLIA Asa
946	IDNUM	70	78	74V57505
946	STREET	79	96	Nethercliffe Hall
946	CITY	97	109	SUFFOLK PARK
946	STATE	111	126	New South Wales
946	ZIP	128	132	1237
946	DATE	158	166	9/3/2034	2034-09-03
946	DATE	186	195	13/4/2063	2063-04-13
946	DEPARTMENT	212	217	Envoi
946	HOSPITAL	220	237	NORSEMAN HOSPITAL
946	DOCTOR	241	261	HONEY KEITHA Tabbert
946	DATE	494	498	2059	2059
946	DOCTOR	1196	1205	Filsinger
946	DOCTOR	1212	1220	S Balius
946	TIME	1223	1239	13:42 on 11/2/13	2013-02-11T13:42
946	DOCTOR	1593	1602	S Percell
946	TIME	1606	1622	14:07 on 11/2/13	2013-02-11T14:07
946	DOCTOR	5032	5034	PT
946	DOCTOR	5036	5038	LE
946	DATE	5042	5049	14/4/63	2063-04-14
946	DOCTOR	5079	5085	C Afan
947	IDNUM	13	23	22R596019S
947	MEDICALRECORD	24	35	2265960.EZS
947	PATIENT	37	55	Morrish, Nathaniel
947	IDNUM	66	74	22R59601
947	STREET	75	83	S Bruner
947	CITY	84	91	YEPPOON
947	STATE	93	96	VIC
947	ZIP	98	102	3260
947	DATE	128	136	4/2/1974	1974-02-04
947	DATE	156	165	24/3/2063	2063-03-24
947	DEPARTMENT	182	205	POW L7 CONSULTING ROOMS
947	HOSPITAL	206	230	PORTLAND DISTRICT HEALTH
947	DOCTOR	234	249	Hugh Ken DICKEL
947	DOCTOR	1196	1198	WS
947	DATE	1203	1210	25/3/63	2063-03-25
947	DOCTOR	1243	1254	H Langsdale
948	IDNUM	14	24	80N5171770
948	MEDICALRECORD	25	36	8055171.TUA
948	PATIENT	38	56	Sybert, Calvin Del
948	IDNUM	67	75	80N51717
948	STREET	76	80	Send
948	CITY	81	88	BLI BLI
948	STATE	90	100	Queensland
948	ZIP	102	106	2569
948	DATE	132	141	27/7/2039	2039-07-27
948	DATE	161	170	25/3/2063	2063-03-25
948	DEPARTMENT	187	204	DICKINSON 2 SOUTH
948	HOSPITAL	207	229	BENTLEY HEALTH SERVICE
948	DOCTOR	233	253	Diedra Hilde Timpson
948	DOCTOR	767	777	V Vanosdel
948	DOCTOR	778	786	V Furino
948	TIME	790	807	9:55am on 23/1/13	2013-01-23T09:55
948	DATE	3454	3461	25.3.63	2063-03-25
948	DOCTOR	3493	3503	V Jankoski
949	IDNUM	13	23	01F2180264
949	MEDICALRECORD	24	35	0112180.HQL
949	PATIENT	37	54	Kilgallon, Lavera
949	IDNUM	65	73	01F21802
949	IDNUM	74	82	01F21802
949	STREET	83	96	Lincoln Knoll
949	CITY	97	105	NUMURKAH
949	STATE	107	117	Queensland
949	ZIP	119	123	6172
949	DATE	158	167	30/5/1997	1997-05-30
949	DATE	187	196	25/3/2063	2063-03-25
949	DEPARTMENT	213	217	IMVS
949	HOSPITAL	220	237	MENINGIE HOSPITAL
949	DOCTOR	241	262	NILDA SELINA AL-FAHAD
949	DOCTOR	2739	2747	A Binger
949	DOCTOR	2754	2762	AForrest
949	TIME	2766	2784	1.20pm on 23.01.13	2013-01-23T13:20
949	DOCTOR	3099	3101	KR
949	DOCTOR	3103	3105	AF
949	DATE	3109	3116	26.3.63	2063-03-26
949	DOCTOR	3149	3156	A Slown
950	IDNUM	14	24	59B238084U
950	MEDICALRECORD	25	36	5902380.WLU
950	PATIENT	38	59	Embury, Pedro Scottie
950	IDNUM	70	78	59B23808
950	STREET	79	86	Riethel
950	CITY	87	95	CESSNOCK
950	STATE	97	107	Queensland
950	ZIP	109	113	5061
950	DATE	139	149	27/11/1979	1979-11-27
950	TIME	169	188	24/01/2013 at 17:30	2013-01-24T17:30
950	DEPARTMENT	200	211	UROLOGY OPD
950	HOSPITAL	212	228	MULLEWA HOSPITAL
950	DOCTOR	232	252	JEAN Tyrone Pounders
950	DATE	369	373	2061	2061
950	DATE	2852	2859	27/3/63	2063-03-27
950	DOCTOR	2892	2902	P Barcello
950	IDNUM	4297	4305	59B23808
950	DOCTOR	4369	4379	P Brundage
951	IDNUM	13	23	33K088493P
951	MEDICALRECORD	24	35	3340884.XKP
951	PATIENT	37	61	Boehler, Alexandra Arlen
951	IDNUM	72	80	33K08849
951	STREET	81	87	Yeadon
951	CITY	88	96	ROSEBERY
951	STATE	98	101	QLD
951	ZIP	103	107	6913
951	DATE	133	143	16/11/2004	2004-11-16
951	TIME	163	182	25/01/2013 at 17:25	2013-01-25T17:25
951	DEPARTMENT	194	211	ST GEORGE PRIVATE
951	HOSPITAL	212	232	GOONDIWINDI HOSPITAL
951	DOCTOR	236	255	MICHAEL Gary TESLOW
951	DOCTOR	1456	1458	ND
951	DATE	1462	1468	1/3/63	2063-03-01
951	DOCTOR	1502	1510	H Hebron
951	DATE	1513	1521	2.3.2063	2063-03-02
951	DOCTOR	3607	3620	H Mardirosian
952	IDNUM	13	23	38O850000O
952	MEDICALRECORD	24	34	385850.AAC
952	PATIENT	36	61	FEIGHNER, ALFREDO-Leonore
952	IDNUM	72	80	38O85000
952	STREET	81	87	Staton
952	CITY	88	100	HEDDON GRETA
952	STATE	102	112	Queensland
952	ZIP	114	118	4230
952	DATE	149	157	2/5/2010	2010-05-02
952	TIME	177	196	31/01/2013 at 09:16	2013-01-31T09:16
952	DEPARTMENT	208	229	Hunter Area Pathology
952	HOSPITAL	230	261	ST VINCENT'S HOSPITAL (LISMORE)
952	DOCTOR	265	287	Ian Reinaldo PETCHULIS
952	DOCTOR	484	497	Kassie Dumars
952	DOCTOR	2915	2917	BN
952	DATE	2921	2927	3.3.63	2063-03-03
952	DOCTOR	2960	2967	I Boley
952	DOCTOR	2973	2978	I Bon
952	DATE	4898	4902	2060	2060
953	IDNUM	14	24	86L981059W
953	MEDICALRECORD	25	35	864981.CPX
953	PATIENT	37	54	SPELLER, Roy KIRK
953	IDNUM	65	73	86L98105
953	STREET	74	78	Keli
953	CITY	79	94	GREENWELL POINT
953	ZIP	98	102	3177
953	DATE	128	137	12/7/2007	2007-12-07
953	TIME	157	175	25/07/2013at 08:56	2013-07-25T08:56
953	DEPARTMENT	187	204	DICKINSON 3 SOUTH
953	HOSPITAL	205	243	EAST WIMMERA HEALTH SERVICE - CHARLTON
953	DOCTOR	247	270	ROSENDO Lenny SCHLUSSEL
953	DOCTOR	324	329	Brady
953	DOCTOR	334	342	Gutirrez
953	DATE	359	367	15/10/63	2063-10-15
953	IDNUM	578	586	86L98105
953	DATE	2806	2813	27/9/63	2063-09-27
953	DOCTOR	2850	2859	X Bobzien
953	DATE	5219	5227	15/10/63	2063-10-15
954	IDNUM	13	23	92D922275O
954	MEDICALRECORD	24	35	9219222.TNO
954	PATIENT	37	52	Caffee, Xandria
954	IDNUM	63	71	92D92227
954	STREET	72	82	Shake Tree
954	CITY	83	90	IPSWICH
954	STATE	92	109	Western Australia
954	ZIP	111	115	5290
954	DATE	141	151	27/11/1989	1989-11-27
954	DEPARTMENT	195	207	RENAL CLINIC
954	HOSPITAL	208	235	GUYRA MULTI PURPOSE SERVICE
954	DOCTOR	239	258	ARNOLDO NIGEL Joynt
954	DOCTOR	1381	1383	EC
954	DATE	1387	1393	9/1/63	2063-09-01
954	DOCTOR	1424	1431	Z Filip
955	IDNUM	13	23	50Z043233W
955	MEDICALRECORD	24	35	5090432.IJW
955	PATIENT	37	49	NESTEL, Jann
955	IDNUM	60	68	50Z04323
955	STREET	69	78	Lark Song
955	CITY	79	94	CHARTERS TOWERS
955	STATE	96	98	WA
955	ZIP	100	104	2629
955	DATE	130	138	2/2/2004	2004-02-02
955	TIME	158	177	30/07/2013 at 08:58	2013-07-30T08:58
955	DEPARTMENT	189	193	IMVS
955	HOSPITAL	194	213	MOUNT ISA  HOSPITAL
955	DOCTOR	217	237	Ernesto Dewitt Feuss
955	DOCTOR	1245	1247	DW
955	DATE	1251	1257	9/2/63	2063-09-02
955	DOCTOR	1287	1295	O Declet
956	IDNUM	14	24	18V0643812
956	MEDICALRECORD	25	36	1880643.XEF
956	PATIENT	38	53	GEBO, JAMES SAM
956	IDNUM	64	72	18V06438
956	STREET	73	78	Grave
956	CITY	79	87	ROSEBERY
956	STATE	87	90	VIC
956	ZIP	92	96	2453
956	DATE	122	131	17/7/2011	2011-07-17
956	TIME	151	170	27/02/2014 at 11:04	2014-02-27T11:04
956	DEPARTMENT	182	211	MOLECULAR DIAGNOSTIC ONCOLOGY
956	HOSPITAL	212	227	INJUNE HOSPITAL
956	DOCTOR	232	249	Finn Duane RACITI
956	DOCTOR	691	698	Leconey
956	TIME	716	733	110Hrs on 27.2.14	2014-02-27T11:00
956	DOCTOR	741	751	C. Nondorf
956	DOCTOR	907	913	Hagler
956	TIME	917	935	1217Hrs on 27.2.14	2014-02-27T12:17
956	DOCTOR	943	952	C. Nezich
956	DOCTOR	1119	1123	Babs
956	TIME	1127	1145	1245Hrs on 27.2.14	2014-02-27T12:45
956	DOCTOR	1153	1161	C. Lidey
956	DOCTOR	2361	2369	C Venske
956	DATE	3870	3876	7/5/64	2064-05-07
958	IDNUM	13	23	65R095349O
958	MEDICALRECORD	24	35	6560953.MZO
958	PATIENT	37	48	Fore, Wyatt
958	IDNUM	59	67	65R09534
958	STREET	68	80	Rocky Spring
958	CITY	81	86	MOAMA
958	STATE	88	106	Northern Territory
958	ZIP	108	112	3608
958	DATE	138	146	1/3/2010	2010-01-03
958	DEPARTMENT	190	204	MACQUARIE WARD
958	HOSPITAL	205	222	JANDOWAE HOSPITAL
958	DOCTOR	226	244	Olen KAREEM Virtue
958	DATE	315	322	14.5.64	2064-05-14
958	DOCTOR	1675	1677	LM
958	DOCTOR	1678	1680	UY
958	DATE	1684	1691	20.4.64	2064-04-20
958	DOCTOR	1725	1734	R Accetta
958	HOSPITAL	2353	2403	GREAT OCEAN ROAD HEALTH - LORNE COMMUNITY HOSPITAL
958	DATE	2538	2545	14.5.64	2064-05-14
958	HOSPITAL	2559	2586	WALCHA MULTIPURPOSE SERVICE
958	CITY	2600	2606	COBDEN
958	DOCTOR	2622	2629	R. Math
958	IDNUM	2749	2759	65R09534.9
958	PATIENT	2760	2764	Denk
959	MEDICALRECORD	1	12	2351154.BUW
959	PATIENT	13	28	PAVOLINI, JANET
959	IDNUM	29	37	23N11540
959	IDNUM	38	46	23N11540
959	DATE	62	70	6/5/2064	2064-05-06
959	DOCTOR	1709	1711	WZ
959	DATE	1715	1722	28.4.64	2064-04-28
959	DOCTOR	1752	1764	F Vonsoosten
960	IDNUM	13	23	44F716366H
960	MEDICALRECORD	24	34	442716.IPQ
960	PATIENT	36	46	Volk, JAME
960	IDNUM	57	65	44F71636
960	IDNUM	66	74	44F71636
960	STREET	75	86	Borers Arms
960	CITY	87	92	DUBBO
960	STATE	94	97	TAS
960	ZIP	99	103	1314
960	DATE	135	143	5/4/2000	2000-04-05
960	DATE	163	172	12/5/2064	2064-05-12
960	DEPARTMENT	189	205	ONCOLOGY (GYNAE)
960	HOSPITAL	206	251	RURAL NORTHWEST HEALTH - WARRACKNABEAL CAMPUS
960	DOCTOR	255	277	ANTONE CARMINE ANTOLAK
960	DOCTOR	1132	1141	K Sangren
960	DOCTOR	1149	1156	K Morro
960	TIME	1160	1177	4:10pm on 10.3.14	2014-03-10T16:10
960	DOCTOR	1734	1744	K Rossetto
960	DOCTOR	1752	1758	K Buda
960	TIME	1762	1779	4:20pm on 10.3.14	2014-03-10T16:20
960	DOCTOR	4828	4830	CN
960	DOCTOR	4831	4833	HH
960	DATE	4837	4844	13.5.64	2064-05-13
960	DOCTOR	4875	4884	K Kinnier
961	IDNUM	13	23	92B737314Q
961	MEDICALRECORD	24	35	9207373.ELQ
961	PATIENT	37	50	Seta, Keturah
961	IDNUM	61	69	92B73731
961	STREET	70	90	Bull Run Post Office
961	CITY	91	103	CAMPBELLTOWN
961	STATE	105	115	Queensland
961	ZIP	117	121	2079
961	DATE	147	155	9/5/1999	1999-09-05
961	DATE	175	183	5/7/2064	2064-05-07
961	DEPARTMENT	200	218	MEDIC/SURGERY WARD
961	HOSPITAL	221	238	YARRAWONGA HEALTH
961	DOCTOR	242	262	Ismael DERICK Hulton
961	DOCTOR	316	325	ALEJANDRO
961	DATE	348	355	13.5.64	2064-05-13
961	DOCTOR	1548	1550	EK
961	DATE	1554	1560	5/8/64	2064-05-08
961	DOCTOR	1591	1599	Y Hosten
961	DATE	2854	2861	13.5.64	2064-05-13
962	IDNUM	14	24	13S338272B
962	MEDICALRECORD	25	36	1373382.THB
962	PATIENT	38	56	RAHIB, Daron Kisha
962	IDNUM	67	75	13S33827
962	STREET	76	87	Slumberland
962	CITY	88	97	RASMUSSEN
962	STATE	99	107	Victoria
962	ZIP	109	113	2570
962	DATE	139	148	2/10/2027	2027-10-02
962	DATE	168	177	20/4/2064	2064-04-20
962	DEPARTMENT	194	210	ONCOLOGY (GYNAE)
962	HOSPITAL	213	229	WUDINNA HOSPITAL
962	DOCTOR	233	254	Angelique JUDE Floore
962	DATE	3708	3715	22/4/64	2064-04-22
962	DOCTOR	3748	3755	E Renda
963	IDNUM	13	23	71P459330K
963	MEDICALRECORD	24	35	7154593.ICK
963	PATIENT	37	60	Meynard, HUNTER Jeffrey
963	IDNUM	71	79	71P45933
963	LOCATION-OTHER	80	91	PO BOX 1322
963	CITY	92	102	WELLINGTON
963	STATE	104	119	New South Wales
963	ZIP	121	125	3315
963	DATE	151	160	8/10/2022	2022-08-10
963	DEPARTMENT	204	231	DEPT OF CORRECTIVE SERVICES
963	HOSPITAL	232	251	LAKE GRACE HOSPITAL
963	DOCTOR	255	281	PHILLIP ASHTONJACK ORGOVAN
963	DOCTOR	886	897	S Gallegher
963	DOCTOR	905	915	S Pinheiro
963	TIME	919	937	10:20am on 10.3.14	2014-03-10T10:20
963	DOCTOR	5209	5211	MZ
963	DOCTOR	5212	5214	OZ
963	DATE	5218	5225	13.5.64	2064-05-13
963	DOCTOR	5256	5263	S Steel
974	MEDICALRECORD	2	13	2944794.XXS
974	PATIENT	14	37	OGILVIE, Louie Marc Ian
974	IDNUM	38	46	29L47948
974	IDNUM	47	55	29L47948
974	DATE	71	80	16/5/2064	2064-05-16
974	DATE	1778	1785	15.5.64	2064-05-15
974	DOCTOR	1818	1827	G Lantaff
976	IDNUM	13	23	87H400447B
976	MEDICALRECORD	24	35	8724004.MSB
976	PATIENT	37	57	Oder, ROLANDO Jackie
976	IDNUM	68	76	87H40044
976	IDNUM	77	85	87H40044
976	STREET	86	99	Gibbons Ranch
976	CITY	100	109	GLADSTONE
976	STATE	111	128	Western Australia
976	ZIP	130	134	6917
976	DATE	169	178	18/8/2014	2014-08-18
976	DATE	198	207	7/10/2063	2063-07-10
976	DEPARTMENT	223	231	RECOVERY
976	HOSPITAL	234	253	BARCALDINE HOSPITAL
976	DOCTOR	257	278	REGGIE Granville COMP
976	DATE	347	354	18/7/63	2063-07-18
976	DATE	493	498	today	2062-09-13
976	DOCTOR	1063	1070	Logston
976	DOCTOR	1092	1103	V Roshannon
976	TIME	1107	1124	10:20am on 8.5.13	2013-05-08T10:20
976	DOCTOR	3837	3839	QG
976	DATE	3843	3850	7.11.63	2063-07-11
976	DOCTOR	3884	3893	V Phegley
976	DOCTOR	6732	6741	V Stfleur
976	DATE	7536	7543	18/7/63	2063-07-18
976	DATE	7750	7759	19/5/2064	2064-05-19
978	MEDICALRECORD	1	12	8242720.OKA
978	PATIENT	13	40	SBARRA, Jin ANTONIA Orville
978	IDNUM	41	49	82L27205
978	IDNUM	50	58	82L27205
978	DATE	73	82	20/5/2064	2064-05-20
978	DOCTOR	1769	1771	FD
978	DOCTOR	1774	1776	PQ
978	DATE	1780	1787	15.5.64	2064-05-15
978	DOCTOR	1820	1828	W Hoppel
978	DOCTOR	2320	2333	W Huffstetler
978	DATE	2335	2342	20.5.64	2064-05-20
979	IDNUM	14	24	56U1224638
979	MEDICALRECORD	25	36	5681224.PJV
979	PATIENT	38	56	PINK, AURORE Twana
979	IDNUM	67	75	56U12246
979	STREET	76	82	Raptor
979	CITY	83	90	OLD BAR
979	STATE	92	107	New South Wales
979	ZIP	109	113	6030
979	DATE	139	149	12/11/2000	2000-12-11
979	TIME	169	188	11/03/2014 at 11:30	2014-03-11T11:30
979	DEPARTMENT	200	230	SOUTH SURGICAL ASSESSMENT UNIT
979	HOSPITAL	231	250	BARCALDINE HOSPITAL
979	DOCTOR	254	274	Randy KIESHA Ebrahim
979	DATE	5253	5260	16/5/64	2064-05-16
979	DOCTOR	5262	5274	K Retherford
980	MEDICALRECORD	1	12	1461424.EED
980	PATIENT	13	32	Uzdygan, Jewel DYAN
980	IDNUM	33	41	14R14241
980	DATE	57	66	20/5/2064	2064-05-20
980	ORGANIZATION	126	139	Liberty Media
980	HOSPITAL	141	158	MUNGINDI HOSPITAL
980	DOCTOR	163	173	D Serapion
980	IDNUM	204	212	14R14241
980	DOCTOR	781	788	D Trent
980	DATE	795	804	20.5.2064	2064-05-20
981	IDNUM	14	24	19V924028D
981	MEDICALRECORD	25	36	1989240.GWD
981	PATIENT	38	71	Kinlock, STERLING, Kaitlyn'Isidro
981	IDNUM	82	90	19V92402
981	STREET	91	97	Stones
981	CITY	98	110	THE ENTRANCE
981	STATE	112	115	VIC
981	ZIP	117	121	1314
981	DATE	147	157	20/12/2013	2013-12-20
981	TIME	177	196	12/03/2014 at 11:14	2014-03-12T11:14
981	DEPARTMENT	208	218	Anatomical
981	HOSPITAL	219	237	ESPERANCE HOSPITAL
981	DOCTOR	241	260	Willis CEDRICK-Pong
981	DATE	2832	2839	15.5.64	2064-05-15
981	DOCTOR	2872	2882	D Rabenold
981	ORGANIZATION	4464	4491	American Standard Companies
981	HOSPITAL	4493	4507	MONTO HOSPITAL
983	IDNUM	13	23	77R045186L
983	MEDICALRECORD	24	35	7760451.VRL
983	PATIENT	37	67	Newnham, RICKIE, MAHALIA'DAMON
983	IDNUM	78	86	77R04518
983	STREET	87	93	Centre
983	CITY	94	102	GRIFFITH
983	STATE	104	107	VIC
983	ZIP	109	113	5022
983	DATE	139	149	20/12/2013	2013-12-20
983	TIME	169	188	12/03/2014 at 11:14	2014-03-12T11:14
983	DEPARTMENT	200	204	West
983	HOSPITAL	205	221	BILOELA HOSPITAL
983	DOCTOR	225	254	Edison NORRIS Barry-PALMERTON
983	DOCTOR	2855	2857	DD
983	DATE	2861	2868	15.5.64	2064-05-15
983	DOCTOR	2901	2911	S Guterman
983	ORGANIZATION	4493	4499	Pfizer
983	HOSPITAL	4501	4549	AUSTIN HEALTH - HEIDELBERG REPATRIATION HOSPITAL
984	IDNUM	13	23	40A885486G
984	MEDICALRECORD	24	35	4008854.XQG
984	PATIENT	37	50	Doucet, Lilly
984	IDNUM	61	69	40A88548
984	IDNUM	70	78	40A88548
984	STREET	79	92	Vineyard View
984	CITY	93	107	PEREGIAN BEACH
984	STATE	109	124	New South Wales
984	ZIP	126	130	0839
984	DATE	165	174	5/10/1987	1987-10-05
984	DEPARTMENT	218	231	CPC Pathology
984	HOSPITAL	234	263	SOUTH COAST DISTRICT HOSPITAL
984	DOCTOR	267	286	PARKER MERISSA Safa
984	AGE	370	372	81
984	DOCTOR	3616	3618	SO
984	DATE	3622	3629	8.10.63	2063-10-08
984	DOCTOR	3659	3670	G Gantvoort
984	DOCTOR	3676	3683	G Veals
985	IDNUM	14	24	45E667093F
985	MEDICALRECORD	25	35	451667.CZI
985	PATIENT	37	65	Horikoshi, GEORGIE Sebastian
985	IDNUM	76	84	45E66709
985	IDNUM	85	93	45E66709
985	STREET	94	101	Phleger
985	CITY	102	112	GLEN INNES
985	STATE	114	122	Tasmania
985	ZIP	124	128	2453
985	DATE	160	169	21/1/1997	1997-01-21
985	DATE	189	198	19/5/2064	2064-05-19
985	DEPARTMENT	214	234	Anatomical Pathology
985	HOSPITAL	237	262	KEMPSEY DISTRICT HOSPITAL
985	DOCTOR	266	283	ALDA YAWURU EVERT
985	TIME	1099	1106	15:50pm	2014-03-17T15:50
985	DOCTOR	1113	1124	Tad Clarson
985	DATE	1132	1141	19.5.2064	2064-05-19
985	DATE	2625	2632	20.5.64	2064-05-20
985	DOCTOR	2662	2669	L Kapps
988	IDNUM	13	23	03A687151O
988	MEDICALRECORD	24	35	0306871.OEO
988	PATIENT	37	66	GROSSHANS, Lieselotte DESMOND
988	IDNUM	77	85	03A68715
988	IDNUM	86	94	03A68715
988	STREET	95	106	Montmorenci
988	CITY	107	117	RED CLIFFS
988	STATE	119	121	NT
988	ZIP	123	127	4514
988	DATE	159	169	15/11/2004	2004-11-15
988	DATE	189	198	20/5/2064	2064-05-20
988	DEPARTMENT	215	233	South Western Area
988	HOSPITAL	236	275	EDENHOPE AND DISTRICT MEMORIAL HOSPITAL
988	DOCTOR	279	299	DENVER Jamaal REEKIE
988	DATE	411	415	2059	2059
988	DATE	1201	1205	2059	2059
988	DOCTOR	1220	1227	Gallwas
988	DOCTOR	1255	1267	A Fieldhouse
988	TIME	1271	1288	9:30am on 18/3/14	2014-03-18T09:30
988	DOCTOR	1815	1817	XO
988	DATE	1821	1828	21/5/64	2064-05-21
988	DOCTOR	1859	1868	A Cocuzza
988	HOSPITAL	2230	2246	AUGUSTA HOSPITAL
988	IDNUM	2455	2463	03A68715
989	MEDICALRECORD	1	12	5187082.DZW
989	PATIENT	13	26	Weihe, Dwight
989	IDNUM	27	35	51X70821
989	DATE	51	60	22/5/2064	2064-05-22
989	DOCTOR	385	387	XA
989	DOCTOR	388	390	GF
989	DATE	396	403	16.5.64	2064-05-16
989	DOCTOR	436	445	O Lunford
989	DOCTOR	461	470	O Montero
990	IDNUM	13	23	19T7392772
990	MEDICALRECORD	24	35	1977392.SUF
990	PATIENT	37	53	Hainline, FALLON
990	IDNUM	64	72	19T73927
990	STREET	73	83	S Crandall
990	CITY	84	93	COONAMBLE
990	STATE	95	98	QLD
990	ZIP	100	104	2118
990	DATE	130	138	3/9/1987	1987-09-03
990	TIME	158	177	12/03/2014 at 13:15	2014-03-12T13:15
990	DEPARTMENT	189	201	Southern IML
990	HOSPITAL	202	222	ROXBY DOWNS HOSPITAL
990	DOCTOR	226	240	JUDE MASTROLIA
990	DOCTOR	696	704	D Hagler
990	DOCTOR	717	727	D Cantrall
990	TIME	731	749	14.40 on 12/.03.14	2014-03-12T14:40
990	DOCTOR	954	956	OZ
990	DATE	960	967	15.5.64	2064-05-15
990	DOCTOR	1000	1006	D Tela
991	IDNUM	13	23	67P750326N
991	MEDICALRECORD	24	34	675750.IHP
991	PATIENT	36	57	ROBBIE, Noble Andreas
991	IDNUM	68	76	67P75032
991	STREET	77	83	Delton
991	CITY	84	91	KYABRAM
991	STATE	93	103	Queensland
991	ZIP	105	109	2168
991	DATE	135	145	27/11/2003	2003-11-27
991	TIME	165	184	28/01/2014 at 15:03	2014-01-28T15:03
991	DEPARTMENT	196	209	DARLING POINT
991	HOSPITAL	212	229	WALLAROO HOSPITAL
991	DOCTOR	233	255	Maria GRADY MCLAUGHLAN
991	DOCTOR	274	278	LIAM
991	DOCTOR	1734	1736	MZ
991	DATE	1740	1746	1.3.64	2064-03-01
991	DOCTOR	1776	1784	A Seiler
991	ORGANIZATION	3258	3270	Beazer Homes
991	HOSPITAL	3272	3295	WERRIBEE MERCY HOSPITAL
993	IDNUM	14	24	09Y051132K
993	MEDICALRECORD	25	35	099051.CKH
993	PATIENT	37	55	Herington, Quinton
993	IDNUM	66	74	09Y05113
993	STREET	75	83	Wakemore
993	CITY	84	94	CAMPERDOWN
993	STATE	96	99	TAS
993	ZIP	101	105	5151
993	DATE	131	140	30/8/2003	2003-08-30
993	TIME	160	179	17/01/2014 at 08:56	2014-01-17T08:56
993	DEPARTMENT	191	212	3HR STAY SURGICALUNIT
993	HOSPITAL	213	232	BARWON HEALTH NORTH
993	DOCTOR	236	257	Merrill Virgil Ereaux
993	DATE	356	364	8.5.2064	2064-05-08
993	DATE	2114	2121	19/3/64	2064-03-19
993	DOCTOR	2152	2160	B Zoutte
993	DEPARTMENT	2455	2462	Laverty
993	IDNUM	2483	2496	09-YANF 13231
993	PATIENT	2497	2505	Wyont, B
993	IDNUM	2506	2515	099051132
993	DOCTOR	2546	2554	B Depung
993	IDNUM	2555	2563	09Y05113
993	DATE	3827	3835	8.5.2064	2064-05-08
993	HOSPITAL	3850	3893	KINGAROY HOSPITAL & COMMUNITY HEALTH CENTRE
993	DOCTOR	3920	3933	Riede, German
993	DATE	3934	3942	6.5.2064	2064-05-06
993	HOSPITAL	3970	3990	SANDRINGHAM HOSPITAL
993	CITY	4000	4006	MACKAY
993	IDNUM	4026	4034	09Y05113
994	IDNUM	13	23	67U072190S
994	MEDICALRECORD	24	35	6770721.ZCS
994	PATIENT	37	52	Denni, Madalene
994	IDNUM	63	71	67U07219
994	STREET	72	81	Residency
994	CITY	82	91	FRANKSTON
994	STATE	93	96	VIC
994	ZIP	98	102	3977
994	DATE	128	137	10/5/1987	1987-10-05
994	TIME	157	176	20/03/2014 at 14:54	2014-03-20T14:54
994	DEPARTMENT	188	193	PaLMS
994	HOSPITAL	196	208	ESK HOSPITAL
994	DOCTOR	212	245	PHILLIP AUGUSTINE Guadalupe-KOZMA
994	DOCTOR	2711	2713	XH
994	DATE	2717	2724	23/5/64	2064-05-23
994	DOCTOR	2757	2764	Q Eynon
994	ORGANIZATION	3787	3800	United Parcel
994	HOSPITAL	3802	3839	SHOALHAVEN DISTRICT MEMORIAL HOSPITAL
995	IDNUM	13	23	15Q093259B
995	MEDICALRECORD	24	34	156093.FOX
995	PATIENT	36	58	OLSTEN, Hilario Twanda
995	IDNUM	69	77	15Q09325
995	STREET	78	87	Montville
995	CITY	88	95	PENGUIN
995	STATE	97	107	Queensland
995	ZIP	107	111	2650
995	DATE	137	145	6/3/2024	2024-03-06
995	DEPARTMENT	189	203	Pathology West
995	HOSPITAL	206	253	BLUE MOUNTAINS DISTRICT ANZAC MEMORIAL HOSPITAL
995	DOCTOR	257	282	Art OSVALDO Randy-SENTENO
995	DOCTOR	2362	2364	EP
995	DATE	2368	2375	23/5/64	2064-05-23
995	DOCTOR	2405	2416	E Smeathers
995	HOSPITAL	4115	4149	BAIRNSDALE REGIONAL HEALTH SERVICE
997	MEDICALRECORD	2	12	734114.HDS
997	PATIENT	13	26	Teagle, Moira
997	IDNUM	27	35	73M11421
997	DATE	51	60	27/5/2064	2064-05-27
997	DATE	92	99	27.5.64	2064-05-27
997	DATE	768	774	3.1.64	2064-03-01
997	DOCTOR	804	812	S Asiedu
997	DATE	1150	1157	27.5.64	2064-05-27
997	DOCTOR	1162	1169	S Kahae
998	IDNUM	13	23	94E715165V
998	MEDICALRECORD	24	35	9417151.ROV
998	PATIENT	37	51	BASSETT, JASON
998	IDNUM	62	70	94E71516
998	IDNUM	71	79	94E71516
998	STREET	80	89	Residence
998	CITY	90	104	NAMBUCCA HEADS
998	STATE	106	121	South Australia
998	ZIP	123	127	4709
998	DATE	162	172	13/11/1995	1995-11-13
998	TIME	192	211	03/04/2013 at 14:56	2013-04-03T14:56
998	DEPARTMENT	223	248	INTENSIVE CARE UNIT SOUTH
998	HOSPITAL	249	292	CAPRICORN COAST HOSPITAL AND HEALTH SERVICE
998	DOCTOR	296	319	WADJARRI RAYMON OPATRNY
998	DOCTOR	3546	3548	OZ
998	DOCTOR	3550	3552	DU
998	DATE	3556	3562	6.6.63	2063-06-06
998	DOCTOR	3596	3604	H Voeltz
999	IDNUM	13	23	42A735223D
999	MEDICALRECORD	24	35	4207352.GJD
999	PATIENT	37	52	AARONSON, VALDA
999	IDNUM	63	71	42A73522
999	IDNUM	72	80	42A73522
999	STREET	81	87	Jossie
999	CITY	88	101	COONABARABRAN
999	STATE	103	105	SA
999	ZIP	107	111	6640
999	DATE	146	154	7/5/1992	1992-05-07
999	TIME	174	193	03/04/2013 at 08:58	2013-04-03T08:58
999	DEPARTMENT	205	226	3HR STAY SURGICALUNIT
999	HOSPITAL	229	245	WOOMERA HOSPITAL
999	DOCTOR	249	272	Julianna DIXIE WHETZELL
999	DATE	344	351	24.6.63	2063-06-24
999	DOCTOR	2055	2057	CY
999	DATE	2061	2067	6/6/63	2063-06-06
999	DOCTOR	2100	2109	M Zirkles
999	DATE	2803	2810	24.6.63	2063-06-24
file10073	IDNUM	8	18	09W766281M
file10073	MEDICALRECORD	27	35	09876628
file10073	HOSPITAL	47	70	SCOTT MEMORIAL HOSPITAL
file10073	IDNUM	132	140	09W76628
file10073	IDNUM	142	152	09W766281M
file10073	PATIENT	154	167	GOLOM, Oriane
file10073	DOCTOR	807	822	Mardell Tackett
file10073	DOCTOR	856	866	A. Cudmore
file10073	TIME	870	889	12:37pm on 21/12/17	2017-12-21T12:37
file10073	DOCTOR	1195	1207	Dedra Seldin
file10073	DOCTOR	1215	1225	A. Shoulta
file10073	TIME	1229	1248	12:37pm on 21/12/14	2014-12-21T12:37
file10073	DOCTOR	1513	1528	MELIDA FEURTADO
file10073	DOCTOR	1537	1550	A. Vandervort
file10073	TIME	1554	1573	12:37pm on 22/11/18	2018-11-22T12:37
file10073	DOCTOR	1804	1818	Willow COGGINS
file10073	DOCTOR	1826	1836	A. Melamed
file10073	TIME	1840	1859	12:37pm on 25/11/17	2017-11-25T12:37
file10073	DOCTOR	2132	2143	Mira SYMONS
file10073	DOCTOR	2151	2160	A. Zeliff
file10073	TIME	2164	2183	12:37pm on 22/12/18	2018-12-22T12:37
file10073	DOCTOR	4605	4614	A. Sluder
file10073	DATE	6507	6516	30/1/2068	2068-01-30
file10249	DATE	12	20	20020830	2002-08-30
file10249	HOSPITAL	36	58	GOULBURN BASE HOSPITAL
file10249	PATIENT	71	77	Cagnon
file10249	IDNUM	86	96	57S887349V
file10249	MEDICALRECORD	103	109	577887
file10249	DATE	235	242	7.10.68	2068-07-10
file10249	DATE	268	274	5.8.66	2066-05-08
file10249	DATE	3018	3024	8/7/69	2069-08-07
file10249	DOCTOR	3056	3064	P Ranney
file10249	DATE	5460	5466	4.8.68	2068-04-08
file10249	DATE	5853	5860	4.11.69	2069-04-11
file10249	TIME	6188	6207	2018-02-02 00:00:00	2018-02-02T00:00:00
file10249	PATIENT	6219	6229	Benintendi
file12618	DATE	12	20	20110514	2011-05-14
file12618	HOSPITAL	36	60	PARKES DISTRICT HOSPITAL
file12618	PATIENT	73	82	Lieberman
file12618	IDNUM	91	101	78J4882982
file12618	MEDICALRECORD	108	114	783488
file12618	PATIENT	167	173	Reazer
file12618	IDNUM	225	233	78J48829
file12618	IDNUM	235	245	78J4882982
file12618	PATIENT	247	265	RIEKE, LOREN Marie
file12618	HOSPITAL	289	324	DONGARA MULTI-PURPOSE HEALTH CENTRE
file12618	DOCTOR	782	787	Lewis
file12618	TIME	791	810	3:45pm on 3/04/2019	2019-04-03T15:45
file12618	DOCTOR	818	830	U. Quercioli
file12618	DATE	2834	2842	6/7/2071	2071-06-07
file12618	DOCTOR	2868	2879	U. Languell
file12618	DATE	5639	5647	6/8/2070	2070-06-08
file12618	DOCTOR	6129	6138	U Haffner
file12618	DATE	6145	6152	14.5.74	2074-05-14
file12618	TIME	6179	6198	2019-03-29 00:00:00	2019-03-29T00:00:00
file12618	PATIENT	6210	6216	Bisard
file12740	DATE	12	20	20380506	2038-05-06
file12740	HOSPITAL	36	72	EIDSVOLD MULTIPURPOSE HEALTH SERVICE
file12740	PATIENT	85	88	SOL
file12740	IDNUM	97	107	36G4082565
file12740	MEDICALRECORD	114	120	362408
file12740	PATIENT	173	179	Draime
file12740	IDNUM	231	239	36G40825
file12740	IDNUM	240	248	36G40825
file12740	IDNUM	250	260	36G4082565
file12740	PATIENT	262	283	Seebold, JEFFREY AMYA
file12740	HOSPITAL	307	326	NARRANDERA HOSPITAL
file12740	DOCTOR	1486	1499	NOLAN Dannels
file12740	DOCTOR	1511	1518	Speight
file12740	DOCTOR	1523	1531	I. Hovda
file12740	TIME	1535	1553	3:17 pm on 29.7.22	2022-07-29T15:17
file12740	DATE	2256	2265	29/8/2069	2069-08-29
file12740	DATE	2336	2344	6/9/2069	2069-09-06
file12740	DOCTOR	2369	2378	I Haberer
file12740	DATE	3963	3971	8/6/2070	2070-06-08
file12740	TIME	4002	4021	2019-06-30 00:00:00	2019-06-30T00:00:00
file12740	PATIENT	4033	4038	PETER
file1291	DATE	12	20	20110702	2011-07-02
file1291	HOSPITAL	36	51	WINTON HOSPITAL
file1291	PATIENT	64	74	Grosswiler
file1291	IDNUM	83	93	57X0091140
file1291	MEDICALRECORD	100	106	579009
file1291	IDNUM	211	219	57X00911
file1291	IDNUM	221	231	57X0091140
file1291	PATIENT	233	247	HARROP, Kattie
file1291	HOSPITAL	271	289	DOOMADGEE HOSPITAL
file1291	DATE	662	671	20/4/2071	2071-04-20
file1291	DOCTOR	679	689	N. Borlace
file1291	DATE	3210	3218	6/5/2071	2071-06-05
file1291	DOCTOR	3244	3253	N. Living
file1291	TIME	5275	5294	2818-09-14 00:00:00	2818-09-14T00:00:00
file1291	PATIENT	5306	5313	SANFORD
file13206	DATE	12	20	20110608	2011-06-08
file13206	HOSPITAL	36	83	BARWON HEALTH - SOUTH GEELONG RENAL UNIT CAMPUS
file13206	PATIENT	96	103	Hershey
file13206	IDNUM	112	122	05T1202623
file13206	MEDICALRECORD	129	135	057120
file13206	IDNUM	240	248	05T12026
file13206	IDNUM	250	260	05T1202623
file13206	PATIENT	262	274	RAGO, Rosita
file13206	HOSPITAL	298	313	BOOLEROO CAMPUS
file13206	DATE	686	695	29/4/2069	2069-04-29
file13206	DOCTOR	703	714	C. Blinston
file13206	DATE	3235	3243	4/5/2070	2070-05-04
file13206	DOCTOR	3269	3278	C. Schadt
file13206	TIME	5300	5319	2019-02-24 00:00:00	2019-02-24T00:00:00
file13206	PATIENT	5331	5337	ALVARO
file13536	DATE	12	20	19970819	1997-08-19
file13536	HOSPITAL	36	56	MARYBOROUGH HOSPITAL
file13536	PATIENT	69	74	Navas
file13536	IDNUM	83	93	63P141221R
file13536	MEDICALRECORD	100	107	6361412
file13536	AGE	245	247	79
file13536	DOCTOR	890	896	Q Nipp
file13536	DOCTOR	1356	1364	Q Manfre
file13536	DOCTOR	1978	1986	Q Easdon
file13536	DOCTOR	4170	4179	Q Barcelo
file13536	DOCTOR	4562	4569	Q Armon
file13536	DATE	4625	4631	7/1/73	2073-07-01
file13536	DOCTOR	4663	4671	Q Halama
file13536	DATE	7606	7614	8/8/2070	2070-08-08
file13536	TIME	7876	7895	2020-05-30 00:00:00	2020-05-30T00:00:00
file13536	PATIENT	7907	7911	Lime
file14038	DATE	12	20	19960703	1996-07-03
file14038	HOSPITAL	36	60	ROYAL HOSPITAL FOR WOMEN
file14038	PATIENT	73	80	Kosinar
file14038	IDNUM	89	99	11M1723890
file14038	MEDICALRECORD	106	112	114172
file14038	IDNUM	217	225	11M17238
file14038	IDNUM	227	237	11M1723890
file14038	PATIENT	239	254	Mcdavis, Felipe
file14038	HOSPITAL	278	295	COLEDALE HOSPITAL
file14038	DOCTOR	700	706	Lucien
file14038	DOCTOR	714	725	E. Langshaw
file14038	TIME	729	747	28.3.20 at 2:46 pm	2020-03-28T14:46
file14038	DATE	2300	2308	6/5/2071	2071-06-05
file14038	DOCTOR	2334	2342	E Bogosh
file14038	DATE	4513	4521	6/5/2070	2070-05-06
file14038	TIME	4551	4570	2020-02-28 00:00:00	2020-02-28T00:00:00
file14038	PATIENT	4582	4592	Casstevens
file15971	DATE	12	20	20110515	2011-05-15
file15971	HOSPITAL	36	71	THE CHILDREN'S HOSPITAL AT WESTMEAD
file15971	PATIENT	84	92	Spaziani
file15971	IDNUM	101	111	32D8722374
file15971	MEDICALRECORD	118	124	321872
file15971	PATIENT	177	182	Walby
file15971	IDNUM	234	242	32D87223
file15971	IDNUM	244	254	32D8722374
file15971	PATIENT	256	275	PATA, ALLEN Raylene
file15971	HOSPITAL	299	322	LAMEROO HEALTH SERVICES
file15971	DOCTOR	780	786	Cortez
file15971	TIME	790	809	3:45pm on 3/04/2020	2020-04-03T15:45
file15971	DOCTOR	817	827	J. Antwine
file15971	DATE	2831	2839	8/6/2069	2069-06-08
file15971	DOCTOR	2865	2874	J. Pilger
file15971	DATE	5634	5642	8/5/2069	2069-05-08
file15971	DOCTOR	6124	6133	J Barcley
file15971	DATE	6140	6147	16.5.73	2073-05-16
file15971	TIME	6174	6193	2019-03-02 00:00:00	2019-03-02T00:00:00
file15971	PATIENT	6205	6215	Monteagudo
file16093	DATE	12	20	20380813	2038-08-13
file16093	HOSPITAL	36	64	PENOLA WAR MEMORIAL HOSPITAL
file16093	PATIENT	77	81	Tory
file16093	IDNUM	90	100	90Z8933957
file16093	MEDICALRECORD	107	113	909893
file16093	PATIENT	166	174	Breitung
file16093	IDNUM	226	234	90Z89339
file16093	IDNUM	235	243	90Z89339
file16093	IDNUM	245	255	90Z8933957
file16093	PATIENT	257	277	Pioche, Zariya Renda
file16093	HOSPITAL	301	319	DANDENONG HOSPITAL
file16093	DOCTOR	1479	1488	STEVE Rux
file16093	DOCTOR	1497	1507	Y. Bogacki
file16093	DOCTOR	1512	1523	Y. Haddaway
file16093	TIME	1527	1545	3:17 pm on 26.6.22	2022-06-26T15:17
file16093	DATE	2248	2257	30/9/2071	2071-09-30
file16093	DATE	2328	2336	6/5/2069	2069-06-05
file16093	DOCTOR	2361	2370	Y Comnick
file16093	DATE	3955	3963	9/6/2071	2071-09-06
file16093	TIME	3994	4013	2019-03-31 00:00:00	2019-03-31T00:00:00
file16093	PATIENT	4025	4030	TYLER
file1637	DATE	12	20	20150812	2015-08-12
file1637	HOSPITAL	36	55	KUNUNOPPIN HOSPITAL
file1637	PATIENT	68	72	Leri
file1637	IDNUM	81	91	11Q4941541
file1637	MEDICALRECORD	98	104	116494
file1637	IDNUM	209	217	11Q49415
file1637	IDNUM	219	229	11Q4941541
file1637	PATIENT	231	247	PIRRELLO, Ovidia
file1637	HOSPITAL	271	299	MILDURA BASE PUBLIC HOSPITAL
file1637	DATE	672	681	21/4/2069	2069-04-21
file1637	DOCTOR	689	697	D. Thorp
file1637	DATE	3218	3226	4/6/2070	2070-06-04
file1637	DOCTOR	3252	3262	D. Gouldie
file1637	TIME	5284	5303	2818-09-14 00:00:00	2818-09-14T00:00:00
file1637	PATIENT	5315	5321	Waylon
file1732	DATE	12	20	19950519	1995-05-19
file1732	HOSPITAL	36	63	LAUNCESTON GENERAL HOSPITAL
file1732	PATIENT	76	82	Elliot
file1732	IDNUM	91	101	69N415212N
file1732	MEDICALRECORD	108	115	6954152
file1732	PATIENT	168	175	Modesto
file1732	DATE	1339	1346	28/9/72	2072-09-28
file1732	DOCTOR	1378	1384	R Fine
file1732	TIME	3806	3825	2737-09-03 00:00:00	2737-09-03T00:00:00
file1732	PATIENT	3837	3842	Sirko
file18432	DATE	12	20	20250924	2025-09-24
file18432	HOSPITAL	36	60	HARVEY DISTRICT HOSPITAL
file18432	PATIENT	73	81	BENEDICT
file18432	IDNUM	90	100	27J5363608
file18432	MEDICALRECORD	107	113	273536
file18432	IDNUM	218	226	27J53636
file18432	IDNUM	228	238	27J5363608
file18432	PATIENT	240	257	Clemmon, WILLETTE
file18432	HOSPITAL	281	309	BOURKE MULTI PURPOSE SERVICE
file18432	TIME	762	781	3:20pm on 5/06/2021	2021-06-05T15:20
file18432	DOCTOR	789	800	G. Seedorff
file18432	DATE	2251	2259	8/8/2069	2069-08-08
file18432	DOCTOR	2285	2294	G. Schehr
file18432	DATE	7013	7021	9/5/2070	2070-05-09
file18432	TIME	7053	7072	2019-05-27 00:00:00	2019-05-27T00:00:00
file18432	PATIENT	7084	7090	Hilles
file19280	IDNUM	8	18	48A136228H
file19280	MEDICALRECORD	27	35	48013622
file19280	HOSPITAL	47	79	FRANKSTON PUBLIC SURGICAL CENTRE
file19280	IDNUM	141	149	48A13622
file19280	IDNUM	151	161	48A136228H
file19280	PATIENT	163	180	Risden, BABS KIRK
file19280	DOCTOR	715	724	L. Faurot
file19280	DOCTOR	732	741	L. Barone
file19280	DATE	745	754	30.6.2065	2065-06-30
file19280	DOCTOR	1221	1229	L. Manos
file19280	DOCTOR	1236	1250	L. Ciampanella
file19280	DATE	1254	1263	28.7.2068	2068-07-28
file19280	DOCTOR	2484	2493	L. Perard
file19280	DATE	3575	3584	30/7/2069	2069-07-30
file1933	DATE	12	20	20080903	2008-09-03
file1933	HOSPITAL	36	50	BENALLA HEALTH
file1933	PATIENT	63	69	Mckoon
file1933	IDNUM	78	88	95W1572866
file1933	MEDICALRECORD	95	101	958157
file1933	IDNUM	206	214	95W15728
file1933	IDNUM	216	226	95W1572866
file1933	PATIENT	228	242	VESSELL, Selby
file1933	HOSPITAL	266	282	WHYALLA HOSPITAL
file1933	DATE	655	664	20/4/2070	2070-04-20
file1933	DOCTOR	672	684	Z. Abendroth
file1933	DATE	3205	3213	5/6/2069	2069-05-06
file1933	DOCTOR	3239	3249	Z. Krenzke
file1933	TIME	5271	5290	2818-09-14 00:00:00	2818-09-14T00:00:00
file1933	PATIENT	5302	5308	DARWIN
file20430	DATE	12	20	20020116	2002-01-16
file20430	HOSPITAL	36	59	MOREE DISTRICT HOSPITAL
file20430	PATIENT	72	78	Rodger
file20430	IDNUM	87	97	16O758135B
file20430	MEDICALRECORD	104	111	1657581
file20430	IDNUM	217	225	16O75813
file20430	IDNUM	227	237	16O758135B
file20430	PATIENT	239	252	Banbury, Stan
file20430	HOSPITAL	276	299	MATER MOTHER'S HOSPITAL
file20430	DATE	579	586	20/5/70	2070-05-20
file20430	DOCTOR	613	620	Lipsitz
file20430	DATE	863	870	24/4/69	2069-04-24
file20430	DOCTOR	885	892	Jingalu
file20430	DATE	1003	1010	24/4/69	2069-04-24
file20430	DOCTOR	1271	1285	O. Sundermeyer
file20430	TIME	1289	1308	11:55 am on 20.2.20	2020-02-20T11:55
file20430	TIME	1580	1599	20.2.20 at 1720 Hrs	2020-02-20T17:20
file20430	DATE	3868	3877	21/4/2071	2071-04-21
file20430	DOCTOR	3903	3915	O. Frederico
file20430	DATE	6124	6133	28/4/2070	2070-04-28
file20430	TIME	6163	6182	2020-02-20 00:00:00	2020-02-20T00:00:00
file20430	PATIENT	6194	6199	Rudis
file20783	DATE	12	20	20251213	2025-12-13
file20783	HOSPITAL	32	54	GRIFFITH BASE HOSPITAL
file20783	PATIENT	67	74	ARNOLDO
file20783	IDNUM	83	93	74K879293K
file20783	MEDICALRECORD	100	106	743879
file20783	IDNUM	211	219	74K87929
file20783	IDNUM	221	231	74K879293K
file20783	PATIENT	233	243	Kuty, Earl
file20783	HOSPITAL	267	303	SWAN HILL DISTRICT HEALTH [SWAN HILL
file20783	DOCTOR	694	700	Sheaff
file20783	TIME	719	738	2:29pm on 4/03/2021	2021-03-04T14:29
file20783	DOCTOR	746	755	T. Tabone
file20783	DATE	1856	1864	5/6/2071	2071-05-06
file20783	DOCTOR	1890	1900	T. Collums
file20783	DATE	4385	4394	9/11/2071	2071-09-11
file20783	TIME	4424	4443	2021-03-04 00:00:00	2021-03-04T00:00:00
file20783	PATIENT	4455	4463	Adamczak
file20864	IDNUM	8	18	22G800251S
file20864	MEDICALRECORD	27	35	22280025
file20864	HOSPITAL	47	74	WENTWORTH DISTRICT HOSPITAL
file20864	IDNUM	136	144	22G80025
file20864	IDNUM	146	156	22G800251S
file20864	PATIENT	158	180	LUSCAVAGE, Dierdre Mel
file20864	IDNUM	253	262	HH28-0025
file20864	DATE	268	275	18/2/67	2067-02-18
file20864	DEPARTMENT	276	284	RECOVERY
file20864	DATE	3633	3642	30/6/2065	2065-06-30
file20864	DOCTOR	3664	3671	H. Sahl
file20864	DATE	5013	5021	previous	2064-05-27
file20864	IDNUM	5029	5039	HH28-00251
file20864	DATE	5045	5052	19/2/65	2065-02-19
file20864	DEPARTMENT	5053	5072	L7 CONSULTING ROOMS
file20980	IDNUM	8	18	43X400109D
file20980	MEDICALRECORD	27	35	43940010
file20980	HOSPITAL	47	65	BLACKTOWN HOSPITAL
file20980	IDNUM	127	135	43X40010
file20980	IDNUM	137	147	43X400109D
file20980	PATIENT	149	165	Dirollo, JANGALA
file20980	DOCTOR	441	447	Maiers
file20980	DOCTOR	455	467	M. Michitsch
file20980	TIME	471	494	10:00 am on the 26/4/15	2015-04-26T10:00
file20980	DATE	2815	2824	29/9/2068	2068-09-29
file20980	DOCTOR	2850	2860	M Fielding
file20980	DATE	4951	4959	1/9/2068	2068-09-01
file20986	DATE	12	20	20010303	2001-03-03
file20986	HOSPITAL	36	83	BLUE MOUNTAINS DISTRICT ANZAC MEMORIAL HOSPITAL
file20986	PATIENT	96	102	Kribbs
file20986	IDNUM	111	121	01U4212684
file20986	MEDICALRECORD	128	136	01742126
file20986	IDNUM	241	249	01U42126
file20986	IDNUM	251	261	01U4212684
file20986	PATIENT	263	280	HENCHEL, Rookwood
file20986	HOSPITAL	304	351	COOLAMON-GANMAIN MULTI PURPOSE SERVICE HOSPITAL
file20986	DATE	3787	3795	9/6/2070	2070-06-09
file20986	DOCTOR	4151	4161	B. Carcamo
file20986	DATE	6973	6976	now	2062-11-27
file20986	DATE	8032	8041	16/6/2071	2071-06-16
file20986	TIME	8426	8445	2020-04-02 00:00:00	2020-04-02T00:00:00
file20986	PATIENT	8457	8460	Sol
file21189	DATE	12	20	20010304	2001-03-04
file21189	HOSPITAL	36	62	HOLBROOK DISTRICT HOSPITAL
file21189	PATIENT	75	81	Andren
file21189	IDNUM	90	100	59Q5422268
file21189	MEDICALRECORD	107	115	59654222
file21189	IDNUM	220	228	59Q54222
file21189	IDNUM	230	240	59Q5422268
file21189	PATIENT	242	258	SILCOX, Dorethea
file21189	HOSPITAL	282	319	CASINO AND DISTRICT MEMORIAL HOSPITAL
file21189	DATE	3755	3763	6/6/2070	2070-06-06
file21189	DOCTOR	4119	4130	P. Cartland
file21189	DATE	6942	6945	now	2062-11-27
file21189	DATE	8001	8010	17/8/2069	2069-08-17
file21189	TIME	8395	8414	2019-06-12 00:00:00	2019-06-12T00:00:00
file21189	PATIENT	8426	8431	Ricky
file21297	IDNUM	8	18	17M563384D
file21297	MEDICALRECORD	27	33	174563
file21297	HOSPITAL	45	62	LAVERTON HOSPITAL
file21297	IDNUM	123	131	17M56338
file21297	IDNUM	132	140	17M56338
file21297	IDNUM	142	152	17M563384D
file21297	PATIENT	154	167	OGLESBY, ADAN
file21297	DATE	213	221	14/10/65	2065-10-14
file21297	DATE	243	251	20/10/68	2068-10-20
file21297	DATE	273	281	22/10/69	2069-10-22
file21297	DOCTOR	739	747	D. Spero
file21297	DATE	751	760	7.10.2068	2068-10-07
file21297	DATE	2227	2236	10/9/2065	2065-09-10
file21297	DOCTOR	2262	2271	D Swanger
file21297	DATE	4530	4540	14/10/2065	2065-10-14
file21297	DATE	4566	4573	17/9/65	2065-09-17
file21297	DATE	5229	5237	15/10/65	2065-10-15
file21297	DATE	5262	5269	18/9/65	2065-09-18
file21297	DATE	5974	5981	17/9/66	2066-09-17
file21297	DATE	6006	6013	21/6/66	2066-06-21
file21297	ORGANIZATION	6045	6064	KB Home Los Angeles
file21297	DEPARTMENT	6065	6068	RHW
file21297	DOCTOR	6109	6130	FRANSISCA Swackhammer
file21297	DATE	6365	6372	22/6/70	2070-06-22
file21392	DATE	12	20	20010413	2001-04-13
file21392	HOSPITAL	36	88	BERRIGAN WAR MEMORIAL HOSPITAL/MULTI PURPOSE SERVICE
file21392	PATIENT	101	108	Bartlet
file21392	IDNUM	117	127	38D1642325
file21392	MEDICALRECORD	134	142	38116423
file21392	IDNUM	247	255	38D16423
file21392	IDNUM	257	267	38D1642325
file21392	PATIENT	269	283	GARONE, DEANNA
file21392	HOSPITAL	307	325	GREENWICH HOSPITAL
file21392	DATE	3761	3769	6/8/2070	2070-06-08
file21392	DOCTOR	4125	4136	I. Jakobsen
file21392	DATE	6948	6951	now	2062-11-27
file21392	DATE	8007	8016	16/6/2071	2071-06-16
file21392	TIME	8401	8420	2020-05-27 00:00:00	2020-05-27T00:00:00
file21392	PATIENT	8432	8441	Alejandro
file21703	IDNUM	8	18	86Z2842909
file21703	MEDICALRECORD	27	34	8692842
file21703	HOSPITAL	46	69	BARMERA HEALTH SERVICES
file21703	IDNUM	162	170	86Z28429
file21703	IDNUM	172	182	86Z2842909
file21703	PATIENT	184	206	UBRY, JOHNATHON Jerald
file21703	DOCTOR	588	599	Fairy Sakai
file21703	TIME	621	642	12:26hrs on 23.8.2018	2018-08-23T12:26
file21703	DOCTOR	650	660	X. Harapat
file21703	DATE	3879	3888	24/9/2068	2068-09-24
file21703	DOCTOR	4453	4461	X Angove
file21703	DATE	7180	7189	28/9/2068	2068-09-28
file21703	ORGANIZATION	7246	7271	Sprint Nextel Corporation
file21703	DEPARTMENT	7272	7277	Orana
file21703	DATE	8034	8042	9/1/2069	2069-09-01
file2179	DATE	12	20	20131021	2013-10-21
file2179	HOSPITAL	36	64	LOCKHART & DISTRICT HOSPITAL
file2179	PATIENT	77	82	Hayer
file2179	IDNUM	91	101	07R8851593
file2179	MEDICALRECORD	108	114	076885
file2179	PATIENT	167	171	Rias
file2179	IDNUM	223	231	07R88515
file2179	IDNUM	233	243	07R8851593
file2179	PATIENT	245	265	Muncey, KEVIN Dagmar
file2179	HOSPITAL	289	314	PAMBULA DISTRICT HOSPITAL
file2179	DOCTOR	772	777	Wayne
file2179	TIME	781	800	3:45pm on 5/03/2019	2019-03-05T15:45
file2179	DOCTOR	808	818	C. Kaehler
file2179	DATE	2822	2830	6/6/2069	2069-06-06
file2179	DOCTOR	2856	2869	C. Desrosiers
file2179	DATE	5629	5637	6/6/2069	2069-06-06
file2179	DOCTOR	6119	6125	C Lill
file2179	DATE	6132	6139	14.6.73	2073-06-14
file2179	TIME	6166	6185	2080-04-11 00:00:00	2080-04-11T00:00:00
file2179	PATIENT	6197	6203	Pelech
file21863	DATE	12	20	20250924	2025-09-24
file21863	HOSPITAL	36	63	ALEXANDRA DISTRICT HOSPITAL
file21863	PATIENT	76	81	BRYAN
file21863	IDNUM	90	100	65N8062076
file21863	MEDICALRECORD	107	113	655806
file21863	IDNUM	218	226	65N80620
file21863	IDNUM	228	238	65N8062076
file21863	PATIENT	240	252	BARCIK, KERA
file21863	HOSPITAL	276	308	NUMURKAH DISTRICT HEALTH SERVICE
file21863	TIME	761	780	3:20pm on 6/05/2020	2020-05-06T15:20
file21863	DOCTOR	788	798	Q. Zappala
file21863	DATE	2249	2258	4/10/2071	2071-04-10
file21863	DOCTOR	2284	2298	Q. Silvertooth
file21863	DATE	7017	7026	5/11/2069	2069-05-11
file21863	TIME	7058	7077	2019-03-05 00:00:00	2019-03-05T00:00:00
file21863	PATIENT	7089	7093	Gerl
file22205	DATE	12	20	20010324	2001-03-24
file22205	HOSPITAL	36	57	OSBORNE PARK HOSPITAL
file22205	PATIENT	70	78	Alterman
file22205	IDNUM	87	97	23J8372659
file22205	MEDICALRECORD	104	112	23383726
file22205	IDNUM	217	225	23J83726
file22205	IDNUM	227	237	23J8372659
file22205	PATIENT	239	253	FICHTNER, Lita
file22205	HOSPITAL	277	294	GOODOOGA HOSPITAL
file22205	DATE	3730	3738	9/5/2070	2070-05-09
file22205	DOCTOR	4094	4103	F. Sneary
file22205	DATE	6915	6918	now	2062-11-27
file22205	DATE	7974	7983	15/8/2069	2069-08-15
file22205	TIME	8368	8387	2019-06-07 00:00:00	2019-06-07T00:00:00
file22205	PATIENT	8399	8404	Elroy
file22269	IDNUM	8	18	70F957323I
file22269	MEDICALRECORD	27	34	7029573
file22269	HOSPITAL	46	84	MUNDUBBERA MULTIPURPOSE HEALTH SERVICE
file22269	IDNUM	146	154	70F95732
file22269	IDNUM	156	166	70F957323I
file22269	PATIENT	168	182	SIGWART, PAULA
file22269	DATE	629	638	27/6/2068	2068-06-27
file22269	DOCTOR	1382	1386	Minh
file22269	TIME	1405	1427	10:07hrs on 28.08.2019	2019-08-28T10:07
file22269	DOCTOR	1435	1445	T. Merrill
file22269	DOCTOR	2232	2246	Dante GUTTMANN
file22269	TIME	2265	2287	11:06hrs on 29.08.2018	2018-08-29T11:06
file22269	DOCTOR	2295	2306	T. Odorizzi
file22269	DOCTOR	2590	2596	Greber
file22269	TIME	2618	2640	11:43hrs on 29.08.2016	2016-08-29T11:43
file22269	DOCTOR	2648	2657	T. Warnes
file22269	DATE	7058	7066	1/8/2065	2065-01-08
file22269	DOCTOR	7088	7095	T Bubar
file22402	DATE	12	20	20251214	2025-12-14
file22402	HOSPITAL	32	49	MENINGIE HOSPITAL
file22402	PATIENT	62	65	Kip
file22402	IDNUM	74	84	91X558271T
file22402	MEDICALRECORD	91	97	918558
file22402	IDNUM	202	210	91X55827
file22402	IDNUM	212	222	91X558271T
file22402	PATIENT	224	236	BRUMLOW, DEL
file22402	HOSPITAL	260	307	KING ISLAND DISTRICT HOSPITAL AND HEALTH CENTRE
file22402	DOCTOR	698	703	Bogie
file22402	TIME	722	741	2:29pm on 7/04/2019	2019-04-07T14:29
file22402	DOCTOR	749	755	Y. Din
file22402	DATE	1856	1864	6/6/2069	2069-06-06
file22402	DOCTOR	1890	1898	Y. Margo
file22402	DATE	4383	4391	5/7/2070	2070-05-07
file22402	TIME	4421	4440	2019-04-03 00:00:00	2019-04-03T00:00:00
file22402	PATIENT	4452	4459	Chaidez
file22499	IDNUM	8	18	59T579230C
file22499	MEDICALRECORD	27	34	5975792
file22499	HOSPITAL	46	85	EDENHOPE AND DISTRICT MEMORIAL HOSPITAL
file22499	IDNUM	147	155	59T57923
file22499	IDNUM	157	167	59T579230C
file22499	PATIENT	169	185	MAENHOUT, ARTURO
file22499	DOCTOR	584	590	Tengan
file22499	DOCTOR	613	624	N. Mccaslin
file22499	TIME	628	647	1320Hrs on 12.11.19	2019-11-12T13:20
file22499	DATE	672	681	17/2/2069	2069-02-17
file22499	DATE	2062	2071	13/1/2068	2068-01-13
file22499	DATE	2240	2249	17/1/2066	2066-01-17
file22499	DOCTOR	2274	2281	N Yeary
file22499	DATE	3369	3378	16/1/2065	2065-01-16
file22604	IDNUM	8	18	07P590398L
file22604	MEDICALRECORD	27	33	075590
file22604	HOSPITAL	45	62	CORRIGIN HOSPITAL
file22604	DOCTOR	142	152	B Hillseth
file22604	DATE	154	163	29/1/2066	2066-01-29
file22604	IDNUM	179	187	07P59039
file22604	IDNUM	188	196	07P59039
file22604	IDNUM	198	208	07P590398L
file22604	PATIENT	210	223	Myslim, ROSIO
file22604	DOCTOR	678	686	B Titzer
file22604	TIME	1037	1057	6:15pm on 15.11.2016	2016-11-15T18:15
file22604	DOCTOR	1065	1074	B. Marley
file22604	DATE	3650	3659	22/2/2065	2065-02-22
file22604	DOCTOR	3680	3688	B Cotten
file22604	DOCTOR	7029	7038	B Dibella
file22604	DATE	7040	7048	1/2/2068	2068-02-01
file2301	DATE	12	20	20420305	2042-03-05
file2301	HOSPITAL	36	84	EASTERN EYRE HEALTH AND AGED CARE - KIMBA CAMPUS
file2301	PATIENT	97	102	GARRY
file2301	IDNUM	111	121	28G2912568
file2301	MEDICALRECORD	128	134	282291
file2301	PATIENT	187	195	Montuori
file2301	IDNUM	247	255	28G29125
file2301	IDNUM	256	264	28G29125
file2301	IDNUM	266	276	28G2912568
file2301	PATIENT	278	299	BOHM, ANDREW Adrianne
file2301	HOSPITAL	323	355	FRANKSTON PUBLIC SURGICAL CENTRE
file2301	DOCTOR	1515	1528	Emilio KLUTTZ
file2301	DOCTOR	1540	1549	Goldfeder
file2301	DOCTOR	1554	1565	G. Baldrige
file2301	TIME	1569	1587	3:17 pm on 26.6.22	2022-06-26T15:17
file2301	DATE	2290	2299	30/9/2071	2071-09-30
file2301	DATE	2370	2379	6/10/2071	2071-10-06
file2301	DOCTOR	2404	2412	G Devany
file2301	DATE	3997	4005	8/7/2070	2070-07-08
file2301	TIME	4036	4055	2764-09-30 00:00:00	2764-09-30T00:00:00
file2301	PATIENT	4067	4075	Aristide
file23518	IDNUM	8	18	86D211304E
file23518	MEDICALRECORD	27	33	861211
file23518	HOSPITAL	45	68	SCOTT MEMORIAL HOSPITAL
file23518	IDNUM	129	137	86D21130
file23518	IDNUM	138	146	86D21130
file23518	IDNUM	148	158	86D211304E
file23518	PATIENT	160	175	REHART, Flossie
file23518	DATE	3216	3225	17/2/2069	2069-02-17
file23518	DOCTOR	3251	3259	V Riggan
file23518	DATE	6505	6514	14/1/2069	2069-01-14
file23991	IDNUM	8	18	34Z242362N
file23991	MEDICALRECORD	27	33	349242
file23991	HOSPITAL	45	60	INJUNE HOSPITAL
file23991	IDNUM	121	129	34Z24236
file23991	IDNUM	130	138	34Z24236
file23991	IDNUM	140	150	34Z242362N
file23991	PATIENT	152	169	HERCEG, WILLODEAN
file23991	IDNUM	232	240	34Z24236
file23991	DATE	2131	2139	4/5/2066	2066-05-04
file23991	DATE	2800	2808	7/5/2066	2066-05-07
file23991	DOCTOR	2833	2843	J Mccalebb
file23991	DATE	6216	6224	8/4/2066	2066-04-08
file24860	IDNUM	8	18	55Q843221Y
file24860	MEDICALRECORD	27	34	5568432
file24860	HOSPITAL	46	64	PETER JAMES CENTRE
file24860	AGE	136	138	67
file24860	DATE	261	265	2067	2067-14
file24860	DOCTOR	653	663	O. Ritchie
file24860	DOCTOR	667	676	O Pishner
file24860	TIME	680	696	11:33 on 26/2/15	2015-02-26T11:33
file24860	DATE	3199	3206	29/5/66	2066-05-29
file24860	DOCTOR	3238	3248	O Overholt
file24860	DATE	4137	4143	5/6/65	2065-05-06
file25723	IDNUM	8	18	13M964379H
file25723	MEDICALRECORD	27	34	1349643
file25723	HOSPITAL	46	64	KUNUNURRA HOSPITAL
file25723	DATE	2768	2777	23/5/2066	2066-05-23
file25723	DOCTOR	2808	2815	C Clerc
file25723	DATE	4049	4055	5/7/65	2065-07-05
file25723	DOCTOR	4544	4552	C. Clamp
file25723	DATE	4556	4562	5/7/65	2065-07-05
file26049	IDNUM	8	18	61I985337P
file26049	MEDICALRECORD	27	34	6139853
file26049	HOSPITAL	46	64	KATHERINE HOSPITAL
file26049	DATE	1919	1928	18/6/2066	2066-06-18
file26049	DOCTOR	1960	1967	R Doxon
file26094	IDNUM	8	18	82A5852950
file26094	MEDICALRECORD	27	34	8205852
file26094	HOSPITAL	46	85	GOULBURN VALLEY HEALTH - WARANGA CAMPUS
file26094	DATE	1678	1687	19/7/2066	2066-07-19
file26094	DOCTOR	1719	1730	W Burington
file26144	IDNUM	8	18	40W606354J
file26144	MEDICALRECORD	27	34	4086063
file26144	HOSPITAL	46	69	COWRA DISTRICT HOSPITAL
file26144	DATE	2445	2454	16/7/2069	2069-07-16
file26144	DOCTOR	2486	2492	K Nest
file26174	IDNUM	8	18	61N207202U
file26174	MEDICALRECORD	27	33	615207
file26174	HOSPITAL	45	81	MIDLANDS MULTI PURPOSE HEALTH CENTRE
file26174	DATE	2625	2634	21/6/2066	2066-06-21
file26174	DOCTOR	2666	2676	P Brabazon
file26174	DOCTOR	2700	2709	P Gillard
file26174	DATE	4031	4038	24/7/68	2068-07-24
file26174	DOCTOR	4076	4086	P Grunwald
file2618	DATE	12	20	20050225	2005-02-25
file2618	HOSPITAL	36	62	HILLSTON DISTRICT HOSPITAL
file2618	PATIENT	75	79	Kehm
file2618	IDNUM	88	98	18K228260D
file2618	MEDICALRECORD	105	111	183228
file2618	PATIENT	164	169	Jesse
file2618	IDNUM	220	228	18K22826
file2618	IDNUM	230	240	18K228260D
file2618	PATIENT	242	259	LEITE, BAMBI ELLA
file2618	HOSPITAL	283	321	MUNDUBBERA MULTIPURPOSE HEALTH SERVICE
file2618	DATE	3964	3972	3/6/2071	2071-06-03
file2618	TIME	9374	9393	2792-05-08 00:00:00	2792-05-08T00:00:00
file2618	PATIENT	9405	9410	Haake
file26211	IDNUM	8	18	76G249328M
file26211	MEDICALRECORD	27	35	76224932
file26211	HOSPITAL	47	62	WARREN HOSPITAL
file26211	AGE	134	136	54
file26211	DATE	2293	2302	20/7/2068	2068-07-20
file26211	DOCTOR	2334	2342	S Fadely
file26310	IDNUM	8	18	97X949277X
file26310	MEDICALRECORD	27	34	9799492
file26310	HOSPITAL	46	69	WERRIBEE MERCY HOSPITAL
file26310	DATE	153	160	10.7.65	2065-10-07
file26310	DATE	186	193	22.9.69	2069-09-22
file26310	DATE	219	225	6.1.68	2068-06-01
file26310	DOCTOR	659	665	X Odil
file26310	DOCTOR	672	683	X Levasseur
file26310	DOCTOR	691	700	X Kildare
file26310	TIME	704	725	10:50am on 22/04/2019	2019-04-22T10:50
file26310	DOCTOR	1157	1165	X Manard
file26310	DOCTOR	1172	1180	X Staner
file26310	DOCTOR	1188	1198	X Swindell
file26310	TIME	1202	1223	10:50am on 19/05/2019	2019-05-19T10:50
file26310	DATE	4992	5001	24/6/2069	2069-06-24
file26310	DOCTOR	5033	5041	X Bulcao
file26310	DOCTOR	7417	7426	X Gerlock
file26310	DATE	7901	7907	6.3.69	2069-06-03
file26310	DATE	8245	8252	19.8.66	2066-08-19
file26310	DATE	8358	8365	8.11.68	2068-08-11
file26354	IDNUM	8	18	61H799586S
file26354	MEDICALRECORD	27	34	6127995
file26354	HOSPITAL	46	60	BENALLA HEALTH
file26354	DOCTOR	834	847	Q Stefanovich
file26354	DOCTOR	851	857	Q Ruhl
file26354	DOCTOR	865	872	Q Lerud
file26354	TIME	876	894	10:11am on 23/4/19	2019-04-23T10:11
file26354	DATE	2806	2813	23/6/69	2069-06-23
file26354	DOCTOR	2845	2852	Q Godbe
file26396	IDNUM	8	18	19D710634A
file26396	MEDICALRECORD	27	34	1917106
file26396	HOSPITAL	46	62	EXMOUTH HOSPITAL
file26396	DATE	1190	1197	22.7.65	2065-07-22
file26396	DOCTOR	1229	1236	E Buddy
file26430	IDNUM	8	18	24H592241Z
file26430	MEDICALRECORD	27	34	2425922
file26430	HOSPITAL	46	62	WHYALLA HOSPITAL
file26430	DATE	2415	2422	25.7.66	2066-07-25
file26430	DOCTOR	2454	2461	F Quant
file26486	IDNUM	8	18	72D613209I
file26486	MEDICALRECORD	27	33	721613
file26486	HOSPITAL	45	69	MORUYA DISTRICT HOSPITAL
file26486	DATE	1338	1345	28.6.65	2065-06-28
file26486	DOCTOR	1377	1387	U Weisholz
file26543	IDNUM	8	18	46N4526191
file26543	MEDICALRECORD	27	35	46545261
file26543	HOSPITAL	47	63	BILOELA HOSPITAL
file26543	DATE	148	156	7.8.2066	2066-08-07
file26543	DOCTOR	736	748	M Clippinger
file26543	TIME	752	772	11:58am on 24.5.2019	2019-05-24T11:58
file26543	DATE	2383	2390	24.7.66	2066-07-24
file26543	DOCTOR	2422	2431	M Anagnos
file26543	DOCTOR	3125	3133	M Stoeke
file26543	DATE	3134	3142	7.5.2066	2066-05-07
file26574	IDNUM	8	18	51R234216C
file26574	MEDICALRECORD	27	34	5162342
file26574	HOSPITAL	46	101	ROBINVALE DISTRICT HEALTH SERVICES - MANANGATANG CAMPUS
file26574	DATE	1600	1607	29/7/68	2068-07-29
file26574	DOCTOR	1639	1649	N Cabreros
file26611	IDNUM	8	18	09N255274K
file26611	MEDICALRECORD	27	34	0952552
file26611	HOSPITAL	46	77	COONABARABRAN DISTRICT HOSPITAL
file26611	DATE	2061	2069	2/7/2069	2069-07-02
file26611	DOCTOR	2101	2110	B Carneal
file26656	IDNUM	8	18	67J386332T
file26656	MEDICALRECORD	27	35	67338633
file26656	HOSPITAL	47	81	ROYAL TALBOT REHABILITATION CENTRE
file26656	DATE	1868	1877	11/1/2069	2069-11-01
file26656	DOCTOR	1909	1917	Q Dicara
file26656	DATE	3134	3142	7/8/2066	2066-07-08
file26745	IDNUM	8	18	88A977280E
file26745	MEDICALRECORD	27	35	88097728
file26745	HOSPITAL	47	66	MILLMERRAN HOSPITAL
file26745	AGE	138	140	79
file26745	DATE	2417	2425	7/7/2066	2066-07-07
file26745	DOCTOR	2458	2466	V Morron
file26869	IDNUM	8	18	36W907249N
file26869	MEDICALRECORD	27	33	368907
file26869	HOSPITAL	45	67	ALPINE HEALTH (BRIGHT)
file26869	DATE	150	157	10.4.66	2066-04-10
file26869	DATE	183	189	6.4.68	2068-04-06
file26869	DATE	2933	2939	6/4/69	2069-04-06
file26869	DOCTOR	2971	2981	J Brachman
file26869	DATE	5377	5383	5.7.65	2065-07-05
file26869	DATE	5770	5777	11.4.68	2068-04-11
file26941	IDNUM	8	18	09G847658I
file26941	MEDICALRECORD	27	35	09284765
file26941	HOSPITAL	47	74	ROCKINGHAM GENERAL HOSPITAL
file26941	DOCTOR	850	854	Walt
file26941	DOCTOR	880	892	C Buckwalter
file26941	DOCTOR	900	906	C Linn
file26941	TIME	910	931	11:42am on 06/05/2016	2016-05-06T11:42
file26941	DOCTOR	3835	3844	C Deloach
file26941	DOCTOR	3851	3862	C Tabatabai
file26941	DOCTOR	3866	3877	C Wallbrown
file26941	TIME	3881	3897	1:55pm on 6/2/16	2016-02-06T13:55
file26941	DATE	4607	4613	5/8/66	2066-08-05
file26941	DOCTOR	4645	4656	C Panzarino
file26964	IDNUM	8	18	14K629265H
file26964	MEDICALRECORD	27	34	1446292
file26964	HOSPITAL	46	86	EAST WIMMERA HEALTH SERVICE - WYCHEPROOF
file26964	DATE	1226	1232	9/4/65	2065-04-09
file26964	DOCTOR	1264	1272	D Plumer
file27008	IDNUM	8	18	62G640313P
file27008	MEDICALRECORD	27	34	6226403
file27008	HOSPITAL	46	85	TWEDDLE CHILD AND FAMILY HEALTH SERVICE
file27008	DATE	321	325	2057	2057
file27008	DATE	1912	1921	15/5/2065	2065-05-15
file27008	DOCTOR	1953	1960	R Szeto
file27008	IDNUM	1983	1991	62G64031
file27008	DATE	2660	2667	20/4/69	2069-04-20
file27038	IDNUM	8	18	36Q4996234
file27038	MEDICALRECORD	27	34	3664996
file27038	HOSPITAL	46	62	NANANGO HOSPITAL
file27038	DATE	1562	1569	25.4.69	2069-04-25
file27038	DOCTOR	1601	1611	K Cheramie
file27038	DOCTOR	1629	1637	K Seelye
file27038	IDNUM	2528	2536	36Q49962
file27064	IDNUM	8	18	41U3612303
file27064	MEDICALRECORD	27	33	417361
file27064	HOSPITAL	45	86	COLLINSVILLE MULTI-PURPOSE HEALTH SERVICE
file27064	DATE	748	754	5/6/65	2065-05-06
file27064	DOCTOR	786	794	L Pietig
file27086	IDNUM	8	18	15D111539E
file27086	MEDICALRECORD	27	34	1511115
file27086	HOSPITAL	46	73	ALEXANDRA DISTRICT HOSPITAL
file27086	AGE	145	147	61
file27086	DATE	843	850	18/6/69	2069-06-18
file27086	DOCTOR	882	890	D Sowell
file27134	IDNUM	8	18	73Z132698N
file27134	MEDICALRECORD	27	34	7391326
file27134	HOSPITAL	46	89	YOUTH PREVENTION AND RECOVERY CARE (Y-PARC)
file27134	DOCTOR	726	735	S Svetlik
file27134	DOCTOR	739	748	S Dechico
file27134	TIME	752	769	3:41pm on 10/5/17	2017-05-10T15:41
file27134	DATE	1887	1894	13/7/67	2067-07-13
file27134	DOCTOR	1926	1935	S Pitassi
file27158	IDNUM	8	18	78D914204M
file27158	MEDICALRECORD	27	35	78191420
file27158	HOSPITAL	47	62	ALBANY HOSPITAL
file27158	DOCTOR	235	241	T Klyn
file27158	DOCTOR	311	323	T Berkheimer
file27158	DATE	333	342	14/9/2065	2065-09-14
file27158	DATE	2488	2495	16.9.68	2068-09-16
file27158	DOCTOR	2531	2537	T Dews
file27158	DOCTOR	2545	2554	T Cordoba
file27158	DOCTOR	4304	4315	T Alleruzzo
file27263	IDNUM	8	18	42N853504G
file27263	MEDICALRECORD	27	35	42585350
file27263	HOSPITAL	47	68	THE MORNINGTON CENTRE
file27263	DOCTOR	1199	1204	Bursi
file27263	DATE	2983	2990	19/9/68	2068-09-19
file27263	DOCTOR	3022	3029	L Kiehm
file27263	DATE	5646	5653	29/9/68	2068-09-29
file27297	IDNUM	8	18	00J874662P
file27297	MEDICALRECORD	27	34	0038746
file27297	HOSPITAL	46	62	GAYNDAH HOSPITAL
file27297	DOCTOR	619	626	A Thode
file27297	TIME	630	648	12:24pm on 15/5/17	2017-05-15T12:24
file27297	DATE	2303	2310	18/7/67	2067-07-18
file27297	DOCTOR	2342	2348	A Moir
file27297	DOCTOR	2372	2382	A Baublitz
file27384	IDNUM	8	18	05N656279O
file27384	MEDICALRECORD	27	34	0556562
file27384	HOSPITAL	46	82	WIMMERA HEALTH CARE GROUP - DIMBOOLA
file27384	AGE	154	156	78
file27384	DATE	2095	2102	16/9/68	2068-09-16
file27384	DOCTOR	2289	2298	A Winners
file27384	DEPARTMENT	3006	3022	WEST GYNAECOLOGY
file27384	HOSPITAL	3024	3054	TOOSEY AGED AND COMMUNITY CARE
file27413	IDNUM	8	18	79X496679J
file27413	MEDICALRECORD	27	34	7984966
file27413	HOSPITAL	46	58	LAURA CAMPUS
file27413	DOCTOR	2500	2512	T Digerolamo
file27413	DOCTOR	2519	2526	T Lammy
file27413	TIME	2530	2547	1:40pm on 17/5/17	2017-05-17T13:40
file27413	DATE	2692	2699	20/7/67	2067-07-20
file27413	DOCTOR	2731	2742	T Marciniak
file27447	IDNUM	8	18	37T526637R
file27447	MEDICALRECORD	27	35	37752663
file27447	HOSPITAL	47	63	NORTHAM HOSPITAL
file27447	ORGANIZATION	223	248	Commercial Metals Company
file27447	IDNUM	249	257	37T52663
file27447	DATE	1683	1690	26/6/69	2069-06-26
file27447	DOCTOR	1723	1731	H Rients
file27447	DOCTOR	2554	2559	H Suh
file27478	IDNUM	8	18	32X398244Q
file27478	MEDICALRECORD	27	34	3283982
file27478	HOSPITAL	46	70	WAIKERIE HEALTH SERVICES
file27478	DATE	1902	1909	26/8/66	2066-08-26
file27478	DATE	2307	2314	27.5.68	2068-05-27
file27478	DOCTOR	2344	2356	I Bennington
file27478	DATE	3176	3182	6/9/68	2068-09-06
file27506	IDNUM	8	18	05G148653L
file27506	MEDICALRECORD	27	34	0521486
file27506	HOSPITAL	46	73	QUIRINDI COMMUNITY HOSPITAL
file27506	AGE	145	147	55
file27506	DOCTOR	390	399	Zachariah
file27506	DATE	401	410	27/9/2065	2065-09-27
file27506	DATE	1125	1132	26.8.65	2065-08-26
file27506	DOCTOR	1165	1175	X Calvello
file27619	IDNUM	8	18	63D269601U
file27619	MEDICALRECORD	27	35	63126960
file27619	HOSPITAL	47	61	ALPHA HOSPITAL
file27619	AGE	133	135	75
file27619	DATE	3102	3109	30/8/68	2068-08-30
file27619	DOCTOR	3141	3151	P Walliser
file27672	IDNUM	8	18	68H041218T
file27672	MEDICALRECORD	27	34	6820412
file27672	HOSPITAL	46	79	CRANBOURNE INTEGRATED CARE CENTRE
file27672	DATE	191	199	6.9.2066	2066-06-09
file27672	DOCTOR	203	212	Q Treamer
file27672	DATE	2315	2321	9/2/65	2065-09-02
file27672	DOCTOR	2354	2361	Q Valer
file27672	DOCTOR	3056	3068	Q Bencivenga
file27672	DATE	3764	3772	5.7.2066	2066-05-07
file27672	DOCTOR	3776	3785	Q Nuessen
file27729	IDNUM	8	18	16D062377B
file27729	MEDICALRECORD	27	34	1610623
file27729	HOSPITAL	46	71	BROKEN HILL BASE HOSPITAL
file27729	DATE	170	178	9.7.2068	2068-07-09
file27729	AGE	191	193	71
file27729	DATE	2366	2372	3/8/68	2068-08-03
file27729	DOCTOR	2404	2412	F Brobst
file27729	DATE	4164	4173	10.9.2065	2065-09-10
file27759	IDNUM	8	18	90M801676W
file27759	MEDICALRECORD	27	34	9048016
file27759	HOSPITAL	46	95	EMMAVILLE - VEGETABLE CREEK RESIDENTIAL AGED CARE
file27759	DATE	1780	1786	6/6/69	2069-06-06
file27759	DATE	1964	1970	6/4/68	2068-06-04
file27759	DOCTOR	2000	2011	X Lundstrom
file27759	DATE	2641	2648	6/10/68	2068-06-10
file27784	IDNUM	8	18	95Q783283V
file27784	MEDICALRECORD	27	34	9567832
file27784	HOSPITAL	46	62	GOSFORD HOSPITAL
file27784	DATE	2125	2131	6/5/66	2066-06-05
file27784	DOCTOR	2163	2171	Y Perigo
file27807	IDNUM	8	18	69A523693Q
file27807	MEDICALRECORD	27	34	6905236
file27807	HOSPITAL	46	65	STANTHORPE HOSPITAL
file27807	DATE	2155	2162	10/6/65	2065-10-06
file27807	DOCTOR	2194	2203	R Cordner
file27850	IDNUM	8	18	27W554651Z
file27850	MEDICALRECORD	27	35	27855465
file27850	HOSPITAL	47	104	LISMORE BASE HOSPITAL - RIVERLANDS DRUG & ALCOHOL SERVICE
file27850	DOCTOR	694	706	Hayden SEIDL
file27850	DOCTOR	713	722	F Warncke
file27850	DOCTOR	730	738	F Larock
file27850	TIME	742	761	11:25am on 4/4/2016	2016-04-04T11:25
file27850	DATE	3298	3304	7/6/65	2065-06-07
file27850	DOCTOR	3336	3342	F Haen
file27886	IDNUM	8	18	22A326258Y
file27886	MEDICALRECORD	27	34	2203262
file27886	HOSPITAL	46	69	MOREE DISTRICT HOSPITAL
file27886	AGE	158	160	87
file27886	DATE	2187	2195	11/10/65	2065-10-11
file27886	DOCTOR	2227	2236	G Reznick
file27886	DOCTOR	3176	3184	G Lamana
file27886	DATE	3186	3195	23/9/2065	2065-09-23
file27926	IDNUM	8	18	80W456316G
file27926	MEDICALRECORD	27	34	8084563
file27926	HOSPITAL	46	67	BOORT DISTRICT HEALTH
file27926	DOCTOR	674	681	Freddie
file27926	DOCTOR	688	695	U Munda
file27926	DOCTOR	699	709	U Delsavio
file27926	TIME	713	729	5/8/18 at 3:48pm	2018-08-05T15:48
file27926	DATE	743	750	6/10/66	2066-06-10
file27926	DATE	3833	3840	6/10/66	2066-06-10
file27926	DOCTOR	3872	3882	U Vaclavik
file27999	IDNUM	8	18	54G296625B
file27999	MEDICALRECORD	27	35	54229662
file27999	HOSPITAL	47	72	DUNGOG COMMUNITY HOSPITAL
file27999	DOCTOR	429	438	N Helaire
file27999	DATE	442	449	7/10/68	2068-07-10
file27999	DOCTOR	532	542	N. Teasley
file27999	TIME	543	560	6/8/16 at 17:15pm	2016-08-06T17:15
file27999	DATE	2049	2056	8/11/67	2067-08-11
file27999	DOCTOR	2089	2098	N Sutphin
file27999	DEPARTMENT	3254	3266	SA Pathology
file27999	HOSPITAL	3268	3286	BALAKLAVA HOSPITAL
file28041	IDNUM	8	18	59K078222A
file28041	MEDICALRECORD	27	35	59307822
file28041	HOSPITAL	47	62	NEWMAN HOSPITAL
file28041	DATE	146	155	18.6.2069	2069-06-18
file28041	DATE	1500	1507	9/10/69	2069-09-10
file28041	DOCTOR	1539	1547	O Leidig
file28041	DATE	2621	2630	18.6.2069	2069-06-18
file28095	IDNUM	8	18	23T818632V
file28095	MEDICALRECORD	27	35	23781863
file28095	HOSPITAL	47	86	EDENHOPE AND DISTRICT MEMORIAL HOSPITAL
file28095	DOCTOR	916	922	G Sang
file28095	TIME	926	947	11:18am on 14.05.2016	2016-05-14T11:18
file28095	DATE	2429	2437	14/10/66	2066-10-14
file28095	DATE	2486	2493	18/9/69	2069-09-18
file28095	DOCTOR	2525	2535	G Bouillon
file28095	DOCTOR	3447	3454	G Zumbo
file28140	IDNUM	8	18	80P938690E
file28140	MEDICALRECORD	27	35	80693869
file28140	HOSPITAL	47	75	MILDURA BASE PUBLIC HOSPITAL
file28140	DATE	2995	3002	17/7/69	2069-07-17
file28140	DOCTOR	3034	3040	V Chee
file28164	IDNUM	8	18	85T710307D
file28164	MEDICALRECORD	27	35	85771030
file28164	HOSPITAL	47	84	NARROMINE HOSPITAL & COMMUNITY HEALTH
file28164	DATE	2911	2918	18/6/68	2068-06-18
file28164	DOCTOR	2948	2958	W Chrisley
file28227	IDNUM	8	18	59D560607X
file28227	MEDICALRECORD	27	34	5915606
file28227	HOSPITAL	46	73	CALVARY PUBLIC HOSPITAL ACT
file28227	DATE	2763	2770	19/9/65	2065-09-19
file28227	DOCTOR	2845	2854	O Chandra
file28227	TIME	2858	2878	1:20pm on 15/04/2018	2018-04-15T13:20
file28227	DOCTOR	2928	2939	O Forrester
file28227	TIME	2943	2963	1:25pm on 12/07/2019	2019-07-12T13:25
file28227	DOCTOR	2996	3005	O Gretter
file28270	IDNUM	8	18	17Z681765G
file28270	MEDICALRECORD	27	34	1796817
file28270	HOSPITAL	46	60	BENALLA HEALTH
file28270	DOCTOR	1100	1105	Nicky
file28270	DOCTOR	1112	1125	NERISSA FARVE
file28270	TIME	1129	1149	12:08pm on 18/8/2019	2019-08-18T12:08
file28270	DATE	2343	2350	21/7/68	2068-07-21
file28270	DOCTOR	2382	2390	D Greeno
file28322	IDNUM	8	18	12D453372F
file28322	MEDICALRECORD	27	35	12145337
file28322	HOSPITAL	47	71	WAIKERIE HEALTH SERVICES
file28322	DATE	3292	3299	26.7.69	2069-07-26
file28322	DOCTOR	3332	3340	E Buttry
file28322	DATE	4668	4675	1/10/65	2065-10-01
file28387	IDNUM	8	18	70Z483320O
file28387	MEDICALRECORD	27	35	70948332
file28387	HOSPITAL	47	75	LOCKHART & DISTRICT HOSPITAL
file28387	DOCTOR	607	616	S Bergsjo
file28387	TIME	620	638	16:10pm on 21/4/15	2015-04-21T16:10
file28387	DOCTOR	825	837	LEON Galanis
file28387	DOCTOR	844	855	S Kunishige
file28387	TIME	859	876	4:20pm on 23/4/19	2019-04-23T16:20
file28387	DOCTOR	1060	1068	S Hibner
file28387	TIME	1072	1090	16:20pm on 24/8/18	2018-08-24T16:20
file28387	DOCTOR	1275	1285	S Halperin
file28387	TIME	1289	1306	4:30pm on 21/5/16	2016-05-21T16:30
file28387	DATE	2967	2975	27/10/65	2065-10-27
file28387	DATE	3493	3501	23/10/68	2068-10-23
file28387	DOCTOR	3533	3543	S Swindell
file28387	DOCTOR	8038	8047	S Tessmer
file28387	DOCTOR	8109	8118	S Perotti
file28430	IDNUM	8	18	28V404488W
file28430	MEDICALRECORD	27	33	288404
file28430	HOSPITAL	45	70	FITZROY CROSSING HOSPITAL
file28430	DATE	166	175	27.9.2066	2066-09-27
file28430	DOCTOR	180	189	G Valadao
file28430	DATE	1783	1790	29/7/69	2069-07-29
file28430	DOCTOR	1823	1831	G Behlen
file28430	DOCTOR	1839	1847	G Nikach
file28430	DATE	2982	2991	26.7.2066	2066-07-26
file28430	DOCTOR	2996	3005	G Wieloch
file28517	IDNUM	8	18	49N105346H
file28517	MEDICALRECORD	27	34	4951053
file28517	HOSPITAL	46	83	NARROMINE HOSPITAL & COMMUNITY HEALTH
file28517	DOCTOR	318	331	PABLO BREAULT
file28517	DATE	2935	2941	1.9.66	2066-09-01
file28517	DOCTOR	2973	2984	L Samuelsen
file28517	DEPARTMENT	3790	3810	3/9 JENNIE COX CLOSE
file28517	HOSPITAL	3812	3828	WOOMERA HOSPITAL
file28517	DATE	5289	5299	30/11/2068	2068-11-30
file28554	IDNUM	8	18	07J126304Q
file28554	MEDICALRECORD	27	35	07312630
file28554	HOSPITAL	47	70	MARGARET RIVER HOSPITAL
file28554	DATE	168	177	6.10.2065	2065-10-06
file28554	DATE	1664	1671	29/7/66	2066-07-29
file28554	DOCTOR	1703	1713	A Affolter
file28554	DOCTOR	2902	2907	A Daw
file28554	DATE	2908	2918	10.11.2068	2068-11-10
file28577	IDNUM	8	18	55F146453Z
file28577	MEDICALRECORD	27	34	5521464
file28577	HOSPITAL	46	77	DENTAL HEALTH SERVICES VICTORIA
file28577	DATE	1192	1200	30/10/65	2065-10-30
file28577	DOCTOR	1230	1237	O Duvel
file28606	IDNUM	8	18	13B267411H
file28606	MEDICALRECORD	27	35	13026741
file28606	IDNUM	47	51	D302
file28606	DATE	1048	1055	30/9/69	2069-09-30
file28606	DOCTOR	1087	1095	D Weflen
file28630	IDNUM	8	18	61X298579Q
file28630	MEDICALRECORD	27	34	6192985
file28630	HOSPITAL	46	88	WESTERN DISTRICT HEALTH SERVICE - HAMILTON
file28630	DATE	944	951	10/1/69	2069-10-01
file28630	DOCTOR	983	992	R Panakos
file28662	IDNUM	8	18	82P8994270
file28662	MEDICALRECORD	27	34	8258994
file28662	HOSPITAL	46	61	INGHAM HOSPITAL
file28662	DATE	1670	1676	8/8/65	2065-08-08
file28662	DOCTOR	1708	1717	W Mckenzy
file28715	IDNUM	8	18	49L810585K
file28715	MEDICALRECORD	27	34	4948105
file28715	HOSPITAL	46	94	EASTERN EYRE HEALTH AND AGED CARE - KIMBA CAMPUS
file28715	DATE	2748	2754	8/7/68	2068-07-08
file28715	DOCTOR	2844	2849	Hiram
file28715	DOCTOR	2857	2866	L Ostroot
file28715	TIME	2870	2885	10:45 on 6/6/15	2015-06-06T10:45
file28715	DOCTOR	2918	2926	L Dicola
file28715	DOCTOR	3208	3214	L Petr
file28751	IDNUM	8	18	97H930543S
file28751	MEDICALRECORD	27	35	97293054
file28751	HOSPITAL	47	76	COOTAMUNDRA DISTRICT HOSPITAL
file28751	DATE	160	167	16.7.69	2069-07-16
file28751	DATE	1093	1099	9.6.67	2067-09-06
file28751	DOCTOR	1131	1141	Z Escobedo
file28751	DATE	2101	2109	15.10.66	2066-10-15
file28751	DATE	2173	2181	15.10.66	2066-10-15
file28788	IDNUM	8	18	55D951602B
file28788	MEDICALRECORD	27	34	5519516
file28788	HOSPITAL	46	82	ARMADALE KELMSCOTT MEMORIAL HOSPITAL
file28788	DATE	228	232	2066	2066
file28788	DATE	1875	1883	9/8/2067	2067-09-08
file28788	DOCTOR	1953	1969	Rudolf SINIBALDI
file28788	DOCTOR	1976	1983	N Rorer
file28788	TIME	1987	2002	13:52 on 3/7/17	2017-07-03T13:52
file28788	DATE	2014	2020	9/6/67	2067-09-06
file28788	DOCTOR	2052	2061	N Napihaa
file28788	DOCTOR	2079	2088	N Mechler
file28788	DOCTOR	3303	3314	N Manocchio
file28818	IDNUM	8	18	76V552550M
file28818	MEDICALRECORD	27	34	7685525
file28818	HOSPITAL	46	61	ROBINA HOSPITAL
file28818	DATE	1626	1633	10/8/65	2065-10-08
file28818	DOCTOR	1665	1673	S Bratek
file28856	IDNUM	8	18	24R573518V
file28856	MEDICALRECORD	27	34	2465735
file28856	HOSPITAL	46	65	DUBBO BASE HOSPITAL
file28856	DOCTOR	933	937	Radu
file28856	DOCTOR	944	951	H Pince
file28856	DOCTOR	959	968	H Garrels
file28856	TIME	972	990	15:50hrs on 4/6/18	2018-06-04T15:50
file28856	DATE	1433	1439	6/8/65	2065-08-06
file28856	DOCTOR	1471	1480	H Blashak
file28941	IDNUM	8	18	45I274476G
file28941	MEDICALRECORD	27	34	4532744
file28941	HOSPITAL	46	88	TRESILLIAN FAMILY CARE CENTRE - WILLOUGHBY
file28941	DATE	2530	2537	10/8/69	2069-08-10
file28941	DOCTOR	2569	2580	M Dieckmann
file28941	DEPARTMENT	3384	3395	Hunter Area
file28941	HOSPITAL	3397	3418	BOORT DISTRICT HEALTH
file28965	IDNUM	8	18	03E294525P
file28965	MEDICALRECORD	27	34	0312945
file28965	HOSPITAL	46	90	ROYAL MELBOURNE HOSPITAL - ROYAL PARK CAMPUS
file28965	DATE	1792	1800	13/11/65	2065-11-13
file28965	DOCTOR	1832	1840	A Heholt
file29054	IDNUM	8	18	51B225583X
file29054	MEDICALRECORD	27	34	5102255
file29054	HOSPITAL	46	65	CANTERBURY HOSPITAL
file29054	DOCTOR	1222	1231	P Shimkus
file29054	DOCTOR	1238	1247	P Bronsky
file29054	DOCTOR	1252	1260	P Gaskin
file29054	DOCTOR	1268	1280	P Fothergill
file29054	TIME	1284	1303	10:00hrs on 12.9.19	2019-09-12T10:00
file29054	DATE	4449	4457	17/10/69	2069-10-17
file29054	DOCTOR	4489	4499	P Faragoza
file29126	IDNUM	8	18	72S826441I
file29126	MEDICALRECORD	27	34	1983466
file29126	HOSPITAL	46	73	TINGHA MULTIPURPOSE SERVICE
file29126	AGE	145	147	79
file29126	DATE	4612	4620	17/11/65	2065-11-17
file29126	DOCTOR	4652	4658	D Reap
file292	DATE	12	20	19940730	1994-07-30
file292	HOSPITAL	36	60	MERCY HOSPITAL FOR WOMEN
file292	PATIENT	73	80	Gerding
file292	IDNUM	89	99	67T367609P
file292	MEDICALRECORD	106	113	6773676
file292	PATIENT	166	174	Gattison
file292	TIME	412	433	26/08/2018 at 17:10hr	2018-08-26T17:10
file292	DATE	1848	1855	28/8/66	2066-08-28
file292	DOCTOR	1891	1897	S Nies
file292	DOCTOR	1905	1915	S S Lucken
file292	TIME	3650	3669	2761-04-09 00:00:00	2761-04-09T00:00:00
file292	PATIENT	3681	3695	ADRIAN-Dattilo
file29216	IDNUM	8	18	88K967557A
file29216	MEDICALRECORD	27	34	8849675
file29216	HOSPITAL	46	77	ST VINCENT'S HOSPITAL (LISMORE)
file29216	DATE	1603	1610	21/7/68	2068-07-21
file29216	DOCTOR	1643	1651	X Scrape
file29216	DEPARTMENT	3344	3356	SA Pathology
file29216	HOSPITAL	3358	3397	TWEDDLE CHILD AND FAMILY HEALTH SERVICE
file29331	IDNUM	8	18	46G988616I
file29331	MEDICALRECORD	27	35	46298861
file29331	HOSPITAL	47	70	COBAR DISTRICT HOSPITAL
file29331	AGE	142	144	56
file29331	DATE	2203	2210	24/7/69	2069-07-24
file29331	DOCTOR	2242	2252	L Litchard
file29469	IDNUM	8	18	67Y689574U
file29469	MEDICALRECORD	27	34	6796895
file29469	HOSPITAL	46	83	CASINO AND DISTRICT MEMORIAL HOSPITAL
file29469	DATE	167	174	23/5/67	2067-05-23
file29469	DOCTOR	1026	1032	Q Yohn
file29469	DOCTOR	1060	1070	Q Kingston
file29469	DOCTOR	1075	1083	Q Wisbey
file29469	DOCTOR	1097	1107	Q Haberern
file29469	TIME	1111	1131	1:35pm on 22.06.2018	2018-06-22T13:35
file29469	DOCTOR	1777	1786	Q Colling
file29469	DOCTOR	1814	1823	Q Catrini
file29469	DOCTOR	1831	1838	Q Wieto
file29469	TIME	1842	1862	1:40pm on 25.08.2018	2018-08-25T13:40
file29469	DATE	4838	4846	25/11/69	2069-11-25
file29469	DOCTOR	4878	4886	Q Raskin
file29469	DOCTOR	6968	6978	Q Zielesch
file29469	DATE	7929	7936	10.2.65	2065-10-02
file29469	DATE	8373	8380	23/5/71	2071-05-23
file29469	DOCTOR	8409	8422	OMER Landruth
file29494	IDNUM	8	18	14U600522C
file29494	MEDICALRECORD	27	34	1476005
file29494	HOSPITAL	46	60	MOURA HOSPITAL
file29494	AGE	132	134	81
file29494	DATE	2301	2308	27/7/69	2069-07-27
file29494	DOCTOR	2341	2349	E Weafer
file29494	DOCTOR	3041	3049	E Labate
file29518	IDNUM	8	18	72Q6316804
file29518	MEDICALRECORD	27	34	7266316
file29518	HOSPITAL	46	62	HEATHCOTE HEALTH
file29518	DATE	677	684	30/8/66	2066-08-30
file29518	DOCTOR	716	726	T Viessman
file29589	IDNUM	8	18	30M751748T
file29589	MEDICALRECORD	27	33	304751
file29589	HOSPITAL	45	75	KANGAROO ISLAND HEALTH SERVICE
file29589	DATE	1918	1925	1/11/65	2065-11-01
file29589	DOCTOR	1957	1964	H Horak
file29667	IDNUM	8	18	09A373655N
file29667	MEDICALRECORD	27	34	0903736
file29667	HOSPITAL	46	84	EUGOWRA MEMORIAL MULTI PURPOSE SERVICE
file29667	TIME	332	353	25/09/2015 at 17:10hr	2015-09-25T17:10
file29667	DATE	1768	1775	30/8/65	2065-08-30
file29667	DOCTOR	1811	1819	B Brumby
file29667	DOCTOR	1827	1836	B B Dubey
file29737	IDNUM	8	18	67W394713W
file29737	MEDICALRECORD	27	35	67839471
file29737	HOSPITAL	47	59	LAURA CAMPUS
file29737	DOCTOR	599	604	P Duk
file29737	TIME	608	633	10:20am on the 25.08.2016	2016-08-25T10:20
file29737	DOCTOR	1097	1108	P Mackinnon
file29737	TIME	1112	1137	10:20am on the 28.08.2018	2018-08-28T10:20
file29737	DOCTOR	1575	1583	P Bliese
file29737	TIME	1587	1612	10:20am on the 27.08.2019	2019-08-27T10:20
file29737	DATE	5039	5046	27/7/68	2068-07-27
file29737	DOCTOR	5076	5084	P Fenley
file29737	DATE	6649	6656	10/8/68	2068-10-08
file29802	IDNUM	8	18	78N995671H
file29802	MEDICALRECORD	27	34	7859956
file29802	HOSPITAL	46	71	DUNGOG COMMUNITY HOSPITAL
file29802	DATE	171	179	9.6.2065	2065-09-06
file29802	DOCTOR	184	194	U Delagado
file29802	DATE	2583	2590	28/8/65	2065-08-28
file29802	DOCTOR	2689	2701	U Himmelmann
file29802	TIME	2705	2724	2:50pm on 24/5/2016	2016-05-24T14:50
file29802	DOCTOR	2757	2766	U Bushong
file29802	DOCTOR	4575	4585	U Paliotta
file29903	IDNUM	8	18	36K015629Q
file29903	MEDICALRECORD	27	34	3630156
file29903	HOSPITAL	46	95	GOULBURN VALLEY HEALTH - CENTRE FOR OLDER PERSONS
file29903	AGE	168	170	71
file29903	DATE	3234	3241	1/11/68	2068-11-01
file29903	DOCTOR	3277	3286	J Mongeon
file29903	DOCTOR	3294	3304	J J Grilli
file29949	IDNUM	8	18	94G0367889
file29949	MEDICALRECORD	27	35	94203678
file29949	HOSPITAL	47	78	LONG JETTY HEALTH CARE FACILITY
file29949	ORGANIZATION	199	216	Chubb Corporation
file29949	IDNUM	228	236	94G03678
file29949	DATE	4052	4059	10/6/69	2069-10-06
file29949	DOCTOR	4091	4098	X Kyger
file29985	IDNUM	8	18	42C067746H
file29985	MEDICALRECORD	27	35	42006774
file29985	HOSPITAL	47	63	QUILPIE HOSPITAL
file29985	AGE	135	137	72
file29985	DATE	354	359	today	2062-09-13
file29985	IDNUM	484	500	42-CC-67-7462989
file29985	DATE	2030	2036	7/9/66	2066-09-07
file29985	DOCTOR	2068	2077	L Himenez
file30028	IDNUM	8	18	47G939353G
file30028	MEDICALRECORD	27	33	472939
file30028	HOSPITAL	45	71	WINGHAM COMMUNITY HOSPITAL
file30028	DATE	1675	1682	7/10/65	2065-10-07
file30028	DOCTOR	1746	1754	M Rainge
file30028	DOCTOR	1761	1769	M Dobbin
file30028	TIME	1773	1791	18:14 on 6/07/2019	2019-07-06T18:14
file30028	DOCTOR	1824	1833	M Burtell
file30112	IDNUM	8	18	05C969411P
file30112	MEDICALRECORD	27	35	05096941
file30112	HOSPITAL	47	66	SPRINGWOOD HOSPITAL
file30112	DATE	150	160	23.10.2071	2071-10-23
file30112	DATE	198	205	19.9.69	2069-09-19
file30112	DOCTOR	1129	1138	B Kuehnle
file30112	TIME	1142	1163	12:30pm at 06/07/2016	2016-07-06T12:30
file30112	DATE	2959	2965	8/9/69	2069-09-08
file30112	DOCTOR	2997	3006	B Humphry
file30112	DOCTOR	3958	3966	B Lonero
file30112	DATE	5205	5212	16.9.65	2065-09-16
file30112	DATE	5545	5554	24.9.2071	2071-09-24
file30112	DOCTOR	5612	5627	ALPHA Hallerman
file30112	DATE	5662	5670	23.10.68	2068-10-23
file30177	IDNUM	8	18	78M709710J
file30177	MEDICALRECORD	27	34	7847097
file30177	HOSPITAL	46	61	MURGON HOSPITAL
file30177	DATE	1782	1790	19/10/69	2069-10-19
file30177	DOCTOR	1822	1830	T Meiste
file30231	IDNUM	8	18	10U001527G
file30231	MEDICALRECORD	27	34	1080015
file30231	HOSPITAL	46	78	NUMURKAH DISTRICT HEALTH SERVICE
file30231	DATE	1976	1983	16/9/66	2066-09-16
file30231	DOCTOR	2078	2088	E Simitian
file30231	TIME	2092	2108	12:10 on 12/7/15	2015-07-12T12:10
file30231	DOCTOR	2141	2150	E Kulling
file30292	IDNUM	8	18	78R0226855
file30292	MEDICALRECORD	27	35	78602268
file30292	HOSPITAL	47	71	COLLIE DISTRICT HOSPITAL
file30292	DATE	155	163	27.10.68	2068-10-27
file30292	DATE	324	331	15/9/66	2066-09-15
file30292	DOCTOR	402	407	Spier
file30292	DATE	2146	2153	16/9/65	2065-09-16
file30292	DOCTOR	2185	2192	S Yoest
file30292	DOCTOR	4132	4143	S Blaszczyk
file30292	DATE	4181	4188	26.9.69	2069-09-26
file30292	DOCTOR	4206	4216	S Teixeira
file30319	IDNUM	8	18	99I623534A
file30319	MEDICALRECORD	27	34	9936235
file30319	HOSPITAL	46	70	VICTORIAN HEART HOSPITAL
file30319	DATE	1407	1415	20/10/65	2065-10-20
file30319	DOCTOR	1448	1454	X Smay
file30416	IDNUM	8	18	47E643592I
file30416	MEDICALRECORD	27	35	47164359
file30416	HOSPITAL	47	85	CLONCURRY MULTI-PURPOSE HEALTH SERVICE
file30416	AGE	157	159	78
file30416	DATE	3335	3342	20/9/69	2069-09-20
file30416	DOCTOR	3374	3385	L Schoolman
file30453	IDNUM	8	18	05A764650R
file30453	MEDICALRECORD	27	34	0507646
file30453	HOSPITAL	46	86	HUNTER NEW ENGLAND MENTAL HEALTH SERVICE
file30453	DOCTOR	426	443	RIGOBERTO POKORNY
file30453	DATE	563	571	21/10/68	2068-10-21
file30453	DATE	1858	1866	21/10/66	2066-10-21
file30453	DOCTOR	1898	1909	A Shiminski
file30453	DOCTOR	4032	4038	A Lyew
file30453	DOCTOR	4246	4256	Miss RONCO
file30453	DOCTOR	4730	4740	A Erenrich
file30453	DATE	4744	4751	5.10.69	2069-10-05
file30500	IDNUM	8	18	26S365518C
file30500	MEDICALRECORD	27	33	266365
file30500	HOSPITAL	45	73	BOURKE MULTI PURPOSE SERVICE
file30500	DATE	156	163	30.9.66	2066-09-30
file30500	DATE	1525	1532	22/9/65	2065-09-22
file30500	DOCTOR	1564	1572	O Mclure
file30500	DATE	2596	2603	29.9.69	2069-09-29
file30591	IDNUM	8	18	74O396566L
file30591	MEDICALRECORD	27	35	74539656
file30591	HOSPITAL	47	70	THOMAS EMBLING HOSPITAL
file30591	AGE	142	144	63
file30591	DURATION	232	239	6 weeks	P6W
file30591	DATE	272	277	today	2062-09-13
file30591	DATE	2275	2282	24/9/68	2068-09-24
file30591	DOCTOR	2315	2322	T Payan
file30635	IDNUM	8	18	32K4166257
file30635	MEDICALRECORD	27	35	32441662
file30635	HOSPITAL	47	67	ROYAL PERTH HOSPITAL
file30635	DOCTOR	764	772	I Bowser
file30635	TIME	776	794	10:19am on 22/7/15	2015-07-22T10:19
file30635	DATE	1913	1920	25/9/69	2069-09-25
file30635	DOCTOR	1952	1960	I Haaker
file30635	DOCTOR	2224	2239	ALECIA Pershall
file30635	DOCTOR	2759	2775	VIVIANA Stockwin
file30728	IDNUM	8	18	80G437683C
file30728	MEDICALRECORD	27	34	8024376
file30728	HOSPITAL	46	60	MOURA HOSPITAL
file30728	AGE	132	134	93
file30728	DATE	3219	3227	26/10/65	2065-10-26
file30728	DOCTOR	3259	3266	W Kinde
file30728	DOCTOR	7406	7411	W Wei
file30759	IDNUM	8	18	01Y038531N
file30759	MEDICALRECORD	27	35	01903853
file30759	HOSPITAL	47	75	BOURKE MULTI PURPOSE SERVICE
file30759	DATE	2116	2124	28/10/66	2066-10-28
file30759	DOCTOR	2156	2167	B Mirabelli
file30779	IDNUM	8	18	69U059699W
file30779	MEDICALRECORD	27	34	6970596
file30779	HOSPITAL	46	64	MAROONDAH HOSPITAL
file30779	DATE	1834	1842	25/10/68	2068-10-25
file30779	DOCTOR	1872	1879	Q Gekas
file30810	IDNUM	8	18	17Q170757E
file30810	MEDICALRECORD	27	35	17617075
file30810	HOSPITAL	47	78	BRAIDWOOD MULTI PURPOSE SERVICE
file30810	AGE	150	152	60
file30810	DOCTOR	799	811	E Dominiguez
file30810	DOCTOR	814	822	E Eccles
file30810	TIME	826	840	22/7/18 on 1pm	2018-07-22T13:00
file30810	DATE	1158	1165	27/9/66	2066-09-27
file30810	DOCTOR	1197	1206	E Tatters
file3691	DATE	12	20	20130917	2013-09-17
file3691	HOSPITAL	36	54	TOOWOOMBA HOSPITAL
file3691	PATIENT	67	72	Sanna
file3691	IDNUM	81	91	37H7705166
file3691	MEDICALRECORD	98	104	372770
file3691	IDNUM	209	217	37H77051
file3691	IDNUM	219	229	37H7705166
file3691	PATIENT	231	249	Olaughlin, Ernesto
file3691	HOSPITAL	273	306	THE KILMORE AND DISTRICT HOSPITAL
file3691	DOCTOR	711	718	Lindsay
file3691	DOCTOR	726	738	J. Gorzynski
file3691	TIME	742	760	29.3.23 at 2:46 pm	2023-03-29T14:46
file3691	DATE	2313	2321	4/5/2070	2070-05-04
file3691	DOCTOR	2347	2357	J Sosinsky
file3691	DATE	4528	4536	7/5/2071	2071-05-07
file3691	TIME	4566	4585	2819-02-13 00:00:00	2819-02-13T00:00:00
file3691	PATIENT	4597	4603	Moerbe
file4096	IDNUM	8	18	95D701664Y
file4096	MEDICALRECORD	27	33	951701
file4096	HOSPITAL	45	89	ROYAL MELBOURNE HOSPITAL - ROYAL PARK CAMPUS
file4096	IDNUM	185	195	95D701664Y
file4096	MEDICALRECORD	196	206	951701.RRL
file4096	PATIENT	229	238	Margarito
file4096	PATIENT	244	258	Wynter JAHNCKE
file4096	IDNUM	283	291	95D70166
file4096	IDNUM	292	300	95D70166
file4096	STREET	301	307	Sharpe
file4096	CITY	333	342	BALRANALD
file4096	STATE	344	359	South Australia
file4096	ZIP	361	365	3741
file4096	DATE	489	497	9/7/1991	1991-09-07
file4096	TIME	544	563	27/05/2018 at 09:36	2018-05-27T09:36
file4096	DEPARTMENT	575	580	PaLMS
file4096	DOCTOR	606	621	Truman Lijewski
file4096	ORGANIZATION	699	713	R.R. Donnelley
file4096	DATE	754	760	1/8/65	2065-01-08
file4096	DOCTOR	3763	3775	ARDEN AUSTON
file4096	TIME	3779	3787	14.18Hrs	2015-05-22T14:18
file4096	DOCTOR	3795	3803	X. Homer
file4096	DATE	3807	3814	24.7.65	2065-07-24
file4096	DOCTOR	3898	3904	X Hohm
file4096	DATE	7304	7312	6/1/2065	2065-06-01
file4096	DATE	7358	7365	12/8/68	2068-12-08
file4096	DOCTOR	7412	7429	Ngarigo ARNSWORTH
file4096	DATE	7641	7648	12/7/68	2068-12-07
file414	IDNUM	8	18	16V302522J
file414	MEDICALRECORD	27	34	1683025
file414	HOSPITAL	46	64	GERALDTON HOSPITAL
file414	MEDICALRECORD	127	138	1683025.GHJ
file414	PATIENT	139	155	Goulette, Andres
file414	IDNUM	156	164	16V30252
file414	IDNUM	165	173	16V30252
file414	DATE	189	198	11/5/2062	2062-05-11
file414	PATIENT	237	243	Johnie
file414	DOCTOR	257	263	Rickey
file414	DATE	272	279	5/11/33	2133-11-05
file414	MEDICALRECORD	287	294	4307227
file414	IDNUM	307	316	43A722722
file414	DOCTOR	325	335	Heidebrink
file414	DATE	397	404	25/9/63	2063-09-25
file414	DATE	530	537	25/9/65	2065-09-25
file414	HOSPITAL	560	587	ROCKINGHAM GENERAL HOSPITAL
file414	DOCTOR	1496	1510	Mayah Macknair
file414	DOCTOR	1536	1552	REGGIE HARDISTER
file414	DOCTOR	2063	2075	Kamala NERIS
file414	DOCTOR	2101	2112	NOBLE Schan
file5118	IDNUM	8	18	64R4236807
file5118	MEDICALRECORD	27	34	6464236
file5118	HOSPITAL	46	59	ROMA HOSPITAL
file5118	IDNUM	121	129	64R42368
file5118	IDNUM	131	141	64R4236807
file5118	PATIENT	143	159	WOFFORD, ROSETTA
file5118	DOCTOR	833	843	R. Sumners
file5118	DATE	847	853	7/6/68	2068-07-06
file5118	DOCTOR	1168	1180	R Chamberlin
file5118	DATE	1991	2000	7/11/2064	2064-07-11
file5124	DATE	12	20	20150830	2015-08-30
file5124	HOSPITAL	36	58	COBRAM DISTRICT HEALTH
file5124	PATIENT	71	76	Corle
file5124	IDNUM	85	95	22N444639B
file5124	MEDICALRECORD	102	109	2254446
file5124	AGE	247	249	79
file5124	DOCTOR	892	902	F Koudelka
file5124	DOCTOR	1362	1374	F Wiltberger
file5124	DOCTOR	1988	1996	F Musich
file5124	DOCTOR	4180	4187	F Comee
file5124	DOCTOR	4570	4582	F Blachowski
file5124	DATE	4638	4644	2/6/72	2072-06-02
file5124	DOCTOR	4676	4683	F Itani
file5124	DATE	7618	7626	8/6/2071	2071-06-08
file5124	TIME	7888	7907	2846-12-08 00:00:00	2846-12-08T00:00:00
file5124	PATIENT	7919	7926	Endsley
file5168	IDNUM	8	18	70J464797J
file5168	MEDICALRECORD	27	34	7034647
file5168	HOSPITAL	46	70	MERCY HOSPITAL FOR WOMEN
file5168	IDNUM	133	141	70J46479
file5168	IDNUM	143	153	70J464797J
file5168	PATIENT	155	173	Monhollen, ORIELLE
file5168	DOCTOR	777	790	U. Bonnenfant
file5168	DATE	794	801	10.8.65	2065-10-08
file5168	DOCTOR	2233	2239	U. Asa
file5168	DATE	2967	2975	9/8/2068	2068-09-08
file5220	DATE	12	20	20271102	2027-11-02
file5220	HOSPITAL	36	64	MILDURA BASE PUBLIC HOSPITAL
file5220	PATIENT	77	82	Quade
file5220	IDNUM	91	101	38F5857557
file5220	MEDICALRECORD	108	115	3825857
file5220	PATIENT	168	175	Meroney
file5220	DATE	1451	1458	26/9/66	2066-09-26
file5220	DOCTOR	1490	1500	I Muddiman
file5220	TIME	3128	3147	2706-03-23 00:00:00	2706-03-23T00:00:00
file5220	PATIENT	3159	3165	Mathew
file5423	DATE	12	20	20070930	2007-09-30
file5423	HOSPITAL	36	86	GREAT OCEAN ROAD HEALTH - LORNE COMMUNITY HOSPITAL
file5423	PATIENT	99	104	ROYAL
file5423	IDNUM	113	123	59X186613D
file5423	MEDICALRECORD	130	136	598186
file5423	AGE	253	255	66
file5423	DOCTOR	450	457	Solomon
file5423	DOCTOR	928	934	Renouf
file5423	DOCTOR	941	948	N Dumay
file5423	TIME	970	991	10:55am on 16/03/2015	2015-03-16T10:55
file5423	DOCTOR	1439	1445	Oliver
file5423	DOCTOR	1448	1457	Parshotam
file5423	DOCTOR	1464	1472	XRodrick
file5423	TIME	1495	1516	12:10pm on 19/04/2019	2019-04-19T12:10
file5423	DOCTOR	1788	1794	Saliva
file5423	DOCTOR	1797	1801	Pore
file5423	DOCTOR	1808	1819	X Decarmine
file5423	TIME	1842	1864	12:10pm on  19/03/2019	2019-03-19T12:10
file5423	DOCTOR	2955	2962	Minelli
file5423	DOCTOR	2969	2976	XBailey
file5423	TIME	2980	3001	12:50pm on 19/04/2018	2018-04-19T12:50
file5423	DATE	6333	6342	24/6/2069	2069-06-24
file5423	DOCTOR	6374	6383	X Soprych
file5423	DOCTOR	16827	16834	X Maino
file5423	DOCTOR	16936	16943	Rogelio
file5423	DOCTOR	18346	18354	X Belski
file5423	DOCTOR	18365	18373	X Lizama
file5423	DOCTOR	18386	18396	X Iturbide
file5423	DOCTOR	18401	18411	X Jernigan
file5423	TIME	18439	18458	2512-10-20 00:00:00	2512-10-20T00:00:00
file5423	PATIENT	18470	18481	Vanschoiack
file5533	DATE	12	20	20020309	2002-03-09
file5533	HOSPITAL	36	83	KING ISLAND DISTRICT HOSPITAL AND HEALTH CENTRE
file5533	PATIENT	96	103	Kisicki
file5533	IDNUM	112	122	07T107761M
file5533	MEDICALRECORD	129	137	07710776
file5533	PATIENT	190	204	ROLANDO-OKRENT
file5533	AGE	267	269	76
file5533	DATE	1208	1216	6/6/2068	2068-06-06
file5533	DOCTOR	1248	1257	C Donmore
file5533	TIME	3111	3130	2050-01-04 00:00:00	2050-01-04T00:00:00
file5533	PATIENT	3142	3149	Shearer
file5794	IDNUM	8	18	65P1377297
file5794	MEDICALRECORD	27	34	6561377
file5794	HOSPITAL	46	87	GEORGE TOWN HOSPITAL AND COMMUNITY CENTRE
file5794	IDNUM	149	157	65P13772
file5794	IDNUM	159	169	65P1377297
file5794	PATIENT	171	185	MAUSS, CORDELL
file5794	DOCTOR	641	652	Q Nachtrieb
file5794	TIME	672	689	2.10pm on 21.5.15	2015-05-21T14:10
file5794	DOCTOR	5196	5208	Q Campoverde
file6094	IDNUM	8	18	13L258888D
file6094	MEDICALRECORD	27	34	1342588
file6094	HOSPITAL	46	62	ROSEBUD HOSPITAL
file6094	IDNUM	124	132	13L25888
file6094	IDNUM	134	144	13L258888D
file6094	PATIENT	146	168	Single, TRACY LAWRENCE
file6094	HOSPITAL	244	264	SUNBURY DAY HOSPITAL
file6094	DATE	265	272	30/6/65	2065-06-30
file6094	DOCTOR	658	663	Heron
file6094	STREET	1693	1698	Gooch
file6094	DOCTOR	4368	4379	E. Bourlier
file6094	TIME	7057	7076	31/07/2017 03:36:00	2017-07-31T03:36
file6094	AGE	7095	7097	46
file6094	DATE	7221	7227	2/8/65	2065-08-02
file6094	IDNUM	7386	7394	13L25888
file6094	DOCTOR	7455	7463	E. Nugal
file6094	HOSPITAL	7465	7490	KEMPSEY DISTRICT HOSPITAL
file6094	DEPARTMENT	7500	7505	PaLMS
file7016	IDNUM	8	18	34D859736O
file7016	MEDICALRECORD	27	35	34185973
file7016	HOSPITAL	47	67	MATER ADULT HOSPITAL
file7016	IDNUM	129	137	34D85973
file7016	IDNUM	139	149	34D859736O
file7016	PATIENT	151	167	FREEDMAN, Terrie
file7016	DOCTOR	3561	3569	J Crehan
file7016	DATE	6178	6188	14/10/2065	2065-10-14
file7054	DATE	12	20	20061203	2006-12-03
file7054	HOSPITAL	36	52	AUGUSTA HOSPITAL
file7054	PATIENT	65	73	Sauceman
file7054	IDNUM	82	92	92Z870794X
file7054	MEDICALRECORD	99	107	92987079
file7054	DOCTOR	234	244	Y Trapasso
file7054	DATE	246	256	19.11.2068	2068-11-19
file7054	DATE	1724	1731	11/6/72	2072-11-06
file7054	DOCTOR	1764	1773	Y Komatsu
file7054	DOCTOR	3615	3624	Y Garibay
file7054	DATE	3626	3636	19.10.2070	2070-10-19
file7054	TIME	3931	3950	2051-10-02 00:00:00	2051-10-02T00:00:00
file7054	PATIENT	3962	3971	Tassinari
file7405	DATE	12	20	19980922	1998-09-22
file7405	HOSPITAL	36	54	FRANKSTON HOSPITAL
file7405	PATIENT	67	75	Cliffton
file7405	IDNUM	84	94	12Q471652I
file7405	MEDICALRECORD	101	108	1264716
file7405	AGE	246	248	79
file7405	DOCTOR	891	898	D Knust
file7405	DOCTOR	1358	1368	D Wickline
file7405	DOCTOR	1982	1991	D Voetsch
file7405	DOCTOR	4175	4187	D Caffarelli
file7405	DOCTOR	4570	4583	D Mccambridge
file7405	DATE	4639	4645	3/7/72	2072-07-03
file7405	DOCTOR	4677	4686	D Munhall
file7405	DATE	7621	7629	5/8/2070	2070-08-05
file7405	TIME	7891	7910	2846-12-08 00:00:00	2846-12-08T00:00:00
file7405	PATIENT	7922	7929	Mammano
file7445	IDNUM	8	18	60M591711R
file7445	MEDICALRECORD	27	33	604591
file7445	HOSPITAL	45	60	GLENSIDE CAMPUS
file7445	IDNUM	121	129	60M59171
file7445	IDNUM	130	138	60M59171
file7445	IDNUM	140	150	60M591711R
file7445	PATIENT	152	164	Niss, Keenan
file7445	DOCTOR	2692	2701	R. Dierks
file7445	DATE	4203	4213	16/11/2064	2064-11-16
file7445	DEPARTMENT	4272	4277	Orana
file7445	HOSPITAL	4278	4293	MORAWA HOSPITAL
file8067	DATE	12	20	20400205	2040-02-05
file8067	HOSPITAL	36	52	MAREEBA HOSPITAL
file8067	PATIENT	65	70	Diego
file8067	IDNUM	79	89	28J5128699
file8067	MEDICALRECORD	96	102	283512
file8067	PATIENT	155	164	Stockhoff
file8067	IDNUM	216	224	28J51286
file8067	IDNUM	225	233	28J51286
file8067	IDNUM	235	245	28J5128699
file8067	PATIENT	247	269	CANION, ROBENA Virgina
file8067	HOSPITAL	293	311	MACQUARIE HOSPITAL
file8067	DOCTOR	1471	1488	Moses DELAGUARDIA
file8067	DOCTOR	1500	1506	Decato
file8067	DOCTOR	1511	1518	G. Gori
file8067	TIME	1522	1540	3:17 pm on 28.4.20	2020-04-28T15:17
file8067	DATE	2243	2252	28/8/2070	2070-08-28
file8067	DATE	2323	2331	5/6/2071	2071-05-06
file8067	DOCTOR	2356	2367	G Cucchiara
file8067	DATE	3952	3960	7/9/2071	2071-09-07
file8067	TIME	3991	4010	2764-09-30 00:00:00	2764-09-30T00:00:00
file8067	PATIENT	4022	4027	AMADO
file8088	IDNUM	8	18	76F543827I
file8088	MEDICALRECORD	27	33	762543
file8088	HOSPITAL	45	94	GOULBURN VALLEY HEALTH - CENTRE FOR OLDER PERSONS
file8088	IDNUM	155	163	76F54382
file8088	IDNUM	164	172	76F54382
file8088	IDNUM	174	184	76F543827I
file8088	PATIENT	186	198	PACHLA, CODY
file8088	DOCTOR	2186	2188	NX
file8088	DOCTOR	2855	2862	U Pults
file8088	DATE	4343	4352	14/1/2067	2067-01-14
file8088	DEPARTMENT	4409	4421	SA Pathology
file8088	HOSPITAL	4422	4437	CAMDEN HOSPITAL
file8088	DATE	5203	5210	15.2.67	2067-02-15
file8786	IDNUM	8	18	81J3154342
file8786	MEDICALRECORD	27	34	8133154
file8786	HOSPITAL	46	64	HERBERTON HOSPITAL
file8786	IDNUM	126	134	81J31543
file8786	IDNUM	136	146	81J3154342
file8786	PATIENT	148	168	FITZ, Garrett DARELL
file8786	DOCTOR	958	967	V. Towery
file8786	TIME	971	989	1010am on 26.12.18	2018-12-26T10:10
file8786	DOCTOR	2975	2984	V Strimel
file8786	DATE	4462	4471	12/6/2067	2067-12-06
file9042	DATE	12	20	20091202	2009-12-02
file9042	HOSPITAL	36	81	RURAL NORTHWEST HEALTH - WARRACKNABEAL CAMPUS
file9042	PATIENT	94	98	RORY
file9042	IDNUM	107	117	55S264833C
file9042	MEDICALRECORD	124	130	557264
file9042	AGE	247	249	66
file9042	DOCTOR	444	447	Lon
file9042	DOCTOR	918	926	Leonides
file9042	DOCTOR	933	941	O Tarras
file9042	TIME	963	984	10:55am on 20/04/2018	2018-04-20T10:55
file9042	DOCTOR	1432	1437	Valen
file9042	DOCTOR	1440	1448	Dobbratz
file9042	DOCTOR	1455	1461	OBlair
file9042	TIME	1484	1506	12:10pm on  16/03/2019	2019-03-16T12:10
file9042	DOCTOR	1777	1785	Steveson
file9042	DOCTOR	1788	1795	Cannedy
file9042	DOCTOR	1802	1809	O Spade
file9042	TIME	1832	1854	12:10pm on  17/04/2019	2019-04-17T12:10
file9042	DOCTOR	2945	2951	Mccade
file9042	DOCTOR	2958	2965	JJarrod
file9042	TIME	2969	2991	12:50pm on  17/03/2016	2016-03-17T12:50
file9042	DATE	6322	6331	21/6/2066	2066-06-21
file9042	DOCTOR	6363	6374	J Inocencio
file9042	DOCTOR	16818	16826	J Moniot
file9042	DOCTOR	16928	16935	Gonzalo
file9042	DOCTOR	18338	18346	J Godown
file9042	DOCTOR	18357	18366	J Grinage
file9042	PATIENT	18379	18388	J Dudycha
file9042	DOCTOR	18393	18400	J Ulses
file9042	TIME	18428	18447	2512-10-20 00:00:00	2512-10-20T00:00:00
file9042	PATIENT	18459	18468	Lighthart
file9392	IDNUM	8	18	03O285892K
file9392	MEDICALRECORD	27	35	03528589
file9392	HOSPITAL	47	86	GOULBURN VALLEY HEALTH - WARANGA CAMPUS
file9392	IDNUM	148	156	03O28589
file9392	IDNUM	158	168	03O285892K
file9392	PATIENT	170	185	Vandevelde, LEO
file9392	DOCTOR	805	812	C Blott
file9392	DOCTOR	820	831	C. Eastlick
file9392	DATE	835	841	1/1/67	2067-01-01
file9392	DOCTOR	6631	6639	C. Mcgaw
file9392	DATE	9003	9011	6/2/2068	2068-02-06
file9392	DEPARTMENT	9068	9082	MACQUARIE WARD
file9392	HOSPITAL	9083	9101	NORMANTON HOSPITAL
file9762	DATE	12	20	19930624	1993-06-24
file9762	HOSPITAL	36	79	CENTRAL HIGHLANDS RURAL HEALTH - DAYLESFORD
file9762	PATIENT	92	96	Wapp
file9762	IDNUM	105	115	18S067408J
file9762	MEDICALRECORD	122	129	1870674
file9762	PATIENT	182	187	Bober
file9762	TIME	425	446	25/05/2015 at 17:10hr	2015-05-25T17:10
file9762	DOCTOR	450	452	AU
file9762	DATE	1861	1868	28/8/68	2068-08-28
file9762	DOCTOR	1904	1912	D Scobie
file9762	DOCTOR	1920	1929	D D Toren
file9762	TIME	3664	3683	2015-05-20 00:00:00	2015-05-20T00:00:00
file9762	PATIENT	3695	3709	AHMAD-BENBROOK
